title,title_sentiment_score,text_sentiment_score,date,rating,review
" Good movie, only sort of about chess
",0.4404,0.971,2021-03-11 00:00:00,9,"It's really about a very intelligent man under intense pressures and probably with an undiagnosed mental condition. The fact that Bobby Fischer and his mother were in fact spied on by the FBI didn't help. Also, Nixon and Kissinger really were following the 1972 match, and it really was like a skirmish in the Cold War, and Kissinger did indeed call Bobby.Though, I think the notion that Bobby (or Spassky) were like sacrificed pawns by their governments is rather exaggerated.Bobby certainly seemed to be out there, but a lot of his actions in the 1972 matchup seem to be tactics of a smart man. The ""blunder"" in the first game certainly suggests this.For the movie itself, Tobey does a fine job playing Bobby. It seems the only real complaint about him was that Bobby was really tall, and that may have impacted his opponents psychologically. That may well be true, and Tobey is a lot shorter, but it's impossible to get every nuance right, and it would probably be hard to really convey that.Sarsgaard as Father Lombardy is great, often subtly hilarious. I don't know how well he portrayed the actual Lombardy, but he tended to steal the scenes he was in."
" If you know nothing of chess ...
",0.0,0.6469,2021-02-17 00:00:00,2,"Then you would know that Fischer was not this way during his climatic peak to winning the World Championship. The stress on this movie was on his mannerisms, thought processes and the way he reacted in chess & social interactions.They were greatly exaggerated for the most part. This individual do more for chess to extol it to a higher ground, more $$ and exposure. The players of today thank him for that. To portray him in such a bad light considering when you got to know how he really was was a great contrast to what we see here. If you're looking for a half-truth movie about a chess player then it's your cup of tea but if you're looking for the real Robert Fischer story then move on.Highly recommended is Frank Brady's book, ""Bobby Fischer: Profile of a Prodigy"" or the highly technical,""A Psychobiography of Bobby Fischer"" by Joseph G. Ponterotto Ph.D. who is a licensed psychologist and a Professor of Counseling Psychology in Fordham University's Graduate School of Education, New York City. He currently is Coordinator of Fordham University's Mental Health Counseling Program."
" Good biopic
",0.4404,0.8519,2021-02-13 00:00:00,8,"Pawn Sacrifice gets to dramatize the real-life story of Bobby Fischer (Tobey Maguire), Cold War-era chess prodigy and champion. In a clear attempt at prestige candidacy, the film falls victim to the usual biopic pitfall by relying solely on the events as they played out, as opposed to using them to determine a story worth telling. Maybe a bit too long but certainly worth it"
" Superficial, should have been a lot better...did they not even bother to watch the 2011 documentary? The screenplay was weak...
",0.2584,-0.8416,2021-01-22 00:00:00,6,"Tobey did an OK job, but the script was poor, and why they didn't just use Bobby's actual words as much as possible is beyond me...especially given the amount of it that is recorded...I mean the Dick Cavett bit were they changed the dialogue with the really poor CGI is like a microcosm of what's wrong with this movie...as Spassky himself said ""surrogate/artificial""...also, Tobey just looks wrong for 1972, they could have used him for the 50s to early 60s shots, but needed someone else thereafter. I thought he did a good job of depicting Bobby's paranoia/fear in some scenes though. Someone mentioned Nicolas Cage here, OK if this was the 90s, way too old...Christian Bale would have been better IMO...But, I think once Fincher dropped it they should have pulled the plug. Shame. It has some redeeming features, worth watching once anyway, but the seams really show on the second viewing."
" 6 stars for a great true story told in a pedestrian manner. Still worth checking out.
",0.8316,0.9846,2021-01-08 00:00:00,6,"PAWN SACRIFICE was an interesting movie that told a good story. I was never bored. But I was also never gripped. The story of Bobby Fischer, and in particular, his rise to world champion chess player via an epic competition with Russian Boris Spassky, is amazing. I was too young at the time to have any real memories of it now, but I can only image, at the height of the Cold War, how this battle must have resonated with Americans (and Soviets).But I found the approach to tell us the story was clunky and frustrating. First of all, depicting chess on screen isn't the easiest task (at least trying to make it exciting is)...so the approach the film often uses is to have the characters played by Michael Stuhlberg (Fischer's ""agent"") and Peter Sarsgard (a priest who used to be a chess champion, and is now Fischer's ""sparring partner"") explain to each other, and thus the viewer, what is happening and why it's amazing. We never feel the amazement ourselves...we have to see THEM being amazed and by extenstion try to feel amazed. So, the chess itself is tricky. And then, so is the character of Bobby Fischer. If this were a fiction story, I'd say Fischer's character is unbelievable and immensely unlikable. I guess because it's a true story, I BELIEVE the character, but I dislike him all the more. He a massive egoist with no redeeming qualities. He plays great chess, but he treats EVERYONE around him with disdain or worse. He makes insane demands because he can. He's is also a paranoid, driven by demons that have made him crazy (to be blunt). Frankly, at almost no time do we see the ""human"" in Fischer, the guy we can relate to. He's a terribly unsympathetic character...yet I think we're meant to feel sorry for how the strains for his genius have driven him mad. I just want someone to beat the guy up! Tobey Maquire seems to do a fair job with the role (actually, everyone is perfectly fine), but the script doesn't give him a chance to earn our caring or sympathy. It dwells so heavily on his peculiarities.Also, here's a nitpick. I watched the blu-ray of this film and the detail is so fine, I could readily see the makeup on the actors, Maquire in particular. He looked like a guy smeared with inexpensive base makeup preparatory to going out on stage. Or maybe a guy with a bad spray-on tan. It was distracting!The film is quite low budget. Old newsreel footage does a lot of the plot movement for us, rather than other, less clumsy but more expensive solutions. Technically the film is unimaginative.I know my gripes sound like the film is a failure, but it is still worth watching. The performances are solid, if not quite award caliber. And the amazing story is pretty compelling. The raw material is so good, even this somewhat flat-footed telling can't take away from the sheer ""you've got to be kidding me"" of it. Worth a look."
" Not an accurate biopic
",0.0,0.5879,2021-01-08 00:00:00,1,"This is the case of a typical biopic film from the XXI century.
The story is plenty of mistakes, and things that never happened.
Important characters of the match are forgotten (Like the good icelandic friend and Fischer´s bodyguard Sammy) and others are invented.
But the most terrible thing is the McGuire performance. The physical resemblance with Fischer is zero (teh actor small stature vs Fischer taller figure, for instead) and his acting is not accurate. Fischer was plenty of sense of humour and always smiling in public. This is a Mcguire´s project so the basic chess mistakes of the film are this actor responsible.
A giant figure must be interpreted by a giant actor. What is not the case.
For not to say, a giant story must be written by a giant writer. Not the case too."
" The neurotic genius
",-0.34,0.9131,2020-12-24 00:00:00,5,"Chess has never been a very popular sport or activity in the United States except during the time of Bobby Fischer. Fischer brought a whole new light and popularity to game;in large part because he was the only American in a Soviet dominated field during the Cold War. Pawn Sacrifice covers this aspect of Fischer extensively as well as the other most notable feature of his life...his mental illness. By the time of his death he was practically insane but even as a young man and chess champion he dealt with psychosis. It's not enough to cast in actor who resembles him physically but also one who can convincingly pull off these characteristics. And that's where I believe Tobey Maguire was properly cast in the part. Though he is five inches shorter and doesn't look or even sound like the actual World Champion,Maguire is able to capture his personality and essence. Thus being a believable Bobby Fischer. The film also includes some strong performances from Liev Schreiber and Peter Sarsgaard as well.Pawn Sacrifice is a picture centered around the intense showdown between Boris Spassky and Bobby Fischer:the global attention that surrounded it and Fischer's neuroticism."
" A good and interesting biography!
",0.7088,0.9966,2020-12-22 00:00:00,7,"Plot:Set during the Cold War, American chess prodigy Bobby Fischer finds himself caught between two superpowers and his own struggles as he challenges the Soviet Empire.Analysis:Following the first steps to success of the famous American chess player Bobby Fischer this movie tries to tell an interesting story behind a game that included personal ambition, cold war political influence and mental ilnesses. Fischer was a tragic figure and this movie does a good job at giving people a taste of his unique personality. Although, this movie alters the real story a little to make it more cinematic and interesting, the general feeling and the main events are the same, so the viewer can undestand what was going on in Bobby's life at that time.Starting with the good elements, Tobey Maguire proves once more that he is capable at doing great stuff beyond Spiderman and his performance is really breathtaking, he combines that look and the whole feeling of Fischer and does a good job imitating his reactions. The arrogance in his words, the madness in his thoughts, the passion in his eyes, everything is perfect, an acting masterclass from Tobey and a great experience for the viewers. Everyone else was also pretty nice and especially, Liev Schreiber was really good as Boris Spassky, he delivered both sides of hus character and fullfilled his mission in this film.The story follows Fischer from his early years till the big match this movie was made for. Although, the first few minutes were interesting enough there was a huge drop of quality as the film continued until a certain point were it finally found the theme this whole story should have. There are some boring moments, especially until the middle of the movie, mostly because a biography needs to inform people about the details and some of them are really unnessecary. From the point that it gets the right focus, it's way more interesting and quite enjoyable.Pawn Sacrifice was directed by Edward Zwick, the man behind The Last Samurai and that was a huge advantage for this movie. Although, he didn't reach his full potential, there were many interesting choices of camera shots and the general feeling was kept on point, so despite not being his best work, this movie was another example of his great vision and talent. Great capture of feelings, appropriate colours and artistic camerawork are proof that this movie was nowhere near being the classic boring style of many biographies.After all, this is a biographic film. It manages to inform, entertain and give a good taste of society's backround during this time period. It's a full and good experince that although it won't blow your mind, it will keep you interested till the end and will give you enough information to make you look up the story of Bobby Fischer's life. It sacrifices some entertainment to tell the whole story, so some scenes especially in the first half are kinda boring but as the whole story enters the final act, it's way better.Conclusion:It's a great movie, especially for chess fans, it's a great start to make someone search this man's accomplishments, beliefs and life, something that is a result of great acting and direction that really gave this film something special. It could've definetely been more well-written but it's good enough for a nice and memorable experince and a motivation to learn about a great athlete and a troubled man.Rating: 7.5/10"
" Tobey
",0.0,0.755,2020-11-30 00:00:00,1,What's wrong with this movie???? It's the pink elephant in the room casting a short guy to portray a tall guy. It's like casting Andrei the giant to play napoleon. Part of Fischer's aura was his long lanky fingers wrapped around a chess piece with lightning speed banging out genius moves.... he had physical presence because of his height and broad shoulders and how he would tower over a chess board analysing while standing up ...how can short guy pull that off??? Total 100% self indulgence on Tobey to cast himself as Fischer. The only actor that should have been offered the lead role is Nicholas Cage and the movie would have been a massive success.
" Spiderman V. Sabretooth
",0.0,0.762,2020-11-28 00:00:00,8,"Love the cinematography and look of this film. Fantastic color! That's my favorite thing about this movie! But it's not only super visually pleasing, it's also a crazy interesting story. This movie was 2 hours long but did not at all feel like it, it pulled you in and once it did, it didn't let ya go!
It kind of takes a little while to pull you in though, it's got a bit of a rough start. It seemed to lack a bit of direction, and it was a bit confusing."
" Doesn't capture chess or the much of the story
",0.0,-0.1494,2020-11-06 00:00:00,4,"Agree with Victorhoz, really wish it captured chess... the boards, the positions, the decision making under different circumstances. I'm also bothered by the film's exclusion of so many critical events in Fischer's career, specifically those not long before the Spassky duel of which 1/4 of the film is comprised."
" A Look into the Top of the Chess World and Convincing Drama
",0.5423,0.9722,2020-08-05 00:00:00,9,"Probably one of the best biographical documentary films / dramas about a chess player living in an intense period of time. And Robert James Fischer definitely belongs in the Top 5 players that have ever lived. I like how they interwove a few scenes of the actual Bobby Fischer at the end and how the chess scenes were mostly accurate. They show some of his novelties however they didn't pay attention to his famous knight maneuvers, together with Morphy's the best in history. Instead the producers focused on the Cold War bout with the Russians. Which is a nice decision for a movie. But they could at least have shown the trap involving the bishop sacrifice from B3 to F7 and winning the queen on D8, which he funnily enough simply obtained from one of those Russian chess magazines, but his GM opponent didn't know.Also in reality, Fischer didn't resign after blundering his bishop in Fischer vs. Spassky Game 1, hoping for inaccuracies, but at that level he indeed might as well have. All in all this is a very good portrayal of the social and mental difficulties tagging along with the full dedication to a potentially brain-wrecking game, and ignoring life's other opportunities such as building relationships. It also shows an outstanding acting performance by Tobey Maguire."
" 7/10?? This is just brillaint 10/10
",0.0,-0.7039,2020-07-29 00:00:00,10,"I don't know why it's been rated 7/10 but infact it covers the beauty of chess, the moves and the backdrop of cold war so beautifully. The performance, the trauma and the ending is just heartbreaking. I watched this when it came out but today I watched it again and I am shocked that it's rating is just too low."
" If you like chess to any extent, you will hate this movie.
",-0.296,0.7473,2020-07-05 00:00:00,4,"Imagine if there was a movie about a famous football player, a striker specifically, and they would not show any goals or the scoreboard in that film. You would see close ups of his legs, close ups of the ball, shots of the applauding crowd in the audience, but no goals or scoreboard whatsoever...This is exactly what this director is doing. You won't see anything that was happening on the board, you won't see positions or moves. There is no respect for the game nor for Fisher nor for the viewer who may be interested about the games.I get it, that a significant proportion of the viewers could not appreciate the details of those positions, but they could at least throw something for those who could, a few seconds when we could see the positions on the board, a few seconds wouldn't be boring for those who are not interested... But no, you get nothing, nothing at all if you are a chess enthusiast. This is disrespectful and lazy.I gave it a 4 solely for the acting, which was decent. As a story about Fisher and chess, it would be a fat zero."
" This is a really underrated movie.
",0.0,0.7422,2020-07-02 00:00:00,8,"Yes, the movie got slow at points, but the overall premise of the movie, the cold war setting, the phycological aspect of Fischer is absolutely interesting and Macguire does a fantastic job. Overall a solid movie."
" Brilliant
",0.5859,0.9702,2020-05-27 00:00:00,9,"Toney Maguire is outstanding in thus period piece. Unlike most ""biopics"", this film truly works. This is due to strict adherence to the true story of Bobby Fischer: The greatest chess player in history, who was also had serious mental wealth issues. I remember watching this match live. It is compelling, and sometimes very difficult to watch. I believe this is the best performace of Tobey Maguire's career. Forget about all the comic book Spiderman bruhaha. This is a gut punch of realism. Kudos to director Edward Zwick."
" A story that gripped the world, but not the cinema...
",0.0,0.9652,2020-05-18 00:00:00,6,"This could have been a fascinating account of the troubled life of American chess prodigy Bobby Fischer - unfortunately, Tobey Maguire just couldn't quite convince me that he was that man! The well documented life of this chess genius and of his many demons is the stuff of public record, but this interpretation borders on the melodramatic just a bit too often, and the lead performance is way too one-dimensional for me to get beyond the initial reaction that he was a bit of an arse. An hugely accomplished master of his craft, but as an human being - an arse. There are flashbacks to try and give us some guidance as to the causes of his paranoia - his mother was a communist living in the USA so he genuinely believed that the FBI were listening in on him from a very early age - a neuroses that never left him - and as such his sense of trust was internally compromised and his ability to form meaningful relationships never remotely developed. Liev Schreiber - who really only features towards the very end, does indicate a bit of the grace and professionalism of arch-rival Boris Spassky but it is delivered by Edward Zwick in an almost grudging fashion - the pesky Ruskies will do just about anything to win - except, that is, play fair! It does demonstrate the effectiveness of the cold war chess battle that many of us will recall from the 1970s, but it could have been much more adventurous and less stereotyping with it's characters."
" Mania filled movie
",0.0,0.5442,2020-04-10 00:00:00,1,"09APR2020 {1/10 stars F} Recommend? No; Long and slow movie, with a lot of shaky cam.I did not choose to play this movie, but watched anyway. I only know two things about Bobby Fischer, his name and that he was a Chess champion. What I can say about the movie it is SO! VERY! SLOW! it drags on and on! It is just shy of two hours but felt at least twice as long.Very poorly written and directed movie full of scenes that jump from one thing to another not showing anything of some chess matches and right back to more ranting, raving and paranoid delusions from Bobby! Even if every paranoid delusion and outburst in the movie from Bobby is true it is portrayed very poorly and have no empathy or connection with Bobby. The movie starts with a time jump ahead, don't miss that part.Like other reviews said, I thought Boris, Father Bill and Paul were well acted. But Tobey Maguire as Bobby seemed more like a petulant spoiled kid having tantrums throughout the movie. After awhile I got numb to Bobby's hissy fits and couldn't wait for the movie to end. They should have chosen a better suited actor to play Bobby or not made the movie.CONTENT ADVISORY: One occurrence of the f-word, Bobby meets a hooker that happens to be staying at the same hotel as him and tells her that he wants to lose his virginity, later they are shown in bed together Bobby without a shirt on sitting up in bed mostly covered by a blanket that starts at the middle of his chest and talking about chess moves. The hooker lays next to him on her stomach touching Bobby's arm with her bare back to the camera.Bobby hints at wanting her to leave so she says, ""Well it was great for me too. Thank you."" Bobby replies, ""Thank you"" as he looks the opposite direction from the hooker. Hooker sits up on the edge of the bed with her back to the camera and everything below the lower back is blocked by the blanket on the bed. No other nudity is shown. A lot of cigarette smoking and occasional hard alcohol drinking, even the priest is shown drinking the hard alcohol and in one scene smokes a cigarette.{1=F 2=D- 3=D 4=C- 5=C 6=B- 7=B 8=A- 9=A 10=A+}"
" from the pile
",0.0,0.0772,2019-12-31 00:00:00,6,"SUCCESSES: The film correctly covers the main theme, which is the life and chess of Bobby Fischer. The script is acceptable.
FAULTS: Sometimes it becomes passive and repetitive, which produces boredom and sleep when you see it."
" Interesting film.
",0.4019,-0.5859,2019-12-24 00:00:00,7,"Im not a chess player and really didnt know a thing about this movie before I watched it. Good story and acting was solid. You dont need to be a chess player to appreciate This film. If you have a few hours to kill, no question there are worse movies to watch"
" LOVED THIS MOVIE, I REMEMBER MUCH OF THE STORY FROM CHILDHOOD
",0.5994,0.9368,2019-12-13 00:00:00,9,"I really loved this movie - just found it at the library in 2019! Sorry it didn't get more attention - I would have watched it years ago. Very good acting! Loved the music! I've never seen Tobey Maguire in a movie (I never was a Spiderman fan) but he's very good. The movie has its funny moments and its intense points. I never realized all the crazy things that go on in the background of these big competitions. From what I remember about this big chess competition, this movie seems to depict the story accurately. Crazy how politicians get involved! I totally recommend this movie - even if you watch it years after its release (especially since the movie is about the 60's and 70)'s."
" It's all in the mind
",0.0,0.6696,2019-10-23 00:00:00,10,Engaging intense powerful and a heart breaker ! Loved it. It tells you how one can ruin one's own achievements failing to truly understand what's going on
" Great insight into the talent and mind of a tortured genius
",0.5106,0.9874,2019-08-10 00:00:00,8,"A dramatization of the life of Bobby Fischer, one of the greatest chess players of all time. While covering his early life and chess career, focuses largely on the 1972 World Chess Championship match between Fischer and the reigning champion Boris Spassky.Great movie. Shows well Bobby Fischer's exceptional talent for chess and also the mental issues that seemed to be part and parcel of this genius.Always interesting but not consistently engaging though. Coverage of Fischer's childhood and early career give a decent background to how his talent and personality and mental issues developed but aren't compelling viewing. However, when the movie reaches the 1972 World Championship Match it shifts into top gear and becomes incredibly engrossing viewing.Great performance by Tobey Maquire as Fischer. Solid supporting cast that includes Liev Schreiber (as Spassky), Michael Stuhlbarg and Peter Sarsgaard.For an even greater insight into the talent, mind and personal demons of Bobby Fischer watch 'Bobby Fischer Against The World' (2011). Superb documentary."
" Decent chess movie
",0.0,0.9069,2019-05-20 00:00:00,6,"Toby Maguire did a en excellent job as Bobby Fischer! I think it's boring & Bobby complained a lot more than I knew although I didn't know much about the real person/story except he was one of the best chess players ever! Not too bad of a movie, well written and only good to watch once or twice."
" Toby Can Act
",0.0,0.9169,2019-04-03 00:00:00,10,"I couldn't think of a better actor to fill the role as mad Bobby Fischer. Toby Maguire is a brilliant actor, but I had no idea how well he can play an egotistical maniac. I knew the story of Bobby Fischer quite well, but the way this movie done was flawless. Chess can be an extremely competitive/serious game, and so the excuses come with it, but Bobby had a way of doing in a charming and hilarious way. ""You're one of them, aren't you?"" Refreshing to see a character portrayed by some who thinks differently than the rest of the world."
" That Was Some Hard Core Pawnography
",-0.1027,0.9766,2018-11-11 00:00:00,8,"Just caught this on Netflix UK and I thought it was a great watch for a lazy Sunday. I'm not sure how much of it was true but man alive, I think it's fair to say, Mr F's ""head was in the shed"". Definitely some mental issues going on there. I thought it was filmed well, cast well, acted very well and directed well. Overall, an enjoyable watch."
