title,title_sentiment_score,text_sentiment_score,date,rating,review
" Love this crude vulgar movie!
",0.2003,-0.4019,2021-03-06 00:00:00,8,Just funny as hell. Everyone shines. Have watched it many many times.
" Fantastic Sequel to a Classic
",0.5574,0.69,2020-12-20 00:00:00,9,"If you enjoyed the first Bad Santa, this one is full of the same hilarious antics. Hope there is a third!"
" Better than the first Bad Santa.
",-0.1531,0.8258,2020-12-05 00:00:00,10,It's a really hilarious and rude film and Thurman has grown but not lost any weight. Sunny the mother of Willie is a rude and mean but funny person. I find the film better than the first one is because it's funnier and makes more sense like I don't know. I hope they'll make a Bad Santa 3 in the future.
" Entertained me during lockdown
",0.4019,-0.9758,2020-12-02 00:00:00,5,"Hilarious, shocking and entertaining too. A few weak spots. I did not like the subplot where Willie is stalked by that strange young man.
Definitely watch if you're not into tame comedy. Not alot of gross out moments, but a whole lot of swearing, dirty sex and one suicide attempt. Billy Bob Thornton is very believable as the depressed violent alcoholic."
" Everybody's Favourite Santa?
",0.0,0.9507,2020-11-08 00:00:00,7,"Ha how low can Santa go? Watch this movie to find out!Its silly, funny, repugnant, tasteless, surprising, shocking and good for some genuine laughs.Kathy Bates is awesome in this movie!!Have some fun with it :)"
" Not As Good As The OG
",-0.3412,-0.6797,2020-10-18 00:00:00,4,"Not as funny nor as sad as the original,i don't know but i kinda haven't a watched a good movie since the early 2000's maybe movies just lost the plot in general ever since"
" Such a beautiful continuation.
",0.5994,0.6652,2020-09-28 00:00:00,7,"The use of the classical music is awesome... Also, somewhere in the movie, the mother says that willie was born in january but willie corrects her, saying that he was born on the 4th of august, which is the real birthday of the main actor playing willie... Recommend the movie to everyone who wants to spend an hour an a half for pure enjoyment..."
" Bad Santa 2 is the perfect sequel
",0.0516,0.4305,2020-07-28 00:00:00,7,"Of course not as good as the first, but still has that charm and heart as the first one had."
" Hilarious
",0.4019,0.6369,2020-05-22 00:00:00,7,Lots of laughs-even better than the original (which is rare). Kathy Bates is a hoot.
" Bad Santa 2 is just barely an ok sequel
",-0.3774,0.6338,2020-02-18 00:00:00,5,"I really liked the first Bad Santa movie. It was original in its brashness and in its humility. The second film, Bad Santa 2, set 13 years later has nothing original about it. I would rate it as a positive 5 star review only because it does have a few shining moments that reminded me of how good the first movie was back when.Bad Santa 2 suffers from what almost always occurs with sequels when the director cannot come up with a new idea on how to tell an old story. With sequels that do not have an original idea, it will either be way more violence or way more sexual content.Bad Santa 2 relies almost solely on bad sexual content jokes throughout. It is so laden with them that it is not even funny anymore. To top that off, new characters, old characters, and even supporting characters need to find ways to divulge about their sexual desires. Whenever the film does try to add in dialogue that does not center around sex, many times it feels like a rehash of lines from the original. And where expletives were used with feeling in the first film, this film uses expletives like it uses the sex talk, as if it became a normal daily routine.The film does explain plot points from the previous film. It tells you why Willie Soke is not with his previous girlfriend, why the kid(who is now a young adult) keeps following him around, and how he ends up meeting back up with his sidekick Marcus from the first film.What saved this film was the relationship between Willie Soke(Billy Bob Thorton) and Thurman Murman(Bret Kelly). There is a moral light at the end of the tunnel in this film between those two characters that for the briefest of song moments returns you to what made part of the first Bad Santa film such a good movie.A few reviewers have written that watching Bad Santa 2 will destroy your memory of the first film. I do not agree. It added another chapter to the story, just not a very good one. But like Hangover 2, my recommendation would be that it is a movie you will probably only watch once and that is it."
" Why was this bad ?
",-0.628,-0.5334,2020-02-13 00:00:00,4,This film had a lot of potential with just copying the last one but it couldn't even do that right. The foulmouthed Bill Bob couldn't even save this one.
" Bad Santa 2
",-0.5423,-0.9754,2020-01-01 00:00:00,3,"The first film was a good punch in the face for the usual sentimental feel-good festive movies, but I don't think anybody was expecting, or even wanting, a sequel, but it happened, and I had a feeling it wasn't going to work before I had even watched it, directed by Mark Waters (Freaky Friday, Mean Girls, Just Like Heaven). Basically, set thirteen years after the previous events, Willie Soke (Billy Bob Thornton) is now working as a valet driver for a country club, he is still depressed, and he is again addicted to sex and alcohol. He tries to hang himself to death but is interrupted by a visit Thurman ""The Kid"" Merman (Brett Kelly), who has turned twenty-one and works at a sandwich shop. Thurman's father has abandoned him, and his grandmother has passed away two years before, so Willie is the closest thing to family he has left. Thurman delivers a package to Willie, it contains a large sum of cash, from Marcus Skidmore (Tony Cox), his former partner who has been released from jail. Marcus, expressing sincere remorse for betraying Willie, tells Willie there is a new money-making opportunity in Chicago, that could be worth millions. Willie reluctantly agrees, while unsuccessfully trying to help Thurman lose his virginity before he leaves for Chicago. When they arrive, Willie is annoyed to find out the scheme involves a children's charity, but much more so that their partner is Willie's estranged mother, Sunny (Kathy Bates). Willie reluctantly agrees, as Sunny is suffering from Parkinson's Disease, though he secretly makes a deal with Marcus to cut Sunny out when the time comes. Willie is forced to dress as Santa Claus once again, he ends up getting arrested after getting into a fight with another man dressed as Santa (Mike Starr), mistaking him for being a paedophile. Willie is bailed out by the charity's founders, Diane Hastings (Christina Hendricks). She initially wants to fire Willie for his bad behaviour, but he agrees to attend AA (alcoholics anonymous) meetings with her. Diane's husband Regent (Ryan Hansen), who also runs the charity and is cheating on Diane with his secretary, orders his head security guard Dorfman (Jeff Skowron) to track and follow Willie, becoming suspicious of how much time he's spending with Diane. Meanwhile, Marcus tries to obtain the keys to Regent's office where the charity's safe is kept, by seducing security guard Gina De Luca (Jenny Zigrino), but finds she is ""high maintenance"". Elsewhere, Willie starts a sexual relationship with Diane, and he and Sunny start to bond, especially when the two of them rob a mansion together posing as Santa and Mrs. Claus. As they bond over their takings, Sunny gives Willie a gun so he can take revenge on Marcus, despite Willie's insistence that Marcus has changed. Thurman has tracked Willie and arrives in Chicago. Willie at first considers leaving him at a laundromat but soon takes him to the shelter at the charity. Thurman ends up joining the children's choir, they will perform a concert on the same night as the planned heist. Willie approaches Gina himself, they have sex in the bathroom of a bar, and he obtains the keys. It is the night of the performance and the robbery, Willie manages to catch Thurman singing, which makes the kid very happy. As Willie cracks the safe, Marcus is about to betray him again, but Regent and Dorfman catch them in the act. However, Sunny reveals she is betraying them both, telling Willie the bullets in the gun she gave him are blanks before shooting Marcus. She tries to escape by disappearing into a crowd of people dressed as Santa at an outdoor party with Willie, Regent and Dorfman chasing her. Willie catches her and attempts to take the bag of stolen cash by saying the kids need it more. In their struggle, the bag is torn open and the money flies into the crowd. Enraged, Sunny attempts to shoot Willie again, but hits Thurman jumps in the path of the bullet and gets hit in his behind. Both Sunny and Willie are arrested, but Willie is not charged for helping to catch Sunny. While he recovers, Willie is visited in the hospital by Diane who wakes him up with a handjob. He later takes a job as a janitor at the charity, goes to visit Thurman and accepts him as family. Willie also visits an injured Marcus, ""tea bagging"" him and posting pictures of this on Instagram, as revenge against Marcus. Also starring Octavia Spencer as Opal. Thornton is still swearing and boozing constantly, but it's not as good as before, Cox as the ""elf"" sidekick is okay, Kelly as the slow-witted teenage ""kid"" is odd rather than cute, and Bates throws herself into the role of the equally rude mother, but she is almost out of place. The first film is a cult favourite with its deadpan humour, digs at the Christmas stuff and constant profanity and deadpan humour, unfortunately this sequel doesn't quite hit the mark, I did titter sometimes, but overall it is a relatively disappointing seasonal comedy. Adequate!"
" Much better than the original, with its melancholic VIBE and ALTERNATIVE CHRISTMAS MESSAGE
",0.5994,0.6458,2019-12-30 00:00:00,9,"The hypocrats who say the movie is bad, aren't honest or objective, even to themselves. I do not know what they expected from this sequel, when its pretty damn obvious that it will be full of f* words and jokes and not gonna be politically correct either. So it seems to me, like people who complain and put a negative reviews here, are hypocrites and pretend to be goody-goody. Also, they just didnt get the point of this movie. The movie has alternative message.
I absolutely love this movie and think it is underrated.
This movie is better than the original, because the depth is added to it, in a part where it shows relationship between Willie and his mom (Kathy Bates). You start to get why Willie is so self-destructive. He didnt have much choice what way to be, really. Its like in real life: even your mom does not necessarily genuinely loves you. And maybe it is actually easier to find unconditional love somewhere else, than expect it from those, who suppose to. Even parents betray, yes. At the end of the day, your accomplice in crime might be far decent person, than your parent, who suppose to love and care for you.
The movie is full of alrernative christmas message for those, who had/has disfunctional family and a tough upbringing. Well, if you have brain, you will see it. It actually has some depth, not just a cheap laughs. So, I think a lot of people who put negative reviews just don't get it.
It has this melancholic vibe, and it is refrechingly different."
" Very poor compared to the first film.
",-0.5256,0.4672,2019-12-26 00:00:00,1,"Must have been very easy for the actors to memorize their lines as all they do is spend the entire film telling each other to 'F off'.
Funny for the first 5 seconds but not so for the rest of the film"
" Better than the original!
",0.6696,0.925,2019-12-24 00:00:00,8,"I realize most people can't be objective about sequels. The main criticism is that this one lacked originality. How most manage to miss the point. It certainly had its own personality. More vulgarity, better one-liners, more non-stop laughs and the filming location had an important ingredient, snow! The addition of the incomparable (Kathy Bates) put this over any of the original cast. She added a depth that only she could, but definitely delivered in the filth department. I was impressed with the chemistry between her and (Billy Bob Thornton). His relationship with the kid was even more precious this time, especially the choir solo scene. In closing, both Bad Santa flicks are a refreshing antithesis to the endless Christmas banality that's churned out."
" Welcome mediocrity
",0.4019,-0.6249,2019-12-24 00:00:00,4,"Bad guy gets sexual proposition from mentally retarded young guy of 21 y.o., punches his mother, is sexually harassed by all women.
Off course, his partner is ridicoulous and can't manage to get any of them.
Sex is you've guessed the funny part.
Finally, except very few dialog lines/situations, i've only felt pity for people working for this movie.
Good luck for watchers"
" Worse than the first one
",-0.4767,-0.7909,2019-12-24 00:00:00,1,"I didn't finish it. It has nasty, filthy language and is absolutely not funny. I wish Kathy Bates had turned this down. I lost respect."
" Yuk
",0.0,-0.6678,2019-10-28 00:00:00,1,I was shocked at the really disgusting dialogue - pfff not for me & seriously Cathy Bates & billy bob you really were dredging the muck here. Yuk Yuk.
" Bad Santa...yes..really BAD!!
",-0.8525,-0.8847,2019-09-13 00:00:00,2,"After this I had to question if maybe i was carrying some false (happy) memories of the original.
I remember it being hillarious and looked forward to the 2nd, but boy was i in for a let down!!
This was just SOoooo BAD!The script was horrible.
There was NO laughs whatsoever, just a lot of cussing and deviate sexual stuff that seemed to only aim for shock value.
Whatever they were aiming for, it definately was NOT laughs.
Id be suprised if even a 16 year old found anything even slightly amusing in this.The swearing did nothing and was just really OTT for no reason.
Even the acting performaces came over as ""clunky"" in execution.
Indeed, it seemed like (and quite rightly) the actors just wanted to get off their horrible lines, wrap the whole mess up, and get the hell out of there as quickly as possible.I cant believe Thornton read the script and actually went through with this.
I'd certainly never bother with anything he does in future again, after having this monstrosity burnt into my movie memory.I always scorned reviewers who give one star to movies, as it would mean a film is void of even a single redeeming factor.
But yeah, im giving this 2, only because i dont wanna be that guy..Still scratching my head to think of any redeeming factors though...
just plain terrible!!"
" As foul-mouthed and unpleasant a movie as you will ever see
",-0.4767,-0.8557,2019-03-24 00:00:00,7,"Most people probably won't like this. It is as foul-mouthed, unpleasant, and politically incorrect a comedy as one is likely to find anywhere - but therein lies its power. In this sequel flick, the bad santa joins up with his midget buddy for a trip to Chicago, where they meet up with santa's mom for a little larceny and lunacy. Bates, Thornton, and Cox make for a solid team of goofy outlaws."
" 2 live crew
",0.0,0.8395,2019-02-20 00:00:00,10,"Since BAD SANTA 2 was brave enough to use a ""2 live crew"" in the film, i want to see a ""2 live crew"" film. Yes, the film is incredibally nasty, but you are hollywood and can perfect this without a ton of problems. Dont skimp on the ratings system. i know it costs alot of money to make an NC-17 film but the band was very free in their speech, so what! ""Banned in the USA"""
" ECHOES THE FIRST MOVIE BUT DEFINATELY HAS FLAWS
",0.0,0.9739,2019-02-01 00:00:00,6,"This sequel to the 2003 original has the same lewd humour as its predocessor and it does have its laughs and the red head with the big boobs is awesome, thornton and cox deliver like the last time out but the scene when willy punches his mother is just a tad O.T.T lol ridiclious! i think the scene should have been more subtle, the kid returning as a young man was unrealistic and silly the lad is even more gullable than the little boy in the first outing and i dont think it works, the actor put on the weight to look like his younger self , he should have returned his usual self with a change of direction in character then maybe this might just have lived up to the more superior original."
" Good laugh
",0.7579,-0.2617,2019-01-06 00:00:00,8,"Political incorrect film with loads of obsence language. Won't suit all people, but if you generally liked Bad Santa 1 you wontnmind this."
" Quite a step down
",0.0,0.8497,2018-12-27 00:00:00,5,"Bad Santa 2 is another sequel which in Hollywood takes original cult classic or well original films, and releasing over 10 years. Bad Santa 2 came out 13 years after the original, released in 2003 and quite a bit has changed since.This film seems to step up in the vulgar, shock value and overall disgusting behavior compared to the original. And with all of that, Bad Santa 2 falls short and simply isn't as funny as the original. There are since some laughs but overall, the original has a better feeling with its pace, plot and is overall more interesting. Better grouping of characters as well.Billy Bob Thornton is his same self which is great as the role of Bad Santa, same with Tony Cox. Kathy Bates as the mother is decent. Bad Santa 2 uses the same formula as Bad Santa but since nothing is much shocking anymore, there isn't much in which we have not seen."
" Vulgar Beyond Belief, Stupid and a Waste of Time
",-0.7351,-0.2591,2018-12-18 00:00:00,1,"I have no problem with foul language, but in this case, this sorry excuse for a movie seems to be nothing but a vehicle to see how many times they can say f-this, f-that, f-you. It's not at all an exaggeration to say that they can't go more than 60 seconds without some kind of expletive. However, constant swearing does not a movie make, especially when most of it is uncalled for. It just makes it all very boring and tedious. Unfunny, stupid, the writers obviously had nothing. It was painful to watch, and endlessly disgusting. Unless you live in a trailer and think that's just great, save yourself and don't bother watching this utter garbage."
" Not as good as the first but not bad
",0.4717,-0.7498,2018-12-08 00:00:00,5,An enjoyable and often funny film that is not as good as the first but still good to see billy bob playing the role and the supporting cast was good too except for Kathy Bates who was disgusting. She's a good actress but the things she said and did were terrible lol. The script should of been better too much vulagarity. Otherwise good.
" Bad santa 2 (2016)
",-0.5423,0.9042,2018-12-08 00:00:00,6,Bad santa 2 tries to bring back the old experience of the outstanding predecessor but falls short.Not bad.But the innovativeness and the dark humour was a bit bland.Still when you love the character there is always something to it.Overall - 3/5
" Same formula but too foul-mouthed
",0.0,0.0825,2018-12-02 00:00:00,5,"Same formula as the first so entertaining from that perspective, but script lacks, too much foul language, and Bates character was just weird and unnecessary."
" One of these stars is out of sympathy
",0.3612,0.715,2018-07-26 00:00:00,2,"Bad Santa 2 is bad. It has the feel of a tacky, cash grab kids movie, with all of the profanity you could ever want and more. I swear all the f#$%Ing time, I'm also a young horny guy, but this film takes no rest. It depends on it, for some reason.Plot- Picture the first Bad Santa. Okay, now watch the trailer for this movie. Then, add a typical douchebag as a villain and a trashy over the top Kathy Bates. Finally, imagine a derivative ending to it all, followed by a montage of testicle photos on Tony Cox. It was pretty stupid.Writing- Literally every other line is a sex joke, and if Tony Cox is on the screen, you can bet he's getting grilled for being a midget. I think profanity is great, but the people making this movie have no creativity or timing. Not one single quote.Characters/Acting- Acting wasn't bad at all, but Billy Bob seems a bit less tenacious, when he should be furious by this point of the Bad Santa time line. There are plenty of moments that feel like you're listening to a childs movie in terms of their wording and performance. Quality- The movie was shot well and everything technical is great, but its got no style (not that I need that, I just wanted to walk away with something rewarding) and I don't have much else thereOverall, the first Bad Santa is one of my top 10 favorite movies. It was original, really funny, honest, and even heartwarming. A very underrated christmas movie. This, Bad Santa 2, is just as crappy as it looks. If you like nonstop trash talk and any movie with a good actor, go for it. But I recommend you stay away."
" horrible vulgar low brow FAIL
",-0.87,-0.6633,2018-06-24 00:00:00,1,NOT ONE LAUGH--Vulgar and dumb script no charm and joy as the first Bad Santa a huge FAIL
" Just plain unpleasant
",-0.4767,-0.9727,2018-05-16 00:00:00,5,"Alcoholic disaster Willie Soke, saved from suicide by loveable man-child Thurman Merman, moves to Chicago where he runs up against his old deeply unpleasant dwarf sidekick Marcus Skidmore and his even more deeply unpleasant mother Sunny. Together, the 3 of them plan to rob a charity which hires down-and-outs to be - yes, you guessed it - Santas under the guidance of dodgy philanthropist Regent and his big-breasted sex-starved wife Diane. Crime and sex ensues.I never saw the original, but I get the joke: wouldn't it be funny if there was a Santa whose every quality was diametrically opposed to everything Santa stood for? Well, apparently, it was such a good joke that it merits a sequel, albeit it had to wait for 13 years.This film has an ugly start - the fundamentally unlikeable Wille Soke, bemoaning his life, tries (and fails) to commit suicide. It then moves through a series of unpleasant events in which unlikeable people do unlikeable things (the most likeable of these being when Christina Hendricks repeatedly yells ""F*ck me!"", in the throes of a knee-termbler with a fully-Santa-clothed Billy Bob Thornton against a dumpster down a scuzzy back street alley.The only likeable character is Thurman Merman, 8 years old in the original movie and now 21 but acting in every respect as if he was still 8: a nice character, but not even slightly believable.The film contains profanity on an industrial pollution scale (not unexpected, but not very edifying either) and is profoundly unpleasant in almost every respect.Yet I laughed. Not constantly, and not that deeply, but it did raise chuckles fairly frequently. I suspect that this makes me a bad person, but I take comfort from the fact that I am no worse than the people who made this horrible film.I am ashamed to say that my lower lip trembled during the Silent Night sequence."
" Disgustingly enjoyable!!!
",-0.4359,0.5233,2018-03-22 00:00:00,7,"Almost as vile as the first and a great addition in the form of Kathy Bates.A role I believe only billy bob could've got away, smiles throughout."
" Almost as good as the original.
",0.6022,-0.833,2018-02-24 00:00:00,7,"However, it doesn't have John Ritter or Bernie Mac, and Billy Bob is looking old as fuq but ain't he?The one thing that negative reviews say that is true is this movie is very vulgar.... as it should be....This movie is full of laughs.Hopefully they make one more Bad Santa and some sandwiches!"
" Not terrible
",0.3724,0.9568,2018-02-18 00:00:00,5,"The problem with this movie is that one is forced to compare it to Bad Santa. The original is much more than a great Christmas movie. It's in everyone's top 5 comedies of all time. If there was no Bad Santa, Bad Santa 2 would be viewed as a decent Christmas movie. It's still better than Elf but it lacks the original creatives, any live interest, both of whom were exceptional in the original. It also lacks the worth adversary like the head of mall security in the original. Plus it feels like it's a bit sanitised.Not terrible but not a patch on the original."
