title,title_sentiment_score,text_sentiment_score,date,rating,review
" Not Horrible, But Still Not Very Good.
",-0.3631,0.9663,2018-01-12 00:00:00,5,"The original 'Bad Santa' from 2003 is a raunchy classic. A washed-up Santa and his elf friend annually rob malls they work at; then Santa's habits are catching up with him and he befriends a kid who he grows to care about. The movie is dark, the jokes are hilarious, and there is so much depth in the characters that give the movie its heart.Anything wrong with a sequel to this? Not at all. Anything wrong with a sequel being made more than a decade after the original? Absolutely. One thing almost certain about sequels that are released a decade or more after the predecessor is that is it will be a hugely inferior retread. Case-in-point, 'Bad Santa 2.''Bad Santa' from 2003 was no masterpiece by any means, but at least everything was fresh and its heart was in the right place. The sequel tries to recapture what worked before with only a few elements coming out good.Billy Bob Thornton returns as the sex-addicted alcky, Willie Soke. He's had a bunch of odd jobs since quitting the heist business, but has not amounted to anything and hasn't changed much. Thurman Merman/The Kid still comes by and annoys Willie. This is the essence of both films that played the groundwork. It's The Kid who makes this sequel worth sitting through. Thurman is going to be 21 in a few days and it's funny to see that he hasn't changed much either. There's a few sexual jokes with Willie and The Kid that I'll admit made me laugh a bit.Then familiar and dull territory gets taken advantage of with the arrival of Willie's old sideckick, Marcus. Willie still isn't over his betrayal, but reluctantly accepts Marcus' plan: steal over a million dollars' worth of donations from a homeless shelter in Chicago. Marcus' man on the inside is Willie's mother played by Kathy Bates. One of my favourite actresses ever is one of the major drawback in this film. It didn't hurt to see her play anybody foul-mouthed, its how bad her writing and delivery of it all was. There's someone else bad on the inside who's a rival, and forgettable and impossible to care for.As as I started, this tries to recycle almost everything of the first. Still lots of sex (actually way more sex this time around), lots of booze, lots of swearing, same setups, same results, and very little is actually funny. Not horrid, just stuff to brush off in an instant.The Kid decides to pay a surprise to Willie as an early Christmas present. This element with Thurman comes the closest to reaching the level of the first. Willie and Thurman is not as good here as it was before, but we still very much enjoy them both this time around. Without Thurman Merman and Willie, the movie would have floundered more and my rating would be lower. But as it is, 'Bad Santa 2' is nothing special, yet not an abysmal failure.2/4"
" Cash Grab
",0.0,0.1027,2018-01-03 00:00:00,4,This seems strictly like a cash grab. It had twice the crudeness from the original but only half the story.
" Another Christmas movie classic, not to be seen with the family
",0.0,0.9641,2018-01-01 00:00:00,8,"This movie is better enjoyed after watching the first. There are plot points that are relevant. But regardless of this, just like the first movie it is a hilarious adult comedy. I just binge watched both and the first one is just a tad better. Perhaps because of the originality, bu the second contains more profanity.... hummm tough choice. 
Not juvenile sexual humor, rather very serious and extremely funny. Highly recommended."
" Freakin' Bad
",-0.5423,0.7552,2017-12-31 00:00:00,5,"That was too much of anything! A lot of swearing & sexual behaviour. I didn't see the first one, but I guess it was better. ""Santa 2"" should not be in the title. It may be, without any problem, just ""Bad"", because it's bad, as a whole. It has some funny and goofy scenes, but you can barely sketch a smile by them (at least that happened in my case). Don't put it in your watchlist, wishlist, or whatever... It doesn't worth a penny."
" wtf
",-0.5859,-0.9809,2017-12-26 00:00:00,2,"We all love the first film, it was great, this film is very dark and very awful.first at the end of the first film, willy had redeemed himself and turned into the good guy, but in this, he seems like a bad guy again, being nasty to the ""kid"" trying to
steal from him and stuff.. 
and that black dwarf guy is bad and I hate him, I really hate him after he killed the store security guy in the first film, and he was talking about tea bagging people. 
then Kathy bates shows up and I dont know if the film makers intended her to be as revolting as she looks here, but she literally made me sick looking at her. I dont wanna see some saggy old women in underwear AT ANY POINT IN MY LIFE. 
the film is just dark and doesn't have any good gags, 
and at the end when it shows them photos of Willys ball sack on the dwarfs face was too much, I dont wanna see ball sacks in movies I watch"
" Watched this for two reasons
",0.0,-0.9098,2017-12-24 00:00:00,3,"Watched this for two reasons, in spite of hearing of the negative reviews: 1) Watched it as a sort of homage to the original, and 2) I'm sort of wary of 2nd hand info, when it can be easily watched.So, I watched it. The best way to describe it is to remind you of the common preconception of the original ""Bad Santa"", admittedly gleaned from the previews showing at the time: It was popularly understood to be a ""bad boy"" yawp, which contrasted wonderfully with the discovery that it worked marvelously as a touching redemption tale. It was a fantastic Christmas movie for the ages, cleverly disguised as a prurient snack toss-off.Well, ""Bad Santa 2"" IS *that* movie. It is nothing more than the bad-boy snack boredom killer that ""Bad Santa"" was supposed to have been.Even if I discount the original--decide not to judge ""BS2"" by the standard of ""BS""--it *still* simply fails to rise to the level of a film worth watching, if you expect movies to be more than boredom killers. I got one grim chuckle out of the whole thing, and the rest is pretty much just well-produced spectacle. The flick *is* well-produced... but that's it. There's no real mythic payload, except for a tepid and poorly thought out demi-effort to shoehorn a few would-be redemptive moments in, here and there.It's sad. Is it *really* the case that in all of the Hollywood system, not one decent breakthrough screenplay that would do decent service to the gravitas of the franchise was anywhere to be found? Really?I give this a few stars merely for the expert production work. Aesthetically, it's a sump.Go watch the original; specifically, the director's cut. You might cry tears of redemptive joy."
" no longer so outrageously new
",-0.5709,-0.8563,2017-12-21 00:00:00,4,"Willie Soke (Billy Bob Thornton) is still a drunken screw up. Happy endings are BS. He tries to commit suicide only to be saved by The Kid, clueless Thurman Merman. Marcus Skidmore (Tony Cox) gets early release from prison and has a job lined up in Chicago, robbing a charity run by Diane Hastings (Christina Hendricks). They infiltrate by joining the Santa charity and then it's revealed that Willie's mother Sunny Soke (Kathy Bates) is the leader of the scam.It's not funny anymore. It's not so outrageously new. Even the Kid is no longer a kid. He's still chubby but the humor is gone. It's sad to sit thru an unfunny comedy. I wonder if a sequel could be made of him struggling to make it work in the suburbs with Sue. Kathy Bates competes for an ugly off. Billy Bob is lifeless. Hendricks is cold. Not much is funny here."
" Bad Santa 2 is BAD!
",-0.8412,-0.9532,2017-12-13 00:00:00,1,"I am astounded that anyone would give this movie more than one or two stars. But I suppose what's one man's garbage is another man's treasure, and there's no accounting for bad taste. The writers were intent on including every off-color...no wait, every type of disgustingly gross, filthy dialog imaginable, assuming the audience craves this kind of so-called humor. I am no prude, but there was nothing to redeem this movie from the trash heap. Perhaps some viewers will watch this so they can play the drinking game, taking a shot every time the 'F' word and it's derivatives is uttered. If that's the case, expect to succumb to alcohol poisoning by the 30 minute mark."
" If you don't Redbox request this for Christmas; you are completely stupid!
",-0.6105,0.2441,2017-09-21 00:00:00,10,"We at my house love Christmas movies. Late into the Christmas season I can talk my wife into watching Bad Santa. I never thought that movie could be topped. When I saw Bad Santa 2; from the very start I could not believe it. It was totally hilarious. They brought back the old cast elegantly. You just knew it would be just as great as the last Bad Santa; from the start. My wife who kind of does not like Bad Santa; insisted on watching it to the end, and she rarely feels that way. Kathy Bates being in this movie really brought it home for the woman folk. If it were not for the woman folk that think Kathy Bates is our image of our true self; we would be left behind. Long live Bad Santa and Kathy Bates and the land of the free. sem·per fi·de·lis!"
" I almost had a friend, once.
",0.4445,0.9046,2017-08-20 00:00:00,8,"Willie (Billy Bob Thornton) teams up with Marcus (Tony Cox) and his mother (Kathy Bates) to rob a crooked charity in Chicago on Christmas Eve. Brett Kelly is back. He is not longer a dumb fat kid, but now is a dumb fat adult. Male fantasy Christina Hendricks has a role and Billy Bob Thornton says the things to her every guy wish they could.The actual robbery was at the end of the film and was anti-climatic in a film that never had a climax...other than that other kind. The movie was filled with sexually crude, over-the-top humor that was amusing from the shock value, but not LOL funny...like a bad Apatow movie. Certainly this is a low point for director Mark Waters. Octavia Spencer was funny as a prostitute, although if you are really that hungry Octavia, I'll make you a sandwich. Co-writer Shauna Cross demonstrates her diversity as she was the screen writer for ""If I Stay"" a polar opposite type of film. Kudos, I think. If you like crude sexually humor, that is what this film is all about.Guide: F-word, sex, crude sex talk, fake scrotum nudity."
" Fun Companion Piece for Fans of The Original
",0.6808,0.9985,2017-07-23 00:00:00,6,"2003's Bad Santa is the ultimate irreverent Christmas movie. If you're burnt out on sappy, overly sweet joy around the holiday season, the dark, raunchy, unashamedly politically incorrect content of the first is the perfect antidote to that. The original also had great performances and a story with some actual heart to it in the end. The sequel, strangely made over a decade later, is more of the same, just not quite as fresh, without as much meaning and heart in it, but still entertaining, especially if like me, you're a fan of the original. The story, following down-on-his luck deadbeat safecracker Willie Soke, kind of tarnishes the happy ending of the original, and in a way undoes a lot of the character development that Willie went through. It's kind of a back-to-square one opening that resets the story to the place of the original, which is more or less what this installment is. I knew that going in and enjoyed some of the foul lines and funny situations, but the original had the support of (unfortunately deceased) gifted performers such as Bernie Mac and John Ritter, both very skilled comedians for Billie Bob to play off of, even Ajay Naidu from Office Space making a cameo. The sequel features Oscar Winners Octavia Spencer and Kathy Bates, as well as Mad Men alumni Christina Hendricks, as well as returning cast members Tony Cox and a grown Brett Kelly, who looks more or less the same just slightly taller. Bates does well as Soke's mother, but the addition of her character to the story sort of feels like the concept getting stretched, which is what this entire movie is. Although still funny, a segment in the film that features a heist of a high-priced estate feels forced and tacked on into the plot, seemingly an excuse to repeat the scene from the original with the kids sitting on Santa's Lap, with Willie confused and disgusted by what they ask for. A lot of the movie is like this, and it suffers from not having the indie-film feel that Ghost World director Terry Zwigoff brought to the original. It feels a bit more stripped down and an imitation of that style, and like I mentioned earlier, it just doesn't have the same heart. I would more or less only recommend this if you've seen the first multiple times and like it, and really want to see more of Willie and his messed up friends, like I did. If you've never seen either, see the original, and if you only thought it was fun for that one time watching it, you should probably leave it at that.I definitely hope that in another 13 years, we don't get yet another Bad Santa. I can't really figure out why they decided to wait so long after the feeling and interest of the original died down to do this, but the concept and idea is officially stretched as far as it can go. The talent on display and some of the genuinely funny laugh lines in this keep this from being firmly average."
" A Worthy sequel
",0.4404,-0.7741,2017-07-18 00:00:00,8,"Lewd, crude, vulgar, and funny as hell. Touching, too. The kid is back and innocent as ever. Kathy Bates is incapable of a bad performance, and nails it as mom. The last 30 seconds was the best part. I was still laughing after it was over. Not for the easily offended or even the moderately offended."
" ""Well it's startin' to feel like Christmas.""
",0.5574,-0.9366,2017-07-18 00:00:00,6,"This movie doubles down on the use of the 'F' word and embellishes it with various scenes of sexual perversion that brings down one's expectation of a humorous follow up to the original ""Bad Santa"". I could almost go with the banter between Willie Sokes (Billy Bob Thornton) and Marcus Skidmore (Tony Cox), but throwing Kathy Bates into the mix as the foul mouthed Mom of Thornton's character was a bit much to take. Not to mention whatever actress Christina Hendricks might have been thinking to appear in the dumpster scene with Willie doing the nasty. I don't think that's exactly what 'Giving City' had in mind before Willie, Marcus and Sunny showed up. I don't know, I found ""Bad Santa"" to be something of a guilty pleasure but this one was way too much of a 'good' thing, if you know what I mean. In other words, ""Bad Santa 2"" was just plain bad."
" If it had a butthole......
",0.0,-0.2803,2017-07-16 00:00:00,7,"This was a decent attempt at rekindling an old flame. The first Bad Santa set a movie trend years ago, and introduced most of the world to Billy Bob Thornton. This installment was a bit of a let down. The jokes were funny, but felt forced and awkward. The interaction between Bates and Thornton was fun, however there was almost too much animosity between Santa and Elf that Elf was a useless character. Not only did they not have much screen time for the Elf, his lines were almost identical to the first movie. SPOILER The heist was almost not even important in the movie, as by the end you pretty much have lost interest. It is a sad relationship to see between Kathy and Billy's Characters as is most typical family drama. I didn't care for the three of them turning on each other BUT it was hilarious to see Elf get shot AND ran over. That was one of the most realistic scenes I've yet to see on screen. Very accurate depiction of Chicago too! The chubby kid could have used better development, like have him transfer jobs to the Hoagies shop in the Chi and have some rude customers come in(Typical in Chitown) All in all this film hit me hard in a more dramatic way, than comedic. It was kind of sad to see Kathy Bates and Sh****stick trying to kindle their relationship and let by gones be. Good film, just fell a little short, especially for the cult- classic being the ancestor to this."
" Pretty good for a sequel
",0.7269,0.9587,2017-07-15 00:00:00,7,"I had low expectations here, as sequels often suck.But I liked this one. Its pretty much a rehash of the the original, but raunchier and still funny. I laughed out loud at more than one scene. The funniest parts are when Willie and Marcus take shots at each other, and when Willie has the kids on his lap while he is playing Santa."
" Sodomy was never SOoo funny!
",-0.4015,-0.9973,2017-07-15 00:00:00,1,"Bad Santa has been ruined just like Dumb & Dumber. It's as if the lazy ignorant degenerate Hollywood writers hate & despise comedy & want smarmy ugliness in its place with a small community niche fixation on the glories of sodomy,doing everything in their limited vocabulary of ""F"" words & generic hardcore poo poo jokes to utterly destroy any fond memories one might have had ...welcome to the New America your not Kansas anymoreWhy the hate?Now with Bad Santa 2 Sodomy is the MAIN theme with alcoholism secondary. Billy Bob bangs(sodomizes) two mousy horny women, ones a rich recovering alcoholic the other a plump security guard . The acts happen near a dumpster,Christmas tree lot and bar bathroom ...plus out of the blue a blonde party hostess masturbates Billy Bob for no apparent rhyme or reason while the birthday kiddies are in the next room.I guess the HIV/AIDS epidemic & Hollywood hysterics from drama queens is so passé.Billy Bob's character looks gaunt, medicated & suicidal...I wonder what Bad Santa Christmas cheer he's still trying to spread while in a alcoholic haze & without a condom?The Black dwarf is still angry but now has new murderous thug persona . Billy Bobs mom (Kathy Bates) is an old swearing tramp stamp whore in one of her worst-best 'Misery' flashback roles.The clueless fat innocent kid from the original is now a stalking clueless twenty year old retarded man-child with a dismal future ahead of him (I worry about him) Insultingly bad and distressful knowing the suicidal drunk & perpetual man-child may be homeless together with Santa Lennie sodomizing self hating women & George watching behind a dumpster.A one star * black-out ,bathhouse hangover."
" Not as bad as some of the reviews on here
",0.431,0.8899,2017-07-14 00:00:00,7,"I enjoyed this! I got what I was expecting - which was something similar to the first Bad Santa. I will say though that Kathy Bates nailed her role in this and was probably the highlight of this movie - I couldn't stop laughing, she was that hilarious! This was no worse or better than the first film but it was just as fun and entertaining! It's a 7/10 from me"
" Very original comedy
",0.6566,0.9451,2017-06-24 00:00:00,7,This definitely feels like the original. Too bad they didn't meet their budget. I would love to see a Bad Santa 3. I'm still wondering if the real Therman Murman ever has even studied sexual education. He's the best loser I have ever seen. I mean honestly 21 years old and singing in a f(expletive)cking choir. Sh*tstick was classic too. Sh*tstick's mom was great ever since her appearance as Adam Sandler's mother in the Waterboy. Thank god Thurman Merman wasn't laid in the film. Maybe in the next one eh buddy.
" Much funnier, slutty, immoral Santa, but....
",-0.5574,0.998,2017-06-21 00:00:00,6,"Look, I don't why this doesn't deserve more than a six from me. It outsanta's first on laughs, the first couple of minutes had me worried, from the start of that wonderful tracking shot along the paved two way drive in downtown shopping L.A. But then, it becomes so much funnier and punchier, laughs a constant. Thornton, a great actor, seriously, wonderfully resumes his role, where he's more pathetic, and repellent, hitting rock bottom, but still doing what he does and loves best, boozing and womanizing, some more beauties, some I said, not as hot as the ones he did, in the original, and one wonders what happen to Lauren Graham's character, Sue, the barmaid, from the first. He's revisited by an arch enemy, well two, our loud, angry cursing dwarf (Tony Cox) and stepping on board this timer (Kathy Bates) who plays Thornton's loser of a mother who had Willie at 13. Thornton is pulled back into action, this time stooping lower, by putting on the Santa Claus suit again, and creating a diversion, where his partners, rob charity money for homeless kids. The kid has grown up, and like Thornton, is exactly the same, asking dumb questions, talking crap, and still believing about the jolly bearded man in the red suit. The continuing humorous dialogue never slacks at all, where I was laughing much more in this one. One scene where Thornton, snaps at good for nothing Mum, interrupted while eating pizza, familiarizes us with a scene from the first one, where he was interrupted while on his lunch break. The line is almost a clone from the line in the original. The two twists in the end were good, where the final scene, which I made for something else at first, was tasteless and unfunny as this kind of same gag involving genitalia, has been done before. What I really loved about this one, which doesn't have to apologize for nothing (another quality I loved) keeping the happy spirit of Christmas alive, is that the characters haven't changed one bit, especially Thornton's and our new player, (Bates-fantastic) is a real nasty piece of work, where we can see, where Thornton got his beautiful bedside manner from. He has got a bit more of a heart in this one, where he has gone a little soft, where you savor these few moments. His decision of goodwill near the end, teaches us a valuable lesson about greed. But why do I feel this doesn't deserve more than a six? I put it down to it's wearing moments, where you feel, it's better to quit while ahead as with other sequels. It could be cause it's done with the same form, and took, lower below the belt laughs, to make it work. It got to a point where it felt tired, and the wearing was showing. It's as though the movie was relying on gross profanity, or too many moments of familiarity, like structure of story, ""The walls closing in angle"" or scenes, like ""the sitting on Santa's lap"" which was more meatier here, and the greedy people that could jeopardize, Thornton and company's little job. Too, the plots of conflict, and situations, which I thought were well structured. We again, sharing Thornton's familiar vices and habits, which are never changing. This is where the wearing happens, through the familiarity. Also, the substitute of a beauty, by another one, angelic and hotter, being that of Kendricks, so refreshingly cute, spouting those same words like Graham, who gets she gets butt fu..ed by Thornton. All of this highly poses a the question? ""Should there be a Bad Santa 3?"" Of course, not. Why ruin a bad thing? And this Santa, is a good one to finish an end note on, ball sack or not. See if you can spot who Mark Starr is here. cause he fooled me, until I read his cast role."
" I love this movie
",0.6369,0.962,2017-06-18 00:00:00,10,"I love the old cast. For me it's a good comedy with liberated humor. Billy Bob Thornton and Tony Cox act and look like there weren't 13 years between movies, like the second movie came a year or two after the first one. And I was totally surprised how does Brett Kelly look like OMG! He is 24 now, but he as so natural as ""The Kid""! I even googled if it's him or they took a new guy.Thank you guys, I was waiting :)"
" The return of the bad Santa!
",-0.5848,0.9817,2017-06-14 00:00:00,6,"I did not expect this sequel, especially not after 13 years. Even the first film has been just a good for me. I won't say it was an unnecessary follow up. They retained main cast, well, only lead two plus the boy who is now in his early 20s. A similar pattern storyline. If you have already seen the previous one, you would know what to expect from it, but not how much and that was the main issue with this. So anyone would predict the scenes, as well as the twist. Like most of the sequels, it indeed weakened. Though somewhat enjoyable for the good performances.R rated comedy. That's another advantage for the grownup audience. But if you aren't a fan of that thematic, then it is even worse than what it's rated everywhere. The length was good, a simple plot, yet the characters had not seriously developed, particularly the new ones. The big excuse was it is a comedy film. They all just came in and straight away displayed whatever they were up to as if we knew them very well. Despite an average film, it can be watched once, even if you liked or not the first part. And it is mainly because of Billy Bob Thornton.6/10"
