title,title_sentiment_score,text_sentiment_score,date,rating,review
" Deepwater Horizon
",0.0,0.5748,2021-04-10 00:00:00,8,Deepwater horizon was a really good movie that told a real story About an Oil Rig When I first bought this movie I did not even watch it for a while it was not so interested into it I watched it today I really like Mark Wahlberg performance in this movie I liked all the characters in this movie the only character they want u really to care about is the wife in this movie which to me trying to be in the movie The Oil stuff what happens is insane It was cool visually and it was insane crazy I give Deepwater Horizon An B+
" Informative
",0.0,0.3597,2021-04-04 00:00:00,4,"As a historical film, this was very informative. The story was very realistic and the way this was filmed was also so realistic I wondered how it was filmed. It was a very heroic movie the latter half of the movie was just filled with fire scenes and explosions, and as accurate was it was, there was so much of it that I was skipping parts of it."
" Realistic acting and effects when Deepwater Horizon exploded, set on fire and collapsed. Very realistic film of that real accident.
",-0.765,-0.2144,2021-02-28 00:00:00,7,"Drama/history/accident film based on a true story. This is the biggest accident in the history of the oil industry in the US, which occurred in 2010. The first half of the film is something meaningless and perhaps boring, the film tries to show us some deepwater horizon crew members, but it should be shorter. The second half is the accident itself, where the pressure of the underwater pipe is high and defuses initially but then follows an explosion and the Deepwater Horizon is engulfed in flames and gradually collapses. Crew members try to survive and fight against time, explosions and flames. In the end it shows the real characters as well as some of the victims of the accident. An overall pretty good effort, although it could have been better, filling more in the second half of the film and reducing the first half that was pretty meaningless. As a whole it is recommended, and both Wahlberg and Kurt Russell are very good at their role."
" A Real Monster Story!
",0.0,0.99,2021-02-15 00:00:00,8,I didn't really know what to expect when first going into this film. For the most part it was shot great. Being base on a true story. I believe they captured some great moments. There's several scenes in this movie the I love to re-watch. There's a part where Mark Wahlberg's character is telling his daughter about his job and its just awesome to watch. My favorite character in the film is the Oil Drill. Its a true beast. Some shots reminded me of Steven Spielberg's movie Jaws. Acting in this film was good from all the actors and the special effects are good. There's just a few events/hero moments that where just a little over the top to me. But... This is a survival story and its a great watch.
" Not For The Faint-Hearted . . . or Epilectically inclined
",0.0,0.9934,2021-01-11 00:00:00,2,"This is not a review or comment on the story (why bother re-telling stories and plots in reviews anyway?) but on the film and its technique.
And right from the beginning I would say I am only partly qualified to review it. This is because I could not watch it.
This is my statement on (and my plea against) the whole hand-held camera culture and what it does to otherwise (possibly) perfectly good movies. It is an abomination.
Perhaps the creatives thought it would give teh story the realism it deserves. Think again! The story carries the thrill, not the guy/gal carrying the camera in a sweaty hand.
Now quite possibly those with brains that are not prone to seizures brought on by external neural influences (like strobe lighting eg) may find this movie exciting and half their luck. But for us folk who actually like to see a story told in a manner that, to say the least, does not actually distract us from the story, it is unwatchable . . .. very much like most other movies made with the infamous hand-held.
Now there is a place for it, to be sure. But it needs to be used with great discretion. Or left to the undergraduates at film school as they find their footing for the reel world.
Hell, it's not as if they needed to cut corners and save a few dollars on proper cameras surely! But that is how it comes across.
So, sorry, had to give this one a miss, but I read the reviews and the synopsis and have a pretty good idea of it all. Just a pity I couldn't watch it as a movie."
" A sad story wrapped in a great movie
",0.25,0.9938,2020-12-10 00:00:00,8,"Wow, what a movie this is. It's sad, ofcourse, that it's based on true events. But it's a great movie. I love Wahlberg and he plays this role perfectly. A strong leading character in a setting ruled by male group energy. Gina Rodriguez is perfect for the role as the only female on the rig. The movie has it all: a great cast with Russell and Malkovich, a good script, a convincing work atmosphere that you would expect on a rig, spectaculair CGI and the story of greed with all of it's consequences. Overall a must watch if you're interested in the synopsis"
" So sad!
",-0.5697,0.9108,2020-11-26 00:00:00,8,"Couldn't actually believe this was a true story , i balled my eyes out ! i found this so interesting great watch though!!"
" Realistic and emotional
",0.1531,0.6369,2020-11-17 00:00:00,10,"I didn't look away for a second while watching this. Grasping, emotional, wonderful - I cried. I believe story from the first second until the last. Really makes you think, puts a perspective to everyday life. Thank you to all involved."
" Too bad
",-0.5423,-0.977,2020-11-09 00:00:00,4,"It's an interesting story, but it's a shame it wasn't made by a director able to tell a coherent story and an actor with more range than a baseball pitcher with late stage Lou Gehrig's disease. I still have no idea why this happened the way it did, and when all hell finally breaks loose it's all a jumbled mess. Painfully mediocre. It would also have been good taste to at least mention the massive environmental damage caused by the events portrayed in this film."
" Intense
",0.0772,0.5994,2020-11-09 00:00:00,8,"An intense and dramatic movie that recounts a huge event in American history.Marky Mark is always stellar in all his movies. His acting adds an intensity unlike any other.I watched this movie all the way to the end. I found it both educational, informing, and mind-blowing.Thank you to the heros on that day of April 20th."
" I wish they spoke understandable english
",0.4019,0.7868,2020-10-28 00:00:00,6,"Show was ok and entertaining but as someone who only speaks English i had trouble understanding them for 90% of the movie. I understand they wanted to make it authentic and the actors spoke with the same Southern USA accents as the characters they portrayed but most English speaking people can't understand that.
These actors normally speak perfect English so I know its not their fault and must have been the choice of the director. If you are not from Southern USA then turn the subtitles on."
" Well made movie, good acting and a tribute.
",0.6124,-0.7096,2020-10-16 00:00:00,8,"First of all a technically well made disaster movie. It also highlights the fate of the men and women directly affected by the event (which was at the time somewhat overshadowed by the public focus on the environmental damage). It is also a tribute to the American working class portrayed by Mark Wahlberg and specially by Kurt Russell as Mr. Jimmy. Small drawback: John Malkovich's acting as the "" typical incompetent management guy"" is a bit over the top."
" Perrrrrrfect work 👍🏽
",0.0,0.987,2020-10-14 00:00:00,8,"Peter Berg that's mean incredible thing unbelievable thing, (wow wow wow wow) how can I describe him?!!
It's impossible on any director to do what he did in this movie, all this success for a movie was depend on director.. Last thing, Mark Wahlberg this human creats the characters, he is the best choice, he is another wow wow wow. Lol"
" What happened needs better explanation
",0.4404,-0.88,2020-08-18 00:00:00,6,"An impressive recreation of the Deepwater Horizon offshore floating rig, the key individuals working on it, and the disastrous explosion and spill that occurred. The story ends with the rescue of all but the dozen or so who perished in the catastrophe, and doesn't deal with the efforts to tap the leak and the damaged caused by the resulting pollution, and BP's less-than exemplary efforts to set things right. Despite the film's attempt to explain in laymen's terms what happened (even using the main character's daughter's science project to demonstrate the concept involved), it's never clear exactly what happened or why, other than the fact that shortcuts were taken and safeguards overlooked, all apparently in an effort to get the rig back on schedule (it was more than 40 days behind). A good lesson in why we need regulations and government agencies to enforce them."
" Watchable but unexceptional disaster movie
",-0.7684,-0.3182,2020-08-16 00:00:00,7,"A paint by numbers disaster film, saved by an A list cast and captivating effects. Berg does manage to inject a fair amount of pace and tension into a very light weight script to make a watchable, undemanding popcorn flick."
" Good job
",0.4404,0.7425,2020-07-23 00:00:00,7,"At first, the kissing scene seemed like a movie. Then everything seemed to be where I came from. The accident happened in 2010 in the Gulf of Mexico. The acting of the actors is very good and really feels."
" Genuine Tension
",-0.3182,0.1779,2020-06-09 00:00:00,7,Wonderful cast that brought a palpable tension and edge. Slow start but edge if ur seat drama mostly
" Gripping and emotional.
",0.1531,0.8436,2020-06-07 00:00:00,9,Gripping and emotional true story. Mark wahlberg never disappoints and this one shows true spirit.
" The second half makes it all worth it
",0.2263,0.3615,2020-05-15 00:00:00,7,"The first half is alright. There's some fine moments of levity and some unintentuonally funny moments, like John Malkovich's wonderfully malkovich performance and Kurt Russel's pronunciation of the word ""cement"", but it was nothing special.The second half, on the other hand, is absolutely terrifying.
It doesn't depict the disaster as an exciting action set piece, but as a harrowing living nightmare from hell.
It's incredible, immensely disturbing and hard to watch.
It made it all worth it."
" Horrible booring
",-0.5423,-0.8172,2020-05-13 00:00:00,3,"Horrible booring I'm so disappointed 😥
I can't believe that"
" A classic 'disaster' blockbuster
",0.5994,0.9785,2020-05-13 00:00:00,7,"Deepwater Horizon is very much like lots of other blockbusters, but it is enjoyable and worth a watch if you're not up for something too taxing. It helps that I really like Mark Wahlberg and Kurt Russell is great value.We all know the script, something bad is going to happen, but the film is well executed and the fact that is is based on a true story (that I didn't know the outcome of) adds to the tension. All the characters fill the necessary gaps; a few 'good' guys, a few 'bad' guys, lots of brave guys and a worrying partner at home for good measure. They are all done well though and you soon find yourself invested in the outcome.6.9/10 - Expect some witty dialogue, a few tense moments and lots of big action sequences. Oh and don't forget the popcorn."
" Well done recreation of the BP oil rig that blew up in 2010...
",0.1531,-0.8804,2020-05-10 00:00:00,8,"1st watched 10/15/2016 :
Well done recreation of the BP oil rig that blew up in 2010 and started a major investigation. The movie is ""not"" about the investigation, but about the oil rig(called ""Deepwater Horizon""), and the people who worked on it and were a part of the disaster. This movie shines because it focuses on this aspect of the incident(the disaster itself). It stars a bunch of capable actors including Mark Wahlberg, Kurt Russell, John Malkovich, and Kate Hudson - who encompass a story, I believe, that people want to hear. The workers knew they weren't in for a cakewalk when they boarded the hovering ship. Right away - the 2 big dogs(Russell & Wahlberg) question the lack of a concrete stress test. The bigwigs are interested in getting the drilling done as quickly as possible, but the ones that know what they are doing won't easily falter. Eventually - after a few stress tests - they allow the drilling to happen, but things soon fall apart. The rest of the movie is the action of the disaster - unknown by most folks, without seeing this movie. This is why the movie is so interesting and effective. Not to be missed."
" Focuses mainly on the explosion & immediate aftermath, and little on the finer details
",0.0,-0.8862,2020-05-08 00:00:00,7,"It's sad to think that Transocean/BP lost nothing, and 11 people lost their lives (and who knows how many millions of animals died from the 210million gallons of oil that was spilled).Transocean/BP got at least a $500million insurance payout, and who knows how many billions of dollars they made from the Deepwater Horizon rig in the 10years that they operated it. And NOBODY went to prison. 11 people dead and no repercussions.Anyway, the film is pretty good... I would have liked it if they went into a bit of detail on what all the various terms is that they used like marine riser, annular, EDS, kick, and so on. They used to many terms and jargon that the average viewer is left in the dark. They could maybe even have shown what the capping process looks like in the aftermath of the whole event, as I think the capping process would have been very interesting and would have placed a capper (excuse the pun) on the whole movie.But it's a good movie to watch if you're interested in the whole event, even-though it does offer only a cursory glance at the causes of the disaster, and spends the majority of the time focusing on the panic & mayhem that happened during the actual explosion."
" Not a word about the ecological consequences
",0.0,-0.9614,2020-04-20 00:00:00,4,"I can't believe thid movie is 100% focused on the people working on the oil rig. To be crass: What's worse, 11 dead humans or the enormeous damage to nature and wildlife?Even in a situation like this, the station including staff and their responsibilities must be much better equipped to prevent or minimize the disaster on the surroundings. If not, such platforms should not be allowed.Obama said, ""This oil spill is the worst environmental disaster America has ever faced"".At least the last 1/3 of the movie should be about the aftermath. This is so irresponsible. It is just like another ""Towering Inferno"" movie."
" Oil
",0.0,0.25,2020-03-31 00:00:00,10,Quaint rom com. I like the bit where the oil rig blows up
" Excellent action/suspense movie but....
",0.5719,-0.9354,2020-03-12 00:00:00,7,"I can't speak to how realistic this movie is I don't know the details. This was a real event and people lost their lives. But for the conversations and details within the movie I am not sure how accurate it is but it doesn't matter if you want a good fast paced tense movie this is a good one. I have mixed feelings about it, the movie focuses on the oil rig workers and really focuses on putting the blame on the BP execs and basically saying they forced us into this situation. Which might be how it happened.They show the real folks at the end of the movie so I am sure you can dig into the actual facts and I know BP was sued or fined billions of dollars over this. It was interesting to see the life on an oil rig and show just how scary things can get if things go wrong.There are lots of scenes of people getting hurt or killed so if you are sensitive to that don't watch. Otherwise its a solid movie and great acting from Mark and Kurt."
" An impressively done film...both heart-breaking and infuriating...it's story will leave a deep impact.( Hong Kong B+ Movie) My Ratings 9/10
",0.4215,-0.4939,2020-03-07 00:00:00,9,"The range of well-developed characters, detailed analysis of the pre and post crisi, and the score all worked perfectly together to turn a real life horror story, into a real life horror story you can see in theatres."
" Expressing a real tragedy
",-0.6597,-0.9845,2020-02-09 00:00:00,8,"This movie was great in showing the disaster happened in April 20,2010 intially and was followed by oil spill in Gulf of Mexico for a few months! the movie clearly shows what happened and why this happened. I just saw this movie and I enjoyed it. during the movie the crew on oil rig ran a negative test( a test which basically is done before the mission starts to see if the pipes can handle the pressure and if there is any pressure on the main pipe). They say that there is a huge pressure on the main pipe but the coordinators on this event asked them to run this mission anyways without really think of how dangerous the situation is. What worst is the manager of the crew team (the one who has to give the crew permission to start the mission) thought that pressure would be okay. He was under the pressure of supervisors because the project was behind about 51 days. So they started pumping up the oil and eventually the pressure built up and pipes broke down. massive amount of pressure was on pipes and oil started flowing out. following this the generators started to work faster than normal and the heat they produced made a massive fire and then a explosion and one second later the whole rig was on fire. the movie pictured all these events just fine and what is sad is that 11 crew members lost their lives and about 4.9 million barrels of oil spilled out in the ocean. It was the greatest tragedy in oil industry for the U.S. I personally recommend to definitely watch this movie."
" Great Movie for Climate Change Deniers
",0.4588,-0.0176,2020-01-11 00:00:00,2,"If you're worried about being lectured about the environmental impact of mining for fossil fuels, don't, because this movie doesn't mention it once. We don't even learn anything about any the damage this disaster caused. Everyone is an all American hero and you can continue your day feeling completely guilt free.If you can accept the movie is complete fantasy, you might enjoy the special effects.Absolute trash."
" Amazing!
",0.6239,0.7764,2019-12-13 00:00:00,7,"Deep water horizon delivers what it was, the story based on the true events of deepwater horizon oil spill that exploded, well at first 30 mins was just getting into the story and building the characters i was waiting to reach the point when will the things were going to start, after all it got me into its atmosphere and catching up with the scenes, amazing cinematography with all those explosion and fires burning behind the scenes, discovering the life of those workers kinda gets hard to watch how people are dealing with those things, seeing people between life hope and survival, at the ending it was sad to see all those workers had lost their lifes, at last its well crafted, highly recommended if you like disaster types, 7.5/10⭐"
" They're in DEEP doo-doo
",0.0,-0.8964,2019-11-07 00:00:00,7,"I'm not sure I know much about the true story this flick is based on, but I know a quality action movie when I see it.Mark Wahlberg of the critically acclaimed 'Marky Mark And The Funky Bunch' stars as some roughneck on board an oil rig at sea when an explosion rips through said plant. Ouch.Exactly the cause behind the tragic incident and the shortsighted people responsible for the stupid mistakes which got them this far makes the film worth watching by itself.The highlight though, is definitely the blowing up of the station and the dreadful aftermath. Fire everywhere, collapsing structures aplenty and people scrambling for lifeboats... total chaos. I love it.Give it a whirl. 7/10"
" To those calling it Hollywood trash.
",0.0,0.2023,2019-11-05 00:00:00,10,"This movie yes is much of bangs and booms. And people reviewing negative and claiming its trash. I would like to see them work on a rig in middle of the gulf isolated from fast rescue. This movie portrays what the ones on the rig and outside the rig went through and watched happen. So to those claiming it didn't happen that way. Please explain that to those who did not make it off of the rig.
Marky Mark and Kurt Russel do an incredible job."
" Wow.
",0.5859,0.9024,2019-09-28 00:00:00,8,"I've always been a fan of disaster movies but few have the impact of ""Deepwater Horizon"" The fact that it's a true story puts it in a class by itself. This movie did take its time to get going but that's fine. When it finally gets to the meat and potatoes, wow, hold on to your hats. Once the accident happens, ""Deepwater Horizon"" becomes quite terrifying. This movie is a powerful and moving tribute to the victims and their families. Honorable mention: an excellent John Malkovich."
" Captivating
",0.0,0.8932,2019-09-23 00:00:00,8,"I totally enjoyed this movie from beginning to end. It was emotionally captivating. Great acting as usual by Mark. If it wasn't for the end scenes, I wouldn't have believed that this actually happened, the scenes were just breathtaking."
" A great suspenseful and realistic movie.
",0.6249,0.8543,2019-09-01 00:00:00,9,"Loved this movie. Kept me on the edge of my seat almost the entire movie, starting with the bird strike on the way to the rig. From the sarcastic banter to the realistic sets, it was great. Russell, Wahlberg, and Malkovitch are terrific. The only thing I thought was missing was a bit more explanation of what a cement bond log is and why it was so important, and same thing for the negative pressure test. Glad they made this movie and glad they went to such lengths to make it as real as possible."
" Rewriting history using movies
",0.0,0.2621,2019-08-25 00:00:00,1,"Notice how the script writers work so very hard to make all of the oil rig workers seem so caring, loving and kind. No partiers, no drunks, no one greedy for money any way they can get it. I think British Petroleum paid good money so this movie could influence the public and worked hard to put oil rig workers in a good light. I would never work for any oil company ever. I despise the whole oil industry for dominating the transportation industry for 100 years and counting. Damn the oil."
" Realistic and raw, but with some fatal flaws.
",-0.6956,-0.2654,2019-08-16 00:00:00,7,"Powerful and seemingly realistic. Very raw and emotional, I do feel the acting could have been better. I also think Mark Walberg isn't a good casting for this movie. He just radiates this vibe that doesn't fit well with me. The incompetence of some of the workers also had me rolling my eyes just a bit."
" Best disaster Drama of this Decade...
",0.0258,0.9837,2019-08-06 00:00:00,7,"Deepwater horizon (2016)
Probably one of the best disaster drama in last 10 year which itself based on true event n please refer Google once before u watch this movie..mike Williams ( mark wahlberg) is just a normal family guy works in huge oil rig site (based on real life character)
Most of the film take place offshore gaint drilling rig,First half is bit slow even opening scenes are not much to do with a actual movie they just shown for character introduction...Actual movie starts after 45mins most of first half scenes are about technical side stuffs of how oil rig process works n its something like documentary but worth watching...second half almost racy n edge of the seat experience till the climax scene,fire explosion scenes are really a visual treat
CGI is one of the most perfect part of this movie n also amazing Background score too...A good entertaining movie with the message..."
" emotional and tragic
",-0.34,0.3804,2019-07-10 00:00:00,10,"This movie moved me and was intense from the beginning, I really enjoyed it and RIP to all that lost their lives"
" my notes
",0.0,0.0444,2019-07-01 00:00:00,2,Typical true story movie that followed the formula of all previous versions. I just didn't care (1 viewing)
" Emotional and authentic
",0.1531,-0.6058,2019-06-19 00:00:00,9,Decent movie which really captured the disaster. It was emotional and authetic. Acting was spot on and not over the top. It was respectful whilst capturing the desperation. They did well to break down something very hard to understand for the viewers to digest
" Inspired me to go read up on the disaster.
",-0.2263,0.1102,2019-06-02 00:00:00,8,"Pro:
Hits all the right emotional notes while respecting the people.
Inspired me to go read up on the disaster.con:
Very little nuance. American hero, damsel in distress. Evil corporation etc.
A little confusing regarding how the rig was coming apart."
" Disaster movie done right
",-0.6249,0.9901,2019-06-01 00:00:00,8,"I do not know exactly what we like so much about disaster movies, maybe the action or the effects, but with this movie there is not only a combination to pass the time watching some amazing special effects, but it is also a provocative film that moves our feelings; with very emotional scenes and an incredible direction that manages to portray events with as much intensity as possible. The performances are on point, completely great and fervent, Mark and Kurt do an incredible job as the tough guys but genuinely worried about the lives of their co-workers. The cinematography of the film is something special, the scenes are incredible to admire with fantastic special effects, the fire is extremely realistic and gives an excellent sensation of panic and heat, that plus the incredible sound design make Deepwater Horizon a movie very intense and provocative.I am surprised by the fact not only that the film itself is a great achievement for effects, but also how the performances and the script manage to create a quite realistic and palpable scenario in which we can feel the terror of seeing the fire engulf the entire platform. Highly recommended."
