title,title_sentiment_score,text_sentiment_score,date,rating,review
" A real disaster movie!
",-0.6588,0.8743,2017-12-31 00:00:00,10,"Deepwater Horizon There are some disaster movies that are straight up disasters.
Hollywood likes to feed us a steady diet of them.
Usually from the guys and gals that brought us Independence Day regurgitated or ridiculousness like Geostorm!Here director Peter Berg has brought us a fantastic film that tells the story of a real life disaster. An explosion that occurred in 2010 on the off shore oil rig named Deepwater Horizon, which created the worst oil spill in history.
Like I said, a real life disaster.
A story that is told by firstly introducing us to real life characters that are developed before any chaos ensues.
This is masterfully done by Berg and scriptwriters Matthew Sand and co to cement the audiences care for what happens to the lives on screen.
There's no hot shot scientists here played unconvincingly by Hollywood's latest Beef cake!
Instead Mark Wahlberg proves that he can actually act when he's not too busy getting caught up in Transformers nonsense.
We also get a commanding performance from the always brilliant Kurt Russell as Mr Jimmy, the man in charge.
Peter Berg takes his time setting the movie up before events unfold.
He gives the audience a chance to learn a little about oil extraction and the pressure that is applied by multi billion dollar companies wanting their payload.
John Malkovich gives a solid performance as the BP executive named Vidrine who is applying such pressure to Russell's character.
A great performance even if Malkovich's accent seemed a little erratic at times.When disaster does eventually strike it is incredibly staged and this movie looks and sounds fantastic.
The special effects are some of the best I've seen in recent years.
Sound design is ear shatteringly good. 
If like I, you missed this movie at the cinema, please watch this on the biggest TV you can find with a good 5.1 surround sound set up.
This film deserves that much.
Deepwater Horizon is as much as an immersive experience as it is good story telling.
The Dolby Atmos sound mix is a tool wonderfully utilised.
Picture quality is top notch too with rich colours accentuating the unbearable heat caused by the devastating explosions.
I thoroughly enjoyed Deepwater Horizon and this movie is proof that when done right a disaster movie doesn't have to be a disaster."
" Pointless Documentary with lots of explosions
",0.0,0.9365,2017-12-23 00:00:00,4,"A movie that focuses on a single binary event- the Deepwater Horizon explosion. The film avoids delving into the political, social, or ecological ramifications of the disaster and its aftermath. This is a major disappointment for me. The directors could have made so much more of this movie. The film stars Mark Walhberg as a technician who works on the Deepwater Horizon. Wahlberg's character has no special skills that are apparent or ever explained. He has no interesting dialogue. He sits around surfing the web and chatting with his wife half of the movie. When things go south, he suddenly morphs into a super hero with super human skills who saves lives. But I digress. Wahlberg's role in Deepwater Horizon is virtually identical to ""The Perfect Storm"". He has a Suzy-homemaker wife played by Kate Hudson who sits at home watching soap operas all day worrying about him while Wahlberg is out at sea trying to earn a paycheck for his family. It was like they carbon-copied his character from ""The Perfect Storm"", but changed the scenery to an oil rig. Other stars include Kurt Russell, John Malkovich, and Gina Rodriguez. Russell is the good-guy rig supervisor who the workers love. He is at odds with Malkovich, a BP executive, who only cares about corporate profits at the expense of safety and the environment. The most passionate scene of the movie involves a heated exchange between Russell and Malkovich, but this exchange is done awkwardly. It is not classic Kurt Russell. Both Russell and Malkovich have bizarre accents that are difficult to understand. Russell tries to speak with a Southern accent and Malkovich uses a New Orleans Creole accept. Both work poorly. It is nearly impossible to understand what they are saying, but you get the gist of their dispute. Gina Rodriguez's character is also a tech of some sort. There's really not much else to say on her. She is boring like Wahlberg. The other characters in the movie are background props. They are cannon-fodder. The characters do all sorts of tests that are never explained to the audience. You have no idea what is going on and it is never explained what caused the failure. The action scenes as the disaster begins are well done. Lots of blood, shrapnel, etc. There is a scene that looks like it was stolen right out of the movie ""Titanic"" where a worker is blown off the side of the rig into the sea and hits a propeller of some sort before bouncing off to his death. Overall, the movie is an easy paycheck for Wahlberg and Russell. They are asked to do very little as the film focuses more on explosions. With a letter effort, the writers could have added some scenes in the beginning and the end about the politics and environmental consequences."
" OK, we have a disaster and we want to make a movie.
",-0.2185,0.9246,2017-12-10 00:00:00,4,spoilersstarting with a good dramatic building with a happy husband who loves his wife travelling to the rig for 3 weeks which leads to technical talks and artificial argument which ends in an explosion with trials to turn the actor into a real hero >>ends :)i rated 4 just because i like the offshore life
" A look at the environmental disaster that everyone remembers.
",-0.6249,-0.6949,2017-11-01 00:00:00,8,"After watching a couple really awful movies this week I needed a movie like this one. This one I truly enjoyed. Based on a true story so it always gives the movie a bit more punch. Everybody remembers the terrible tragedy that occurred that day. Some would think it's a human tragedy but to me it's an environmental catastrophe. Millions of liters of oil devastating marine wildlife and this for decades. The movie doesn't mention anything about that, but it still remains a good movie to watch. Just to have an idea on what happens on an oil platform like that. That the big oil concerns like BP are faulty in every way is obvious. That they will never face consequences doesn't bother anybody. That's just the way it is. The mighty lobbyists win again. Mark Wahlberg gives us a good performance, as well as the other actors. The catastrophe scenes look like they are all real so for that the movie gets big credits. The story is poignant and will make everybody think about the disaster that happened there. A good catastrophe movie, even for the people that are not really into this kind of movies."
" Powerful Catastrophe Film
",-0.3818,0.9795,2017-10-02 00:00:00,9,"In this age, it is not easy to create films about catastrophes, without sliding into expensive but uninteresting CGI effects, or getting cheap and nasty. Deepwater Horizon is a very fine example of exquisite balance between excellent actors' performances (Kurt Russell, John Malkovich, Mark Walberg and Kate Hudson all show definite depth and sophisticated valor, depicting their parts decently and with a great gusto) and awesome CGI effects. Without going deeper into technical details, I have to admit the film has achieved its main goal - to show true heroism, valor, valiance and also cowardice and shallowness in the wake of doom and death. Excellent depiction of Lousiana nature, exactly right balance of mundane, tragic, heroic and stupid all add certain flavor to the very tough and nutritious broth of a film. I do recommend this fast, deeply tragic, decent and sobering film to all who want to think and would like to watch something serious and thought-provoking."
" ""This here's the well from hell, girl!""
",-0.5848,-0.0249,2017-10-02 00:00:00,10,"I didn't expect the film to be that much of an action movie, even though the Deepwater Horizon incident remained at the national forefront for over three months. After the characters are established and the premise of the story is set, the semi-submersible offshore oil drilling rig known as Deepwater Horizon turns into a veritable fireball with employees scrambling for their lives, or in the case of the eleven who didn't make it, a final, forbidding resting place. There's just enough well drilling science interspersed throughout the story to guide the uninitiated about what happened, with a thorough indictment made against the cost cutting maneuvers of the British Petroleum honchos calling the shots. Besides what we see here, I was also expecting in some way the eventual successful effort that shut the oil spill down, but the picture really only followed the tragedy through the first few days until the surviving crew members were all rescued. One's visceral response to the blazing inferno that consumed the oil rig is tempered by the fact that this was a real event that claimed eleven lives. What's impressive is the mammoth undertaking director Peter Berg accepted when offered the challenge to make the film. Extra features on the DVD describe the formidable task, putting you right in the middle of the disaster."
" Corporate greed leads to disaster.
",-0.7783,-0.8889,2017-09-24 00:00:00,7,"It's the second movie I see in a row where Mark Wahlberg is presented as the heroic average guy. Do all Americans see themselves as former underwear models? The movie was OK. First show how good and professional and real people are the heroes of the story, demonize the middle management who wants to get things done hoping it will all be OK and risking everybody's lives, express the idea that money hungry sons of bitches are to blame, then blow everything up.The film presents only the actual event, with lots of fire, explosions, blow outs and debris flying everywhere. The lower on the corporate ladder people are the more heroic they appear. That's dramatization for you. I would have loved to have a small part in the end dedicated to the BP cover up and the legal mess afterwards, but they kept quiet. I don't even know if it was all cleared up by 2010. However, you should look up Peter Berg's article about BP's interference with the movie. Just look for ""The 'well from hell' – my fight with BP to film Deepwater Horizon"" and you'll find it.Bottom line: classic disaster movie, with a straight story of the event, rather than the entire political and legislative chaos that ensued."
" Hope ain't a tactic
",0.4404,0.9757,2017-09-18 00:00:00,10,"This is a dramatization of the events surrounding the explosion and BP spill of the Deepwater Horizon floating platform located 41 miles off the coast of Louisiana. The film centers around Mike Williams (Mark Wahlberg) the Chief Electronics Technician (according to his hard hat but he was an engineer) of the crew and to a lesser extended through Andrea Fleytas (Gina Rodriguez) an operator. The operation of the drilling is explained early in the film by Mike's daughter using a coke can and honey for a school project. Ominously the coke sprays out the top.We see Mike struggle to maintain a safe ship against the pressure of schedule and profits as they drill ""the well from hell."" He says, ""Every time I peel off a band-aid I find three or four more. "" He butts head with John Malkovich who had the honor of playing BP engineer and representative Don Vidrine, the film's bad guy. He helps explains things to Don by comparing safety to noodling.The special effects were pretty intense. Like so many major accidents, people want to deny they are happening until too late. The irony is that this unsafe rig was getting a safety award for being BP's safest rig. I shudder to think.In the end, the film has a brief tribute to those who lost their lives for oil and profits.Guide: 1 F-word. No sex or nudity."
" Good explanation with real great visual effects
",0.7906,0.974,2017-09-17 00:00:00,7,"I wanted to give it a chance on DVD. The reviews here were promisingly. The story begins slowly introducing well the main characters of this ecological drama. The pace gets faster until the big disaster happened. I was very impressed by the great special effects on the platform and underwater. I mean all the details were realized so real that I felt to be directly in the catastrophe. Congratulations to all the specialists and especially director Peter Berg that created an authentic documentation based on true events. I hope this nightmare will never happen again. Then I liked very much the outstanding performance of Marc Wahlberg, Kurt Russell and John Malkovitch. At the end my vote and the one of my wife matches nearly 7 /10 with the rating of IMDb."
" Countless Explosions & American Heroics
",0.5267,0.8545,2017-08-30 00:00:00,7,(Flash Review)We all know the real story and this movie put you right in the thick 'oil' of it. The first half builds up the characters and their backstory so in the second half the movie can tug at your heartstrings as you watch them try to handle and survive the explosions and endless fires. Very good and realistic production and effects. It was really believable. The script was a little too narrowly focused. It is mainly about the worker's heroics and their escape. I would have liked to learn a bit more about why the drill failed. You get a little bit in a couple scenes but they could have added more time to flush that out more in my opinion. They also pitted BP vs the Deepwater crew as BP the cost-conscience big oil company vs the downhome American blokes. My understanding was BP was most at fault but Deepwater wasn't totally innocent of fault but this doesn't claim to be true to life so can't fault it too much. It was good and entertaining and emotional; an above average Hollywood blockbuster movie.
" Great to see this film made
",0.6249,-0.9819,2017-08-28 00:00:00,9,"I would have given this film an 8, but given the subject matter and that BP so negligently failed in their responsibilities along with others, to lead to this disaster and how important this story is to be told, I give it a 9. Unless you avoid news, you will know about the oil rig disaster in the Gulf of Mexico 2010.Besides the loss of life on the rig, the impact on life in the gulf has been incredibly bad and will continue to be so for a long time. When corporations are given too much freedom to manage themselves, such a disaster unfolds. How many birds and fish and other life was destroyed ? and then the impact on all kinds of people whose livelihood depended on the region being in a clean state. This is an excellent film for all to see, young & old as a reminder of why government needs to do its job and keep things managed."
" Worth a Watch
",0.2263,0.9923,2017-08-24 00:00:00,7,"This is a movie about the 2010 BP oil disaster on the Deepwater Horizon platform and mainly concentrates on the events leading up to the explosion and the explosion itself.If I am being honest, it was a bit slow for the first half of the film but when the action sequences kick in, it was quite impressive with good use of CGI effects and rattles along at a good pace.My friends in the industry say its not accurate, however, for the lay person its OK - the acting is OK, the script is OK the effects are good. What is disappointing is that very little attention was paid to the consequences of the explosion like the environmental impact and subsequent court case etc etcOverall though, not a bad movie and an enjoyable watch - probably a 7.5 rather than a straight 7/10."
" One solid film!
",0.2244,0.9763,2017-08-08 00:00:00,8,"A good movie: A time framed story which chronologically counts down of what happened with the infamous BP gulf oil spill! Who did what? Safety concerns, managements push for profits over safety and the suspicion that something was wrong! Great acting from the lead roles. Kurt Russell is the ever vigilant, all knowing alpha male safety consultant. Kurt Russell's character was a hard edge in a serious Charlton Heston way. Mark Whalberg is the family oriented caring professional loved by his crew. John Malkovich is the the push for it's costing us profits manager and is manipulative. The management team does not answer why the safety team's check was cancelled. Deepwater Horizon background of the rig, processes, and extras gave the realism of the oil platform. Berg directs the foreground and background of oil rig procedures and characters into a realistic disaster story so well, that Deep Water Horizion is hard to Watch! Eight out of ten. There is even an explanation that the well is so deep that the pressure of the earth and oil was too great for the dig."
" Rating: A
",0.0,0.999,2017-08-06 00:00:00,9,"True stories always have a special effect on me. If the director is able to capture the exact amount of reality needed for this kind of movies, then it becomes more than a film, but an experience that everyone should go through. Peter Berg does a brilliant job, I can't praise him enough.Everything from the character development scenes from the first act (which is surprisingly interesting and captivating) to the amazing visuals and controlled pacing, is near perfection. He gives time for us to care enough about everyone so that when the ""accident"" starts, we truly care about the characters and we want them to survive.I love that there's no time for us to breathe or have a more relaxed scene from the moment the mud kicks in because that's how they felt when they were in the middle of the disaster. I love that there's never a ""Hollywood"" scene, everything seems real and frightening. I love that the movie takes its time to explain how everything really went wrong, step-by-step, even if we aren't BP's scientists/engineers (there's a perfect analogy done with a Coke and a straw). I honestly love everything about Peter Berg's direction and I can't wait for Patriots Day (it seems that he's doing a ""true story trilogy"" with Mark Wahlberg ... great!).Speaking of him, Mark Wahlberg is amazing in this film as well as Kurt Russell. Both of them have performances so heartfelt and REAL, they really give everything they have into this movie and that just makes it even more fantastic. John Malkovich is also present and I gotta say: he perfectly captures the arrogant, stupid, ""bad guy"" from the BP company. I hate him, he's a total asshole. If he truly was like that in real life, well ...Deepwater Horizon deservedly honors the brave workers and heroes of that day. The story is detailed perfectly, the first act might be a little bit slow, but it compensates with the amount of characters that we care about by the beginning of the disaster. The performances are great (an Oscar for Wahlberg wouldn't be a surprise), the unbreathable pacing, from the moment of the first mud kick, is as real as it can be and Peter Berg's direction is flawless at all the other levels.MSB Reviews - If you like my reviews, please follow my blog :)"
" I know, lets make a film blowing up an oil rig !
",-0.2003,-0.8988,2017-08-03 00:00:00,6,"Typical boring disaster movie. You know whats going to happen and it takes ages to get to it, wading through boring family story stuff. Also for 'based on a true story' it's remarkably vague who is to blame/what was the fault. A rather 'cliched ; it was the rich oil company penny pinching so avoided testing. Although the business sense of avoiding a few hundred thousand dollars for tests to protect a few hundred million worth of rig is rather bizarreMore cliché, rather vague 'oil company' people on the rig, trying to override safety concerns By being so vague it came across as, yet another 'glib' ""based on a true story"" offering from the Hollywood BS factory. If they had been more decisive with the fault/blame it would have been more interesting. Presumably, though, they were scared of getting sued, so just went with the vague, shadowy 'evil oil company'. Mediocre - neither a terrible film nor a great film. Watch once and forget"
" Fantastic disaster movie
",-0.128,0.9117,2017-07-20 00:00:00,8,"A Fantastic disaster movie, excellent performances by Mark Wahlberg, Kurt Russell, Kate Hudson, and Gina Rodriguez, Particularly fine performance by John Malkovich as the company man. Fantastic direction by Peter Berg, excellent screenplay by Matthew Michael Carnahan ... (screenplay) and Matthew Sand"
" BP: hold your head in shame!
",-0.5255,-0.8684,2017-07-15 00:00:00,8,Based or inspired by actual events this movie is a first class production. It shows events that led to a terrible oil rig tragedy. There is a highly intelligent script and the special effects are realistic yet of course awful and are the outstanding feature of this picture. As with many tragedies the greed to cut corners and make money was at the heart of this disaster. The victims deserved far better. 8/10
" A high-quality Hollywood disaster flick
",-0.6249,0.2741,2017-07-12 00:00:00,7,"DEEPWATER HORIZON is a Hollywood disaster flick based on a true story and filmed in the same gritty, hand-held style as something like UNITED 93 or CAPTAIN PHILLIPS; in other words, Paul Greengrass is a big influence. The film is gripping and engaging, cleverly building the tension early on with hints at what could go wrong and involving the viewer in some surprisingly realistic interplay between the characters.The worst thing about this film is the extraneous sub-plot involving Kate Hudson's at-home wife. She adds nothing to the story whatsoever, only serving to drag it down and spoil the pace at times. This leads to the film's opening sequence, which is literally the worst part of it, totally boring and without merit. The story should just have started with Mark Wahlberg arriving on the oil rig for work. Still, things only get better, and when the disaster occurs in the second half this is thrilling stuff indeed, hard-edged and complemented by strong CGI effects. Wahlberg is fine, but I found Kurt Russell to be the heart and soul of the piece. DEEPWATER HORIZON is miles ahead of rival fare like 2012 and SAN ANDREAS in terms of quality."
" More filler than drama
",0.0,-0.9913,2017-07-05 00:00:00,4,"In April 2010 the exploration oil rig Deepwater Horizon, stationed in the Gulf of Mexico, suffered a catastrophic disaster, exploding and being set on fire. This is the story of the lead-up to the disaster, the disaster itself and the individual actions involved, and the aftermath.More filler than drama - essentially a 40-50 minute short docudrama turned into a 107 minute movie. The remainder is just padding. Yes, I know, the idea is to engage you, the audience, by getting you to know and like the characters and thus empathize with them when disaster strikes, but here it doesn't really work. The lead-up here is dull, and the attempts at engagement overdone and overt. It also doesn't help that, having introduced you to all these characters, other than the main ones it is difficult to tell who is who when the tragedy unfolds.On that point, the action itself is difficult to follow. By trying to make things as realistic as possible, director Peter Berg also makes things more confusing, with dim/dark lighting and random, unexplained things happen. It becomes hard to tell which characters are involved or what the dangers are (other than the obvious ones, of course).While a tragedy, there's not enough detail and drama involved to make a complete movie, but it got made anyway."
" Excellent Portrayal of the BP Disaster
",-0.1027,0.3804,2017-07-04 00:00:00,8,"As usual, Peter Berg does another excellent job keeping the audience involved in his movies. There were a number of individual personal stories and interplay between characters. What was needed was more names and titles as the main characters appeared on screen. It was difficult to hear and understand a lot of dialogue as the movie moved quickly along from scene to scene. It was important to me to know who the 11 who died were while they were on the screen. Having a brief name and title as was done with the lead actors would have helped us relate to those who lost their lives. Or perhaps in the end - show the actors along with the real pictures of the fallen. Great excitement and visual portrayal of a real disaster that should not have occurred. May God bless those who lost their lives. Very emotional in the end."
" Watching Paint dry....
",0.0,-0.2654,2017-06-30 00:00:00,1,"Way too short, it felt like the film was rushed. The action sequences felt forged in a sense that CGI was perhaps used? Not a good combination to have Kurt Russell and Mark Walberg in the same film - lets stick to the Fast and Furious franchise, where your better suited. Mr Walberg.. Ted 3 perhaps?"
