title,title_sentiment_score,text_sentiment_score,date,rating,review
" Unexpected surprise
",0.2732,0.8881,2021-03-24 00:00:00,8,"I DVR'd this movie based on the description alone knowing nothing else about it. To my great surprise it has Nicholas Hoult, Sir Ben Kingsley AND Sir Anthony Hopkins. Do you really need any more motivation? Watch thes actors do their thing with a fair to middling script, and you will see how a great actor in a poor scene can elevate the whole shebang!"
" Better than the reviews suggest
",0.4404,0.8717,2021-03-21 00:00:00,8,"Seriously, what's not to like? Action, car chases, two knights chewing up the scenery and an engaging leading couple. SOOOO much better than I expected. Great fun."
" Romantic comedy
",0.6369,0.9895,2021-03-09 00:00:00,6,I think this makes the perfect romantic comedy film to bring your girl out. Lots of love motivates a guy to get rich quick by stealing the big mobster and get lucky along the way. The love is romantic and the luck is comedy. Great chase to make the romance palatable to the guys.
" Decent Enough
",0.0,0.9418,2021-02-07 00:00:00,7,"This film isn't going to win Oscars or awards but as an action film its decent enough.
I really enjoyed it, nothing new but it wasn't boring and had plenty of action. Easy watching and decent entertainment."
" Never Judge a Book by Its Cover
",0.0,-0.9862,2021-01-24 00:00:00,3,"Never judge a book by its cover, or a movie by the big names on the poster. My wife and I were reminded of this adage last weekend when we were flicking through the TV schedules and decided to watch ""Collide"", largely because of the words ""starring Ben Kingsley and Anthony Hopkins"". Bad move.The film is about two young Americans living in Germany. Both characters, in fact, are played by British actors, Nicholas Hoult and Felicity Jones, who were cast after Zac Efron and Amber Heard dropped out. (Good move). A young man named Casey meets a girl named Juliette in a bar, but she wants nothing to do with him as she knows that he works for a Turkish-born drug dealer named Geran. Casey is so smitten that he quits Geran's gang and finds more lawful employment. Juliette's prejudices against drug dealers to not extend to those who have retired from the business and the two begin dating and eventually start living together together.And then Juliette is taken ill, and it is discovered that she needs a kidney transplant. Because of doubts about her immigration status, she does not qualify for the operation in Germany, and she does not have the money to pay for it in America. To raise the money Casey goes back to work for Geran, who wants him for a special job. As this job involves stealing drugs belonging to a much more powerful drug lord named Hagen Kahl, who is noted for his ruthlessness, Casey finds that he has put himself and Juliette in great danger. (This is why Juliette had to be American. Had the character been British she could have returned home and had the operation free of charge on the National Health. So why are so many Americans opposed to the idea of a state-run health service?)By coincidence, this was one of two modern British crime thrillers made in the late 2010s and set, or partly set, in Germany, which I have watched recently, the other being ""The Good Liar"". Both films star two senior members of the British acting profession, all of them now in their seventies or eighties, Hopkins and Kingsley here and Ian McKellen and Helen Mirren in ""The Good Liar"". Of the two, ""The Good Liar"" is by far the better. It is not a perfect film- the script and plotting leave a lot to be desired- but it does contain two excellent performances from the two leading actors.Unfortunately, I cannot say the same for ""Collide"". It is, by a considerable margin, the worst film I have ever seen starring Hopkins (the previous holder of that title being Oliver Stone's clunking classical epic ""Alexander""). It is not quite the worst film I have ever seen starring Kingsley, but it is the worst since the appalling ""Harem"" from the mid-eighties. Kingsley is admittedly an actor whose work can vary in quality; his career has contained some notable peaks such as ""Gandhi"", ""Schindler's List"", ""Twelfth Night"" and ""Shutter Island"", but it has also contained some troughs, and the dreadful performance he gives here as Geran must count as one of the deepest of these. Hopkins has generally been more consistent in quality throughout his career, but even he does not shine here. His Kahl is strangely bland and disappointing, insufficiently menacing for a supposedly ruthless drug baron.The other big problem with the film is that it does not contain any character with whom we can sympathise. Yes, I know we are supposed to be rooting for Casey, but I find it difficult to root for a drug dealer, even a reformed drug dealer who has slipped back into his old ways out of supposedly noble motives. (And Casey did not give up drug dealing out of remorse or conscience; he did so because it was the only way he could get Juliette to sleep with him). The script is badly written and the plot frequently does not make a lot of sense. About the only redeeming feature of this film is that the frequent car chase and car crash scenes are well handled. And with a title like ""Collide"" that seems entirely appropriate. 3/10"
" Bullet proof cars and overloud effects
",0.0,-0.9208,2021-01-20 00:00:00,4,"It may be a fairly mindless action film, but even with that there is a limit about how much you can suspend belief.Car doors do not stop bullets - very little of a car will stop bullets - so this gets silly very quickly, Small pistols to practically rocket launchers are firsed at ordinary cars and the worst that happens, most of the time, is that the side windows break - NEVER the front windscreen - only the sides. Which break several times in on sequence.Cars do crash and catch fire, but that is no surprise because no-one seems to be in them.The to compound all this, after half an hour of actors whispering at each other, the chase sequences are absurdly loud.Not a film for anyone over about 10."
" Good Car Chase
",0.4404,0.9528,2021-01-17 00:00:00,5,"It can't be a bad life as a Top Actor, earn loads of dosh to make crap films, where you can totally overact and have a bit of fun, I hope Anthony and Ben were paid well cause they are using around 10% of their acting ability in this film.
I mean Ben is playing it for laughs, it is a comedy"
" Fast & Furious meets Jason Statham
",-0.5719,0.8074,2021-01-16 00:00:00,10,"No need to over-think every movie. This one's a case of sit back and just soak up the action, fast cars, guns and explosions.Hero does a deal with a drug kingpin to save the girl he loves. Best laid plans...Massive car chases, fight scenes and lethal ordinance, meshed with a booming soundtrack, delivers adrenaline all the way through."
" Surprisingly engaging action thriller
",0.6124,0.9955,2020-10-02 00:00:00,10,"If I knew nothing of Collide before I saw it, which I almost didn't, I'd have to say I'd have come away thinking I must have missed the trailer to a new action blockbuster somehow. I don't know about other reviews, but for me it was as deviously hard-pressed as any Die Hard movie, with a terrific cast giving their all. There were at least four terrific bad guys, including a superbly supercilious Anthony Hopkins and an over-the-top Ben Kingsley being almost as enjoyable as his character in Sexy Beast. The leads were awesome, their acting flawless and their characters a real spark. The story, for me, was clever and original. The dialogue was classic. But the main driver here is the action sequences. If you like cars being flipped like tiddlywinks amid screeches and bangs then Collide is a work of genius. After a wizard romantic start, I found, for me, the last two thirds of this movie to be a terrific edge-of-seat ride, and it was easily an enjoyment and well worth a 10."
" Grand Theft Auto: The Movie
",0.4588,0.7221,2020-07-14 00:00:00,6,This actually isn't half bad once the car chase scenes start happening. Quite entertaining.
" Just like every show/movie being written these days.
",0.3612,-0.25,2020-07-11 00:00:00,3,"Another one of those movies where they fire 5 thousand rounds at someone 100 feet away but couldn't hit the side of a porta-potty from the inside.
Flashbacks by the dozen.
Bad-guy monologues and of course ""save the girl"".
Car chases, foot chases, bickering, flashbacks.
Women telling Men they're wrong, getting angry, chopping down their confidence, storming out etc., and then apologizing later. Writers are following the politically correct ""empowering women"" movement, but overcompensating.
It's as if all writers are taught by the same professor who follows a playbook that was written decades ago."
" Predictable
",0.0,0.9055,2020-03-25 00:00:00,5,"While the acting is good and the action scenes better than expected, this movie is just too predictable and borderline ridiculous. The big plot twist was a bit unbelievable and came too late to save this cliche action letdown. While hoults character can be commended for keeping going, most of his escapes are either lucky or ridiculous."
" Not easy to say something...
",-0.3412,0.6478,2020-03-07 00:00:00,6,"The beginning is really boring and it's hard to go on watching.
Then it changes and somehow you can start enjoying something.
In my case, I don't like the actor, probably with another actor I would enjoy the movie, so I didn't like so much almost anything, but I have to recognize that the movie is not totally bad.
Anthony Hopkins and Ben Kingsley of course, they do what has to be done, in a professional way as usual.
But for the rest... anyway give a look and then decide... for me it's a 5.5-6."
" Nice action movie with romance
",0.7506,0.7739,2020-01-06 00:00:00,5,"The story is solid. The action was sometimes exciting.
Overall, the movie was OK."
" Good action movie.
",0.4404,0.918,2020-01-03 00:00:00,7,"People who talk about being films not being original or needing crazy in depth stories probably enjoy nothing in life. Every movie doesn't need to be top notch for you to sit down and enjoy it.This is just an action flick, nothing more, nothing less. Guns, fast cars and some decent actors.The story doesn't even matter, it's like any other action movie. Bad guys, a girl and some money/drugs. The action makes this movie great if you ask me. I love watching stuff blow up and bullets spray everywhere. If you're into that, this film will be worth the watch."
" Sit back strap in & enjoy the ride
",0.4939,0.8478,2019-11-07 00:00:00,8,"It's one of those 100 mile a hour thriller chase movies that works! Great acting & crazy action scenes. Nice twisty turny sometimes edge of seat plot, well worth a watch."
" Very nice cliché action movie
",0.4754,0.9567,2019-10-21 00:00:00,7,"I found the average rating of the reviews unfair, so I decided to rate it and make a brief comment. It seems like a low budget movie, but it has good action scenes with car chases. The actors are nice and the direction too. The script is simple, but not bad at all. It's a cliché movie of romance and action, but it's worth watching."
" Really bad
",-0.5849,-0.3167,2019-09-23 00:00:00,5,"Really bad, dont see it. Its like a video game. Just fancy cars nonse persecutions"
" my notes
",0.0,0.0756,2019-07-24 00:00:00,2,"Pretty terrible. there was a little bit of entertainment value, but the amount of dumb things that happen in this movie is overwhelming. and i've never noticed bad transitions until this movie. i was so dumbfounded by one of the scene changes that i laughed. (1 viewing)"
" Best for car chasing sequence !
",0.6696,0.9898,2019-06-20 00:00:00,8,"It is an action thriller mostly on car chasing. Veteran actor Anthony Hopkins and Ben Kingsley both play here drug mafia's role. A youth, Casey (Nicholas Hoult ) fells love in Juliette ( Felicity Jones) and one day they found that the girl has to replace kidney and want of lot of money, then youth goes to his old boss to ask for money his boss, Geran ( Ben Kingsley) tells him to steal the truck of drug of Hagen Kohl ( Anthony Hopkins). Casey takes challenge with his own plan despite huge risk of high security. Will he get his aim and got the money for his girlfriend, that is the answer is movie. Very interesting story and action packed drama start to finish. Car chasing scenes are heart of the movie. Though whole car action drama looks a little unrealistic, movie is watchable. I wonder that not a single bullet can touch Casey till the end and second unbelievable thing is that if Casey hide the truck then why are goons trying to shoot him, without knowing that where is the truck ? We can leave such thinking behind when watching such fantastic movie. Acting done by Anthony Hopkins and Ben Kingsley is superb. Also Nicholas Hoult gives you fresh experience with perfect helpless but clever youth. Felicity Jones is okay in her role. Cinematography of Car chasing is a good, beautiful and perfect work. Movie is worth for it. If you are action lovers then must watch this title."
" I hate this movie!!!!!Terrible"" Garbage in Garbage out""
",-0.7067,0.6245,2019-03-26 00:00:00,1,"It is sad to try to watch great actors make a fool of their talent just to pay the bills. Anthony Hopkins and Ben Kingsley are two of my favorites, and I can guarantee it is not because of movies like this one. I had to watch it because of what they use to be. Getting old can be a handicap if you have to work because you need the money, when yesterday you worked because of the demand for your talent. It may not be their entire fault, it may be the directors or there is not creative talent out there who could write a good script. I know now, they are not as great as they were. I will stick to the oldies but goodies and leave this new garbage alone. I gave it a (1) because it ended right and was over"
" Recycled garbage
",0.0,-0.224,2019-03-23 00:00:00,1,"I can't believe this movie even has a 5.7 rating. Everything about this movie is recycled...poorly, almost as if it was written by a robot, taking different storylines from other movies. The plot is unoriginal, the twist is just silly, and the characters are all unbelievable, over the top, and poorly acted....all of them. Even the car chases, the main point of this movie, are not done well and if you can't even do that well Im not sure why they even made the movie."
" What did I just watch?
",0.0,0.8625,2019-03-05 00:00:00,5,"Pretty bad. I'm surprised Anthony Hopkins agreed to do this movie. They must have paid him a pretty penny. Nick Hoult really needs to learn not to be so self-aware when the camera is focused on him. He tends to smile at the corners of his mouth during those moments, enjoying the attention, and it never works with the scene. He's had this bad habit since, ""About A Boy."" The movie overall is a bunch of dumb luck for the main character combined with mediocre action scenes. The end doesn't make any sense either."
" If 2001 America made a movie about Europe
",0.0,0.9186,2019-02-22 00:00:00,7,"Let me just say.
I did enjoy this movie.
It's definitely no where near as good as it thought it was or wanted to be.
Which was surprising considering the cast.
If this same movie was made with a B list cast people would probably think it was very underated.
But this cast you're used to seeing attached to very high calibre scripts.
This was simply an action flick, without more depth to it than that.
So as that. It's great.
But people are probably perplexed seeing those names be typical action movie characters.
Who knows why people take on projects.
Maybe they get burnt out always being so deep and ascending and just wanted to have fun getting paid to make a movie in Europe.
Who knows, we don't make the big bucks."
" If the plot is weak, can you turn it upside down by running all the way?
",-0.4404,-0.4404,2019-02-18 00:00:00,5,"If the plot is weak, can you turn it upside down by running all the way?"
" Good Movie
",0.4404,0.8885,2019-02-14 00:00:00,8,"This movie was pretty good. It has good characters, action and storyline. I would like to see a sequel to this movie."
" Nothing New Here; Just Easy Fun Action
",0.7351,0.9716,2019-02-09 00:00:00,8,"(Flash Review)This is an easy movie for people to crap all over. It's just trying to entertain and not looking for Oscars or deep meaning. The plot is about two loaner Americans living and floating through Germany with checkered pasts who meet up and fail in love. The guy tries to shake his past and his illegal job to prove to the girl he can be a better person and earn an honest loving. While his girlfriend needs some serious money for a health condition the guy takes one last risky job to get a quick financial score for her operation. Will the means justify the end? Even Anthony Hopkins is in this and does his great signature line deliveries and Ben Kingsley is a brash wacko gang leader. Overall, there are some sweet high end sports cars used in the chases combined with some interesting music tracks. Relax, enjoy and don't think."
" Bright lights, good looking people, and not much else...
",0.7003,0.7165,2019-02-08 00:00:00,5,"Every single actor in this movie, Kingsley and Hopkins included, are way too good for it. In every scene, they're thinking to themselves ""I'd be more artistically fulfilled doing a Verizon commercial,"" and you can tell. This isn't cinema, this is an overtly shiny, ninety minute car commercial."
" Fast paced, exciting with good twists
",0.7269,0.9387,2019-01-28 00:00:00,9,Ben and Anthony - brilliant portrayal of alter egos of a chilled Anglo - German and emotional Turk /Arab. The protagonist carries it along with constant action. Would have preferred more depth to the conversations but can't expect miracles and Love wins in the end.
" Fast paced full of twists in the plot
",0.0,0.9042,2019-01-27 00:00:00,7,Great cast. More car chases/hour than pretty much any film. Combination of love and evil that is unique. Anthony Hopkins as superb as ever.
" Really fun action car-movie
",0.5563,0.9809,2018-12-11 00:00:00,9,"Anthony Hopkins really brings some quality to this movie, but otherwise it was a good solid funny entertaining movie to begin with. The plot is not too complicated, the dialogue is not that great, but hey, this is a car/chase/action movie and it does what I want from this kind of movies good; great car chases with nice cars (I guess Nicholas Hoult was not paid for this movie but rewarded in drivetime in some great cars at the autobahn), a decent yet thin story and simple character-development that lets you like the good guys and loathe the bad.If you are in for a nice movie with some action, you like cars and just want to be entertained then this is a great movie to watch. I gave it 9 stars to get the rating up a bit, but it definately deserves 7 just for entertainment value."
" GREAT MOVIE
",0.6249,0.6867,2018-08-02 00:00:00,10,THIS MOVIE IS A FULL 10 A MUST WATCH. A LOT OF TWISTS AND TURNS AND VERY GOOD ACTION...NOT A SLEEPER
" Cool cars
",0.3182,-0.6465,2018-07-16 00:00:00,6,"But the ending not so much. Good action driving. Scenery great, but some of the movie doesn't match the vibrant scenery. Maybe I'm tired if dark movies with pulsating techno yuck music?"
" Terrible, terrible, terrible!!!
",-0.88,-0.8824,2018-04-05 00:00:00,1,"I admittedly do not like action movies to begin with, but I somehow thought the cast sounded good. Boy was I ever wrong! I kinda realized after a few minutes that recording this was a big mistake. What utterly ridiculous garbage!! Not even the fact that it is set in my home country of Germany makes this bearable. Shame about all those nice cars!!!"
" Quick Review - for the undecided, more than simply it sucks!
",-0.5707,-0.7953,2018-02-03 00:00:00,1,"Watching this flabby turkey during a bout of insomnia made us all think 'come back action Hollywood action flicks all is forgiven'. I'd only watch this again as background noise while the beer and pizza arrives and everyone settles in before we watched a real heist action movie Hollywood style.The setting is not LA, NY but home of the EU money makers, Germany although you wouldn't believe it looking at the drab dreary apartments (Hollywood know HOW to make down and dirty look grunge and sexy), then there's the 'acting'. Two major thespians from the theatre wheel out for this, Welshman Anthony H and Anglo Indian Ben K, and they overact in the most cliche way... is this a prostrate thing with old male actors? Then the two young Americans are from the bargain basement, a goofy tooth chick who looks like a strung out crack head. And then there's the action male lead (I refuse to say his name) looking 10 years her junior on account of the intern who did her make up. He is an action hero who can't fight his way out of a paper bag, and keeps raising his hands like a scared kid when anyone shoots at him (c'mon Jason Bourne we need your strong but sensitive aura here). He does do one thing though, and that is to look and act pussy whipped. Playa he ain't! Don't be fooled by any talk of action in this fat flabby turkey. IF anyone says so, it's because it's probably the first film they've seen since they went into their Old Peoples Home 20 years ago, or the're from Cologne and you know what we say about Cologne. 'If I could choose where to die it would be Cologne coz no one would notice if I was alive or dead '"
" amazing film
",0.5859,0.8402,2018-01-08 00:00:00,10,Amazing film action all the time with a touch of love
" a waste
",-0.4215,-0.8817,2017-12-27 00:00:00,4,"Casey Stein (Nicholas Hoult) meets Juliette Marne (Felicity Jones) at a concert in Cologne, Germany. They start dating. He works for local criminal Geran (Ben Kingsley). She needs a kidney transplant. Hoping to make money for her surgery, he takes a job from Geran to steal drugs from his evil boss Hagen Kahl (Anthony Hopkins). It does not go well.I've never heard of this film and was surprised to see the top level cast. It's trying to be a stylish action thriller. It is not successful. The plot is plodding simplicity. Ben Kingsley is over-compensating with crazy character work which clashes with a rather bland performance from Nicholas Hoult. The plan does not work but I've seen worst. There is plenty of action but no tension. The writers probably considered themselves Tarantino but they are nowhere close. There are situations that don't make sense but the movie keeps going. It's a waste of perfectly good actors."
" A Dummy gets chased around movie
",0.0,-0.8648,2017-09-09 00:00:00,6,"In every movie there is an expectation to suspend disbelief..to an extent. This one asks you to shut off any relations you have with common sense or cognitive thought. Anthony Hopkins (he is fab, but over the top) character...a real baddie, but ultra powerful, stand up business man, famous, squeaky clean...is suddenly popping people and brandishing a gun in a gas station..in Germany...Germany!...where there is probably a camera or two. Like his henchman (who we assume is highly trained & paid) thinks it is a genius idea to run around a Subway station brandishing a gun...and shooting it in the air..in....wait for it..Germany......AGAIN there is probably a few cameras & cops around. Then there is the empty eyed hero...I counted 3 times in the film where he gets lucky flailing around and grabbing something that saves him. I was bored and watched it, felt compelled to write this....did the Producers assume people have gotten really stupid? they had a budget and two amazing actors. They decided to make a film about a dummy getting chased by villains who make stupid mistakes. Instead of saying ""ok, we got the guy from Sexy Beast...let's shoot for that level"""
" Suspension of disbelief stretched way too far.
",0.0,-0.2275,2017-08-12 00:00:00,3,"Pretty generic action film, they could have saved enough money by replacing Hopkins and Kingsley with cheap character actors to use an actual script with a plot. This film really begs the question most of this mindless claptrap always engenders- if the villains can fire 10,000 rounds at the hero and not hit him once, why do they keep shooting?"
" The Things we do for love
",0.6369,-0.7906,2017-07-23 00:00:00,7,"While ex-pat Casey Stein (Nicholas Hoult) is in a night club, he meets a bartender, Juliet (Felicity Jones) and they are in love. Julie makes Casey quit his life of crime working for Geran (Ben Kingsley) who deals in cocaine. Later we discover Juliet needs $200,000 for a kidney transplant. Casey gets involved in a crime which includes multiple chase scenes, car wreaks, and he must have gotten shot at 100 times or so...all misses. It was a one man ""fast and furious"" on the Autobahn.The film was fairly well constructed with only minor ""twists"" which was simply stuff we didn't see happen. It was primarily an action film first and love story second. The teaser crash scene in the beginning, comes at about an hour into the feature.Guide: No sex or nudity. I don't recall any F-words"
" A very much ""must see""
",0.0,0.927,2017-07-14 00:00:00,8,"Sir Ben Kingsley and Sir Anthony Hopkins together, backed up by Nicholas Hoult, well what could be better? Sasha Robertson should be very proud of this line up.We have all experienced action movies with car chases, but the use of the cars in Collide is superb. Scenes that the Fast & Furious franchise would be envious of.It is not without continuity faults but they can be forgiven for the story line, cast and beautiful cars, (alas,some of which are destroyed).Watch it, enjoy it and then watch it again."
