title,title_sentiment_score,text_sentiment_score,date,rating,review
" Better than the Burton one
",0.4404,0.7927,2018-05-30 00:00:00,7,"The two Alice books are must-read classics, and have found their way onto screen in many different versions. James Bobin's film is a direct sequel to Tim Burton's Wonderland film: both take their names from Lewis Carroll's books, but neither takes any more than characters from them: Alice Through The Looking Glass is another original story.The end of Burton's Alice In Wonderland movie saw our heroine ditch her nerdy fiancée and go off to sea. Through the Looking Glass starts with a dramatic sea chase, before Absalom the Butterfly (voiced by Alan Rickman in his final cinema work) calls her back to Underland, where the Mad Hatter (now named as Tarrant Hightopp) is pining away for his lost family. Alice's adventure - seeking the Hightopp family - involves her stealing a time machine from Time himself, a menacing personification of entropy, who is understandably miffed at having this mechanism nicked, especially given that it has the potential to unravel reality.In short, the story has nothing whatsoever to do with Carroll's book. Having said that, it's not a bad story - it holds the attention, has lots of eventfulness and action, illuminates some of the characters, offers a couple of emotional moments, and allows Johnny Depp to mug from under the Hatter's elaborate makeup. I preferred it to the story offered in the previous film.The visuals are, as expected, impressive, and Sacha Baron Cohen's Time is a good addition to the cast. Rhys Ifans as the Hatter's Dad makes less impression. The reservations I had with the first film are still there - Barbara Windsor is just plain Wrong as the voice of the dormouse, naming the characters is both unnecessary and irritating, Anne Hathaway's White Queen's airy-fairy affectations get on your nerves, and Helena Bonfire Carter's Red Queen is still nicked wholesale from Queenie in Blackadder.Mia Wasikowska's Alice is pleasingly feisty, more so than she was in Wonderland. And so we come to Johnny Depp's Mad Hatter. We've seen the character before, of course, and Depp once more gives us the gentle, lisping, well-spoken and slightly barmy Hatter who has a bond with Alice, as well as the occasional psychopath from the Gorbals. To these he adds the declining depressive, a sad reflection of the heartier main iteration. But ultimately they are all Johnny Depp doing funny voices under funny makeups and, despite their appeal, I do find myself wondering if Depp has now overdone the heavily disguised eccentric phase of his career.This is nonetheless an enjoyable film, more so than its predecessor."
" A Hot Mess
",-0.3612,-0.6812,2018-05-22 00:00:00,2,"I really enjoyed the Alice in Wonderland film so I was looking forward to seeing this one. Alice Kingsleigh (Mia Wasikowska) is captaining her father's ship, The Wonder, escaping Malay pirates and giving orders to port while her crew is going to starboard but they escape anyway. She's a year late returning to London only to find that her father has died and her jilted fiancé Hamish has taken over. Her mother has agreed to sell the family's shares in the shipping company and give up The Wonder to save her home. Absolem (Alan Rickman) turns up and Alice follows him through the Looking Glass. The Hatter (Johnny Depp) is all depressed. He is haunted by memories of his family killed by the Jabberwocky. Alice has to get the Chronosphere from Time (Sacha Baron Cohen) and return to the past to save Hatter's family. The White Queen (Anne Hathaway) is there making strange gestures with her hands but with well-groomed eyebrows this time and the Red Queen (Helena Bonham Carter) is back and apparently off her meds again. Then Alice wakes up and everything since she went through the looking glass was a dream while she was in the insane asylum. And the Hatter's family is fine, they have been living in an ant farm. The movie goes downhill from there."
" Oh the effects...
",0.0,0.9636,2018-05-10 00:00:00,3,"I'm not even done watching to film, I'm about 10 minutes from the end but I'm so disinterested by it that I thought I would write a review while the final scene plays. I think this title is very much a testament to the fact that money does not buy you a decent movie. Effect after effect after effect after garish colours and CGI animals. My goodness, if they had paid their tech guys a little less, and their story-writers a little more we may have had something good here. (Although in my opinion they were finished by the first movie in this series with the casting of Alice. What a vapid and uninteresting actress.) Through the Looking Glass by Lewis Carol is a beautiful story, and while I know they're not exactly going for a retelling, they could have thrown a few nods to it here and there. Overall, very disappointing. But in true Disney fashion, it is a pretty thing to watch."
" I actually kinda (God, help me...) liked this movie.
",0.6395,0.8647,2018-04-28 00:00:00,6,"I couldn't have been less interested in this franchise, completely dumbfounded as to why they were trying to make sense out of an intentionally non-sensical world. This sequel continues that journey into unneeded clarity, though with better results. Maybe I was just more prepared for what was to come, but I also think it has decent emotional arcs and cool visual ideas, despite Depp's lazy performance and way too much plot."
" Very pleased with this movie
",0.4927,0.888,2018-04-27 00:00:00,10,"So many positive points that I can name off, some including beautiful graphics, interesting plot, unique story line, and many more."
" They shouldn't have bothered
",0.2411,-0.8583,2018-04-22 00:00:00,3,"You know your film's going to be bad when even Tim Burton doesn't come back to direct it, and this follow up to Burton's ALICE IN WONDERLAND is one of the most forgettable Hollywood blockbusters I've seen in a good while. I should note that it has nothing to do with the Lewis Carroll novel, instead mixing together a Wellsian time travel plot as Alice once more heads to Wonderland to rescue the Mad Hatter from a certain death. Right from the beginning, where we see Alice captaining her ship in a big CGI set-piece, I knew this film would be complete nonsense and so it proves. It's one of those slick CGI action adventures in which every single shot has to be packed with CGI landscape, imagery, and characters. The same old annoying characters return from the first film to annoy once more (hello, Helena Bonham Carter) while Mia Wasikowska seems to have mastered that single expressioned, mildly bored look. The story goes through cliche after cliche, merely showing off the latest work from the CGI animators rather than having any kind of real character or warmth of its own, and as such it is quite the bore."
" Visually beautiful
",0.5994,0.8029,2018-04-01 00:00:00,7,"It is ""decent"". Not extraordinary, nor a waste of time. The sad thing is that it focuses more on the sparkly scenes, like these would impact the viewer the most. In fact, the story lacks substance and this should have been the epicentre of interest. It is far from great, although it's not a disappointment. Something slipped through the fingers of the producers when they were producing this movie. Now it's another commercial film."
" What A Waste
",-0.4215,0.8809,2018-03-28 00:00:00,5,"Continuing my plan to watch every Johnny Depp movie in order, I come to Alice Through The looking Glass.There is no need for this movie. That's true of most sequels, but it's especially true of Alice Through The Looking Glass. This movie was made for one reason. Alice In Wonderland made money. A lot of it. Over $300 million at the domestic box office alone! Original director Tim Burton is not involved with this one, and it shows, truthfully the movie as a whole is a mess. It rook me three attempts to get through it. All the major characters from the first film return, but Carter is criminally sidelined. The girl playing Alice is in every scene, yet, she makes zero impression!! Depp makes even less impact. Truthfully even writing this is boring me. Despite Depp going on a huge publicity tour, and appearing at Disneyland as The Mad Hatter to surprise guests. Alice Through The looking Glass only grossed $77 million at the domestic box office to end the year to 39th highest grossing movie of 2016."
" Witty,melodious lines, visual feast and wonderful acting.
",0.5719,0.9955,2018-03-25 00:00:00,9,"Just saw on Netflix, not even interested to watch it but put it up to entertain my young niece while i browse away on the phone. But from the quick glances, eventually it pulled me in by the stunning visuals, beautifully crafted and unique constumes, special effects are feast for the eyes and the oh so wonderful witty and melodious dialogue was captivating and heartfelt. I never read Lewis Carroll before, only watched the movies or Disney cartoons. This is wonderful movie and a joy to watch. Main cast was amazing especially Johnny Depp, Mia and surprisingly Sacha Baron Cohen whom I'm not actually a fan, but his character was so interesting. Love this. Such an underrated movie. Watching this again later with full attention."
" Mediocre
",0.0,0.765,2018-03-24 00:00:00,5,"The Sequel to the 2010 hit Alice in wonderland. now both you and i know how bad was the first one. This one at least had some elements from the books, the visuals were better asswell, in Alice in wonderland it was dark and griddy wich doesn't fi wonderland. Thow to be fair it fits underland.This one is bright,colourful and neon.But it's still trying to make wonderland an action pack war movie with rebelion and it just doesn't work.I dare say the acting was a lot better to. Alice at least was more intrested on what was going on and even Deep got better at scenes. Thow in some he was even worse (YOURE ALIIIIIIICE). And finally the god of this film TIME. time played by sosa barron koan was really a god. He is like David cross from the cipmunks the one star it diserves it just because of him."
" Not bad at all
",0.431,0.9619,2018-03-04 00:00:00,9,"Despite the special effects being sometimes great and other times 'meh', Alice Through the Looking Glass surprised me a lot!
It's very funny, light and pleasant to watch.
Once again we saw Anne Hathaway and Helena Bonham Carter carry the movie but Mia Wasikowska is a lot better than before.. her acting is really good in this one.
The meanings about Time and Family are really well done in almost every possible way.. the 'cause and effect' is on point.
Really good movie."
" Not enough Wonder
",0.0,0.5271,2018-01-22 00:00:00,5,"I enjoyed the first film, I thought it struck a good balance between the whimsical eccentricity of the source material and the modern Hollywood demand for thrill ride action.
But the second time around they get it all wrong, much as they did on the second Pirates of the Caribbean. Too much rushing around and too little humour and quirkiness.
Firstly, right from the get go, they forget to maintain the vital distinction between the Fantasy World of Wonderland, where the impossible is common place, and the Real World, where the possible needs to remain within the constraints of the culture and available technology of the day, in order to be credible.
So we get Alice, the teenage female Captain, sailing her Victorian sail powered merchant ship in ways that defy the laws of Real World physics (Groan)
Who needs to visit Wonderland if we can bend the Real World to our will in this way?
Secondly I think the decision to try and explain the backstory and motivation of the previous film's characters and situations was misguided.
We don't need to know this, and it goes against the whole idea of ""Wonderland"", once things are explained, they often lose much of their ""Magic"", their wonder.
The Queen of Hearts happens to be a bitch and she serves a purpose in the story, that is her only ""why"", we aren't supposed to understand or feel sorry for her.
The fun of Wonderland is in the novelty of the experience and trying to explain it only dilutes or destroys that.
Thirdly they don't introduce enough new characters or situations with the requisite quirkiness, the original is a parade of quirky characters, this one only has a few, with the space between filled up with, briefly, revisiting old ones and, mainly, by pointless rushing about.
I enjoyed Sacha Baron-Cohen's ""Time"", but his assistants were merely derivative of other movies tiny mechanical robots, and there was very little else we hadn't already seen in the first movie.
Too whoever wrote the script for this one I say ""Off with their heads!"""
" it struck me in time, space and in my heart.
",-0.25,0.8392,2018-01-21 00:00:00,10,"Too bad there are too many bad reviews. I love this movie, the puns, the creatures, the actors, the characters and the story. I love the make up, the make belief and the making of the Hatter, the Queen of Hearts without a Heart and Time and Time again.
I like what another review said: You have to have an imagination to like this movie. 
And I do!!! Lucky for me. The story isn´t just mindless entertainment, it struck me in time, space and in my heart."
" Another Winner
",0.5859,0.8999,2017-12-10 00:00:00,9,"Good (prequel) sequel film... it's very much in the 'spirit' of the earlier film (Alice in Wonderland 2010). Not much else to say about the film - if you like the first one then watch this one for more of about the same (with a different story of course).I'll ditto what I said of the 2010 film... The Carter-Depp-Burton Trio works well again for this film set.Love the artworks, costumes, set, colours, cinematography, direction, - you name it - I love it! 9/10"
" Time is a thief and a villain
",-0.7906,-0.5226,2017-12-04 00:00:00,8,"The film opens with an incredible scene as Alice (Mia Wasikowska) captain of ""The Wonder"" eludes Chinese pirates in the middle of a storm through the Straits of Malacca, 1874. She does 'the impossible"" something she likes to do ""six times before breakfast."" When she gets back to London her financial circumstances has taken a turn for the worst. She ends up back in Wonderland where she must go back in time in order to save Hatter Tarrant Hightopp, who believes his parents are alive, but who died. She meets Time (Sacha Baron Cohen), a kinder German version of Rasputin type of man who must endure a rash of puns.As the film progresses, only Alice can save all of time, space, and dimension and realizes you only have one family.This film lacked the action, scenes, drama, and adrenaline flow of the first one. Through the time travel sequences we obtain background information of the queens and why their relationship as sisters fell apart. It seems the Queen of Hearts didn't eat the tarts after all.Mia Wasikowska continues in her female role model, although not as strong as the first feature. These time travel things seldom work too well."
" Alice Through the Looking Glass lavishes with colorful, eye-dazzling visuals that unfortunately fail compensate for its uninspired story
",-0.7096,0.9928,2017-10-10 00:00:00,5,"Tim Burton's reimagining of Lewis Carroll's 'Alice in Wonderland' in 2010 was far from anything special, but its ability to engage the audiences with its dazzling visual imagery in an effort to distract the director's drift from the familiarity of the source material proved to be enough to make a head-spinning earning at the box office. After sitting through this film's follow-up, which picks up shortly where the end of the film left off, I was only left pondering with the question of why a sequel was even remotely necessary. With Tim Burton reassigned to the producer's chair, James Bobin takes over the director's role in attempt to squeeze the small remaining juice out of the source material, but does with results that are a bit underwhelming to say the least. This film, following the eponymous character on yet another adventure through Wonderland dazzles with just about everything from the visuals to the quirky humor that made granted appeal to its predecessor except a satisfying story. What Bobin's leaves us with is more of a roller coaster ride through a cave of wacky cartoon imagery than a cohesive family fun picture. The film focuses on Alice (played by Mia Wasikowska) who disappears through a mirror and into the magical world of Wonderland where she reunites with the White Queen (played by Anne Hathaway), bobbled head twins Tweedledee and Tweedledum (both played by Matt Lucas), the chesire cat, and white rabbit. They inform her of the urgent news of the Mad Hatter (played by Johnny Depp) growing ill due to his depression of the loss of his family. To save the poor man from his fate, Alice must travel back in time with the help of Time ""himself"" (played by Sacha Baron Cohen) to change the course of events that led to the death of family at the hands of the Red Queen (played by Helena Bonham Carter).For a continuation on Lewis Carroll's classic source material, you would think that writer Linda Woolverton would come up with a premise little more thoughtful than what is sold here. Sadly, that is the only beginning of the misdeed that drives this fairy tale into diminishing effect. The best thing James Bobin's wrings out the picture is an overwhelming barrage of colorful visual design of the whimsical world of Wonderland completed with bloated CGI that pits Aussie actress Mia Wasikowska with the daunting task of interacting with mysterious creatures who only exist in the computer. Wasikowska manages to pull it off and Bobin's makes a fabulous attempt at springing the imaginative world to life. But for everything and everyone else though, that is another story. Wasikowska is left adrift in a story that, while has its moments, never gets truly engaging. The moments of excitement are scarce as the film pedaling swiftly from subplot to another without giving any of the classic supporting character a time to shine. It is especially disappointing for Johnny Depp's Mad Matter who stole the show in the previous film, and is succumbing to a performance that is more vexing than charming. If there is anyone even remotely as charming as Wasikowska here, it is Sacha Baron Cohen, giving a quirky impression of his loopy character. On the other hand, the fun is left to the climax when Alice and the rest of the characters are forced to make a daring attempt to save Wonderland as the entire place from ground is up is morphing into rust. It's too bad however, that lot of the pulse-pounding excitement is left buried under an uninspired plot while the visual effects are left to stand out with open arms. On the bright side, it does make a sweet visual ride with who happen to see this in 3-D.Alice Through the Looking Glass is an underwhelming fantasy ride that benefits from striking visual methodology that manages stick out among the uninspired mess of a story. That is not to say this doesn't make for a wholesome family entertainment, but there are certainly better options to say the least."
" Weird reviewS – A very big surprise, did not expect this
",0.1725,0.996,2017-10-06 00:00:00,7,"First of all, I want to say that I am not a big fan of the first movie, directed by Tim Burton. I thought it was an OK movie and nothing more. When I heard about this sequel, I couldn't care less. And the trailers didn't do much either to get my interest for the movie. So it took ages before I saw this film. And mama mia, was I wrong about it. This is, in my opinion, one of the most underrated movies that came out this year. It's more interesting than the first one, with a far more interesting story and concept. And in the end, it has a really good message for children about time and how we should use time the best way we can, and that the most important thing is our family. The directing is solid, on par with the first movie. The acting is OK, with some good CGI. The music and art direction is actually were the movie shines. There are some incredible beautiful scenes in this movie. It's definitely eye candy for children but adults too. It is a good family movie, and I would never thought that I would say this, but now I feel sad that this movie didn't do better at the box office. And actually really surprising, after all the first movie made over 300 million domestic and over 1 billion worldwide. So what really happened here ? But they could definitely use more time, especially in the beginning, for characters and story. The movie would gain more momentum and be stronger. Most of the CGI is great, but there are some scenes with bad CGI in it. This movie is definitely a step forward, and I would like to see a third movie, but I doubt we will get one. Families will enjoy this and children will learn one or two thing with this movie too. In the end, I would recommend this movie to everyone, go buy it on blu ray. Christmas is coming, and this will definitely be a great gift for every child who didn't see this movie (according to the box office of this movie, there's a lot of children who didn't see this film). This is a good movie, with more pros than cons. + Visually impressive + Art Direction + Very entertaining - They could take more time for character development and story - Some bad CGIGOOD - 7/10"
" Out of Time...
",0.0,-0.4497,2017-09-05 00:00:00,5,"Family feuds... I'm surprised that Tim Burton didn't make time in his schedule to direct this... all of those simmering sibling and daddy issues would make a good loose trilogy with Wonka and Big Fish...The film tries to tackle big themes within a kaleidoscopic world - but it winds up going through the motions, and, unfortunately for a film about Time, has the feeling of drag when it should zip."
" An unwanted sequel
",-0.2263,0.9252,2017-09-04 00:00:00,2,"Having used the books by Lewis Carroll for the first film there's really nowhere for this sequel (an unneeded one at that) to go in terms of plot.It manages to cobble something together, that is equally as nonsensical as anything Carroll dreamed up, but apart from some big names popping up in their roles from last time (Anne Hathaway, Johnny Depp) there is a strong sense throughout that this is a sequel for the sake for a sequel.I'm not saying the Tim Burton directed first part was a masterpiece, but at least it was grounded on something more solid."
" What are great visuals without context or a good plot?
",0.4007,-0.5163,2017-08-16 00:00:00,3,"Without Tim Burton as director, and you did very well, Tim, to stay away. Sequel to the 2010 movie ""Alice in Wonderland"", this one soon starts with sexist feminist propaganda, with Alice a few years older as, just imagine, captain of a merchant ship. The innocent Alice of the first movie here is an arrogant pirate to her subordinates, she responds crookedly to her mother and steals an artifact that allows her to travel in time even though she has been warned and experienced firsthand that the past is unalterable, and she does it to help the Hatter who is dying of, just imagine, nostalgia for his 'supposedly' dead family. Then in the end all turns out well with impossible understandings: the two queens would never be friends forever and ever even being sisters, for one is notoriously insane, just as Alice's mother's change of heart is totally out of character. Moreover, the story is bad, confusing, and stumbles upon itself like the hands of a clock in infinite circles (and that is what it is about!), the visual aspect being the only redeeming factor. But what are great visuals without context or a good plot? The answer to that question is this movie."
" Stunning but not good
",-0.3202,-0.9521,2017-07-21 00:00:00,2,"The visual effects and the costumes (except the costume being mentioned) in Alice through the Looking Glass looks good but unfortunately the story seems muddled and worst thing that this movie could offer was Johnny Depp's costume and the makeup which is unlike the first movie in which his costume looks awesome but in this sequel; it's making it sick and uncomfortable, plus Helena Bonham Carter's performance as Red Queen is completely jarring and annoying to hear and watch. Not Good Indeed."
" Unengaging Story
",0.0,0.8874,2017-07-17 00:00:00,5,"(Flash Review)This felt like a cash grab for all involved. Perhaps not having Tim Burton at the helm didn't bode well for the bland script. The basic plot is the Mad Hatter is feeling downtrodden so Alice has to go back in time to help him. While going back in time she must outwit a personification of time. Time was probably the best character in the movie. Lots of CGI time traveling effects. By the way, all 5 points go to the production team as they did a great job. If only there was half the effort put into the story and script. There were a smattering of witty jokes but overall I felt zero engagement or concern for the character's efforts. There was also a sub plot point that bookends the entire movie but by the end you had completely forgotten about it so you are likeoh yah, they had to tie that up rather than add meaning by touching on it throughout."
" A Superb Movie Worth Watching
",0.7184,0.9579,2017-04-28 00:00:00,8,"I don't know why peoples are hating this movie, this is definitely a movie worth watching.Well i didn't like the first one but this one is far better than the first one.Visual effects of the movie is best thing about it.....i just love the graphics of the movie....just don't go with all the negative reviews,this one is better.I like the characters,especially johnny Depp and yes Alice is the real heroine."
