title,title_sentiment_score,text_sentiment_score,date,rating,review
" Step down, but still fun
",0.6652,0.9259,2020-03-30 00:00:00,8,"The usual case with me for sequels is I usually enjoy them more because they don't need to spend as much time developing the characters and can jump right into the action. Not so with this film. I enjoyed ""Divergent"" more. That's not to say I didn't like this movie, just not as much. I still thought it was great. Some parts were a bit unnecessary and slow, I thought the way they filmed the action sequences was great, though. The ending made me wonder ""How are they going to continue this?"" and I'm excited to see how, whenever that may be. There was a bit of overacting by Shailene Woodley in this film (her crying felt forced and unrealistic) but the other actors did a great job. It's not the best YA series out there, but it is still enjoyable. I'm excited to see part 3 (and possibly 4).
Grade: B 8/10, 4/5 stars"
" I actually liked it
",0.4215,0.9891,2020-03-26 00:00:00,6,"Insurgent is very good! I had seen this movie before and found it boring but I gave it another try. I found it to be very intriguing and fun. The action is great and leaves you on the edge of your seat. The acting is very good, especially from Shailene Woodley, Ansel Elgort, Theo James, Miles Teller, Kate Winslet, and Naomi Watts. The characters are developed well in this movie as the story progresses. The only part of the movie that was dragged was the scene with Tris and Kate Winslet. It felt like too much was shown of that when it wasn't needed.
It's not as good as Divergent but still good enough to enjoy."
" Divergent vs. Insurgent games
",0.0,0.2415,2020-03-24 00:00:00,9,As the progress sequel continues in Divergent. The following continues games in Insurgent. More advance than before the previous movie. In Divergent was only a start wram up training childplay games. In Insurgent highly skilled profound intense mild difficulty games.
" steamy, explosive, surreal
",0.0,0.4927,2020-03-22 00:00:00,9,"This is the steamiest Shailene and Theo get in the trilogy, the only onscreen hetero action I could bear through. The CGI scenes are hella impressive.
Uhm, why are you even here if you haven't watched it (I'd suggest watching this and the first on. we are going to pretend the last one never happened ✨)"
" Different to the book but more entertaining
",0.6474,0.9525,2020-02-21 00:00:00,8,"Fair to say the movie strays quiet far from the book but I think it kept it more interesting to suit a movie. Not nearly as bad as the reviews say, I still enjoyed it and am keen to watch the next."
" Divergent was better, But.
",0.2382,0.7506,2020-01-12 00:00:00,6,"Yep pt1 was better, but it's still a good movie in it's own right."
" I enjoyed it
",0.5106,0.5837,2020-01-02 00:00:00,8,Honestly I feel like most of you guys hate the move because you've read the book you put faces and plots to the movie before they even made and that's why the series is rated bad. I haven't read the book so I am leaving a happier and better rating. I think this movie was good and I recommend it to any fan of action or even romance movies. There were some plot holes but you can figure it out it is definitely not worth the one or two that some users have it. However it's up to you to decide whether it's worth your time or not watch then look at the rating cus they can be discouraging.
" Darker than the first movie
",0.0,0.8742,2019-12-24 00:00:00,10,"This movie is more darker and more mature and much more violent than the first movie. It has great themes and they give you heavy stuff to think about. The animation is spectacular and I love this more than the first movie. The acting is top notch - especially with Shailene Woodley and Kate Winslet. Woodley steps up with her acting and you truly believe that she IS the character she's portraying. She really embraces and doesn't shy away from the issues Tris is struggling and dealing with. She makes Tris extremely relatable and human and I found myself crying at several of her scenes - she's extremely good.
And then there's Kate Winslet. She is PERFECT as the movie's villain. She is cold and evil and she does it extremely well. She is an excellent, excellent actress.
With the violence, while there's definitely more than in the first movie, thankfully they keep it (mostly) just off-camera, but the implication of what is happening is very obvious and if you think about the implication too much, it could make your stomach turn.
It is a solid sequel and I can't wait to watch the next movie!"
" Trash bin movie
",0.0,-0.6771,2019-11-01 00:00:00,1,What is wrong here? This movie absolutely deserves much lower grade than this one.
" Insurgent - the torture continues
",-0.5994,-0.4391,2019-10-16 00:00:00,3,"The second chapter of the Divergent series, follow up from the exact same point in which the first movie ended. Insurgent improved slightly the story telling and is less boring, even if some scenes are completely unnecessary. Action scenes, that should be the main core of this production are embarrassing: who worked on the title clearly do not know how to use a green screen properly, and CGI effects can be definitely better. Moreover, as usual Shailene Woodley (Tris), is completely flat in her acting, you don't know if she is angry, sad or happy, because she does not have any facial expression, it seems that you are looking at a rock. Theo James has more or less the same acting skills: a tree trunk. The only one that did a decent job is Kate Winslet, as the main villain.I don't even know how you can release a movie like this, with a budget of 110 millions dollars (IMDb movie page as source) and not to put some efforts on a technical perspective, maybe actors were too expensive? I don't have idea, the only thing that I know is that I thought that doing worse than the previous chapter was impossible, but they made it: they managed to fail harder.I will try to watch also the third and last movie to see if at least in the end they were able to save something, but I highly doubt."
" I Don't Think You Will Agree With the Low Ratings
",0.1027,0.9715,2019-09-29 00:00:00,8,"It was exciting and had a coherent plot. The acting and CGI were good. The characters were constant in their roles. As with any futuristic drama, you have to suspend your belief and ignore a few plot holes but there was nothing silly or insulting to my intelligence. I knocked off 2 stars for the uninspired mood music and the rather quiet dialogue. I thought that it was slightly better than the previous movie as the factions weren't overly exaggerated but rather accepted and simply part of the story.
In my opinion, the low ratings are strange. There are not a lot of other movies today that I feel have a good story and are well presented and acted. And exciting!"
" A good action movie
",0.4404,0.936,2019-07-28 00:00:00,7,"Insurgent is a good follow on movie from divergent. Don't know what's with some of the negative reviews, I personally liked the film great acting and had me gripped through the whole movie. The special effects were pretty good to a good movie to watch although Divergent is a lot better. But I throughly enjoyed it"
" Why this movie is bad and continuously receives terrible ratings
",-0.765,0.9517,2019-07-26 00:00:00,1,"Although the Divergent series is old I have just started reading the books and am now on the third, Allegiant. After I completed the first book I was ecstatic to see how the ingenious book would be converted to a movie expecting the same transformation that the Hunger Games series made, which was wonderful. But i was sadly mistaken.The first movie, Divergent, was very humorous to me and I spent most scenes laughing at the conversion of the characters, plot, and even some settings. I tried to over look it though keeping at least a sliver of hope that insurgent might be better because of the change in directors. So I read Insurgent, the story carried its brilliance and raised my hope to assurance that even if the casting will be the same, there is no way that the director can let down this amazing story, but again mistaken. The movie ruins the reputation that the books received and i am astounded that Veronica Roth herself would let this movie into the public. First off, the plot is lost in every scene making this dystopian world sound war riddled instead of secretive and hidden. Also, the acting is such a let down considering the numerous famous actors and actresses casted, the main characters seem confused instead of strong because of the weak acting that Woodley and James withheld throughout the movie. Lastly, even large events in the book were overlooked because of the time the director wasted to put unimportant factors that are not even relevant to the story!Do not watch this movie and the others of this series, save yourself the time and dignity. I do suggest reading the books though because as I suggested they are brilliant and truly inspiring pieces of art, which is why I am writing this review. If I could sum this movie into one word it would be, disappointment. This movie is a disappointment. The acting is a disappointment. The time I took to watch this movie disappoints me."
" A solid follow-up to 'Divergent'
",0.1531,0.9961,2019-07-12 00:00:00,8,"This film opens five days after the end of 'Divergent'; Jeanine has declared martial law and placed the blame for the massacre of Abnegation on Divergents. Tris, Four and others who survived have found sanctuary with Amity Faction but must move again when Dauntless forces loyal to Jeanine turn up. They manage to escape and find themselves amongst the factionless. They then continue into the city and reunite with other free members of Dauntless at Candour Faction. While this is going on Jeanine acquires a box containing a message from the city's founders... to open it she requires a Divergent who rates extremely highly in each of the five faction tests. Not surprisingly the person who is most likely to achieve this is Tris. Jeanine issues an ultimatum; either Tris surrenders to her or she will cause people to die.I enjoyed 'Divergent' so was keen to watch this; I was not disappointed. It might help that I never read the books so aren't bothered by its failure to stay close to the original story. The film is packed with action from start to finish; some of this is 'real world' with obvious dangers and some takes place in simulations which appear to be no less dangerous but allow the impossible to seem possible in spectacular ways. The special effects are very impressive throughout. The cast is solid; most notably
Shailene Woodley who is great as Tris... and looks stunning with a pixie cut! Theo James is good as Four and Kate Winslet is suitably unpleasant as Jeanine. I liked how the film gave us a look at the lives of two more factions, Amity and Candour, as well as showing the factionless as more than just future homeless people. There are of course some flaws; one still has to suspend ones disbelief to accept the faction system and there isn't the sense of danger I'd like... since Tris is the protagonist I never suspected she might get permanently harmed. Overall though I'd say I enjoyed this film as much as he first; it may not have been the most original film but it was more than just sufficiently entertaining. On the strength of this I won't waste too much time before watching 'Allegiant'."
" Drifting Away From The Book
",0.0,0.8553,2019-06-30 00:00:00,8,"I thouroughly enjoyed this movie. However, it has strayed far away from the book, and has gotten slightly confusing. However, that doesn't take away from being enjoyable, and any fan of the sci fi genre will like the series."
" A pretty consistent sequel to the fist film, both in plot twists, progression, and cliches.
",0.4939,0.9903,2019-05-26 00:00:00,7,"If The Hunger Games has given us anything from this uprising of Young Adult film adaptations, it's that each successive film is released in each successive year. There's no waiting for years for the next part of the trilogy to come out, only to have characters cast differently. The Divergent series is no different, but still stands in the shadow of its Hunger Games predecessor.This time around, we get the pleasure of Robert Schwentke directing the post-apocalyptic action. With his previous films like RED (2010) and The Time Traveler's Wife (2009), it's clear he can handle action as much as he can romance. While the action is excellent, the romance seemed to be a little lacking. Having read this book after watching the film, the plots start to diverge a bit (ha ha, get it?) almost in part due to the removal of the more sexually-charged relationship between Tris (Shailene Woodley) and Four (Theo James).Since the focus of the film is mostly on the action, the Divergent simulations were quite visually interesting, with the real-world action almost seeming tame in comparison. Sure, some of the characters, like Peter (Miles Teller) were grating and obnoxious, but unfortunately added to the plot. Some of the trouble I'm starting to have with this series is being unable to clearly see the inevitable conflict of the trilogy. Sure, the ending of Insurgent had some amount of closure in a plotline mostly disconnected from the first film, but at least it led toward something to be used for the plot of the final films. It just really felt like not much had happened between the plot of two movies.A pretty consistent sequel to the fist film, both in plot twists, progression, and cliches, I give Insurgent 3.5 stars out of 5."
" Mind numblingly boring
",-0.3182,-0.3716,2019-05-01 00:00:00,2,"The first movie was engaging enough but Insurgent is just a flat, emotionless mess."
" Solo entretenimiento
",0.0,0.0,2019-05-01 00:00:00,6,"Juegos del hambre, maze runner, una película más del estilo."
" too many plots are meaningless
",-0.4404,-0.2732,2019-02-19 00:00:00,4,"In mediocre works, too many plots are meaningless, too many plots exist only for special effects. Is the experiment designed to solve the problem of human nature?"
" I don't get the hate
",0.4585,0.8807,2019-02-06 00:00:00,7,"I have not read the books myself, like some other critiques here. I find the hate unnecessary though. This is not the best Sci-Fi movie I've ever seen, let's be honest, but it isn't that bad as well.This sequel makes sense to me as Tris and Four continue to rebel against evil Jeanine of Erudite which wants to avoid people leaving the circle Chicago is in. It's a whole journey to come to this point and yes, the action-scenes are not all well scripted, but it does make sense to me at least. I mean people complain about action scenes not being totally realistic in any sense, but do people forget what a movie is all about? Don't people have any imagination anymore? Just let the movie continue without paying literally attention to every single detail.The only thing that I constantly find weird (but I guess the character in the book does it) is that Peter constantly is like ""Hey, screw yourself"" and when he sees Tris and Four winning he is like ""Hey, I want to join you"" and this goes on and on continously...Don't get me wrong here. I'm not a reviewer that puts hours into his review of everything he saw in the movie. I'm generally just a guy that was quite entertained by this and the prequel and feel a bit offended by people that go off like that so quickly."
" Barbie and Ken in Dystopia!
",0.0,0.864,2019-01-28 00:00:00,3,"Last week, my dear wife and I watched ""Divergent"", which was a predictable and daft but nevertheless endurable dystopian thriller targeted at teenage girls. My wife wanted to see ""Insurgent"" now, even though I tried to persuade her that it's never a good idea to watch a sequel in a series where the original is already just so-so. ""Divergent"" was predictable, which pretty much means that ""Insurgent"" is an open book entirely. Evidently heroine Tris and her lover boy Four are blamed for Evil Queen Kate Winslet's genocide scheme that went awry. Of course they will have to seek help from people they swore never to speak with ever again. And, unmistakably, they will have to reach out to the cowardly leaders of the other fractions and convince them to stand up against the megalomaniac Jeanine and her elite Erudite army. Will they succeed? Gee, what do you think?Okay, maybe I shouldn't sound so arrogant. I'm a 37-year-old male who preferably watches mean-spirited horror movies and obscure cult cinema, so I'm not in the target audience group of Veronica Roth's books or these hi-tech film adaptations. Notwithstanding, the quality level of the screenplay for ""Insurgent"" forces me to think the producers and the director underestimate the intellect of their target audience. Even after the approximately 47th simulation sequence, the writers still think they can fool us into believing Tris' next ordeal is reality, for sure. These simulation sequences are utterly grotesque and preposterous, by the way. We're talking floating houses on fire and dead-mother holograms. And, seriously, what's with all the shattering glass and pulverizing decors? Is this supposed to be cool? Are we supposed to be impressed? All it does is establish that the responsibility of the special effects was in the hands of immature digital nerds. Shailene Woodley still doesn't look like a convincing and brave heroine, not even with her hair cut short, and particularly Theo James must have felt quite ripped off when he got hold of the script. In ""Divergent"" he was a tough and hunky rebel, but in ""Insurgent"" he is downgraded to Tris' docile and obedient sidekick. They are kind of like Barbie & Ken, in fact."
" Worse than the first one, no need to waste time on this franchise
",-0.7964,-0.4754,2018-12-31 00:00:00,2,"Worse than the first one, there is really no reason to watch this except if you're in the plane and you've watched everything else they have available, like it was for me."
" cliché af
",0.0,0.8044,2018-12-05 00:00:00,3,"This movie is cliché unoriginal and forgettable.CHARACTERS
Four is now pointless cause he is there cause he is Tris boyfriend.
all the development they gave Four just went away and he is now this one dimensional character who is just there to support Tris no matter what.
It would have been good to see some conflict with relationship instead of seeing them support each other 100% and love one and other 100%.
It would have been more genuine and real if we see some conflict it dosen't even have to be major it could be minimal.
Tris is this strong depressed woman that's all she is.
She is not as bad anymore but it felt like they showed how Tris dealt with the consequence's and then they just didn't expand on it for certain reasons.
The major events in Divergent are almost irrelevant cause they are mostly forgotten.
And that one dream scene where they showed Tris suffering with the consequence's was terrible.
They straight up said this cringe line ""You killed us all"" just a nitpick.ACTION
I love action scenes specially good ones.
But what i don't like is when an action scene deviates from the story
The action scenes are to much.
It's like every scene needs to have action and it makes the story worse.
instead of giving dialogue to the character they throw in an action scene.VERDICT
I don't have so much to say about this movie but it's bad.
I'm gonna review the last movie and i have seen RT score and it says that it's the worst of the bunch.
I will watch the movie to judge for myself"
" Good film
",0.4404,0.8481,2018-11-23 00:00:00,10,The action of this movie is great and the setting of the characters is great
" MAY THE TRUTH SET YOU FREE
",0.6808,0.7299,2018-11-20 00:00:00,8,"The film opens with a narration to give you the basic outline of society and the issue in case you are like me and confuse all these films that are a year between releases. I am glad they did this or else I would have been looking for a vampire with handcuffs and a bow running through a maze. Tris (Shailene Woodley) is a ""deadly divergent"" and is wanted by Jeanine, (Kate Winslet) the ruler, so she can open a ""Hell Raiser"" looking puzzle box. Theo James ""Don't call me Tobias"" is her love interest. Miles Teller as Peter had the best role which allowed him to do some acting.I loved Shailene Woodley in ""White Bird in a Blizzard"" but in this film, I really couldn't get into her character. In fact nearly all the characters were cardboard exhibiting mediocre writing that goes along with ""go in happiness."" The main plot drags a lot and if not for the special effects of the SIM world the movie would fall flat. Oscar winner Octavia Spencer has a small role and doesn't get to strut her stuff.And what was that scene where they hop the train? They are actually running FASTER than the train when they jump on it. Seriously? And then the train speeds away once they get on so their antagonist can't catch up to it,This is another fun teen fantasy film, not to be taken seriously even with $110 million US dollar budget.Guide: One mouthed F-bomb near end. Implied sex. Side breast? I liked the film in spite of its short comings."
" another dystopian universe nothing special
",-0.3089,-0.3413,2018-11-16 00:00:00,1,Review: I really didn't enjoy this movie because there is no part that is clearly coherent. The direction and screenplay are both sub-par. Both the casting and acting are both sub-par also. All in all I would give this a star out of a possible five stars.
" Exciting second installment in which Tris will be forced to make difficult choices about sacrifice , love , courage, and allegiance
",0.7269,0.9837,2018-10-15 00:00:00,6,"Insurgent movie is a sci-fi, action and drama movie based on a book by Veronica Roth . It contaisn noisy action , rhrills , chills , high body-count and impressive state-of art FX . Sixteen-year-old Tris Prior (Shailene Woodley) lives in a dystopian society divided into five factions. and now she seaches answers in the ruins of a futuristic Chicago. As each faction represents a different way of handling things. Erudite are the intelligent. Candor the honest. Abnegation the selfless. Amity the kind. Dauntless the brave.The Erudite have declared war against Abnegation, because they think that they have important information about the Divergent, who are apparently dangerous for the faction-system. After the earth-shattering revelations of Divergent and beyond the wall enclosing Chicago , Beatrice Prior is running with her brother Caleb (Ansel Elgort) and with her sweetfriend Four (Theo James) from enemies . All of them have to continue her fight against a nasty alliance run by Kate Winslet which threatens to tear her society apart with the help from others on her side. Tris approaches the residents of Amity led by Johanna (Octavia Spencer) , but they all stand away from her. Later on , they meet the Factionless leader and Four's mother, Evelyn (Naomi Watts). Tris faces one impossible challenge after another as she unlocks the truth about the past and ultimately the future of her world. In order to survive, Tris has to make imposible decission about herself and her beloved friends. One Choice Can Destroy You and to finally discover the shocking truth of the world around her .It's a standard Science Fiction with no much sense where there is suspense, thriller, getaways and pursuits , frenetic action , struggles , explosions , violence and enough characterization . Dealing with a girl who is escaping with his fiance and brother from the enemy, while unleashing new secrets about her family's past , hers parents , Tony Goodwyn- Ashley Judd, and her mysterious Divergence . It is a very loose rendition of Veronica Roth's novel, that packs a vastly different screenplay , unlike the first movie . It takes parts of a successful trilogy , in the films ""Insurgent"" is the sequel to ""Divergent"" and is followed by ""Allegiant"" with Allegiant -part 2 being called ""Ascendant"". Whereas there are only actually 3 books in the trilogy. Shailene Whooley gives an acceptable acting as the brave teen who is haunted by her past and takes desperate , risked choices to protect the ones she loves , as well as she must confront her inner demons . Support cast is frankly excellent such as : Ansel Elgort , Jai Courtney , Miles Teller, Zoë Kravitz , Ray Stevenson , Kate Wislet , Naomi Watts , Ben Lloyd-Hughes , Cynthia Barrett , Ashley Judd , Tony Goldwyn and Octavia Spencer . The picture contains a colorful and brilliant cinematography by Florian Ballhaus , it was mostly filmed in Atlanta instead of Chicago and being the first film in the ""Divergent"" series to be released in 3D . As well as a thrilling and adjusted to action musical score by Joseph Trapanese . The motion picture was well directed by Robert Schwenke , though Neil Burger was meant to direct this film, but couldn't due to scheduling conflicts with post-production on Divergente (2014). Robert Schewenke has directed a few but successful films such as : The Time Traveler's Wife ,Tattoo , Flightplan , Allegiant and his last one made in Germany : The captain ."
