title,title_sentiment_score,text_sentiment_score,date,rating,review
" Beautiful film with good story
",0.7783,0.5994,2021-03-18 00:00:00,7,The cinematography is gorgeous and worth watching the film for. The separate storylines are generally well-told and entertaining but the thread connecting them together might be a little too bare.
" Passionate...
",0.0,0.9353,2021-02-28 00:00:00,9,"Adorably insane and bizarre, in the style of the short stories I love, a dark humor, associated with animalistic characters, like the bear and the flea, the young old witches, all magically built, but slowly developed, the dragging rhythm is a little uncomfortable ... I fell in love with this tangle of characters, in a super captivating story, there's no way to be enchanted with so much magic... Passionate..."
" Solid Adaptation of Fairy Tales
",0.1531,0.9992,2021-02-19 00:00:00,7,"This was a movie that I'll be honest, I never heard of. It popped up on Letterboxd for horror films so I decided for Italian horror month to check it out for my podcast as Italy was its country of origin. This is a type of anthology where we have 3 interconnected tales involving three different kings. The synopsis is from the bitter quest of the Queen of Longtrellis (Salma Hayek), to two mysterious sisters who provoke the passion of a king, to the King of Highhills (Toby Jones) obsessed with a giant flea. These are tales inspired by the fairytales by Giambattista Basile.We start this off following what appears to be a clown. There are others that make up what looks to be a circus and we see they are there to perform for the Queen and King of Longtrellis (John C. Reilly). He is enjoying what they're doing, but the Queen not so much. She leaves in anger when she discovers one of the performers is pregnant. We learn that the Queen cannot conceive. Their fortunes change when a Necromancer (Franco Pistoni) tells them a way. The King then goes to kill a sea monster, but he dies in the process. From this beast, its heart is prepared by a virgin and Laura Pizzirani is selected. The Queen must eat it and she will become with child. This virgin also becomes pregnant when breathing in the vapors while it is being prepared.It is at the funeral procession for the King of Longtrellis do we meet our other kings. There's King of Strongcliff (Vincent Cassel) who gives into the lusts of the flesh and also the King of Highhills who has a daughter.From here, the movie takes us 16 years into the future. The Queen of Longtrellis has a son of Elias (Christian Lees) who is albino. He has befriended Jonah (Jonah Lees) who looks exactly like him. The Queen forbids the two from being friends and threatens to send the commoner away if they do not heed her warnings. The two are connected though much more than she cares to believe.The King of Strongcliff continues to lead his life of debauchery. He's entranced when he hears the singing of Dora (Hayley Carmichael). When he goes to see her, she refuses to open the door. The reason is that she is old and ugly. She lives with her sister Imma (Shirley Henderson). They come up with a way of staving off the king, but in the end, he's going to want to see the woman with the beautiful singing voice. She isn't what he's expecting though and Imma doesn't want it going too far. She will do what she has to though if it means losing her sister.There is then the story of King of Highhills. His daughter grows up to be Violet (Bebe Cave). She's heard the beautiful tales of knights and chivalry. Her father doesn't want to lose her. He becomes obsessed though with this magical flea. It grows to a monstrous size, but unable to support itself. He sees a way to ensure he never loses his daughter, but that backfires when an Ogre (Guillaume Delaunay) enters to guess the hide that is displayed.I think that is where I'll leave my recap of the movie. That gets you up to speed what the three stories we will follow without giving away too much. I didn't know that these were fairy tales from Italy, but I thought it was pretty cool. They're not ones I'm familiar with so they are fresh. It would be interesting to see if people growing up there if they are common knowledge.Being that they are fairy tales, they are interesting cautionary tales here with a good message. The Queen of Longtrellis is willing to do whatever it takes to have a son, even sacrifice her husband. The problem then becomes not wanting to give up her son. He's a bit young to be married from the looks, but she doesn't even want him to have a friend in Jonah. She sends him away and this causes Elias to leave her to find him when he discovers he's in trouble. This leads to an interesting showdown with a monster that isn't what it seems. Sometimes we become the monster we don't expect.The King of Strongcliff story is interesting to have Cassel playing the lead. He does so well at living this lifestyle of debauchery. Being that he's a king, he can do whatever he wants. When he falls in love with Dora's voice, she knows that he will never love her, but she likes the attention. Imma tries to prevent it as it leads them down this path of destruction and ruin for the two of them. There's a bit of getting the taste of something better and not wanting to give it up. We also get the 'what are you willing to give up for a better life' angle as well.King of Highhills is another odd one as well. He has this beautiful daughter. She's heard these fairy stories of knights and love. She wants that. As a princess, it would be expected that he would marry her off to a similar family. Instead, this king gets caught up in this magical flea he finds. I like his discovery is while Violet is playing a song on a lute she wrote. It appears he is ignoring her, which in a sense he is. I don't feel it is intentional though. He really has no plans to marry her off and sets up a game that he thinks is unbeatable. That is until the Ogre shows up. Now this isn't a monster one like Shrek. It is just a mountain man who has grown to quite a large size and is uncivilized. This takes a strange journey to Violet becoming a strong woman for sure.Where I think I'll go next is the acting. We have some heavy hitters here for sure with Hayak, Cassel, Jones and Reilly. They're all really good in their performances. Despite them being the stars of the movie technically, I'd say it really is more of Henderson, Carmichael, Cave and the Lees brothers. I really like Henderson as Imma. She wants to just live her life, but Carmichael messes this up with the King showing interest in her. They both get punishments in different forms. Cave was really good as well as Violet. I think she has some of the best growth to where she ends up. It is really showing her losing her naivety and coming of age. I'd say aside from that, the rest of the cast rounds this out for what was needed.What I also thought was good was the effects of the movie. This is visually stunning. I do need to give a lot of credit to the set-pieces they have here. They really did look amazing and feels like we're in this fictional world it is set. There are practical effects here which also looked good. The giant flea and the sea monster would fall into this. There is some CGI for both of these that don't look amazing. It isn't overly important and small part of the movie so I won't hold it against the movie too much. The costumes and everything there were also on point for me.If I do have any issues with this movie though, it would definitely be that it runs too long. We're clocking this in at 134 minutes. It does make sense to run a bit longer as we have to introduce 3 stories, give us the crux of what will be the downfall and then having it end as tales like these tend to do. I did find myself bored though near the end of the second act, going into the third. It does bring me back in, but I think there's some fat that could be trimmed in my opinion.So with that said, this is still a movie that I found interesting. We have some cautionary tales here that I wasn't familiar with. It feels fantastically with some of the elements like giant sea monsters, fleas growing to epic sizes and even a witch thrown in there. It does have social commentary that you can pull from it, even though it is a period piece. I thought the acting was good. No real glaring issues with the effects and the soundtrack fit for what was needed. Overall I'd rate this as above average overall, but just lacking a bit for me to really go higher at this time."
" Very Enjoyable
",0.4927,-0.4652,2021-02-15 00:00:00,8,"Basically, this is that type of movie that you have to start to know if it's for you or not. Don't get influenced by the bad reviews.
Usually I don't watch this type of movies because they tend to be very slow and boring. Despite the bad reviews I read here, I decided to give it a try as Salma Hayek appears on it. And after watching it, I have to say that I really enjoy it, the stories are quite predictable but with a ""plot-twist"" that make them somehow unpredictable."
" A monumental waste of time
",-0.4215,-0.9354,2021-02-05 00:00:00,1,"I have sat through disastrous movies in hopes that they will get better, but this is the worst movie I have ever endured. I have no words to explain the disappointment I felt after watching this movie. It should be relegated to the cutting room floor, never to be aired again."
" Bad taste
",-0.5423,-0.4767,2021-01-27 00:00:00,1,Full of explicit content and obscenity. They should mention these things and spare us the unpleasant details.
" One of the best films in this gener
",0.6369,0.0,2021-01-05 00:00:00,10,The movie was facinating. Kept me hooked all the time. Ive seen it 3 times now.
" Classic with exquisite detail
",0.0,0.8271,2020-11-10 00:00:00,10,"Loved it, quirky story lines with exceptional costumes and command performances from characters fairytales are made of....
Brilliant, not for small children"
" Mixed Bag
",0.0,0.9547,2020-11-10 00:00:00,7,"This film was a monumental undertaking, so beautifully filmed and often lyrical yet the many tales do not piece together so well, the cross cutting from story to story seemed disjunct at times, lacking a common thread to maintain what is never quite a story as a whole. Perhaps as the Ballad of Buster Scruggs, this would have been better as separate stories with occasional overlapping characters.
As it stands for all this it is well worth watching and in many way marvelous. A real mixed bag here."
" As usual, huge enthusiasm or appalled rejection.
",-0.3182,0.9011,2020-07-27 00:00:00,8,"This is yet another example of how viewers can either buy in to a radical project or else feel so outraged by it that they often not only give it low ratings but try and stop others even sampling it. Personally, I'm one of the lucky ones when it come to this film. I found it to be a rich, satisfying and sometimes terrifying experience, wonderfully exemplifying the deeply realistic understanding of human nature of the original story makers. Try it!"
" nice, but not worth looking
",-0.0256,0.8824,2020-07-24 00:00:00,2,"The two stars are for the beautiful images, effects and costumes. It's bubble gum for the eyes. Nice, but it brings you nothing. No story, no plot. Think of man walking so slow you can't tell if he's going forward or backward of standing still. If you like to watch that for two hours, this movie is definately for you. If you don't, skip it."
" Please Save Yourself
",0.6705,0.7334,2020-07-01 00:00:00,1,"When you watch the previews for this movie, you think to yourself that this could really be a great movie.If I could give this movie a zero I would. One is as low as they will let me rate it.The only thing interesting about this movie is the fact that someone fooled the producers into spending money to make it.When the credits roll at the end you will literally stare at the screen and say to yourself what in the hell just happened.Please do yourself a favor and never watch this movie.Also, anyone who has reviewed this movie that gave it good reviews, mark them down as having no taste, and never listen to any review they ever give.You will thank me later.Garbage movie."
" Pointless
",0.0,-0.7201,2020-05-15 00:00:00,1,"Incoherent, pointless and going absolutely nowhere.
Chaotic story, badly written and you can put the best actors in the world in it, but it will always be a disaster.
Absolute waste of time."
" Three separate fantasy tales -- no connections.
",-0.296,0.9552,2020-05-10 00:00:00,4,"Three interspersed, but not interweaved, fantasy tales. The cinematography is amazingly clear and beautiful, and many scenes are worthy of paintings by the Old Masters. But nothing much of interest happens. The tales' scenes are alternated but have nothing to do with each other, except perhaps to occur in the same medieval universe. Many times I thought ""Which story are we on again?"" None of them are particularly compelling and certainly not uplifting."
" Interesting and unique yet ultimately disappointing.
",-0.128,0.7798,2020-04-18 00:00:00,6,"Tale of Tales is interesting and unique -- two things sadly lacking in this age of sequels and remakes -- but the stories were little more than a collection of scenes that never created a greater whole, and neither did the stories merge or intertwine except in the most cursory way. Overall it felt like a missed opportunity to create something better if only they'd put as much effort into developing the story as they did the visuals."
" A film on fairy tales as brutal as original faity tales
",-0.4215,0.8493,2020-03-14 00:00:00,9,"What a wonderful fantasy film! It is quite innovative, as it keeps original brutal and macabre spirit of old fairy tales instead of softening them as most movies do (Disney is the most obvious example, but almost all the others do the same, with less competence). It is interesting that instead of chosing a dark cinematography, as the film is so sinister, the choice was for a colorful one, which emphasizes the magical envirionment. Director Matteo Garrone and the other writers did a good job adapting some tales of Giambattista Basile's 'Pentamerone'. Instead of bringing to the screen the most famous - Rapunzel, Sleeping Beauty and Cinderella -, they chose to merge three others in which they could highlight women issues in different atages of life: youth (The Flea), mildlife (The Enchanted Doe) and elder age (The Flayed Old Lady). All actors perform very well, costumes and makeup are perfect, director Garrone was able to explore that dazzling discomfort Terry Gilliam portrays so well in this films. Sone monsters appear, and they are organic and fearful as we would supposedly consider them if they were in front of our sight in real life. The movie is violent, not only for some explicitness, but also because it pulls out, viciously, deep feelings and concerns of human beings and exhibit them for expectators, naked and undisguised. This is not obe more fantasy flick, this is unique and memorable."
" Gruesome, Raw, Unapologetic
",0.0,0.2573,2020-01-11 00:00:00,6,"Not for the feeble minded,reminded me of the first time experiencing Game Of Thrones.Unexpected, shocking turn of events,teases you with a little sparkle of hope and sheets of despair"
" Like a very long prologue for a film that never connects
",0.3612,0.9681,2019-07-30 00:00:00,5,"Incorporating three art fairy tales (that is: Not folk fairy tales, but written ones) of which only one is well portrayed, the film becomes a bit of a mess.
It succeeds in depicting three rather disconnected kingdoms, with a narrative in each.
The only one that really 'works' is one about a king's affection to a monster (!) which leads him to making a monster of his daughter (!!) by marrying her to a completely different monster (!!!). A bit constructed? Well, there you have it.
The other stories are about a particular king, and a pair of magic twins born out of the queen's wish to become a mother - sacrificing her king and more in the process.As said in the headline it all seems a tad like a prologue - the stories never connect properly, and the points of each story flyes a bit in the wind.Great cast, though, but actually a hard watch. Manages to create bleak worlds, but also to obscure three rather simple stories..."
" Flawed instant semi-classic that; as good as attempt at putting fairy tales on the big screen as we could ask for.
",0.4404,0.9954,2019-06-16 00:00:00,7,"A visually marvellous attempt to translate the vintage fairytale to a the big screen. It is not a ""modern fairytale"" or a ""dark take on fairytales"" it feels in every way the authentic narrative a culture simply converted to the cinematic medium.Filled with stunning costume, architecture, landscape and design, they don't miss a trick with the use of colour like a masters painting.""Hey honey I'm thinking we need a room that's all white"".""Why is that?""""If we ever do anything macabre in it, it will look so boss.""The narrative of the movie is essentially three loosely connected storylines but which themselves feel like a set of short fables. It never stagnates, there is always some new element to play around with but not in an overwhelming way.There is a superb sense of whimsy and lyricism that never quite feels childish, juggling humour and intrigue with an ineffably disquieting undertone. I wouldn't call it a horror but when you're in the mood for a horror I think this will do much better than what most of the genre have to offer.The problems are in the details and the plot logistics: just because you're audacious and beautiful in your handing doesn't mean that you still can't fall down in other ways. Impeccably visualized and with an enchanting score, one find they may often have to meet the plot halfway since some actions occur without any real explanation. I know it's meant to be like a fairytale but still...The Two Sisters story line doesn't seem to know exactly what it want to do with itself. It's very hard to understand exactly what the motivations of the characters are and I don't think they meant it to be as mysterious as it is. They came up with some brilliant music overall but they succumbed to what I call ""City of stars syndrome"". They found one really excellent melody and just played it ad infinitum for this particular storyline thus killing the impact. They also shoehorn some macabre for its own sake and too many plot devices are just magic people springing out of nowhere.There's an unfortunate use of (admittedly pretty good) CGI which really clashes with the tone of the movie. They could have made a much better effect with puppetry or animatronics.Also, they had no idea how to end it.But overall a movie you won't soon forget that you'll be glad you saw despite a lot of small issue."
" What a joke!
",0.3595,0.69,2019-04-17 00:00:00,2,I have watched some amazing low budget films - this is NOT one of them. 2 hours that I wish I could get back in my life!
" bad...just, bad
",-0.5423,-0.0258,2019-04-01 00:00:00,2,"A few good gory parts, but otherwise just terrible all around. i feel like there wasn't a lot of conclusion with the 3 stories, either. Definitely a waste of a few hours"
" Horrific fairytale..
",-0.6597,0.7678,2019-03-01 00:00:00,8,"With a title like that I was expecting the usual loveydovey story, but this.. a horrible fairytale, in the best way. I could not look away! Whenever I thought I knew what's going to happen.. don't know anything about italian ""fairytales"" but definately interested to know more"
" Good story with fantasy, different from Eastern magic stories.
",0.4404,0.8271,2019-02-03 00:00:00,7,"The structure is clever thus the three stories were well organised alternately. In traditional Chinese tales, the key senses of worth is common, i.e., introduce the rule or philosophy of the world, such as retribution and honesty. However, the western tales are full of horror. This movie show us a original western movie of tales, the logic of magic and the world are worth seeing."
" Gorgeous, Twisted Fairy Tale Anthology
",0.6124,0.5404,2018-12-03 00:00:00,9,"Absolutely staggered by this!It came on late on a Sunday night on Channel 4 and I decided to give it a go, and was not disappointed.If you love classic fairy tale films like 'Willow' and 'The Princess Bride', loved 'The Fall' and don't mind a handful of boobies and a wee bit of blood, you'll have a lot of fun with 'Tale of Tales'.People on the reviews here seem to forget that all the fairy tales we were told and we teach our kids are based on crazy-dark original stories (eg, the ugly sisters in Cinderella cutting their feet up to fit the slipper, etc) so it's a bit silly to get squeamish over not very much gore at all.I regretted not 'taping' it as soon as I'd started watching it, and already had stuff lined up on my Sky box, so couldn't +1 it, so it's going to be one of the rare films I go out and buy on DVD. That's not happened since 'District 9'.Love. It."
" Long, slow and empty
",-0.2023,-0.5044,2018-12-01 00:00:00,3,"Frankly I don't understand the positive reviews for this film at all.OK - the cinematography is at time magnificent. Lots of attention to detail in the scenes, costumes and props. That's it - that's pretty much ALL this film has to offer.It's a mash-up of a few assorted fairy tales, with some dark edges. Others have mentioned dark humour, but the darker scenes are intended to discomfort the viewer rather than entertain. I love black comedy - this isn't it. In places, it's like they've tried to copy Monty Python, without actually understanding Monty Python.Many of the film's moments are dragged out with a very annoying soundtrack turned up. The whole thing screams, ""look at me, look at me, aren't I a wonderful film"", except it isn't.You press on regardless because you think, all these tales, how do they come together - I mean, you're not enjoying the experience, but you're still intrigued. Sadly, they don't. The tales just fizzle out, separately, and pointlessly."
" Hollow
",0.0,-0.8132,2018-10-16 00:00:00,5,"TALE OF TALES is a bizarre, sprawling, fantasy anthology that weaves three separate dark fairy tales into one unwieldy whole. It suffers from being overlong and averagely written, lacking interesting characters for the most part and getting by with familiar tropes rather than genuine insight or innovative scenes. Of the stories, there's a brief one with John C. Reilly and Salma Hayek as unhappily married king and queen; a lengthy one about witch sisters looking for love; and a plain bizarre one in which Toby Jones nurtures a giant flea. Some of the effects and scenery look quite nice, but there's a real hollowness to the storyline that lashings of sex and violence can't hope to fill."
" But what about...??
",0.0,0.0044,2018-09-27 00:00:00,6,"Absolutely gorgeous film that makes no sense whatsoever. I wouldn't mind, except right from the start it leads you into thinking that the following events are somehow connected or going to resolve together. But they don't. 
About two thirds through it becomes honestly quite boring and predictable until we reach the end. Or, that is, if it had an end. It doesn't. It just stops suddenly with little to no resolution and a freaky, unanswered question.
Unnecessarily graphic - the gore and on screen sex add absolutely nothing to the production. It could have had a touch of humour or charm to offset the misery and bleakness, but both are in very short supply. Few of the characters have enough dimensions to begin forming a meaningful relationship with the audience. It's quirky, it's kind of unexpected and very well made. Provokes many thoughts and then instantly crushes them. 
If you like to leave a film feeling dissatisfied then this is for you."
" Um, no.
",-0.296,-0.2897,2018-09-26 00:00:00,4,"Three stories take place in three neighbouring mediaeval kingdoms, and the film cuts between them.I like fantasy stories. I like the cast members. I like films which are nicely dressed and presented. We have all of that here.Yet, my word, it is dull. Notwithstand it being wilfully weird - no doubt because so were the original stories - it conspicuously failed to hold my attention. Yes, it looked good and was well acted, but it did not engage me in the slightest, and I was bored."
" Disjointed and Boring
",-0.5574,-0.7195,2018-09-11 00:00:00,5,"It's sad to call a film like this ""boring"", because there's so much in it that is innately interesting. Multiple, loosely connected fairy tales set in a far off time. Thoughtful (maybe?) allegories behind those tales. Beautiful visuals and scenery. Yet, most everything else about this film is lacking. The pace, the connectedness, the depth, and the delivery... all leave the audience wondering ""why am I watching this?"". Sadly, at the end of the 2hr+ commitment, we've still not been given a good answer to that question, and what's left is a forgettable film that was a bit of a chore to make it through, but which had enough potential that it really could (and should) have been good, if not great."
" Adult fairytales.
",0.0,0.9836,2018-09-03 00:00:00,7,"Tale Of Tales tells three different stories based on fairytales by the Italian writer Giambattista Basile. Those are adult fairytales as there is some nudity and a tiny bit of gore. It's weird and sometimes absurd but it's entertaining and that's what it's all about when you watch a movie like this one. The cinematography was very good so for that alone it's worth a watch. The cast is a mixture of well known actors like Salma Hayek, Vincent Cassel, Toby Jones and John C. Reilly, and lesser known but not lesser talented like the twin brothers Christian and Jonah Lees. It's an easy movie to watch, not complicated at all, with strange creatures as almost all fairytales have. I agree that it could have been better but for the amateurs of this genre it's a good movie."
