title,title_sentiment_score,text_sentiment_score,date,rating,review
" Package is pretty, very little substance inside
",0.4939,0.9953,2017-06-08 00:00:00,4,"2 minutes of silence for those who are comparing it to Mughal-e- azam. People who are calling it a masterpiece, are either paid or just simply retarded. While I do believe it is visually stunning, (like any other Sanjay Leela Bhansali film), but we cannot keep praising someone just for his cinematography. Story is the main thing a man comes to watch at a movie theater and when there's none, it becomes lack-lustrous, boring and yawn-worthy. In this matter, Bhansali is way too overrated. His films lack story. This movie was as disappointing as his previous project, Ram-Leela.The four stars I have given in my rating are this way: 1. Priyanka Chopra's performance: She is the show-stealer. She kept her acting well confined and let the lead actors shine. And that is her power. She out-shined all the other actors within her small screen presence, or shall I say, strong screen presence.2. Ranveer Singh's performance: Well he is a star. His acting is at par with any great actor you name, be it SRK, Aamir Khan, or even Big B. His acting was so top-notch that you really wonder if you are watching a real person. He gave Bajirao a real persona, a style which shall be mimic in the future and develop a cult status. His dialogue delivery was so sharp, you see it not only in his words but in his eyes. It is not easy to express pain with a smiling face. Huge applause to Ranveer for portraying the complexities of Bajirao with such precision.3. Cinematography: The cinematography is as always epic. No wonder every scene looks like an oil painting. Every frame looks like an oil painting. Too much research had been done to find the swords, chandeliers, wall paints and backgrounds. The way they brought them together was really stunning. But then if I compare it to Devdas, Black, Saawariya, I felt the cinematography to be a little dull. 4. Catching-off guard: There are a few scenes which will catch you off guard. Suddenly a laughing-out-loud Bajirao will stop laughing while others (who thought the joke was funny) will stand in awkward silence. Suddenly Kashibai will change the topic and a smiling face will utter the most tormenting lines. This kind of unpredictability was classy. It is a welcome change in Indian cinema and it sure paves the way for better content writing. What turned me off:1. Story telling/Screenplay and Editing: The editing was blasphemous and so was the story-telling. How could you do this to a movie like that? It looked more like a TV serial with random slow-motions and forced ""tashion"" on the lead characters. The continuations were so obvious that I began yawning even before the interval. y.2. Deepika's performance: Woah. After watching this movie I came up with this big realization, Deepika is highly overrated. She may become the greatest actress in future but as of now, she is just a pair of two big eyes and a pretty face. Her dialogue delivery is a killjoy. I pondered on the dialogues given to her. The dialogue writer must be pulling his hair off every time Deepika opened her mouth. I have never been so disappointed with a leading actress before. She was so not suitable for the role of Mastani. Had it been given to Priyanka, she would have pulled it off like a pro. 3. Music: Music was dull! Hands down. Only ""Aayat"" was heart touching.It would have been great if Aayat was kept as main score. But anyways, Bollywood cannot live without including 5 silly tracks in their movies so sin forgiven.The above faults are double turnoffs and hence I am deducting 2 stars each. This film could have been better, if:***spoilers ahead***>>There had been more sexual tension between Bajirao and Mastani. When he heals her wound with his dagger, the awkward hug was unnecessary. Had it been a close control-yourself-from-touching-a- man kinda encounter, like she holding his collar instead of embracing him, would have been far sexier. >> There should have been more importance given to Kashi. Kashibai sees Rao and Mastani embracing each other after she informs Bajirao about the upcoming attack on her and thus helps him save Mastani. At that moment instead of letting her come running and return with an awkward face, they should have let Kashi stand behind the door and watch Rao saving Mastani. The eye-contact between the two, with Rao's gratefulness and Kashi's selflessness would have had more impact. Overall, this movie is a one time watch. There is nothing memorable apart from the acting of Ranveer and Priyanka. If you have no serious job then maybe this movie is for you. Otherwise, save your precious time."
" Masterpiece!
",0.6588,0.9847,2017-05-01 00:00:00,9,"The film filled up with emotions, a good story line, good performances(especially RANVEER), fantastic sets and a well handled direction. I'm thankful to Sir Sanjay Leela Bhansali for making this epic. The first half is a bit slower but the second half is pretty much better. Loved it, a must watch film for me. Once again I thank Mr. Bhansali for making such a wonderful film"
" Worse than Manos the hands of fate. A bad spoof of 300 n troy.
",-0.765,0.743,2017-01-26 00:00:00,1,"In the early 18th century, the court of Maratha King, Chhattrapati Shahu (Mahesh Manjrekar) needs a new Peshwa, the equivalent of a modern-day prime minister. In spite of Shripad Rao's (Aditya Pancholi) self- nomination as the Pant Pratinidhi, Ambaji Pant (Milind Soman) chooses to nominate a young Bajirao (Ranveer Singh). To test his spiritual wisdom and knowledge of weaponry, Shripad challenges Bajirao to split a peacock feather with an arrow. Bajirao succeeds and is given the title of Shrimant Peshwa. Ten years later, his wife Kashibai (Priyanka Chopra) is visited by her widowed friend Bhanu (Snehlata Girish Vasaikar), whose husband was accused of spying and hence was ordered to be executed by Bajirao. She bitterly forebodes that just like she longs for her husband, Kashi, too, will yearn for Bajirao.While traveling to Sironja, an emissary from Bundelkhand infiltrates Bajirao's tent and demands his help in fighting invaders. She reveals herself to be Mastani (Deepika Padukone), the daughter of the Hindu Rajput King, Chhatrasal (Benjamin Gilani) and his Muslim Persian consort, 'Ruhani Bai'. Impressed by her skills as a warrior, Bajirao assists her with his army and defeats the invaders. Chhatrasal is overjoyed and insists that Bajirao spend Holi with them. Mastani and Bajirao develop feelings for each other and he gifts her his dagger, which is a symbol of marriage among the Bundelkhand Rajputs. He soon departs for Pune, where Kashi greets him with a tour of their newly-built Shaniwar Wada and shows him the Aaina Mahal (hall of mirrors) which allows her to see him from her room."
" A magnificent movie
",0.5994,0.9991,2017-01-24 00:00:00,8,"True to Bhansali's signature style, this epic love saga, touted as his magnum opus is opulent, dreamy & magnificent. Lavish palaces, mirrored chambers, glittering chandeliers, royal robes & dazzling jewelry â€“ Bajirao Mastani is a richly woven historical tapestry of romance, passion, hatred & conspiracy, all of it veiled in a tantalizing enigma. The film unfolds like an unexplored fable of love between the legendary Maratha general Peshwa Bajirao I & the ethereal half- Muslim princess Mastani. As Rao engages in battles against the Mughals for Chhatrapati Shahu, he is approached by the beautiful Mastani who requests protection for Bundelkhand. In the process, they fall in love. But how will Rao's first wife Kashibai react to this? Will Bajirao's family accept Mastani as his wife & not concubine? Can their love overcome the rigid social barriers & emerge victorious in this battle against the state, family & age-old traditions? Owing to few glitches here and there, Bajirao Mastani falls short of being a masterpiece but it is definitely the perfect tribute to the chivalrous warrior, his gutsy Mastani & the selfless Kashibai. From Bajirao and Mastani's undying passion for each other that transcends all social barriers to their unfulfilled dream of togetherness to Kashibai's unrequited love, everything was beautifully scripted and brought to life by poignant performances. Also, unlike Jodha Akbar, Bajirao Mastani doesn't overlook uncomfortable issues like male infidelity as we see Kashibai questioning Mastani about the reliability of Bajirao's heart. One must also applaud the film's respectable and realistic approach to the issue of bigamy. It doesn't glorify or demean any character to justify its theme. Nor does it give a romanticized version of Bajirao; he is a great warrior & a good man but not without flaws. The triumph of the film's characterization lies in the fact that we feel compelled to empathize even with those who oppose the love story. Whether it is Bajirao or Mastani or Kashi or Ma Saheb, everyone has his or her own reasons and we can clearly see the conflict of head and heart simmering in their eyes. Scenes like Kashi destroying the curtain that reflects the events in Aina Mahal and Bajirao's letter to Mastani stating that Kashibai is both his wife and friend and deserves to know everything stand out. The film's cinematography is absolutely outstanding. Bhansali peppers it beautifully with his rich & fairly well informed vision of the 18th century India. Replete with complex war scenes, panoramic action sequences, enthralling songs, though-provoking dialogues & continuous interplay of light & shade coupled with the clamour of swords & tinkling of anklets â€“ Bajirao Mastani is a complete audio visual treat. Speaking of the performances, Ranveer Singh nails it as Bajirao. From a proud Maratha general to an intoxicated lover guilty of cheating his wife, Singh breathes life into the character. The forever stunning Deepika Padukone lights up the screen as the fiery Mastani who disregards all social norms and believes in writing her own destiny. But somewhere, the intensity in her character is missing & she fails to create an impact. Her style of speech becomes monotonous after a time. Also, the full-blown passion of this pair is missing from the picture. It is Priyanka Chopra who takes the cake here. Her Kashi is grace personified. The transformation from the innocent, vivacious & loving wife to a more mature, muted yet strong lady is flawless. She portrays Kashi's inner turmoil with Ã©lan & conveys the quiet sorrow of a wife & friend forgotten. The supporting cast has also done a fabulous job â€“ supremely good Tanvi Azmi (as Radhabai), intense Vaibhav (as brother Chimaji) & restrained Milind Soman (as the faithful Ambaji) were a treat to watch. Though the story ends on a tragic note & the ending could have been more authentic and less dramatized (as far as Mastani's death is concerned), it is surely one of the most well scripted scenes in the film. Bajirao, hallucinating under fever, sees forces charging at him in the river. He wages his own war & goes into the water swinging his sword . He says his opponent is 'bhagwanÂ… kismat' thus signifying his lost battle with his fate, family & the custodians of religion. From Rao's slow descent into madness to Kashi watching him helplessly to Mastani's failed attempts at freeing herself from the chains that bind her, you can feel their loss, pain & grief. As the sun sets and the rain pours down, it draws the curtain on a 300-year old tale of love 'jiska zikr na kabhi itihas mein hua na kabhi woh udharan bani'. No running across green meadows, no car chase, no item numbers â€“ Bajirao Mastani takes you to a new world full of untasted delights and does complete justice to its theme 'every religion teaches love but love has no religion and is a religion in itself'."
