title,title_sentiment_score,text_sentiment_score,date,rating,review
" Shame on Bollywood !
",-0.5255,0.7601,2021-03-25 00:00:00,1,"Peshwa Bajirao was one of the legendary ultimate warrior and statesman that India has ever seen. He was not only intelligent in terms of political wisdom, but also highly skilled in terms of warfare. He was a warrior that not even the likes of Aurangzeb and Akbar could match in terms of intellect and battlefield supremacy.This film makes a mockery of his life and tries to depict him as a broken lover. It makes the viewer believe that Bajirao's story starts and ends with Mastani.Shri Chimaji Appa Rao was his his faithful brother and accomplice, and certainly not the jealous, insensitive courtier as shown in Sanjay Leela Bhansali's movie."
" Watta!
",0.0,0.7425,2021-01-28 00:00:00,10,"Fantastic movie, must watch. I am very excited after watching this movie. Ranveer Singh, Deepika Padukone, priyanka chopra omg all were mind blowing."
" Marvelous storytelling, great acting , mesmerizing visuals
",0.8402,0.6249,2020-12-18 00:00:00,10,"One of finest bollywood movies I have ever watch.
Masterpiece of Bhansali."
" A historical journey
",0.0,0.9945,2020-08-28 00:00:00,10,These moive turned to be a milestone in the history of indian cinema. The way the moive is been put keep u on track of the history but at the same time the actor keep u engaged in there love story. The chemistry of the actor is really awesome. When it comes to locations I will surely give them 10 /10 because they really take u to the maratha era and u can even see the finest detailing done. The best and the whole way why the pic hold up strong is there script and dailogue they are very prefectly framed and very well spoken. The picture will never bore you and you can surely watch it multiple times.A great moive to watch on a nice chilled afternoon
" powerful dialogues!! acting!!
",0.6083,0.0,2020-08-05 00:00:00,9,Ranveer nailed it..deepika and priyanka both are livin the character
" One of the best movie of Bollywood
",0.6369,0.8122,2020-07-30 00:00:00,9,Cinematography is awesome in this movie which made it epic. Acting and starcast was fab!
" Respects its disclaimer more than history!
",0.3802,0.1335,2020-07-08 00:00:00,6,"Making a film on History,Action & Romance is different than making a film on Fantasy,drama & romance,the makers should get this thing correct before misleading the viewers.
The very beginning moments of the film boast of a grand canvas & visuals and keeps the story going right yet the details in battle formations & tactics were little taken care of.The storytelling gets interrupted after the first half an hour as songs start reeling one after the other as if it's a showcase of dance choreography than Bajirao's history.In doing so,the runtime stretches itself to almost 170 minutes for a story that can barely last 2 hrs.However what's worth appreciating is Ranveer Singh's performance,the dialogues & decent enough direction.Post interval,as the story tries to build up quite a bit it's again ruined by the final 30 minutes of the film.The last battle scene shows Bajirao racing away with a horse out of sheer rage towards his enemies constantly dodging hundreds of arrows,thereby showing how much less attention was given to the Action choreography in the film.Further in the film's concluding moments, history witnesses it's lines being blurred away into Bhansali's fantasy books.
If someone desperately wants to see the film,they can watch it for good visuals,Ranveer's commendable performance, historical romance and some lack a brain entertainment & actions, skipping it would be any day a wiser choice."
" Watch it just connect to lyrics of the each song which is a Marvel in itself
",0.4215,0.9836,2020-06-03 00:00:00,9,"No wonder Bansali spent 10 years on this movie. It is just a grand expression of his immense creativity. I have read that it all began with marathi phrase in ""Deewani Mastani"" song which was composed 10 years ahead of release of the movie.
I truely believe if you need to make something marvelous you must just keep it close to your heart like a child and sprinkle it with love like creativity each day a little more. All of this effort of Bansali sir has bared fruits in this movie and is a wonder to experience in its true sense. I love each every line of all songs as the are filled with meaning and are interlocked strongly with emotions depicted in the movie. Especially, ""Ab Tohe Jaane Naa Doongi"" having a line ""Ek hain mannat, ek hain dua"", ""Daaye se padhe ya baaye se padh, arsh se farsh tak ishq hain likha"" Translation : You may read from left(as in urdu literature) or you may read from right (Sanskrit literature). Either you can look at sky(as in namaaz) or you could bow down (as in hindu custom) both are just one and the same.
Thanks to Sanjay Bhansali, Ranveer Singh, Priyanka Chopra, Deepika Padukone and others for making this wonder possible in Indian Cinema."
" Typical Bhansali Massacre.
",0.0,-0.8483,2020-06-01 00:00:00,5,"I saw Padmaavat and thought it was the best film I saw that year. Then peope started saying watch Bajirao Mastani and see what he has done with this film. I was a bit hopeful of a decent plot. I saw it last night with my wife at home and I found the whole thing ridiculous, predictable. You see - Bhansali's idea of love and romance in films is quite typical. This reminded me of Ram Leela and Devdas - both are painful films to watch. The acting talents of Ranveer and Deepika could not save this ship from sinking. There are several exaggerations made but that is not the issue. The story is quite poor, the songs and dances are great - but like many historical films this made me question why I am spending 150 minutes on it. I am leaving 5 stars because of the sets, the song dances and the modicum of decency maintained by Ranveer. The last 45 minutes should have been deleted. 53 minutes into the film I thought about how bad the timing of the film is. I never call a film slow and so I won't call it slow. It was painfully bad. Watch at your own peril and watch if you are a student of film."
" Great
",0.6249,0.7902,2020-02-23 00:00:00,9,"Bollywood reached its cinematic greatness in Bajirao. The sequence, the camera work and story telling at its best. All the actors' performance were notable. Very well put together. Bajirao Mastani just set new standards in Bollywood industry. Nothing recent comes close."
" For his country, he won all his battle.For his lover, he lost even he himself.
",0.7351,0.8252,2020-01-26 00:00:00,8,"Recommended by my dear friend, i share the same view that it is worth watching though i regard Baahuobali's more attractive. Weakly based on history, Bhansali told the Maratha famous story well still, or at least, it depict it completely and offer us the outside audience a chance to know Indian history, religions and legend.
Besides, since love is a theme being ceaselessly written, discussed, screened and extolled, lover's fight against religion, however, is rare and personally, may be the first topic-related movie(may be even 'work') i have watched. Therefore, while watching, many questions occured to me, like why they cannot marry? Was it because of fearing of being tarnished? but i have also heared that it is allowed that lower caste womam marry higher caste man provided that she brought with herself abundant money, or because it is the very existence of such tragedies alike in indian history that gradually the traditional view evolved?(Hope there is no offence word or potential of offencing meaning out of my ignorance of indian culture).So here comes my suggestion that itcan be better if more religious description being added.
Apart from the film content itself, i also wonder to know is it true that love can be so powerful that a woman would be empowered to forgo everything only to marry her lover and if so, why( i expect an answer combined with the background )?(And if is so, then i would pity myself, as sb said that it is the person without love most pitifulðŸ™ƒ for i even don't believe it nowðŸ™ƒ)
Conclusion, i enjoyed this movie as i expected, so i would like to recommend it to others who'd interested in Indian epic/love legend/war topic-related movie.
p.s i really disgust Bajirao's mother the kind of person, oh how much hatred and pity i hold for her. Ignorant, self-serving and firmly thinking herself being smart and right, she was a victim of traditional ideology without self-knowing and soul-searching conscious! If she was a little more kind, then my hatred toward this character can be mitigated, however, what a pity. so this film remind me sth different, Bhansali said he want to explore the difference in history, actually he showed us the similarity thoughout history, ignorance and evil never decease.
p.s 2, like my topic, Bajrao won all his battle for his country, butfor his lover, he can do nothing, can i deem this as a defeat of being a man?what's man's opinion toward this kind of defeat(discuss within movie content)?"
" kashibai the epic saga
",0.0,0.0,2019-12-27 00:00:00,9,Come on just go and gaze into her eyes .u will understand
" Distorting History for Romance
",0.3612,-0.5719,2019-11-24 00:00:00,4,"Mastani as shown in the movie wasn't a Princess nor anywhere close she was a Slave girl, as bought and sold in 18th Century. She was Head of Harem of Bajirao Peshwa, which is located near Pune.... all facts are disorted in the movie just for the sake of Romance.... She also had relations with Bajirao's Brother Chimanji, an was centre to many conspiracies concerning Peshwa family... Hence ultimately executed. Pathetic Movie, so much fuzz for nothing.."
" An undefeated hero becomes Devdas in Bhansali Movie
",0.5574,0.6249,2019-11-10 00:00:00,1,"Bhansali also shows wrong things in his movies, only love he shows, no reality...He made Bajirao a Devdas...funny...and Indians watch and say, what a love story...hehehe..."
" Lovely visuals, not so great script.
",-0.0871,-0.6808,2019-09-03 00:00:00,4,"The cinematography and choreography were beautiful, just lovely. The main actresses were wonderful. But the story itself was a waste of time; boring and long-winded with a cheesy, ridiculous ending that made no sense. The movie was too long and didn't give any payoff for all the time I spent watching it. The one thing I gained from this movie is having the ""Pinga"" song stuck in my head forever."
" Bhansali did it!!!
",0.0,0.8316,2019-08-11 00:00:00,8,"Sanjay Leela Bhansali's magnum opus film..great directing ,Cinematography..
Great performance by Ranveer Singh,Priyanka chopra.
A nearly perfect film.â¤"
" Absolute masterclass
",0.0,0.8316,2019-06-23 00:00:00,9,"Sanjay Leela Bhansali will a director to remember, whenever there will be mention of Indian history classics..he is a gem of perfection.
Bajirao Mastani is yet another compilation of superb acting,music, screenplay, dialogues,cinematography and directions."
" Hindu propaganda
",-0.25,0.9011,2019-06-05 00:00:00,1,"Hindu oriented movie with parhetic pride over cast etc. It says in the beginning it's not historically accurate but that's exactly why it's interesting to see how the portray Muslims in this movie and other so-called historically inspired but not so accurate movies.
The new India is trying to undermine it's historical Islamic facts and are now making fantasy where Hindus are fighters and brave.
But fantasy will be fantasy."
" Great story
",0.6249,0.9201,2019-04-21 00:00:00,10,The great story with the beauty and acting of Deepika Padukone makes it one of the best movies of all time.
" The pictures are still good
",0.4404,0.6808,2019-02-18 00:00:00,6,"The pictures are still good. The colors, accessories and scenes are in place. Both hostesses have high facial values. It's just that I really don't catch a cold about stories."
" a historical epic- elegant and wholehearted.
",0.4767,0.9842,2019-02-09 00:00:00,9,"Sanjay Leela Bhansali is a master of directing and presents a non-traditional love story through absolutely phenomenal cinematography with well crafted camera angles and movements, beautiful sets, catchy and beautiful songs, amazing use of colour, beautiful costumes, and to finish it all off: a great cast. The film makes you wonder what is the love story and what is the tragedy. You might not love the ending and you might not completely understand the love story, but you will fall in love with the absolute beauty on screen"
" Overflow of color
",0.0,0.9911,2019-01-15 00:00:00,10,"Following the advise of a non-Indian cinefile, and after a look at the trailer, I gave this a try and I was certainly rewarded.
It is certainly not worth an objective 10, however I only mark 1, 5 or 10.Despite the at times mediocre Cgi the overall production values are extremely good. The director amuses himself and us with many symmetrical images of impressive settings combined with Cgi backrounds to make dreamlike results. Same goes for the costumes.The acting of the male protagonist seemed to follow a local perception of a wannabe idolized character, who must look awesome and kickass at any time. What might seem locally awesome, would mostly annoy or have a giggle effect to western audiences. Only at the end of the lengthy 3hours the actor shows some qualities.
On the other hand, the triangle wife, mother, lover characters and actrices excell and pull the strings of the entire movie.The bollywood traditional inclusion of dancing parts is connected to the scipt with good transitions and will not seem ackward at all.Despite certain flaws and apparent influences from western film making, the overall product is highly entertaining despite its length. In addition, it is a quite accurate adaptation of historical events"
" Watching for Ranveer
",0.0,0.5267,2018-12-18 00:00:00,10,Ranveer Singh is one of his kind ...Brilliant actor
" BAJIRAO MASTANI
",0.0,0.2023,2018-12-14 00:00:00,10,"MR AND MRS SMITH
RATED TEN ON TEN
Sudden death is the term used for reformers coming to give us health and wealth like with PIECES OF STAINED GLASS or jumping from a high roof because her boyfriend had issue."
" Majestic and beautiful
",0.5994,0.9217,2018-11-27 00:00:00,8,"SLB shows his magic through this movie. Deepika, Ranveer, Priyanka are absolute perfectionists when it comes to acting. Cinematography is great. Costumes and sets in the movie deserve a special praise. Overall, the movie is a visual treat."
" Amazing film
",0.5859,0.8834,2018-10-25 00:00:00,9,I like every single detail in this film the music is awesome the decorations the clothes everything is perfect
" Favorite movie of 2015
",0.4588,0.5719,2018-09-24 00:00:00,9,This movie is everything. It's just perfect to me. The chemistry between Deepika Padukone &Ranveer Singh is ðŸ”¥ ðŸ”¥ ðŸ”¥ ðŸ”¥
" Blockbuster
",0.5994,0.9062,2018-09-22 00:00:00,9,"Brilliant soundtrack, dance, action. Perfect storyline, classical views, acting, dialog delivery amazing."
" MUST WATCH!
",0.0,0.6124,2018-08-26 00:00:00,8,I don't usually watch bollywood movies but this defo is a must watch :)
" Exceptional movie
",0.0,0.875,2018-07-24 00:00:00,10,"Great movie that is paced well (not too slow, and not too fast). The main actors were amazing."
" Beautiful and grand, great acting
",0.9001,0.9811,2018-07-12 00:00:00,7,"Bajirao Mastani follows the story of warlord Bajirao (Ranveer Singh) and princess Mastani (Deepika Padukone) as they fall in love against their own better judgment and the wishes of those around them. Many people are against their relationship, not only because of their different religions, but also because Bajirao is already married to Kashibai (Priyanka Chopra).This movie is one of the most beautiful movies I have ever seen. Every single shot is visually rich with beautiful set design, cinematography, colour pallettes and costumes. (Some of the CGI isn't very convincing, though.) Only for this I would already recommend people to watch it.
The movie's soundtrack is magnificent too; especially the song Deewani Mastani is a personal favourite of mine. Although I didn't like all of it, it has got nice melodies and is very rhythmic.What I disliked in the movie is (although I hate to admit it) how boring it got. In the first act, there is conflict and good pacing in the story, but in the second act it feels like the story is just meandering towards its ending. Any touching moments felt unearned because it was hard for me to stay invested in the story.
Also, they barely age even though the story takes place over 15 years or something?Nevertheless, Bajirao Mastani is a beautiful and touching movie, and I recommend people to watch it."
" A perfect masterpiece on all levels
",0.8316,0.9965,2018-04-29 00:00:00,10,"This movie is the one that I want to see over and over again without feeling bored. The story is perfectly established, keeps getting interesting through all parts. It deals with romance yet not dull, about war but not filled with actions, and historical but not boring. Acting is attractively beautiful, very professional, very precise when it comes to emotional or action parts. There are almost no spices in this movie, so much less than what one would expect. Directing is better than perfect, even the three or four songs within the movie are so beautiful, very enthusiastic, and very well directed. I know I am using a lot of ""very good"" and ""so beautiful"" words, but the movie deserves even more. This movie is one of the best (if not The Best) movies of its category. I am really seeking to learn Hindi language because of this very movie. I strongly advice watching it."
" Not as much music and dance as you might have wanted
",0.0,0.9987,2018-04-20 00:00:00,7,"But it's such a lovely movie. I went into it because I saw a video that was just Malhari and I thought the dancing, costumes and set was stunning in that scene, so I wanted to watch the entire movie. 
There were only about 4 dance sets in it? And Malhari was far and above the best. I really was hoping for more because the choreography was so great, but I still found myself engrossed in the movie despite that. The story is objectively ridiculous and ignores a lot of socio-cultural issues of the time in favor of keeping the questionable romance in the limelight, but you don't go into Bollywood for that kind of critique. It's a fun story told in a fun and visually stunning manner, with a great leading cast, and if you just suspend disbelief for what, 3 hours? Then you'll have a great time. So yeah, I wish there were more music numbers, but the soundtrack was still great even in the background and I'm really glad I watched it. (I enjoyed it like it was worth more stars, but I rate movies objectively, and there were a lot of flaws that I could easily ignore but still make me unable to rate it up there with the best of the best. )"
" aha re
",0.0,-0.5994,2018-03-20 00:00:00,5,What a stunning story got murdered by the screenplay writer and actors . Remorse.
" Tiresome
",0.0,0.5267,2018-03-07 00:00:00,3,"BAJIRAO MASTANI is an epic-length Bollywood historical romance guaranteed to test the patience of any viewer. It tells of a sappy and long-winded romance between two rival characters: the hero of the hour is tough-guy Bajirao, the heroine a similarly tough warrior princess called Mastani. They do hook up but not before a lot of songs have been sung and cheesy CGI-augmented battle scenes have played out. I found the whole film to be completely underwhelming, made in a flashy and superficial style that prevented me from getting close to any of the characters. The leads in this film dress gaudily and have bizarre facial decorations which I also found more than a little off-putting. With a running time in excess of two and a half hours I found this extremely tiresome."
" A Lavish Disappointment
",-0.5106,-0.0258,2018-02-18 00:00:00,6,"A quality period drama film with lavish sets. The film manages to hold audience attention, however, the ending leaves much to be desired. Battle scenes used CGI and looked artificial. Some good dialogues & performances by Ranvir, Deepika & Priyanka is probably drawing the crowds. A pain to sit through and a benchmark for lavish failures. And to top it all, such garbage receives awards."
" A travesty of epic proportions.
",-0.5719,-0.9866,2017-11-12 00:00:00,1,"This film is both a costly epic and a fantasy turkey biography, not to mention a miserable n failed attempt at creating a story to overtake Romeo n Juliet n Mughal e Azam. Even at nearly 160 minutes long, this ponderous, talky, and melodramatic biopic fails to impress. The critics in India are just impressed with the sets and costumes.As one reviewer on IMDb rightly said about the mess. The director has no clue whether he is making a 17th century historical epic or a Rohit Shetty flick or a fantasy action epic or romantic melodrama or erotic poem here. Watch the scene with Priyanka. Straight outta Kamasutra.Every historical epic film will have a battle or action sequence. Well, this film has only two, one in the beginning n the other towards the end. But the worst part is not the less amount of battle sequences, it is the execution.
The cgi/sfx were poorly done as the graphics were looking fake. The battle sequences were laughable. It reduced the lead character into a fantasy super hero. The first scene copied straight outta 300 and Ong bk. The other battle sequence was more like a Rajnikant style. Thousands of arrows and the single hand defense tactic was a laugh out loud n wtf.This movie even fails as a historical fantasy. Mastani playing a mandolin. Hohoho. Mandolin existed in India during that time? A prime minister/military leader dancing with the infantry n cavalry. Hohoho. That is hilarious. The moves. Maybe the military leader was on Datura given to him by some godman.Wait, i forgot about the dialogues. Cheesy ones mate. Referring one another as vegetables n fruits is epic. That too, in Nana Patekars voice.The rest of the movie is dreadful, a clunker script delivered in a cluster of accents. The accents r silly. Nowhere do we get to see Bajirao or his first wife speak in the Marathi language.In short, this film is an agonizing experience in every category I can think of and others still waiting to be invented. This film is a bloated, overlong, and frankly boring epic. It is a rather slow because of the horrendous editing n at times tedious and soporific film that is far away from being great.There is a clear pattern to colour Islamic rulers as villains with no reference to any facts based on authentic sources of information, said Heeram Chaturvedi, head of department of history at Allahabad University.Distorting history is the new norm in Bollywood.One group is glorified while another vilified.Check out historical books from the British archives. Khilji wasn't barbaric. In fact, he was the most suave n sophisticated ruler. There was no such thing as India during that time. The so called freedom from invaders is a big hoax. Wars were fought merely on the basis of territory.Britishers abolished Sati n gave us education.Look where v r inspite of the so called freedom. The lower caste fellas r totally neglected, the minorities r lynched in broad daylight, female infanticide n female foeticide is rampant. Look at the matrimonial columns. Sick people in India still wants fair colored brides. Adivasis r robbed of their homes.Hate ethnocentric behavior n films. The most detrimental effects of ethnocentrism resulting into genocide, apartheid, slavery, and many violent conflicts. Historical examples of these negative effects of ethnocentrism are The Holocaust, the Crusades, the Trail of Tears, and the internment of Japanese Americans."
