title,title_sentiment_score,text_sentiment_score,date,rating,review
" just perfect
",0.5719,0.9349,2021-03-23 00:00:00,10,"I read this book not all that long ago, and when I saw the dvd was available I jumped at it. Then it arrived and I had fear in my stomach. What if they had ruined it? Film-makers do that all the time. Not this time, I'm happy to report, it's perfect and I wanted to keep watching it over and over. Perfectly cast, beautifully told and not a moment too short or too long. Love it."
" Emotional roller coaster
",0.1531,0.2244,2021-02-02 00:00:00,10,"We need to make more films such this one!
It is an emotional roller coaster that keeps you 111 minutes long."
" Love this movie
",0.6369,0.7568,2021-01-12 00:00:00,10,"One of my favorite! Soulful, funny, dramatic! When viewing it is not possible to break away"
" Look at the essence of things!
",0.0,0.9536,2020-12-15 00:00:00,7,"Look at the essence of things! I hear the director shouting from the first frame to the last. He has a method. He uses cliché situations of cinema to lead us to other interpretations of the characters and we must hold on and not get carried away and watch carefully. The first cliché is the orphan Ove and his strange quiet father. But it was his father who taught him to love. He hugged him with his actions. He was always there for him. His guardian angel. He was proud of him. He taught him to fight if there was a need. He taught him good and evil and to claim. He taught him to claim the most beautiful girl. He did not teach him to hide. Nor to be ashamed. And she just fell in love with him. It was evident from how he was looking for her on the train and how he fully supported her disability till the end. Ove finds it difficult to break free from his grief. And it's been 6 months since he lost her. He still mourns for his father. That's why he's stuck with Volvo. When he says Volvo he says, Dad. I will not go into further details. As for the last letter left, so the writer and director could play with us. Did he finally commit suicide? And all these previous attempts were attempts or guilt part of the mourning for the love he lost. And what about a life you live when it is full of love?"
" Sentimental and uderstated at the same time
",0.3182,0.7615,2020-11-29 00:00:00,8,"I sat to watch this movie because I wanted to see what the hyped book was about, I haven't read it. I was pleasantly surprised by strong acting and clever composition. All the ingredients were there, immigrants, gays, delinquent youth, old and ill, disabled persons and they were used as teaching moments, but it was ok, this is that kind of film. 21. century fairy tale for adults."
" Sweet, funny and sad...and destined to put a smile on your face.
",0.8126,0.9911,2020-11-03 00:00:00,9,"This Swedish comedy about a cantankerous man, old before his time and suicidal after losing his job but realising slowly that perhaps life, and people in general, aren't so bad after all, is a gem. It was nominated for the Best Foreign Language Film Oscar and deservedly so and it's certainly much better than the overrated and not dissimilar ""Toni Erdmann"" and as the older Ove, Rolf Lassgard is miraculously good, (we also get to meet him as a child and a much younger man). Of course, an American version would be hugely sentimental but the Swedes don't really do sentimentality and this is sweet, funny and sad. Any tears it draws, it draws honestly. It's also beautifully directed by Hannes Holm in a series of short scenes designed to show Ove's character and that of his neighbours and it's sure to put a very large smile on your face."
" Rewarding
",0.5267,0.8316,2020-10-17 00:00:00,8,A great book which has been transferred to the screen and works .. excellent movie
" 9.5/10 A touching and at the same time funny story about an evil old man.
",-0.3612,0.9893,2020-10-17 00:00:00,9,"Realy good swedish movie, thas tells beautiful old man's story. Idea it's not realy new, but well submitted. Very pleasant and interesting main character to which you feel from the first minutes of the film. Minor characters are also interesting. The actor in the lead role fit perfectly. The only thing you can find fault with is flashbacks, they had some plot holes. Camera work is unremarkable, and editing in places is clumsy. But watching a movie does not spoil it at all. Who likes the genre of comedy drama, the film must really like!"
" A triumph called Ove
",0.4767,0.9313,2020-09-13 00:00:00,8,Wonderful film that takes you through every emotion as we gradually learn more and more about Ove's past life. Perfect performance from Rolf Lassgard in the lead role with good support from Bahar Pas as one of Ove's new neighbours. A warm hearted and life affirming film based on a book by Fredrick Backman.
" 10
",0.0,0.9159,2020-08-25 00:00:00,10,"This film gets 10 from me because it actually moved me and not many films have done this.I know it is based after the book - which I have not read - but Scandinavian writers have become very popular last decade and many saw their books turned into films.So, I do not know if this is good representation of the book - but I think the film is very good"
" Love it!
",0.6696,0.9674,2020-08-23 00:00:00,10,"Was very doubtful in the beginning as it's categorised as a comedy and it was not that funny. Rather, it seemed miserable. But be patient. It turned out to be a wonderful heart-warming story with laughters and tears. The skill of story telling is superb. The pace is perfect, drawing you in the seemingly simple and yet complex development. A must watch. You won't regret it."
" Don't be put off by subtitles!
",0.0,0.6275,2020-08-18 00:00:00,10,Absolutely brilliant film..... sad and heartwarming at the same time!
" So emotional and funny.
",0.6195,0.9903,2020-08-16 00:00:00,9,"This is yet another Forrest Gump rip-off, but just like most of them it's amazing. This film is heavily emotional and features tons of great humor. It's a movie about life of a special man - Ove this time. Tons of great adventures and a great time with many life lessons guaranteed."
" Yes It was a nice Swedish Movie
",0.6705,0.6124,2020-07-20 00:00:00,8,I love it and it was a good movie with sad ending 😐 and also dont need to understand swedish 😊 to watch it.
" Watch it when you feel lost
",-0.3182,0.9115,2020-07-20 00:00:00,8,"I really love the storyline of this movie. Is from Ove down point to a upper point. After so many attempts, always a reason stop him, the turning point of this movie is awesome. And the last scene, is so beautiful.
Highly suggest watch it when you feeling lost."
" Enjoying
",0.5267,0.8828,2020-07-04 00:00:00,8,"It's very pleasant to watch. I have read the book and to be honest the director has done a decent job in portraying the novel. The way the story reveals is touching, easy to follow. Though some parts were not expressed as well as in the book, it's still a highly-recommended watch."
" Recovering human bonds in a touching and humorous way
",0.3818,0.9859,2020-07-02 00:00:00,8,"A 59-year-old Ove has become miserable after he lost his wife months ago. In despair, he tries to take his own life, but it is interrupted by the neighbors over and over again.Even though he is unreasonably taking it out on others, you will somehow like him from the beginning. He is a self-made man with a sturdy body, maverick and dignified, resentful of bureaucracy, and no doubt in deep grief over the loss.He becomes acquainted with a new neighbor Parvaneh, an Iranian immigrant, pregnant wife next door. She has a lot of things that she needs help with. She dosn't have DIY tools, she has two kids to take care of, and she can't drive a car. It's funny that when Ove is trying to die, Parvaneh keeps pestering him for help. It's funny and heartwarming how he finds reasons not to die.In flashback scenes we see his earlier life. But I don't think the past part is as good as the present part. When he is young, it must be in the 70s, but the scenes do not look like that. And some events are too dramatic to take seriously.Back in the present, he finds people who need help other than Parvaneh. Some are minorities of some kinds. And through helping him, always reluctantly though, he is recovering his trust in people. I also like the tranquiel atmosphere in the neighborhood where we see human bonds are becoming restored in a touching and humorous way."
" Full of sadness & tragedy
",-0.8074,-0.7537,2020-06-30 00:00:00,5,"If like your movies to keep adding sadness & tragedy as they go on, this is the one for you! Why anyone would write this, let alone make a film of it, is beyond me. If I want sadness & tragedy I can read the news about Climate Change. For a movie, I'd like to entertained.Yes there are a few lighter moments, but essentially it's a total downer."
" Overrated
",0.0,-0.2498,2020-06-14 00:00:00,4,"Melodramatic score. No depth. A bit slow paced, takes 45 min before stuff happens. Rolf Lassgård is ok, but the character is without any surprises."
" Ove's recipe how to change yourself.
",0.0,0.4601,2020-06-10 00:00:00,7,"This movie was an adaptation of the book ""The Man Called Ove"". I both read the book and watched the movie. I can't say I liked them but it's the case when you can say that you something could learn from that. I mean I noticed and observed a lot of things from this creation that could help me understand myself better or even to become a better person. I'm gonna write my review considering both the book and the movie. Btw, I have to say that the movie was made pretty close to the script of the book. It's a story of a man who lost his wife at the beginning of his sixties. The man called Ove and he decides to commit suicide because he doesn't see any sense of life without his wife. But all the time he tries to do that he was interrupted by his new neighbor, a young Persian woman who was pregnant. And between all these interruptions we're shown the moments from his past. So we're learning how he met his wife, whose name was Sonja, many details of their relationship. Once they had a road accident and due to that his wife becomes disabled and she couldn't walk anymore. In the book, the author says that Ove never had lived before he met his wife so after she had passed away Ove died inside again. You know, the author of the book tried to show Ove like a man who doesn't like to talk but rather prone to do. So he was a man of deeds but not words. Also, we're shown that Ove is addicted to rules. He always puts rules above people. His wife was an educated person unlike her, Ove never read a book. Besides being a quite educated person, Sonja was a beautiful woman who can choose any man. But for some reason she chose Ove. The author says that she chose him because he had looked at her like no one before, that she saw at him something real and sincere though Ove almost had never spoken. He spoke only when he needed to complain or whine about somebody or something that had broken some of his rules. As we can see he was kind of a bore. And he had nothing in common with his wife. I think that Sonja, like the majority of women, chose him just because she wanted to have by her side a responsible and reliable man. It always seems safe. Is it right? I think it's a matter of personal choice. So finally, the meeting of Ove with his Persian neighbor fully changed his life. He started to pay attention to the people around him and he changed his mind to commit suicide. So in summing up, I want to say that Ove, of course, couldn't be a role model, but at the same time, you could find some of Ove character traits in yourself, and then you could use the Ove's recipe how to change yourself."
" Very Different
",0.0,0.6704,2020-05-30 00:00:00,7,"I read the book before watching the movie and I liked some of the changes that were made for this movie, because the book was long and a little repetitive. And even though the movie gave us a proper ending, I would've liked to see Ove live out another four years of his life with people who loved him before he passed on. This made the movie seem a little incomplete to me. Next, I didn't like the pacing of the movie and it was like they quickly rushed towards the ending. However, this problem also exists in the book - but not as bad as the movie - so the screenwriters probably got the idea to rush through it from there."
" Outstanding Film
",0.6124,0.9827,2020-05-12 00:00:00,9,"Watched this based on the some reviews I like to watch different international films
It was a great experience it takes you through all the emotions joy,anger, sadness
The main lead Rolf Lassgård gave a great performance on the outside looked cranky and without empathy but through the film we see the true character and he had a big heart the rest of the cast were very good and you really cared about the characters
The direction is top notch and visually looks great
I would highly recommend"
" Great adaption of the book
",0.6249,0.9741,2020-05-06 00:00:00,9,Read the novel. This is well done representation of the book. Excellent acting and artistic style to unfold the story behind Ove. Highly recommend this to anyone who wants to see what dedicated marriage looks like as well as the devotion a husband has for his wife. Loved it!
" Art knows no borders, and as an Iranian, I am proud of Ms. Pars's brilliant acting
",0.6908,0.8313,2020-04-11 00:00:00,9,"Hi, I'm Iranian and I really liked Ms. Bahar Pars' game. We Iranians are warm-blooded human beings. Art knows no borders and I am proud of Ms. Pars' brilliant acting"
" Entertaining,okay...
",0.0,-0.2896,2020-03-26 00:00:00,6,"I wish it was just a nice Feel good movie. Unfortunately, I find it too hard to believe that such a bad-tempered old geezer gets so many chances with his fellow men. It would be more likely that his environment would have decided long ago that if he doesn't want to, he should leave it alone. As mentioned, entertaining, but far away from reality, ´too much´, too bad. Less would have been more."
" Pure Excellence
",0.6249,0.6425,2020-03-17 00:00:00,10,"A deeply human, heart warming story .
It makes you want to give Ove a big hug!
Don t miss it!"
" We are alive with our loved ones
",0.7579,0.5923,2019-10-10 00:00:00,7,"This move clearly shows us what is the most important elements of life. Without our loved ones, and people around us, the life does not have any meaning. The Persian family helped Ove to connect with others and enjoy his life."
" Good movie
",0.4404,0.8126,2019-09-23 00:00:00,8,"The man named Over is cranky, stubborn and weird, but he is also kind, sweet and romantic. He is always angry at people, but always help them when needed. He is lonely and depressed, but he also loves with all his heart for his whole life."
" Despite sentimental diversions, this tale of a wily curmudgeon has occasional moments of genuine pathos
",-0.2411,-0.9964,2019-09-06 00:00:00,6,"Released in 2016, A Man Called Ove was the Swedish entry for Best Foreign Language Film at the Academy Awards in 2017. Directed by Hannes Holm, it's based on Fredrik Backman's 2012 book of the same name. Rolf Lassgård plays Ove, a curmudgeon in his 60s, the former president of a neighborhood association of townhouses in a Swedish suburb.
The film is a drama with occasional comic moments. Despite patrolling the neighborhood with gusto, constantly looking for transgressors who break the rules (including driving one's car too fast through the development), Ove is actually quite depressed (chiefly linked to the death of his wife six months earlier and more recent loss of his long time job as an engineer).
Each time Ove attempts to commit suicide (whether it's by hanging or asphyxiating himself by turning on the exhaust in his car for example), he's invariably interrupted by others who seek his help. His principal savior is Parvaneh,, an Iranian immigrant who's just moved in next door with her Swedish husband and two young children. She eventually gets Ove to open up after requesting favors of him including asking him to teach her how to drive and also babysit her kids.
Ove the film manages to have a big heart but eventually devolves into sentimentality. It's fairly predictable that the gruff Ove eventually will be able to let out his emotions, aided by Parvaneh, who makes him see that trying to kill himself is a bad idea, especially because he's someone who has much to offer.
The story also chronicles Ove's earlier life in a series of flashbacks-how he lost his mother as a young child and was close to his father who taught him how to repair car engines (one of Ove's life-long interests). Tragedy strikes a second time (the first being the death of his mother), when his father is hit by a passing train while on the job.
The third devastating tragedy is that his schoolteacher wife ends up paralyzed after their tour bus overturns on a vacation trip to Spain. Ida Engvoll is wonderful as Ove's young wife Sonja but has little to do in the part, which appears chiefly designed to evoke additional tears from an audience already inundated with a veritable heaping tablespoon of tragedy.
Ove's good character is made clear when he grudgingly helps others, which (in addition to his next door neighbor) also includes a friend of Sonja's former student who needs a place to stay after he reveals he's gay and is promptly kicked out of the house by an intolerant father.
Ove also saves a man who faints and falls on the train tracks. This leads to the resolution of the second act crisis, where Rune, Ove's rival, who took over as neighborhood association president, but is now semi-comatose after a stroke, is about to be put in a nursing home (against his wife's wishes), by ""whiteshirts"" (Ove's terms for heartless bureaucrats). A reporter who unsuccessfully attempts to interview Ove after he saved the man at the train station, ends up exposing the whiteshirts for some kind of real estate scam, and they back off sending Rune away.
The sentimental treatment of the handicapped Rune is coupled with additional comic asides which also don't work well at all (Ove's obsession with Saab cars over Volvos is one such example). Nonetheless, director Holm (who also wrote the screenplay), ends the narrative on the right unsentimental note: Ove initially appears to reach the end after collapsing and being diagnosed with an enlarged heart but manages to pull through, only to be found dead in his bed a few months later by his neighbors.
A Man called Ove features a top-notch performance by noted actor Rolf Lassgård as the wily curmudgeon. Despite its sentimental moments, there's enough pathos here to sway even a critical film goer such as myself toward a modicum of approbation."
" Utterly charming film
",0.624,0.412,2019-08-12 00:00:00,9,"I read the book and then saw the film, thinking the film could not be completely true to the book. I was wrong. This is a wonderful depiction of the story and is uplifting and heart breaking at the same time. Wonderful movie."
" Endearing - both the movie and the book.
",0.0,0.0,2019-07-01 00:00:00,10,What can I say? READ THE BOOK THEN WATCH THE MOVIE!
" A wonderful tale of life's journey
",0.5719,0.9183,2019-06-15 00:00:00,8,I thoroughly enjoyed this movie which kept me engaged from start to finish. You become more engaged as his life story unfolds and the various relationships around him develop. Excellent!
" Solid Adaptation Of A Spectacular Novel
",0.4404,0.9899,2019-05-15 00:00:00,8,"Not long before watching this film, I read the novel it is based on and was absolutely blown away by how the main character--Ove--could be rendered so crotchety yet also so heartfelt and sincere at the same time. For the most part, this film adaptation of ""A Man Called Ove"" captures the essence of that novel.For a basic plot summary, this film tells the story of Ove (Rolf Lassgard), an old man in a gated community who seems to relish being the ""village grump"". He yells at cars for driving on ""the path"", does routine parking/garage inspections, and is just generally unpleasant to be around. Just when viewers couldn't imagine an ounce of sympathy for Ove, however, they discover he is grieving the loss of his wife, has just been laid off from his longtime job, and is on the verge of committing suicide. The rest of the film breaks down the middle, with one half flashing back to a young Ove (Filip Berg) and wife Sonja (Ida Engvoll) and roughly the other half a sort of redemption story for the present-day Ove, as new neighbors Patrick (Tobias Almborg) and Parvaneh (Bahar Pars) give him a chance at life again.As with the novel, the beauty of this story is that despite Ove's surly and often outright brutish personality, there is a relatability factor to him that just shouldn't be there (speaking to the incredible character nuance). Nobody really wants to be ""an Ove"", if you will, yet we all know someone like him or have been there a time or two in our own lives. The flashbacks really help to flesh out his backstory too, as it is fascinating to see a charismatic, hopeful Ove turn into the complicated figure of the present bit by bit.About the only thing I don't like about this film is how certain bits are played a bit too comedic for my liking. I understand the ridiculousness of Ove's situation in the first half of the film (constantly trying to die but always being ""thwarted"" by some problem or nuisance that needs solving), but in the novel it isn't played for quite as much comedy as it is at times here. It doesn't ruin the ambiance outright or anything like that, but it does feel a bit out of place in a film with such serious themes.Overall, though, I can see why ""A Man Called Ove"" was nominated for a Best Foreign Film Oscar (it is presented in Swedish dubbed in English). It's an emotional, deep, and yet somehow charming story of the life of a man we've all seen/known before and how he got that way."
" well made and good movie with a huge agenda
",0.743,0.9948,2019-03-17 00:00:00,9,"This was a well made and good movie with a huge agenda. it could have been made without showcasing a mid-movie coming out sequence for one character and without a refugee. it sadly detracts from a purely human experience movie in that those characters could have been anyone but the film makers chose to inject refugees. however, despite the infection by social justice tropes, the movie was meritorious. my wife was bawling - too bad i dont get to be her version of ove despite walking the line with her and the kids kind of like ove.and there was another review here that said 'who cares about car brands these days' - im half ove's age and yes, it does matter. where things are built and who builds them is how the world goes around. all the big tech big advertising companies who shall remain nameless who make all the ""billions"" take all the best, brightest and smartest people and they dont cure cancer - or make fusion energy a reality - or cure/treat autism - no, they shovel advertising in our faces. so yes it does matter what car your buy and where its made.i thought the movie was well above average and was enjoyable even with subtitles."
" Funny and touching even if sometimes predictable
",0.4404,0.7096,2019-02-28 00:00:00,7,"Unusual film with many unusual events with a funny twist. Predictably, his life was not going to end too fast. Clever use of flashbacks."
" The process of being melted is much the same, but the first third of the unreachable part of life touches me more.
",0.0,-0.114,2019-02-19 00:00:00,7,"The color of the picture is rather cold. Then the plot develops slowly, the contrast between the front and the back is somewhat inadequate, overall speaking, the flaws do not hide yo bar. The process of being melted is much the same, but the first third of the unreachable part of life touches me more."
" A man called Ove
",0.0,0.5719,2019-02-17 00:00:00,6,Ove had a wife. He loves her. Ove owns and drives a Saab. Ove believes there is a place and order for everything. A man called Ove believes things should be done one way: the right way.
" Book to Film Adaptat
",0.0,0.9347,2019-02-05 00:00:00,5,"I will admit that my opinion of this is severely impacted by the fact that I read this book shortly before watching the film adaptation. I absolutely loved the book. Then I watch the film and it seems like they made subtle changes to some characters, more significant changes to others, removed some parts of the book entirely and changed things around that, in my humble opinion, would have been much better left unchanged. The film failed to reach the same emotional level and love for the characters that the novel left me with. As a result, I found the film very lacking in many areas. I can only assume that those who rated this so highly did so without reading the book. So if you've not read the book, this may be a great film. If you've read it, prepare for not a small amount of disappointment."
" Must watch
",0.0,0.4206,2019-01-30 00:00:00,7,"You may be bored at very beginning, but please keep watching you will be entartained."
" I love it, yet..
",0.6369,0.9698,2019-01-21 00:00:00,6,"I love the movie, but only because I loved the book very much and I was eager to see the characters, but if you read the book you won't be pleased by how it is presented in the movie. A lot of details are missing so it makes you feel like filling in the gaps. But overall it is a nice movie, but the novel is amazing."
" ------------ Classic -----------------
",0.0,0.9608,2018-12-08 00:00:00,10,"Love, Romance, humor, humanity, entertaining.
but holy moly the actress that plays his wife. WOW !!!
Worth the time to watch. Settle in and let it unfold."
" Watch it
",0.0,0.9101,2018-11-02 00:00:00,9,"I did not expect anything, but I'm very very glad I saw this.
Surprisingly good story and one identifies south the characters."
