title,title_sentiment_score,text_sentiment_score,date,rating,review
" Top talent grinding it out
",0.5574,-0.9682,2021-01-25 00:00:00,3,"How can a film with Marion Cottillard, Vincent Cassel, and Léa Seydoux be so nail-gratingly annoying?Ughhhhhhhhhhhhh. I wanted to scream. And not in a good way. Gaspard Ulliel plays Louis, a successful write who returns home after 12 years offing away with almost no communication, to tell his family that he has a terminal illness.
The film is about how his absence, and the family's imagining of him, has affected all of their lives. What it amounts to is an hour and a half of angst and bitterness, whining and hesitation. Ugh.Louis' older brother (Cassel) refusing to feel any joy lest his anger dissipate. His younger sister (Seydoux) has imagined a dream version of Louis she both idolises and resents. His sister-in-law (Cotillard) is the most sympathetic but even she is mistrustful of Louis' return. Rounding out the cast is Nathalie Baye as the family matriarch who turns to Louis to cure the curdled bonds within the family.What grates is the lack of insight into what it was that has caused Louis to leave for so long. The brief flash-back glimpses we get of his pre-leaving-home life seem happy enough, and the horror-show that is his family now has been caused by his absence.
There's something to be explored here about what we owe our family, about the balance we have to strike between honouring the familial bonds, and look gin after ourselves, about needing to get away from toxic situations even if you love the people you leave behind, but the film is not interested in any of that - it wants only to wallow in how horrific the homecoming is. We learn nothing of why Louis is so desperate to stay away; so desperate in fact that he has done nothing more than send postcards with 2 or 3 words on them for years, so desperate that he does not want his mother to know his address. We can throw out guesses; his homosexuality? His artistic temperament? But the film won't so much as glance in that direction. Home is toxic; that's all it wants you to know.The main character is so blank as to be without a character. He is silent for much of the film. Many scenes are shot largely in close-up, rendering everything claustrophobic, but Louis does no more than look sick, and give a wan smile.
An early exchange of looks between Cotillard and Ulliel gave me hope there was some understanding between them that would yield some insight or drama, but nothing.Cassel is asked only to be angry throughout. Seydoux only anxious. Cottilard only nervous. Baye, at least, is asked to do a little more; but even she seems to see her son only as a way to fix her other 2 children.Perhaps there is something to be gleaned here for those whose home life is truly toxic, perhaps this functions as a sort of acknowledgement that sometimes you shouldn't go home again, but for me, this was a grind.This was the first film I have seen written and directed by Xavier Dolan. I would never write anyone off (there's always hope!), but it may be some time before I venture into Dolan's house again."
" Xavier Dolan's most disciplined work
",0.0,0.6597,2020-06-08 00:00:00,8,"While imbued with his trademark flamboyance, 'It's Only the End of the World' is definitely Xavier Dolan's most disciplined work, in which narrative and film craft function in dazzling tandem. A bold, tense, stylistically daring melodrama performed with thunderous emotions, and packed with explosive performances shot in claustrophobic close-up."
" disappointing
",-0.4939,-0.8242,2020-05-30 00:00:00,2,"Quite disappointing. this movie combines two ""dreams"" of every gay child. (1) i will die and you all will be sorry. and (2) i will go become famous and you will all realise how wrong you were about me. characters are made of cardboard. so are dialogues. Marion was great. but a very weak movie overall. btw (3) why are they all yelling at each other?"
" True masterpiece in its genre
",0.7845,0.9924,2020-03-28 00:00:00,10,"If you love drama movies in which tension increasingly rises as the movie progresses, this is definitely going to rock your boat like it did mine.It's all dialogistic... though the main character is all but a talker. Therefore, it all relies not only on the others' conversations and forms of expressions, but also on the reserved reactions of the main character (Louis). On top of this, the omniscient narrative makes it all the more effective and troubling.This film should definitely talk to everyone, since each family has its own conflictual history... And this family is no exception.
To me, this is as brilliant as Mommy, and I just love Xavier dolan for his pieces of work as he seems to depict family members' interactions perfectly.What makes this movie well worth watching, is that it'll make your heart beat at various speeds even though the tempo remains mainly the same throughout the movie...
Cherry on the cake is of course the brilliant cast. Vincent Cassel is a genius in portraying this kind of quick-tempered, easy-to-get-triggered family man. His performance works just GREAT with the one of Marion Cotillard playing the role of this slightly submissive, calm and withdrawn family woman.Loved it, and will watch again soon."
" Boring
",-0.3182,-0.0176,2020-02-13 00:00:00,1,"I was at least expecting a big plot-twist at the end that will explain the dullness and boriness of this whole movie, and there were none. A complete waste of a movie"
" Dolan does it again
",0.0,-0.9813,2019-08-13 00:00:00,8,"Extremely well acted, filmed and put together. I thought I'd stop and watch again later but never did stop it kept pulling me in. It's a hard film because it is about relationships that hurt, everyone wanting so desperately, no one getting which leaves us the viewer hurt too. Dolan is brilliant in studying these relationships full of need from I killed my mother all the way to Mommy and this. Cinema about pain."
" Dissatisfying.
",-0.5267,-0.4588,2019-08-09 00:00:00,5,"There's a storytelling technique called ""Chekhov's Gun"" that was founded on the principle to encourage a writer's focus on ensuring there are emotional & thematic pay-offs in a novel / script; the basic summary is this -
""Remove everything that has no relevance to the story. If you say in the 1st chapter that there is a rifle hanging on the wall, in the 2nd or 3rd chapter it absolutely must go off. If it's not going to be fired, it shouldn't be hanging there.""
Thus, crafting an entire story around the concept of a terminally ill writer going home after 12 years to confide in his family the news of his diagnosis, teasing that event & then backtracking after 90 minutes of build up to this pivotal moment... Is a disappointment & I'm left wondering what was the point in making this lacklustre movie if Xavier had no intention of following through & making good on his promises?"
" trackable for acting.
",0.0,0.9914,2019-07-13 00:00:00,6,"Sometimes it was boring. The film had excellent acting. We can not say this movie was very bad or great. But we can say Marion is great. Catherine, the character that impressed me the most. I understand once again; Marion Cotillard is really greatest actress. Nearly she play with her eyes. Watching her beautiful eyes and gloomy look is great delight."
" About a horrible young man that doesn't deserve his story to be told
",-0.5423,0.962,2019-06-29 00:00:00,3,"This movie is about a thoughtless, self-centered man who basically disavows his family for no real reason, other than his own disinterest in his family. He's gay, but that has absolutely no real meaning or merit in this movie. I thought perhaps this was why this young man left home with minimal contact for 12 years, not coming home for any reason, birthdays, holidays, even his own brother's wedding, but not even close. His family wants to know him, cares about him, wants to take care of him, be involved, even impress him. Throughout the movie it shows them trying to get to know him, make an effort and no they aren't perfect, but noone is. His sister reaches out to him, telling him details about her life, questioning him about his. His brother's wife tries to share intimate details about her kids and their lives. His mother shares a moment with him telling him to try to reach out to his family, they need him, even if it's a lie. She loves her son even though she knows what kind of person he is. And his brother, forever angry at him because he knows what kind of person his brother is and he lashes out at his sister and wife because he doesn't want them to get hurt by trying to get to know him. So at the end this young man can't even show a simple kindness to his family by even telling them he is dying. He is having dessert and he tells everyone all the lies his mother wants him to. They're all touched and having a moment and then he says he needs to leave and his brother hears the truth and he wants his brother gone and not leaving a trail of heartache behind, even though the trail is already made. Everyone runs off to their own corner, and he leaves, walking out of their lives forever not bothering to even try to get to know his family or let them know him.
This is a movie about a character that doesn't deserve to have his story told. Everyone has normal family awkwardness and to think you're better than your ""dysfunctional"" family is trying to place yourself on a pedestal. Everyone has their own demons to deal with and yes sometimes family can be a hard pill to swallow, but this family wasn't anymore dysfunctional than most and didn't deserve his attitude towards them."
" A wonderful monologue of unsaid things
",0.5719,-0.8979,2019-06-12 00:00:00,10,"A thirty-year-old writer exiled away from his relatives for twelve years, Louis, now condemned by the disease, decided to return to the tracks of this abandonment, which he is responsible or the victim.
After this infinite time spent fleeing the family home, his return resuscitates the heart of a dysfunctional family where the Prodigal Son soon becomes a catalyst of overflowing emotions, impossible to repress.Xavier Dolan then portrays, through a series of monologues and heated exchanges, the impossible understanding of a family failing to reveal some truths.
It is then the looks and the silences, as well as the introspective parentheses offered to Louis, which will end up expressing, in hollows, all the unsaid, the remorse and the nostalgia without sinking into a disturbing pathos and a collective hysteria of bad taste."
" Irritating stage play
",-0.1531,0.4886,2019-05-12 00:00:00,5,"More like a stage play than a movie, about an extremely unlikable family. I wouldn't want to spend more than one minute in the company of any of them. All they do is shout at each other. I'm not surprised that Louis never visited them. Whether you watch this to the end or not depends on your tolerance for screaming idiots. My advice is ... don't."
" Everybody's drama is understandable, just not touching at all
",0.0,0.9659,2019-03-11 00:00:00,6,"Dolan's Mommy (2014) shattered me to pieces, so I was expecting something similar to happen, but nah.
In the hope that maybe this last time something will change, a guy tries to announce to his estranged family that he's dying. Everyone stays absorbed in their own spectacle though, so we only get the chance to see how he supposedly has influenced the lives of the others.
A great idea actually, which reminded me a bit of Lanthimos' Alps, but the execution left me emotionless. The monologues are truly awkward and even though I understand that their purpose is to underline that everybody cares only about themselves, I still think the message could be conveyed more naturally. Moreover, no one is so self aware, not even the French speakers.
I like how he gradually deteriorates during the ""happy"" family reunion though; it's like he's sick from the very negligence of his relatives and the bigger it gets, the sicker he looks.
Everybody else's drama is also very understandable, just not touching at all. Maybe because I too do care only about myself. Hm. Food for thought."
" Did I miss something?
",-0.1531,-0.9865,2019-01-13 00:00:00,3,"Spent the whole film waiting for Louis to tell his family of his impending death. This never actually happened as even after 12 years apart he was unexplainably still terrified of them. They clearly had problems but it seems they were by no means bad people. I also couldnt sympathise with Louis as on the rare occasions he spoke, what he said was mostly cryptic and pretentious nonsense. The film was frustrating and tiring to watch as all the characters basically spent the whole time pushing each others buttons. I just thought the film was trying to manipulate my emotions by randomly mixing hypertense and nostalgic scenes together. The last scene was a ridiculous spectical caused by Louis' mystical communication that caused the whole family exploded in chaos and confusion. Overall, the films portrayal of this family was unnecessary over the top nonsense."
" Nathalie Baye shines
",0.0,0.8225,2018-07-18 00:00:00,7,"Juste la fin du monde is a play that enjoyed a great deal of success in the 1990's while the AIDS epidemic was still raging. A mother and her two sons and daughter settle down to a long day of anger and recrimination as her eldest son Louis returns to the family home after a long absence. So long an absence that he doesn't recognize his sister-in-law Catherine, while his brother sulks and spouts insults towards everyone. The film version makes what I believe is a grave error in casting: Vincent Cassel, 50ish, plays Antoine who is the elder brother here. Since Cassel is almost 20 years older than Gaspard Ulliel (Louis), and since the first born son is usually the one favoured by his mother, it doesn't make much sense to have Antoine bitching about his brother's supposed advantages in life. Louis should be the one vehemently protesting the raw deal he got in life.If birth order is of no concern to you, I'd like to say that Nathalie Baye gives another superb performance as the mother. She's a gold standard now among French actresses. Lea Seydoux does well as the confused, lonely Suzanne. Cassel and Ulliel do the best they can with their parts."
" Nothng really happens but it's a movie you can't forget
",0.2498,-0.367,2018-05-18 00:00:00,5,"I really don't know what's all the fuss about especially that it was a box office. In my opinion, it's not meant for everyone to watch. Not everyone would enjoy a film discussing an unpleasant social phenomena that's taking over modern societies. I was hoping for something to happen all through the movie and that what kept me watching it to the end. Nothing's happened and that was the good part. All the characters feel lonely and can't really communicate, including the protagonist."
" Good but just barely
",0.2382,0.9105,2018-05-12 00:00:00,7,"In the 1990s, Louis (Gaspard Ullilel) is a gay man in his thirties who is a successful playwright in Paris. After a long absence from his family, he returns to the small town where he grew up in order to tell them of a serious health situation. Once there, past family dysfunction is brought to the surface again. The film is based on the play by Jean-Luc Lagarce.The relatives greeting Louis are his mother (Nathalie Baye), his older brother (Vincent Cassel), his brother's wife (Marion Cotillard) whom he is meeting for the first time, and his much younger sister (Léa Seydoux) who was a child when he last saw her. The best scenes are when Louis is one-on-one with each of the women. Among them, there is genuine awkwardness that tries, not always successfully, to hide the feelings of abandonment due to Louis' absence.The scene between Louis and his brother Antoine, however, is not so successful. Antoine is in a constant fit of rage and resentment. While Cassel plays the part well (though rather miscast as he is eighteen years older than Ulliel), the characterization feels incomplete.It's easy to compare Antoine to the Eddie Maresan character in ""Happy Go-Lucky"". But while each are enraged by life, the angry character is more easily understood in ""Happy Go-Lucky"" than in this film.In the beginning, one might have thought that Louis's being gay was the reason for his estrangement but the family seems okay about this. There's no indication of past or present homophobia. It's most likely the bad relations, especially those of his brother, that would probably cause anyone to flee.There is much to ponder in this film and it is very well acted by a fine cast. It is a good film but could have been much better if the character of Antoine was more explored."
" I LIVED IN THAT HOUSE!
",0.0,-0.2477,2018-02-09 00:00:00,10,"I grew up in a family like that. There was no room for each other and, when striving to make things go well for all, everything was a tattered mess. That is what this family is. We tell secrets to the people with whom we are close: I will never tell my family mine, much less that I am dying! He got it right!
I can see people with various mental issues seeing this and, well, it will trigger a lot of things that will not be good for them. Maybe a ""trigger"" warning for them would be worthwhile . . . . ."
" Hugely Disappointing
",-0.5413,-0.9717,2017-11-09 00:00:00,4,"I bought this movie very largely on the basis of the IMDb rating of 7.0. I find that, in almost every case, the score on IMDb is almost always very close to the blind score that I give a movie after I've watched it (having forgotten the rating on IMDb). I guess all this shows is that I have quite ""average"" taste in movies.I expected that I would like this movie and, in some respects, I did. The acting was by and large quite excellent, the cinematography was wonderful, every shot being beautifully framed, the script and the dialogue were also excellent. But, here's the thing. Rarely does a movie so badly miss getting to the bloody point.Young Louis came home to tell his family that he was dying of some unspecified disease and amid all the bitching of arguing among his appalling family, he never gets around actually to telling them. I think I can understand this. Given the utter awfulness of his family, especially the maniacal brother Antoine, I think I might have been inclined in the end to give them all the finger and a parting greeting along the lines of ""F**k you all"" but this really didn't work in the context of a movie where so much more was expected.For the record, I expected an emotional about face after Louis told his appalling family that he was dying but we never even got near there.The whole movie was MOST unsatisfying and I'm afraid it's very unlikely that I'll ever bother to watch it again. It'll sit in my collection gathering dust and I'll probably forget I ever watched it in a few months; at least I hope so.Don't waste your time on this one. It wasn't actually all that bad but I have rarely before been so utterly disappointed by any movie.JMV"
" Read Into Expressions, Not Dialog
",0.0,0.9209,2017-11-01 00:00:00,7,"(Flash Review)The film's plot slowly unpeels like an onion. Where a man returns home to his family after a 12 year absence. There is a brief statement early on about why he decides to return but when or will he find an opportune time to tell his family during his family's constant bickering, snarky comments and yelling? This film is dialog driven but one must read in between the dialog to interpret the true meaning all of which is moderately open to interpretation. It is a slow burn with effective cinematography with long shot holds and communicative music score. So if you are up for a French drama with a family poor at communication yet like to ponder emotional meaning, then this is for you."
" An amazing film
",0.5859,-0.807,2017-10-08 00:00:00,7,"I just watched the Xavier Dolan film: ""Juste la fin du monde"". It is strange one...in the good sense of ""stange""! The main character is a guy who come back home after 12 years absence to announce for his inevitable death to the family. What he is dying from, why he has left home in the first place...so many questions and so little answers. The whole movie has an atmosphere of something ...something from the past. Like a puzzle Dolan gives to the audience piece by piece the parts of the story, and at the end you being left full with questions and with one feeling of inevitability. The family is strange and in the same time so ordinary. The characters are very complicated - they don't know what to say or do, they are wavering over every possible feelings, they are terrified from the reality, they got angry at each other and to the world at the same time, deeply unhappy, each of them stuck into his/ hers personal hell... And actually it is an amazing film. I highly recommend it to all fans of European cinema."
" Subtle but deep - brilliant piece of artwork
",0.7351,0.9344,2017-10-01 00:00:00,10,"Watching this movie was like looking into the eyes of the Van Gogh portraits painted during the years right before his death. It is extremely rare for a film to capture emotions that are so subtle but deep, this clearly isn't going to be a mainstream film since not everyone are capable of those feelings. The film reminded me of the limitations and frustrations of the human experience, that those moments of ecstatic happiness from the past often haunts us with sense of loss, even the things which seemed to be insignificant or immaterial at the time brings a nostalgic feeling when we realise we are not immortal. The characters clearly deeply care for each other, but the limitation of their personalities or a life time of habits (the marks of Antonie's hands or how Catherine constantly looks at Antonie from the fear or triggering his anger) leaving them unable to connect or have a full relationship with each other. This reminds me how we are constantly reacting and reflects the limitations of the human expression and relationships. Louis's sensitivity as he tells his brother the details about his feelings as he travels through the airport was a contrast to his brother's reaction, the lack of empathy from Antoine was not deliberate but a fact, it is not hard to see why Louis stayed away from people/place where he was never understood. The irony is they are family. The scene where Louis leans on the mattress where the scent/dust of the mattress triggers a trip down the memory lane was quite special for me. It represented how the sensitive the human mind is and memories are triggered by the most subtle senses but when we take those trips down the memory lane we are all alone instead of an experience shared between two people. Especially when Louis later learns from Antonie that Pierre has passed away. The actors/actresses are absolutely brilliant and without them the art wouldn't be brought to life.The movie left me feeling sad but nevertheless it's a brilliant piece of art work."
" This family saturates me
",0.0,0.4751,2017-07-26 00:00:00,3,"I have finished watching the movie to be able to do the review, just for that, but it is that this film is repetitive, it constantly counts the same and also you can not get empathy with any of the characters.They are all great, since they get what they are supposed to pretend, show an unpleasant family and with which I do not think I could stand almost anyone else in a morning.The problem is that the script is repetitive, it counts the same over and over again. I got bored after a while and I understood the protagonist as soon as I started the film, I did not need so much time to understand him.Neither the camera nor the photograph is beautiful, it has a white and ugly light and we see the actors many times of sword with what we can not see them.If the director does not realize all this, it is that the address is not good. He does not know how to narrate, does not know how to compose, yes, he directs the actors well.The best thing about the film, when the credits come out, is that it's over."
" Life in a day
",0.0,0.9753,2017-06-07 00:00:00,8,"Xavier Dolan, where have you been all my life? They say your latest film isn't as great as your previous ones, but it blew me away. TALENT.The acting. The music, original and non-original, and the way it is used so perfectly. The flash-backs, and the beauty and power in them. The dialogues. That feeling of wanting to say I love you, but I can't stand you - and soon we will never see each other again."
