title,title_sentiment_score,text_sentiment_score,date,rating,review
" A film about Kristen Stewart texting iMessages on an iPhone.
",0.0,0.7062,2017-04-19 00:00:00,4,"If you would LOVE to watch Kristen Stewart spend an entire film sending and receiving boring anonymous text messages (which have zero relativity to the plot and character development), then boy ahoy you are in for a real treat here!I can't bring myself to waste much time on writing a review for this. The biggest takeaway from this film is that Kristen Stewart sends and receives a lot of text messages with an anonymous person on the other end. That's it. There's really nothing else in this film. It's not scary, it's not mysterious, it's not adventurous, it's not thrilling, it's not dramatic, it's nothing.Hopefully this helps you make your decision if you're considering whether to watch or not to watch."
" A well-acted but unoriginal iPhone-driven ghost story
",-0.4497,-0.9967,2017-04-19 00:00:00,6,"Ambiguity in storytelling is a double-edged sword: it can mask a narrative that is unsure of itself or it can be a source of visual pleasure. It is used to some extent in all good filmmaking, offering imaginative pathways for viewers to bring their own interpretations to the story. But over-reliance on ambiguity is risky. The supernatural film Personal Shopper (2016) elevates ambiguity to an overarching theme. The film offers few clues on whether the story is about a grieving sister's personal journey into the spirit world or her grief trauma psychosis or her encounters with real ghosts.The plot hinges on a brother and sister pact that whoever dies first from their shared congenital heart condition will contact the other from the next world. It is months since her brother died, and Maureen (Kristen Stewart) is still waiting for a sign that he is at peace. Her continued emotional pain and closeness to him is palpable and she is suppressing grief trauma just enough to function. She lives in a world of shadows, both as a personal shopper for a mega-celebrity and as a spiritual medium awaiting contact with the dead. When she starts receiving unidentified text messages that appear to know too much about her, she is unsure if it is her brother or a stalker. There is unmistakable eroticism in how she reacts to the texts and in her relationship with the demanding celebrity. The texts become domineering and lead the story into unpredictable and weird territory.Audiences hoping to witness genuine contact with a departed soul will be disappointed. In its place, they will find a disjointed montage of outer-worldly and mortally sinister possibilities that rely on the viewer joining the dots. Despite the marketing hype, this film lacks originality and narrative coherence. There is an abundance of tired ghostly tropes like floating translucent veils, self- levitating glasses, and a haunted house with creaking floorboards to make sure we know it's a ghost story. Maureen's job as a personal shopper is a narrative construction to reveal her fetish in dressing up and even masturbating in outrageously expensive clothes. Unless you are a voyeur for people's private conversations, the prolonged sequences of iPhone texting from an unknown source can become tiresome. The cinematography is classically supernatural: dark, dark, and then darker scenes with some illuminated only by the whites of Kristen's eyes. The main redeeming feature of this film is Kristen Stewart herself. Whether the script is convincing or otherwise, she has the talent to carry the role in all its mercurial variations, from the fast-talking fashionista, to terrified victim, to the sister poignantly mourning the loss of her beloved brother.In an increasingly secular world, fans of this genre will keep searching for original, plausible, and scary supernatural films that explore the existence of an afterlife. After all, the genre itself exists to give vicarious expression to our fear of death. In one way, Personal Shopper makes a fresh contribution to the genre with its depiction of iPhone technology as the new séance platform for communicating with the unknown. But the film also falls back on old genre standbys like chatting to a ghost via the slamming of doors. Overall, it has enough eerie atmosphere, dramatic tension and unexpected twists to be entertaining, but it is Kirsten Stewart alone who saves it from mediocrity."
" Truly awful
",-0.0258,-0.7263,2017-04-19 00:00:00,4,"We saw this last week and after an hour or so people began to leave. As the titles came up at the end, the woman behind me shouted For f%$£ sake.The basis of the story is weak and revolves entirely around KS seeking a sign from her recently departed brother that there was an afterlife. He was a medium, she is a medium and their near the end friend we find out is a medium. All mediums together. Who here doesn't know at least 3 mediums? There is an attempt to add a story to this drab concoction involving the theft of jewels with starts and finished with quick predictability and seems to have been added to alter the mind numbing acting of KS and her shopping/buying scenes.The end must rank as the worst endings leading from a dull storyline to the Far East (yawn!) 90 minutes I'll never get back"
" A big meh
",-0.0772,0.8787,2017-04-18 00:00:00,4,"Starts out well. The lead actress does a good job. Then...nothing happens, except for some boring and pretentious plot filler that drones on and on until the final twist...which is a resounding meh because it surprises no one and has been done before in much better movies. Don't bother watching unless you really like Kristen Stewart. If you're a fan, you get to see her topless, which I guess is enough for some people."
" Quietly creeping, unsettling film about spirits
",0.0,0.7391,2017-04-17 00:00:00,8,"This taut, low-key mystery thriller proves to be quite unnerving and if you let it, it will become a source of self-debate afterward. It centers around another stark performance by Kristen Stewart, who in her own squirmy but brooding way fits the role perfectly as a European celebrity's personal shopper in Paris who confronts the possibility of spirits in the aftermath of family loss.Stewart's role is fairly similar to the one she had in her previous collaboration with director Assayas, though here the plot deals predominantly with grief and the supernatural rather than pop culture and entertainment; here, Stewart's character's fancy job and the industry she works in become something of an afterthought. The posh surroundings are all but forgotten amid the creepy mood that pervades.The film's biggest problem is not the much-maligned logic gaps, but rather a pacing that is too uneven. The editing here is a bit choppy at times. But the film's tempo and pitch are able to overcome these missteps with an emotional buildup that burrows into the main character's anxieties, uncertainties and ongoing quandaries.You will either find this gripping or ridiculous. But the film gets a lot of points for being both creative and well-executed with the kind of modest but effective style we see too rarely deployed in contemporary cinema. Gladly recommended."
" Unfortunately Stale.
",-0.34,0.9703,2017-04-17 00:00:00,5,"For who this film would legitimately satisfy as a whole is a bigger question than the ones most people will have after viewing. The previous sentence is almost as confusing as how this is getting rave reviews. Perhaps it's those who overlooked the many flaws because they enjoy the director or actors. Kristen Stewart definitely has found her way into some great parts that will surprise those who only are only familiar with the Twilight series. Kudos to her for that and I look forward to many more great performances. It's the story that didn't pay off for me, especially after an interesting trailer. Some will call it pretentious and boring. As someone who usually loves movies that get called those things, I find it hard to argue unfortunately."
" This turd stinks too much to try disguise itself as ""art"".
",-0.4588,-0.913,2017-04-16 00:00:00,2,"Positive critic reviews for this film have me convinced many of them must be on the take, because this is a TERRIBLE film. It fails as a mystery, as a drama, as a thriller, and as a horror. It simply fails. Period. It is a pretentious piece of turd trying to disguise itself as art. But it stinks too much to disguise itself as anything but the pile of crap it is."
" Don't know, what's the story about?
",0.0,-0.3728,2017-04-16 00:00:00,7,"Couldn't reached to the answer of these questions (wiki is not updated or enriched :p)1. Who murdered kyra? Maureen? Spirit of Maureen's brother using Maureen as his vessel (and made Ingo (Kyra's rejected boyfriend) murderer)? 2. Who texted Maureen? Spirit of Maureen's brother Louis? Or Ingo (and wanted to made Maureen murderer)?3. What does it means in Dubai ""Louis is that you or it just me""-- ""(single signal)""? Is it means everything is just happened inside Maureen's head, and she murdered Kyra for her jewelries and later on Louis (her other identity or virtual character) told her to go to hotel and left all jewelries at room 329 to get rid of this murder.Finally, ""WOW"" with the ""Art"" of this film. Kristen Stewart was natural, actually personality of Maureen and KS is all same, so she was just perfect for this character.I love this film."
" Pretentious, drawn out and overly dramatic. Not a good film.
",-0.3412,-0.9354,2017-04-15 00:00:00,2,"I watched this movie, knowing very little about it beforehand, and I was left baffled by how anyone could make such an interesting premise result in such a mundane and tedious film. Nothing goes on for most of the movie, and when I mean NOTHING, I mean nothing. We get overly long shots of Stewart riding her Moped, shopping for clothes, dealing with her ""friends"", and smoking. So much damn smoking. When things do happen, it is poorly executed and reminiscent of a film students first project. The film does not know what it wants to be; a horror movie, a ghost story, a murder mystery, a drama, an art film. It tries to be an amalgam of all of these genres and fails handsomely at every single one. I just don't understand how this can happen. The director is competent, the script was serviceable if a bit simplistic, and the acting was not awful. How can these elements which would work in any other movie fail so incredibly in this one? One scene in particular stood out to me that describes this entire movie; Stewart's character is on a train on her way to London from France. She is receiving text messages from an unknown sender, and the exchange goes on for like 10 minutes. She moves from cart to cart, exchanging high school level texts messages with someone she does not know, and this goes on for 10 whole minutes. Who really wants to see 10 minutes of someone text messaging? It's poor film making, using technology to excuse a lack of creativity. It's the worst type of film making, and while this film is not awful, it really does not deserve to be seen by anyone. It is just not worth it."
" Arsty Fartsy Ghosts
",0.0,-0.8849,2017-04-15 00:00:00,1,"Well, it seems that the director of this movie specifically made it with one noble thing in mind. And no, it was not to discuss the after-life, depression, loneliness, grief, etc.It was made with the sole objective to show again to the audiences a topless Kristen Stewart!!! Which is OK per se (she is not that bad), but not enough to fill the interest of the audience for more than the time her exposed nipples are shown on the screen.Other than that, the story is tedious, Kristen Stewart is irritating in her role (as usual, she cannot act!), characters are boring and dry, nothing scary happens, the alleged ghosts are juvenile and, of course, the film has no resolution at all (it is an artsy-fartsy film, right?). The director simply decides to leave everything hanging in the air like....the ghost of a bad idea!Unless you have a devotion for Stewart's nipples, there nothing much in it."
" So Boring
",-0.3804,-0.8439,2017-04-14 00:00:00,1,"I was looking forward to watching another Kristen Stewart film that looked so good from the trailer. How wrong was I? The run-down cinema in Sheffield had a few problems so there were no trailers or adverts at the beginning, meaning we were straight into the film after ten minutes of apologising by the embarrassed staff.Get on with it I hear you cry! I have to write 1000 characters for this review so that's why I'm waffling..The film started off slowly.. very slowly. I remember checking my watch around twenty five minutes then I don't remember a thing. Yes, for the first time ever in a cinema I fell asleep!After an hour or so I woke to a nudge from behind because I was snoring. I watched for another fifteen minutes but it was so mind-numbingly boring I left the cinema and returned to my hotel room."
" 6/10
",0.0,0.7652,2017-04-14 00:00:00,6,"Maureen (Kristen Stewart) is a personal shopper for big time celebrity Kyra (Nora von Waldstatten). She also happens to be a medium that know how to communicate with spirits from the other world and refuses to leave Paris until she gets a sign from her recently departed brother Louis.""Personal Shopper"" is one endeavor in genre mix I had yet to see. The fusion of styles, ideas and cinematic traditions is fascinating and quite off putting at the start, yet it manages to entertain audiences with moments of true suspense and fascination even though it goes completely off the rails in trying to have any emotional impact or pay off.The film is a mixing of genre as much as it is a mixing of styles. We get these long uninterrupted shots that stalk Maureen through the house which she believes she is haunted and juxtaposes it to scenes that you would expect to find in a dark fashion thriller. This combination admittedly does give the film an inherent interest that never leaves it. The first hour or so of the movie is quite captivating in how unapologetically it brings together these various elements lacing them together with a quite arrogant use of jump cuts which result in a smart idea to link the fantastic with the mundane.Kristen Stewart is a very effective lead, she manages to paint layers of characterization onto this person and open up an emotional place that would have easily been lost in hands of lesser actors. Her work is probably why the suspense scenes work so well. It is amazing to see how in one moment you are following a fashion discussion and you're captivated by it and in the next one you're completely scared by an apparent ghost story. Assayas definitely has to get some credit for the structure in which the horror scenes are built, whilst he has some major problems in tackling the genre, the scenes of suspense work perfectly because of a true mastery on the technical aspect. The elements introduced are synthetic and effective and they are juggled around in a perfect attempt at audience manipulation. Moreover he manages to get a couple of really amazing and suspenseful stable shots that I won't spoil, but really stick out as gems of the technical proficiency of the film.Unfortunately there are many story points and and emotional beats of the film that have almost no context or relevance to character here. Assayas has many problems in building the supernatural and there is lots that is either left for blatant exposition or not explained at all and left in a weird place of misunderstanding. The closure of the picture suffers immensely from this and all of the fancy genre stuff does not come together in an ending that leaves the audience completely cold and clueless on what emotions to feel. Overall the film has some very brave ideas and motifs, but the intention behind it leaves the audience scratching their head."
" a different definition for 'Ghosting' (aka ""Ghost-Text: The Movie"")
",0.0,0.9944,2017-04-02 00:00:00,8,"A movie I didn't think I would contemplate while watching Personal Shopper came to me, and it made me appreciate Assayas's work all the more: Unfriended. Anyone remember that piece of trash? I know not all felt the way I did, but Unfriended represented, for my money, a completely impoverished sense of making material cinematic; that film, if you may recall, was kind of a Skype-found footage horror movie where one saw the action take place in real time on a computer screen with sometimes video of people looking at their computers screens/web-cams, but mostly it was seeing lots and lots and lots of text being typed and exchanged (and, as something else that made me think of it, it's a spirit from beyond the grave who is giving back to the teenagers and bullies).What bothered me when I saw that (aside from a roster of horrible actors, characters and clichés from slashers and found footage), was that there was nothing redeeming the material through the power of cinematic grammar. That may sound a little much to expect, but if one is trying to use modern technology to make a unique spin on a genre experience, then it should have something new to offer our eyes and senses as part of the mis-en-scene, pacing and other facets of filmmaking. What makes Personal Shopper stand out as a much stronger example of what Unfriended died and failed to do was that Assayas is using technology through much of the film - text messages make up a good 50% of the screen-time here, if not more - but he also has two assets as a filmmaker: first, his lead and possible muse Kristen Stewart, who is there to react to the texts and is an active agent engaging with whoever this 'Unknown' is who about 35/40 minutes into the movie starts messaging her and making her feel alienated and distressed, and secondly that he builds suspense and finds realistic moments to take a break in the action of the texts.That is to say, she may be on a train, for example, and messaging with this 'Unknown', and then she has to get off the train or find somewhere else, or there's the trepidation or suspense if she'll actually message back to a message that seems very creepy or suspicious or to increase her paranoia and so on. It's one of the few times that I can think of that a filmmaker has made something that is now practically ubiquitous to the lives of those with smartphones (that is, everyone in the modern world), and yet it's a useful device for tension and drama and conflict for our heroine. The other positive is that it's not all that this movie has up its sleeve; on the contrary, this is a ghost story, but it's really Assayas taking the ghost story as a vehicle not so much for horror (though there are some scenes that may make people jump if they're especially prone to things that 'apparition' in front or behind someone, and a particularly brutal murder), but for an existential sort of inquiry: if there are ghosts and an after-life, shouldn't that be slightly optimistic, that there is some after-life to look out for? What's so strong though is Assayas filming everything with a keen sense of creating suspense when he has to, but also creating a mood for his star to become equal parts vulnerable, strong, confused, sexually aroused (yeah, that kind of happens at one point, thanks to a dress with early 20th century Germanic overtones due to the black leather straps), and searching and questioning as a performer. And it's Stewart herself, who's occasional (or often) trembling and nervous quality serves Maureen really well at times - notice the close-ups of her shaking thumbs - and yet there's a lot of depth here that may be easy to miss that she brings to this character. She has to hold our attention, and at first I wondered if she could (she's in practically every scene - there's one where I thought, maybe, she's an invisible spirit herself?) and she does. She's attractive and yet, as someone I was with pointed out to me after the movie ended, it's a 'Tablua Rasa' sort of thing too: we can project how we feel about her reactions, to the texts, to the people she's around and a little separate from (mostly the rich people she shops personally for, hence the title), and also on the film itself.Is it all a blank slate? Yes and no, and that's what keeps the intrigue for me. Though by the very end, I was hoping for a little more clarity than what I got - some may not feel that way, and there's certainly an emotional undercurrent to that last shot that can be felt greatly. But I wish it hadn't been SO ambiguous; it leaves what is a pretty good, sometimes marvelous and alluring and daring dramatic thriller, in the space of what could have been a masterwork. But, hey, texts are now interesting on a cinematic level, so major ups to Assayas for making that leap."
" Watch it for the stellar performance from Kristen Stewart
",0.0,0.9975,2017-04-01 00:00:00,7,"""Personal Shopper"" (2016 release from France; 108 min.) brings the story of Maureen. As the movie opens, Maureen is being dropped off at a house on the outskirts of Paris. Maureen spends the night hoping to connect with ""the next world"" but nothing happens. Only later do we realize that she is trying to connect with Lewis, her recently deceased twin brother who died in that house from a heart attack. The person who had dropped her off was Lara, who was Lewis' girlfriend. After the opening scenes, we get to know Maureen better: she is a personal shopper for Kyra, a super-busy and well off model, for whom Maureen picks up clothes and jewelry. Maureen has come to Paris after Lewis' death, as Lewis was a medium who believed in the spiritual world. Lewis and Maureen, who suffers from the same heart deformation as Lewis, made a pact that whoever dies first will send a signal to the other from the next world. At this point we're not even 15 min. into the movie but to tell you more might spoil your viewing experience, you'll just have to see for yourself how it all plays out.Couple of comments: this movie marks the reunion of French writer-director Olivier Assayas and Kristen Stewart, who previously made the critically well-received ""Clouds of Sils Maria"". Here they go a very different direction, namely how a surviving twin must learn to go on in life, even while yearning for her twin brother. This movie is nothing short of a tour de force for Stewart, who appears in virtually every from of the movie, I read somewhere that Assayas wrote the role of Maureen specifically with Stewart in mind, and Stewart certainly returns the favor by bringing one of her very best performance to date yet. The days of ""Twilight"" long beyond her, Stewart, still only 26 if you can believe it, continues to surprise (in the best possible way) with her choice of roles (check also: the recent and excellent ""Certain Women"", Anesthesia, the already mentioned Clouds of Sils Maria, and One the Road a few years ago). So far for the good news. For the not quite as good news: the plot requires you to take certain leaps of faith, and to be honest, I couldn't quite get there. So for all the buzz about this being a ""psychological thriller"", I found that a bit of a stretch. Instead I found myself fully mesmerized just watching Stewart's performance. There is a long sequence in the movie where Stewart is on the EuroStar to London and she finds herself texting with an ""Unknown"" number... Just watch! ""Personal Shopper"" premiered at least year's Cannes Film Festival, to great acclaim and with Assayas winning the ""Best Director"" award. The movie finally opened this weekend on 2 screens here in Cincinnati and I couldn't wait to see it. The Friday evening screening where I saw this at was attended poorly (5 people, including myself, of which 2 left about midway through and didn't return). If you are expecting to see a 'scary' movie, you are sure to be disappointed. In instead you are in the mood for a character study about a grieving surviving twin that includes a stellar performance from Kristen Stewart, you are in for a treat, and I'd encourage you to check this out, be it in the theater, on VOD, or eventually on DVD/Blu-ray."
