title,title_sentiment_score,text_sentiment_score,date,rating,review
" An eerie and unnerving thriller
",-0.2732,0.998,2017-10-29 00:00:00,7,"Those going into Personal Shopper expecting some type of straightforward narrative of an as per-usual glum Kristen Stewart going around trying on clothes and living the high living lifestyle will surely be disappointed by Olivier Assayas latest film, as this supernatural tinged thriller mystery is an anything but straightforward experience.Winning the Best Director award at last year's Cannes Film Festival for this effort, Personal Shopper sees Assayas re-team with Stewart after their successful collaboration on Clouds of Sils Maria and the two artists have seemingly in the space of two films developed quite the artistic connection as Assayas assured hand behind the camera works seamlessly with Stewart, as her inwardly haunted Maureen Cartwright tries desperately to connect with her recently deceased twin brother Lewis, only to find herself in a potentially dangerous and possibly otherworldly situation.Personal Shopper is almost unclassifiable and can't be pigeonholed into a specific genre as Assayas comfortably enters into horror/thriller territory as easily as he does drama/mystery as Maureen's experience with the world beyond our own makes itself more apparent and her dealings with an unknown ""messenger"" take hold of her increasingly complicated world.Talking to much about Assayas's layered narrative would undo many of the films surprise's as we're constantly taken into routes we don't expect and it's highly plausible that Assayas's finale will be one of those cinematic endings that creates more than its fair share of heated online discussions and theories.In saying this, Personal Shopper isn't an easily accessible film, its slowly paced and features a bunch of rather unlikeable characters but Assayas's ability to create mood and atmosphere can't be questioned while Stewart delivers one of her best turns as an adult lead as Maureen.As if Twilight was but a sparkling distant memory, Stewart's brave and committed turn as the tormented Maureen holds the film together through some of its rougher patches and some of the scenarios/situations Assayas has asked his leading lady to be a part of could've easily gotten the better of lesser performers.It might not be a turn that manifest's the haters into followers but there's little questioning Stewart's ability to play these certain roles she's become attributed to isn't amongst the best in the business today.Final Say – A truly original piece of filmmaking that isn't made for mass appeal and a work of art that doesn't always hit the high notes it intended to, Personal Shopper is a film like we've never seen before and an unnerving experience that will likely stay with you after the credits have rolled; if you happen to be one of the few that had been transfixed by Maureen's experiences with the forces we have yet to understand.3 ½ dropped glasses out of 5"
" Flat multi-genre, poorly directed, poorly edited film staring Kristen Stewart
",0.0,-0.9917,2017-10-26 00:00:00,3,"Not a good film. A surprise considering many reviews I'd read were very positive, Kristen Stewart fans I expect, but the film fails on nearly every level. Think part of the reason is the director, Olivier Assayas couldn't decide what kind of film they were making. Is it a ghost story, a murder mystery or an artsy character study about the loss of a sibling and existence of an afterlife? Personal Shopper is a bit each with a touch of the Devil Wears Prada sprinkled on top... The director also chose not to develop his main character to any extent, perhaps it's a French film/director thing and I just don't get it. Night shots of Paris were good but the paranormal interactions were not very effective, goofy/funny actually. Also the amount of screen time given to the Kristen Steward character texting was absurd. Sorry, texting is not a replacement for dialog and story. But for me the biggest flaw was the lack of continuity between scenes during a critical encounter involving the main character in a hotel. The enormous story gap is never resolved, just hangs out there through the end of the film. Again, maybe it's a French film thing but it doesn't work for me. Lastly the ending sucked big time. Might have worked with David Fincher directing."
" But is it a scary movie, work or esoteric?
",-0.6486,-0.7521,2017-10-22 00:00:00,3,"I think the fundamental problem of this film is that it does not clarify where it wants to go. The title says one thing and then the main story says another. But the subplots are too long.Kristen would be great, if it was not because she's always the same. It does not convey anything to me. It leaves me very cold and is not a subject to leave you cold.If I had gone for the topic that I believe is going to be the brother's, I could have been well, because the effects it puts on are well achieved, because in those moments it catches you, but then it goes to other subjects than the truth, I'm not interested at all. Another problem is to make such a white photograph in a film of this type, photography has to accompany the plot and does not accompany it precisely.The direction, since it does not clear up or know where to go, since it spends a lot of time with things that do not interest, it is not good. He does not know how to count the camera. The tempo does not get along very well.I was not expecting it that way and it was for the worse."
" The Vidiot Reviews...
",0.0,-0.9511,2017-10-17 00:00:00,6,"Personal ShopperBeing a personal shopper means getting the high of the buy with none of the remorse.However, the only high the buyer in this supernatural thriller wants is a higher plane. Chiefly employed as a personal shopper for a Parisian celebrity, Maureen (Kristen Stewart) spends a great deal of her time trying to contact her deceased twin brother who died of the same heart condition she has. When she receives a text from an unknown source she concludes that it came from her dead sibling.Meanwhile, her boss' dead body has just been found and Maureen is the police's prime suspect.Understated with moments of terror and ethereal cinematography to match Stewart's aloof performance, this esoteric study on spiritualism slowly pierces the veil in an innocuous yet haunting fashion that makes this ghost story subtly scary.Mind you, male ghosts haunting clothing stores tend to linger around the change rooms. Yellow Lightvidiotreviews.blogspot.ca"
" What happened?
",0.0,-0.8074,2017-10-07 00:00:00,2,I had to look up online different Websites to see what people thought about the ending of this movie. I'm unconvinced. There are a lot of theories. I don't like movies that finish and you just don't know what happened. I didn't enjoy this one bit. It's dark and not meaningful. I would say: watch something else instead.
" Vintage horror, mystery and drama, beautifully crafted.
",0.0,-0.9307,2017-10-02 00:00:00,9,"Let me preface by saying something that shouldn't be controversial: Ms. Stewart is a good (great) actress. She is better than that concocted star Jennifer Lawrence. (Apples and oranges, right?). Oh! That Academy debacle - Lawrence is in no way better (or gave any better performance) than Emmanuelle Riva.I, sincerely, don't understand about what people are talking when dismissing Kristen Stewart's acting. (Sometimes I think people are in another reality and seeing something different from me). Maybe most people like overacting, melodramatic acting, pseudo-Shakespearean acting, soap-opera acting, etc., but I surely don't.Personal Shopper is a wonderful character-driven film (if you can only seat through a film with a thick or very tightly woven plot you may not like this) about a young woman who lost a brother with whom she had a strange (or perhaps more common than I believe) agreement that consists of making contact from after-life (if there's such, which I believe not) with each other. Both are self-identified mediums. Both have (he had) a heart condition which can kill the carrier seemingly out of nowhere. So, she hangs around Paris (where her brother died) waiting for his contact from the beyond. (To a cynical sceptic like myself this premise should sound ridiculous, but, alas!, is not and the film was capable of enchanting me even).The so-called profession that gives the film its title is boring (and the main character knows). She goes around Europe and England buying and renting high-end clothes and jewellery for a high-profile personality of the fashion milieu. Boring. But the character is not boring and Stewart's performance just kept me watching with interest (almost without blinking).There are ghosts (or not); a peculiar murder plot that is a somewhat side note (very refreshing in my opinion); hints of madness (or not). Again, Stewart's performance is really mesmerizing.The film have a classic tone to its composition, and, at the same time, a very modern, organic feel. We see things happening with a character and that is it. The grieving sibling story was done before, of course, but how it is done in Personal Shopper feels fresh to me. Avoiding every Hollywood cheapness. (Hollywood is awful in my opinion).Drama, horror, and mystery perfectly bound together. Personal Shopper surprised me. A wonderfully well crafted film that avoids being a cheap Hollywood-we-need-to-win-a-prize- (or) -we-need-to-scare-you-using-loud-noises film without wondering to much to the side of art-house pretentiousness (a shame to me, because I like pretentious).I was thinking of writing something with more depth about this film, but, on second thought, who would read?* Big plus for that short scene with Anders Danielsen Lie close to the ending."
" ""Personal Shopper"" a triumph
",0.4767,0.9971,2017-09-17 00:00:00,8,"It has been five years since Kristen Stewart completed the teen vampire/ werewolf movies in the five film 'Twilight' series, adapted from Stephanie Meyer's best selling books. It would be incorrect to say this was Stewart's big break – that came in 2002 playing Jodie Fosters diabetic daughter in David Fincher's ""Panic Room"". From that 2002 film until 2008 when ""Twilight"" was released she had been making waves in mostly independent films. However, where she once was a young woman with acting talent, we are now witnessing the talent promised for so long in two of her better films, the 2014 ""Clouds of Sils Maria"" and the release this week in New Zealand of ""Personal Shopper"" (2016), both written and directed expertly by Frenchman Olivier Assayas.""Personal Shopper"" revolves around Maureen, a personal shopper, who serves wealthy clients in major cities, buying clothes and accessories, and taking care of mundane chores. She lives in Paris but travels to London and other cities for her employment. Her fraternal twin and brother has recently died; they both had a similar genetic heart problem, as well as this they both believed they had connections to the spirit world, her brother more than she.Opening the film, Maureen stays over at her late brother's house, hoping he will reach her beyond death. His significant other Lara wants to sell the house, and buyers want to know it is free of unhappy spirits. The film suggests what she sees and reacts to, including a series of knowing texts received even while she is on a train to and during her time in London, from ""Unknown"". She believes she is in touch with ghosts.This film really suits Stewart and what has become her signature acting style, as such she is suited for this role like no other at the same age. Stewart, at the age of only twenty-seven is amassing a nice oeuvre of work like no other, except for maybe Jennifer Lawrence – although the fact that Stewart has spread her wings well as working with many Europeans in Europe says a lot about the kind of actress she is choosing to become. In saying that Stewart does not have to chase a payday, as the residuals from the 'Twilight' films will keep her in the black for the rest of her life – which must be a nice luxury.Stewart's Maureen is a woman who is facing a crisis as well as something that has been stalking her for the entirety of her life, that is, the possible impending death of herself and/or her brother – this is a concept that most people from her economic and social background don't face until much later in life. Stewart handles this with aplomb as her style and mannerisms suits this character down to the ground. She seems to be relishing the opportunity to be working with a European like Assayas (again) as well as the subject matter of the two films she has made with him.One of the great things about Stewart is her ability to play supporting parts to other actresses as well as her ability to not seem to have an ego for her on-screen personas. Assayas shoots Stewart in close up with these shots not being complementary as we see imperfections in her face as well as the age that she has seemed to gain through the stresses of her very existence. It is something to see an actress willing to give up her 'look', not to have makeup or to play a 'real' person that is not perfect looking. It is a juxtaposition between the glam pictures you may see of Stewart to this flawed, haunted as well as haunting person that is searching for some truth and perhaps closure.Olivier Assayas has had a long career as well as being a force in French and International cinema for years, he has made a wide variety of films in multiple genres, he has to be one of the more prolific directors in the world today. He also enjoys partnerships with actors, hopefully this is the start of something with Stewart who he obviously enjoys working with – it must also help get a budget when you have a champion with such international clout and awareness.There are many elements to this film that make it unique to the environment it has been released into, it co-opts many genres to give us twists on each one. I loved this movie, but it would be nothing without Stewart who is perhaps shaping to be the actress of her generation."
" Spoilers follow ...
",0.0,-0.8587,2017-09-07 00:00:00,8,"Scruffy, intense Maureen (Kristen Stewart) is personal shopper to high-profile celebrity Kyra (Nora von Waldstätten). She wanders unconcernedly through magnificent Parisian and European streets, taking long journeys to spacious shops that sell ridiculously over-priced clothes. Occasionally she feels she is visited by the spirit of her dead twin brother Lewis, who died from a heart defect she also suffers from. This doesn't dissuade her from smoking though! She spends a lot of her time alone in Lewis's former massive, shambling house which proves the perfect place for a haunting. Only two small problems – firstly, it begins to dawn on her that this un-benign spirit might not be her brother. Secondly, the CGI used to show us the apparition, although subtle, is a bit  CGI. Computer cartoon. This is surprising as other, much more subtle effects are expertly handled later on. The acting is suitably detached. All hesitant and stuttering, awkward and halting, with characters talking over each other. This seems to be an artistic decision, Director Olivier Assayas apparently wanting the demonstrate Maureen's sense of stylish isolation in this way: it does make some of the dialogue difficult to make out. After a series of text messages from a stranger, who Maureen believes is her brother, she begins tentatively to break the rules of her employment and wear some of the garments she has procured for Kyra. Clonking around the spacious apartment in haute couture and high heels feels (and looks) alien to Maureen.It's difficult to know where this is all heading.And suddenly, returning to Kyra's flat after more personal shopping and finding her employer gruesomely murdered, things instantly become very frightening. The addition of strange violent banging sounds somewhere inside don't help ease Maureen's nerves, and shortly she is being interrogated by the police. What happens isn't clear, but it seems to me that Lewis IS the mysterious texter: he appears to help her trap the real killer, Kyra's former boyfriend Ingo (Lars Eidinger).Now free, Maureen goes to visit boyfriend Gary (Ty Olwen) in the mountains. Once there, she is again confronted by the ghostly spirit who communicates with her.'Personal Shopper' is a film designed to attract extreme views: you'll either love it or hate it. I loved it, but I can sympathise with those who complain about drawn-out scenes watching Kirsten Stewart texting. There is a lot of that, but I had no problem with it. As much as anything, I enjoyed the vast, panoramic shots of various cities and locations; there was a definite comparison between Maureen's self-contained world and the hugeness of everything outside it.It's a long 'un: 105 minutes - and it moves very slowly. I have a love for this approach to horror films anyway, and so would strongly recommend it. You could get gloriously lost in Maureen's strange world, but you have to give it a chance."
" Uneasy & Unique...Haunting & Original...Kristin Stewart Captivates
",-0.3818,-0.3472,2017-09-07 00:00:00,8,"Defying all Preconceived Ideas of Genre, Categorization, Expectations, and Notions of any kind, this Art-House Movie is an Unsettling Treat for those that Seek Real Mystery in the Paranormal and Depth in Character of those that are Immersed in its Grip.Kristen Stewart Dominates this Powerful Picture of a Grieving Twin Sister that recently Lost Her Brother to Heart Disease. Both Twins, it seems, considered Themselves Conduits to the ""Other Side"" and Promised Contact if one of Them Passed.This is a Strange, Totally Unique Film that Haunts as it Follows this Troubled Woman on Her Quest to Find a Path to Another Dimension. If Kristen Stewart isn't in Every Scene, it sure Feels Like She is. It's Not an Easy Role and She Rides this Scary and at times Terrifying Tale of a Down to Earth Woman that is Reaching for Other Worlds.Infantile Viewers who must be Spoon Fed Puzzle Pieces of Meaning are Not going to Enjoy this Genre Bending and Baffling Display that has European Cinema Sensibilities.Others who Look for something Apart from the Usual and Far from the Mainstream will Find this a Rewarding Experience.Overall, Not for Everyone and must be Viewed with No Expectations or Preconceptions. It must be Approached with an Open Mind...just Like the Paranormal."
" Stewart Bares All - (all two of them)
",0.0,-0.6049,2017-09-03 00:00:00,2,"I kept falling asleep during this movie, so I really have no idea what it was about. There were scenes with Stewart striding about an old house and prying open doors; there's a scene where she is having a cryptic conversation with a guy who has a strong German (?) accent. She's telling someone she is medium and can communicate with the dead. She's lighting a cigarette. She's lighting another cigarette. She's being examined by a doctor without one of those paper gowns on so we get to see her sweet breasts (gratuitous nudity in my opinion). Everything is grey/blue and depressing and ultimately pointless."
" A subtle, yet deeply effective, psychological drama
",0.5256,0.9839,2017-09-02 00:00:00,9,"Assayas has done it again, it seems. After the delectably rich Clouds of Sils Maria, Assayas has once again spurred a sublime performance from Kristen Stewart in this illusive, cerebral horror film that, even with a goofy scene that should belong in the latest Ghostbuster film, remains sophisticated and truly haunting.As showcased in his last film, Olivier Assayas is ingenious when it comes to writing stories around his deeply engaging characters, and Personal Shopper is no exception. Stewart is incredibly convincing in her role as a damaged clairvoyant, still shaken by the death of her twin brother. Every scene works to add little pieces to her character that helps to greater understand her actions and rather subdued personality. This is easily the best Stewart has ever been, previous performances considered. She is certainly someone to lookout for in the future, as, at this point, she is a frontrunner of the next generation of actors. What is also undeniably impressive is Assayas' ability to tell a story in a heavily visual, almost poetic, way. He, unlike many directors working today, knows when to just let his actors ACT, allowing them to demonstrate their character building talents through minuscule movements and mannerisms that can't quite be explained through spoken dialogue. It's all so gorgeously organic.From the masterful building of tension leading to terrifyingly subtle moments of horror, to Kristen Stewart's brilliant performance, Personal Shopper oozes professionalism. A film that meticulously finds ways to crawl right under the skin of the viewer and linger with them days after."
" Interesting art-house flick
",0.4019,0.8261,2017-09-01 00:00:00,7,"Personal Shopper is a movie from the director of ""Clouds of Sils Maria"" and also stars Kristen Stewart once again. In this movie Kristen plays a character whose twin brother dies and she's looking for his ghost. They both believed in the afterlife and they promised to each other that when one of them days, they have to make contact to the other from afterlife.It probably sounds like I just described a beginning of a horror movie, but this movie is far from that. It's very weird, but it's very interesting too. While not really fun (well, it was never really fun to watch an art-house movie, the fun part comes after when you discuss it and try to figure out what the hell happened), it's certainly interesting. All three acts are very different from each other. The first act is almost a horror movie. The second act is the weak part of the movie, I really can't categorize it, maybe I psychological drama? I don't know, it's very slow paced and it's basically just Kristen Stewart's character shopping, texting and occasionally doing weird stuff. What's an art-house film without characters who randomly do something weird? And the third act is, again, a bit thrillerish with some supernatural elements. It's also a very ambiguous movie and leaves a lot of food for thought, but sometimes it's taken too far and important plot points are showed off- screen. Honestly, I wouldn't even mind it that much if the middle was interesting. In that case there would at least be some kind of balance. This way, it feels a bit off. But the ending is a great example of how to achieve ambiguity in a film. And in the less interesting parts, a bright spot was Kristen Stewart who carried the entire film extremely well and shows that she is one of the most interesting young actresses today. Too bad she's only popular for her worst roles.Overall, this was an interesting art-house film that could have been more interesting, but with its ambiguity, it leaves you thinking."
" Multiple Unrelated Movies Mashed Together that Somehow Mostly Works
",0.0,0.99,2017-08-30 00:00:00,6,"Personal Shopper follows a woman whose job is to be a personal shopper for a famous model, meanwhile her brother has recently passed away and she attempts to communicate with him from the spirit world. For starters, the directing is pretty great, right from the opening scene. Olivier Assayas clearly has a great idea of how to hold the camera to invoke a particular mood or portray a certain idea. In my opinion, he's the best part of the movie. Another one of the best things about this movie is Kristen Stewart. While she can be a little inconsistent, specifically with her line delivery from time to time, she is largely very good in this role, and it's really nice to see her continuing to try and do well at acting after Twilight. As far as the story goes, it's kind of a mess. As I'm sure you got that same vibe from my plot synopsis, there's a lot going on with none of those events really relating to each other at all. While I think it's interesting that Assayas decided to take a very different route with this movie, it's still just a little jarring how unusual and unrelated so much of it is. While I never questioned or got angry at the movie tone or character wise, it's still just a little weird to think about. And at times, the flow was lost a little with the awkwardness of all the entirely different plot points. Overall I liked Personal Shopper. It's a very unconventional movie, and it's certainly not for everyone. While the directing and acting is solid, the story as a whole is very unrelated and weird, and it comes off as pretentious a lot of the time. Furthermore, the pacing suffers as a result of all these story lines that feel like they should be different movies altogether. In the end there are very few people I'd recommend this movie to."
" What a waste of time and money
",-0.4215,0.6748,2017-08-29 00:00:00,3,"I couldn't believe I wasted 2 hours of my life on this film. Kristin has made some great movies in the past and we were looking forward to this ""horror"" movie. I'm guessing the producers were banking on her to widen their audience and cash them all up. Once this film was over in our household it was unanimous that it would have been switched off after 20 minutes. We were so optimistic and hoping it would improve but no luck at all of that happening. Do yourself a favour and spend your money on a real horror movie. This film would have no hope of scaring anyone."
