title,title_sentiment_score,text_sentiment_score,date,rating,review
" Depressing Iranian Drama
",-0.3818,-0.8151,2017-02-24 00:00:00,7,"Emad and Rana are a middle class couple living in an apartment building in Iran, which, for some unexplained reason, is being demolished without evacuating the tenants first. I guess the building codes in the Middle East are not as strict as here in America. The brooding husband and wife are forced to move to another place which had a mysterious previous occupant. Apparently, the woman who lived there was a prostitute with an extensive clientele. Emad is on his way home to the new domicile when his wife suffers a vicious, violent attack. Apparently, she has been mistaken for the last tenant. The couple are an actor and actress who are performing the very American play by Arthur Miller, ""Death of a Salesman."" They are working at a small theater which, I guess, is the Iranian equivalent to off Broadway here in New York. Emad also works as a school teacher to pay their living expenses. The film moves back and forth between the stage play and Emad's obsession with catching his wife's attacker. This is a thoroughly depressing journey, and although the lead actors are excellent, I was totally drained emotionally by the not so happy ending. The Salesman is nominated for best Foreign film at the Oscar's, but personally I would pick ""A Man Called Ove"" as a better choice."
" a crime film, a morality story, thrilling, tragic, full of real human beings up there on the screen
",-0.5267,-0.7738,2017-02-23 00:00:00,9,"I'm sure the play Death of a Salesman has something to do with the rest of this story, but aside from them both having a woman (in this film's story, off-screen) who has male 'customers', I still don't know yet. While The Salesman didn't hit the same emotional peak that A Separation did, this was drawn out in a gut-wrenching sort of way like that film does, where things are so realistic and yet at the same time there's always harsh and sorrowful pathos going on that we can be hooked into the furthering plight of these characters. It's in a way a crime film too, only it's a personal one.Farhadi's storytelling is close to a blend at its most pure of a kind of neo-realism and a film-noir, to draw out the old-time film comparisons; it's about seemingly every-day people who try to lead and good and productive lives (the main couple here are actors and the man is also a schoolteacher, while the other characters that come in the second half of the story are working class as well), and one terrible damn incident brings the world crashing down.As in A Separation the performances are particularly strong, but what I've noticed in these two films is how much Farhadi pays attention to the emotional lives of his women; Hosseini gets his dramatic moments, but he is mostly reacting to things, and tries to be tough and a MAN about things, while Alidoosti's Rana has to internalize this experience, and she is the one who really goes through a full, devastating arc through the film where, by near the end, she's become more of the grown-up and trying to see some reason and let sleeping dogs lie and such, though she's still scarred as well. Perhaps, in thinking it now, the Salesman story is significant as well in that that story is about a man and woman being torn apart by the man being so stuck in his ways, unable to see any other way to go about how to live his life. Hosseini's character wants to do what's right (for a few reasons the cops cant be called after this attack on his love happens as the critical turning point), but his idea for revenge or payback is spurred further by his anger and frustration. Or, to put it more simply: what happens when a family is torn apart by the truth - this, by the way, becomes what may or may not end up being the climax of this film.This is a heavy film, but rewarding because the actors are living so strongly in these moments, and we can empathize with them as well (which is the provocative part, as if Farhadi may be challenging us or himself or both to wonder) as a key character in the third act of the story, where it reaches its resolution - not to mention back where the story began, in an apartment that is unihabitable due to a man-made destruction - and because Farhadi is so vigorous in making practically every scene count. It's a painfully human tragedy (with maybe one or two minor laughs, almost like brief respites) that is able to be interesting, occasionally extremely and uncomfortably thrilling, and naturalistic at the same time, which is difficult to pull off. I may not rush to see The Salesman again, but I'm glad Farhadi continues to make films, and I'm more hopeful it'll win at the Oscars precisely because it is *not* political (except, of course, for how intensely it *is* a feminist story, simply in the sense that it's an Iranian film that feels deep compassion for its female co-protagonist)."
" I expected more
",0.0,0.9239,2017-02-22 00:00:00,7,"I love Iranian movies and the Separation is one of my favorites. Somehow with the Salesman it did not work out. The script is original but the story develops so slowly and drowns out. You do not feel the real drama and the true massage behind it. The director probably wanted to repeat his success using the same means as in the Separation but it lacks originality, something thrilling and insightful acting."
" Watch, watch, watch.
",0.0,0.5357,2017-02-20 00:00:00,7,"Without it yet being an actual problem, watching this felt like Farhadi has become a bit too self-aware, dangerously close to falling into the black hole of his own creativity. A tad too stylized, a lashing too structured, The Salesman is still a profoundly personal movie, anthropocentric to almost a fault without ever crossing that line; a fine balance the filmmaker has proved to be masterful at keeping.The story is simple, held elegantly against the backdrop of Miller's Death of a Salesman; a play in which our heroes are portraying the main characters as a recreational activity. The protagonists' plight is being juxtaposed with that of Willy's and Linda's, elevating the sudden darkness befalling their happiness to an allegory pertaining the small; those innocuous details that can either support or break a union in the aftermath of a domestic crisis.Much like Willy's burden of mediocrity, Emad is being defined by his own perceived inability to successfully tend to his wife, Rana, in the aftershock of an attack that quickly adorns their skin with wrinkles of instability. Cracks appear, on their walls of their home, the build of their marriage, the very foundation of his mental equilibrium and in the process of his wife's healing, the tables are slowly being turned.Rana lifts her chin in subtle pride as she dusts the burden of self-pity off her bruised shoulders and ventures to reestablish herself in a state of weightless normalcy. All the while, Emad seems to be caving under the pressure of his own contradicting duality -- a man who desperately seeks to regain control of a suddenly derailed life, a husband needing to protect, shield and amend in vengeful anger while, simultaneously, mending in kindness, fear, and worry. Two people journeying through life side by side are now being torn to opposite poles in a way subepidermal enough to have you fearing for their relationship without even realizing at what point exactly you reached that emotional status.Farhadi's signature move, it would seem.My personal gripe. The Salesman cuts deep without pushing -- a beautiful movie featuring some stellar acting by almost everyone involved, no argument there. However, and much to my disappointment, I found it falling short during the third act.Emad's inner turmoil leads to many spasmodic, irrational reactions from the beginning of the tale but during the last part of the film, the character becomes unrealistic, like the final scene had been already filmed and Farhadi needed to mold something out of nothing to just get us there.Underwhelming finish aside, the overall outcome is still worth of tremendous praise, even if, for some of you who might end up sharing my views, it finishes not in thunderous applause but a thoughtful sigh of contentment."
" Actor avenges attack on wife.
",-0.4767,-0.9986,2017-02-17 00:00:00,10,"In The Salesman the actors starring in an Iranian stage production of Death of a Salesman live parallel tragedies on and off stage. The first shot is of a rumpled marriage bed, the setting for intimacy and sexual drama. Those values adhere even when the situation is a theatre set. The narrative unwinds from a reported sexual scene, where the heroine is somehow violated by a stranger in her shower. Using an American classical play sets off an immediate contrast between the Iranian and American cultures. The Arthur Miller play anatomizes the shallowness and materialism of American capitalism. It establishes a struggling low-born salesman — Willy Loman — in the function of the traditionally high-born tragic hero. An Iranian production of the American classic would be expected to emphasize the superiority of the Iranian culture. Hence the gaudy summary of the US in the set's neon Casino and Bowling signs. But the choice of a Miller play pays respect to the freedom that political theatre enjoys in America. Hero Emad is delayed that fateful night when he has to stay to deal with the state censors who want to make three cuts in the script. As a literature teacher he's again frustrated when the school rejects his three texts as inappropriate for his teenage boys class. Despite that puritanism the Iranian society is also riven with sexual temptation. Emad explains that the woman who objected to sitting beside him in the taxi had probably been discomfited, perhaps even molested, by another man on another shared taxi ride. The pictures Emad finds on a pupil's cell phone are probably like the raunchy stuff on American boys' phones. At the other extreme the pathetic old man is tempted to sin by the sight of the showering Rana.That schoolboy's not having a father sets a pattern of missing or questioned manhood. The supporting actress has a little son but is separated from her husband. The little boy's obtrusive glasses suggest a preternatural vision, lending weight to his line: ""If my father phones say I'm not in. I like Mommy more."" The boy lives his mother's life so completely that he not only attends her rehearsals but joins the curtain call onstage. The central issue is how Emad and Rana deal with her violation. If Willy Loman's downfall is his seduction by the American myth of popularity, Emad's is for the Iranian myth of male honour. Because the man is held dishonoured by his wife's shame Rana is more traumatized by the old man's appearance in her shower than an American wife would be. Not till the end do we realize that she was not raped and only injured herself by falling through the glass shower door. To avoid further shame Rana determines not to go to the police. She remains traumatized by the experience, too ashamed to return to her professional activity of being watched onstage by men. With his honour pre-eminently at stake, Emad resolves upon revenge. He tracks down and traps the villain. When Rana sees him, she determines to prevent Emad's plan to shame him before his wife of 35 years, his daughter and her fiancé. ""If you tell them we are finished."" Emad seems to accept her decision. A largely decent man himself, when he sees the old man and his family he relents and seems ready to let him leave. But he has another score to settle. He gives him back the money he left behind, then slaps him. That last action pushes the ill geezer over the edge. With his death, Rana's love for Emad is finished too. His insensitivity to her trauma was bad enough — It's a guy thing — but his insistence upon revenge, a fatal excess, is to her unforgivable. Like Rana's shame, Emad's revenge is based on the Iranian principle that a woman serves her man's honour. After her initial trauma Emad seems to feel more violated than his wife. After she labours over a special dinner Emad refuses to eat it because it was bought with the intruder's money. At the heart of Emad's characterization is his exchange with a student over a story: ""How does a man turn into a cow?"" ""Very gradually."" Determined not to be a cow, a wus, Emad plunges bullheaded toward a revenge that costs a man's life and Emad his marriage. Against the current of both Iranian and American culture, this film emphasizes the woman's merit as a civilizing, humanizing force.The first Miller scene we see is where his son catches Willy in a hotel room with a local floozy. That costs Willy son Biff's respect forever. Emad's vengeful plan is to similarly expose the old man before his wife and daughter. It's as If Emad took his strategy from the play instead of from his wife's better sense. The omission of Death from the film's title points to another key difference. We see Emad as Willy, dead, in his coffin, while wife Linda grieves at the paradox that she has just paid off their mortgage: ""We are free!"" But the film ends on Emad staring stolidly, vacantly, as his makeup is peeled off. The character is dead but the actor is alive. But his marriage is dead and so Emad is no longer quite alive. He's an image of death in life, literally alive but emotionally dead. His revenge killed him along with his enemy. In Death of a Salesman we see the themes and events through to Willy's death. In The Salesman the death is omitted because at the most superficial level the hero remains — however emptily — alive."
" Iran in a Microcosm
",0.0,0.9592,2017-02-13 00:00:00,8,"The draw of director Asghar Farhadi oeuvre at times feels very political. The widening cultural, religious and diplomatic gap between the United States and Iran has thus far been stabilized by chilly detente of necessity. Yet if we take our current political climate seriously, such distanced estrangement wont likely last past the New Year.Still film artists like Farhadi, Mohsen Makhmalbaf and the late Abbas Kiarostami have been at the forefront of this complex sandbox of truces and tough talk, making films about Iranian society that easily find reception among America's leftist intelligentsia. Their work, while often critical of Iranian society, nevertheless channels some powerful messaging. They often feel like cries for temperance and peace in a world that becomes ever more belligerent with each passing moment.The Salesman doesn't break that continuity, once again garnering a cultural exchange while engaging its audience with an innately human story. The film begins abruptly with a young couple, Rana (Alidoosti) and Emad Etesami (Hosseini) being forced out of their apartment in the middle of the night along with their neighbors. Their building has become unstable after an earthquake and they are desperate to find a place to stay. Babak (Karimi), a fellow player in the couple's production of ""Death of a Salesman,"" suggests they replace one of his tenants who has been struggling to pay her rent.To explain more would ruin the discovery of one of the most morally complex and painfully human stories since A Separation (2011) to come across the screen. All of the character choices seem genuine and perfectly understandable given the circumstances yet the buildup from those decisions come back in interesting and often devastating ways.Emad, a schoolteacher, approaches most of his problems through an amalgam of analysis and judgment yet the implications of the script trap him in a doleful dilemma he simply can't shake. So too does the script trap the sensitive Rana, who at a pivotal moment becomes fractured like the windows of the couple's slowly collapsing apartment. She suffers through sullen drifts and withdrawals, angry outbursts and bouts of pity; and does so through a filter of feminine devoir.As our female lead, and really, our emotional interpreter, Taraneh Alidoosti's is frightfully on point. Her continual work with Farhadi over the years seems to have given her the ability to really take chances with this role. Her every gaze feels like a provocation and her character's improbable honor wells with a sense of sad power thanks largely to her expressive face.The fact that The Salesman features Arthur Miller's ode to the common man is very appropriate indeed. While the play within the movie balances themes of justice, trust and the abstraction of political violence, the film takes those same themes and filters them through the emptiness of personal revenge. How appropriate then that Emad, plays Willy Loman, a character who's powerlessness leads to his ruination.Much like About Elly (2009) however, The Salesman has a habit of reaching its moral conclusion far before reaching its actual, physical conclusion. The third act, while strong and refreshingly classic in its humanism, can't help but feel like it's dawdling; leaving its human frailties exposed like bleaching bones. Additionally, in today's political climate, Farhadi's chase for universality can't help but look like he's purposely pandering to his western audience. Don't get me wrong, the film is still very much a depiction of modern Iran in microcosm, but now there's a lens of compromised diplomacy.That said, The Salesman is still a strong work of social commentary that approaches the staid, workmanlike zenith of Farhadi's best works. Shahab Hosseini and especially Taraneh Alidoosti are pitch perfect as a young, childless couple that struggle with tough moral dilemmas and the feckless invisible structures that force them to plow through them."
" 4.5 stars... Justice, Iran-style: a human psychological action movie for the mind
",0.5267,0.9962,2017-02-11 00:00:00,9,"""The Salesman"" (2015 release from Iran; 125 min.) brings the story of Emad and Rana, a married couple who enjoy their lives ""in the culture"", as a neighbor comments, and they are the lead performers of a local staging of Arthur Miller's ""Death of a Salesman"". As the movie opens, Emad and Rana are forces to leave their building as the walls are close to collapse (due to nearby construction). An acquaintance in the theater group is able to get them a new apartment on little to no notice, but doesn't mention the previous tenant was known as a ""woman with may acquaintances"". Then one day, when Rana is home alone, someone rings the bell. Rana, thinking it's her husband, lets the person come up and in the apartment. The person assaults Rana in the shower. To tell you more of the plot would spoil your viewing experience, you'll just have to see for yourself how it all plays out.This is the latest movie from Iranian writer-director Asghar Farhadi, whose previous work includes the outstanding ""A Separation"" (which won Best Foreign Language Movie Oscar) and ""The Past"", just to name those. Here Farhadi examines the consequences of an assault on the marriage of a young couple. Keep in mind the movie is set in Tehran, where even with its more progressive leanings in certain circles (like those ""in the culture""), the shame of a sexual assault cannot be overestimated. The question is of course, who did this heinous crime? and will the person be brought to justice? I am biting my tongue and shan't reveal any further. Just be aware that the second hour of the movie is like a human psychological action movie for the mind. The lead performances are outstanding: Shahab Hosseini as Emad (he won Best Actor at last year's Cannes Film Festival), and Taraneh Alidoosli as Rana. This movie has won major acclaim after acclaim since its premiere at Cannes, and is rightfully nominated for this year's Best Foreign Language Movie Oscar. Here's hoping it wins. As a complete aside, there is only the slightest hint of the (supposedly) oppressing religious culture in Iran: the people portrayed in the movie are quite ""normal"" by Western standards. Is it really so in today's Iran? I haven't the faintest idea, as I've never visited Iran myself.""The Salesman"" finally opened this weekend at my local art-house theater here in Cincinnati, and I couldn't wait to see it. The Friday evening screening where I saw this at was attended nicely, but by no means anywhere close to a sell-out. I can only hope that as positive word-of-mouth gets around, more and more people will want to check it out. If you've seen ""A Separation"", in spirit very similar to ""The Salesman"", or if you are simply in the mood for a top notch human psychological drama that happens to come from Iran, don' hesitate and check this out, be it in the theater, on Amazon Instant Video, or eventually on DVD/Blu-ray. ""The Salesman"" is HIGHLY RECOMMENDED!"
" Farhadi, the master of family drama strikes again
",-0.3612,0.9926,2017-02-06 00:00:00,6,"""Forushande"" or ""The Salesman"" is an Iranian movie that premiered last year. It runs for slightly over two hours and was written and directed by Ashgar Farhadi, who has been among Iran's finest filmmakers for a long time now, even if it took until his Oscar win for the world to finally really pay him attention/tribute. For me, it's between him and Panahi who is the top filmmaker from this troubled country right now. As for the cast here, I cannot say I am familiar with anybody, but this is certainly my loss as they are all doing a pretty good job and interestingly enough, the probably biggest supporting actor in here is somebody who worked as an editor for a long time until he finally started acting in film. But the best performance here comes from Shahab Hosseini of course and if he wasn't already, he now is a definite part of the Iranian acting elite. Lets take a look at the story. A couple of artists move to a new apartment where a prostitute (interesting how they avoid using this word) lived in before and the result of a tragic coincidence is that a man suggests she still lives there and forces her to have sex with him. The money he left there afterward certainly implies that rape was never an intentional factor. So it is a crime where really nobody can be blamed. The open door, the previous tenant's background, the client's harshness, it all played together in a wrong-place wrong-time kind of scenario.Rape sure is an important subject at the Academy Awards this year as Isabelle Huppert is a nominee and possible dark horse for the win for her performance as a rape victim in ""Elle"". And this Iranian movie here is in a similar position at the Best Foreign Language Film category at the Oscars. It is not the front runner, but there is definitely the option that it may cause an upset to the German entry as Huppert may cause to Stone. Now back to this one here: Shahab Hosseini is the heart and soul of the film and he is in basically every scene of these 120 minutes. He does a magnificent job and I hope this somehow gets him parts in Hollywood movies. If he wants to, that is. There is no denying he brings the talent to (co-)star in blockbuster films. As for the film itself, I think it was a good watch throughout, but it may get slightly overrated as a whole because of how impressive the last 30 minutes were, especially the first scene between Hosseini and Karimi, which was absolute edge-of-seat material. Sadly, there was an occasional length in the first 90 minutes, which is why I would describe this movie ""only"" as a good film overall, not a great film. I still believe it is more Oscar-worthy than Toni Erdmann, another good film that did not have the great moments this one here does.Finally some more words on ""The Salesman"". I have not seen ""Death of a Salesman"" and I must say the theater parts did the least for me, maybe because these take away from the pure moments of interaction between the two protagonists, or maybe also because I had no idea why Farhadi chose ""Death of a Salesman"" as the play here. Maybe you need to have seen it to understand all the references in this film's plot. But even if you have not like myself, it is still a very tense, enjoyable (sounds not like the right word to be honest) watch in its entirety and Farhadi once again proves that he is a real master of family dramas right now, as good as it gets in depicting life and the way it changes when drastic events may destroy the harmony and everyday life. Highly recommended, for Hosseini's performance alone. And Farhadi's background also takes us into a country where we know very little about, so this insight into society and communities is informative on a level where you actually learn new aspects every scene."
" Just Sink Into Farhadi's Rhythms & Sense of Place
",0.0,0.9264,2017-02-02 00:00:00,9,"While not the masterpiece of ""A Separation"" or ""Firework's Wednesday"", it's none-the-less always wonderful to have a new film by Asghar Farhadi in the theaters here in the States. His humanism and naturalism place him on equal footing with the Dardenne brothers and the fact that he's doing his social character cinema in Iran makes him even more important to a Western viewer. This film quietly unfolds, taking its time. Not having any notion of the plot going in allowed me to sink into Farhadi's rhythms and sense of place and allowed his turns of story to take me by surprise. Eventually, the current reaches an incredibly charged, tense, and emotional last act that never once falls into traditional narrative traps. The final few shots are masterfully simple and perfectly contextualized, supporting a whole film's worth of meaning in and of themselves.My adoration for Farhadi remains."
