title,title_sentiment_score,text_sentiment_score,date,rating,review
" Technically sound but lacking a point
",0.0,-0.9938,2018-06-03 00:00:00,2,"I enjoyed this movie as I was watching it, with my admiration growing and reaching a crescendo up until about 10 minutes from the end, at which point things headed seriously south. But as the credits rolled and the distractions of the brilliance of the acting and execution disappeared a whole wave of questions came crashing down which pretty much destroyed the underpinning logic of the whole story and undoing any redeeming features it may have hadIf you look at the ""story"" scene by scene there is very little that stacks up as being logical or natural and the whole thing is exposed as a rickety structure stuck together by bits of string and sealing wax by the director/writer to make some point. While this lack of logic might be forgivable if the point was worth the deception, personally I fail to see what exactly that point is, let alone what it might be worth. Speaking of rickety structures, let's talk about the collapsing building first. Surely this must be the most ridiculously outrageous and unlikely scenario ever concocted to provide the relatively simple premise of someone having to find a new flat. Is the art of building in Tehran so basic that this sort of thing happens on a regular basis? Was that quick cut to a piece of digging equipment supposed to imply that this was the cause of this disaster? Really? And what on earth is the whole point of ""The death of a salesman"" side issue? If this is supposed to be the classic ""play within a play"" conceit, a la Saura's Carmen, then I must have missed something, for while indeed in the film's coda a (shirt) ""salesman"" may indeed have died, if there is any similarity beyond that it went right over my head. And the whole crucial set up of why Rana left the door open is totally tenuous to say the least. As for the culprit rushing off leaving his keys, his phone and his pick-up truck? Ridiculous. And just how did that glass get on the stairs and why did the culprit not have his shoes off? And while his socks were found, where were his shoes? And how come the pick-up truck, apparently a crucial part of at least 2 businesses, was allowed to remain at the flat for a number of days without any of said businesses missing it? And what is all the nonsense with the previous tenant leaving all her belongings at the flat, something that is entirely irrelevant to the story. And how did Ehmad suddenly end up at the Hospital and why is he so unmoved by his wife's plight? What exactly did happen to Rana we never find out - it is ridiculous to think the old man hurt her so we can only presume she slipped and hurt her head. Why was it not possible to find out more information on the man's phone, even if it was ""cancelled""? Why was the pick-up truck not examined in detail? What was the point of that episode with Ehmad in the car and a lady wanting to change seats? Why would Ehmad think that the driver of the pick-up truck was the culprit when clearly it is a commual vehicle? Why did he not confront the suspect on the spot instead of making up some hare brain story about wanting to move some things? Why would the suspect actually agree to this, and why when he couldn't come in person would he send his future father in law who is half dead and lucky to make it up the stairs? Who is stupid enough to lock a half dead man in a closet for hours?This, then, is the house of cards that forms the backdrop to the ""story"". So what is the actual ""story""? Basically it can be summarised in a very few simple sentences. A woman is ""assaulted"", although we never find out if this is because she was startled by a peeping tom and slipped, or whether she was bashed over the head. Said woman has PTSD, well fair enough. Woman's husband is not angry but resentful of woman's subsequent behaviour. Husband identifies the ""culprit"" and threatens to expose him to his family. His wife gives an ultimatum that if he does so she will leave him. For a moment all seems well and the culprit's family start to take him away. Then, for reasons only known to the husband he reneges at the last minute and exposes the culprit to his family. An ambulance arrives the culprit may or may not be dead and the wife walks out the door.If anyone can tell me the meaning of all this they are a better man/woman than I am. If the movie had stopped before Ehmad exposed the culprit it could at least have ended on a poignant note of redemption and forgiveness, a cliche perhaps, but at least a good one and one that would have redeemed the movie despite its many flaws. By allowing Ahmed to expose him the director destroyed any possible payout for the audience and all we are left with is a bunch of question marks set against an artificial world and involving people we really don't care too much about.In conclusion all I can do is echo what I have already said in my review of another movie by this director (""About Elly""), which is that this movie seems largely an academic exercise pretending to be something deeper than what it actually is."
" One of the best films.
",0.6369,0.7579,2018-04-05 00:00:00,10,This realistic movie is one of the best films that show the truth of Iran society.
" Could have been worse
",-0.4767,0.8952,2018-03-01 00:00:00,6,"I honestly didn't expect much from this movie. Not to be rude or anything but a Persian movie is not really my idea and expectation of a good movie. I just imagine that there will not be much freedom of directing and so on. I also think it's my first Persian movie ever that I saw. I didn't know any of the actors but they were quite good actually. The movie itself wasn't bad but not great either. It's one of those movies I don't regret watching but I'm pretty sure I won't watch it a second time and that I will forget about it in a couple weeks. The story was okay, but just a bit too slow for me. And it also could have been a bit more feisty, with a bit more revenge at the end. But that's my personal choice. All in all it's an okay movie to watch once."
" Another superb film by Asghar Farhadi
",0.6249,0.9816,2018-02-19 00:00:00,9,"Emad (Shahab Hosseini) and Rana (Taraneh Alidoosti) are a couple living in Tehran who work in theatre (currently performing in ""Death of a Salesman""). In their newly acquired apartment, Rana is assaulted by a stranger and suffers post-traumatic stress. Emad vows revenge.A major event in the movie's first half takes place off-screen. This leaves the viewer in the position of judge rather than witness as we can only surmise events from what others have told. The movie's first half is good though relatively plain. But, as the viewer learns later, it is a build-up to an unforgettable second half. This is a wonderful contrast to the many films where the opposite is true. When a movie's second half is the better one, the viewer is given an unofficial extension of the movie as its impact continues well after the ending.Director/writer Asghar Farhadi brings to ""The Salesman"" similar themes (and greatness) as he did with ""A Separation"" (2011) and ""The Past"" (2013). Among the various characters, we in the audience can understand why some would hate others but, by the end, we have compassion for every single one of them especially after we learn more information about the ""villain"". In this way, Farhadi is not just a great storyteller but a fine humanitarian as well. By giving all viewpoints sincerely, he challenges viewers to not only do reconsider anger in our personal lives but possibly in how we look at the world as well. This is noble considering the current state of our world.Hosseini and Alidoosti are quite good in their performances but the standout performance comes from Farid Sajjadi Hosseini as a character who enters the picture only in the second half and leaves the most impact in the movie.Like ""A Separation"" and ""The Past"", ""The Salesman"" is food for the soul and it confirms Farhadi as one of the best movie-makers in the 2010s.OUTSTANDING ACHIEVEMENT: Screenplay by Asghar Farhadi"
" But it is a great tragedy for Iran.
",-0.1154,-0.4595,2018-02-18 00:00:00,7,One of the most beautiful films of the year. It's a simple thing for Europeans. It's a common misunderstanding. But it is a great tragedy for Iran. Because a foreign man saw a woman naked. They are even embarrassed to tell the police.
" dumb and puritanical
",-0.5106,-0.9818,2018-02-04 00:00:00,1,"Walked out. 
Film is stupid, annoying:
The movie is so anti-sex that the characters kept accusing a prior neighbor of promiscuity, to blame her and explain the ensuing evil (the rape, primarily).
The supposedly intelligent husband stupidly assumes, without talking to her about it, that his wife is ready to jump right back on stage after being violently raped and hospitalized."
" Does revenge feel good?
",-0.128,-0.0414,2018-01-01 00:00:00,8,"I decided to watch The Salesman when I found out that it beat the brilliant Land of Mine to best film in a foreign language at last years Oscars. Was it as good as Land of Mine ? well maybe not quite but I'm really pleased I watched it.
It's the story of a couple are forced to leave their collapsing apartment building, when a friend offers them a flat to live in but he doesn't tell them this it was formerly inhabited by a prostitute. While home alone at night and taking a shower, the wife is attacked, and has difficulty coping with the aftermath. 
This is a film set in Iran but it could be set anywhere. The people in this film are just like you and me and although there are cultural difference you wouldn't really know it in this film.
Writer and director Asghar Farhadi has made thought provoking film about disgrace , revenge , and pride and the cast do him proud. 
The Salesman is available on Amazon."
" A fascinating dramatic effort
",0.5423,0.9759,2017-11-14 00:00:00,8,"Winner of this year's Best Foreign Language Oscar at the Academy Awards, The Salesman continues on Iranian director Asghar Farhadi's stunning recent collection of dramatic works that includes fellow Oscar winner A Separation and Golden Globe nominee The Past.An intense and intimate drama that veers into a character driven and decision making thriller in its later stages, Farhadi's film focuses on the fractured relationship that begins to build between married couple Emad and Rana Etesami after Rana is violently assaulted in the couples new rental property.Brilliantly played by Shahab Hosseini and Taraneh Alidoosti respectively, Emad and Rana are both believable characters and well-drawn ones, staples of Farhadi's ever increasing strong body of works, and their separate journey's in learning to deal with and overcome this violation of their lives is one you as an audience member will be drawn into like a moth to a flame.Emad who's initially a strong and respectable figure, a beloved teacher and theatre actor (the title of this film relates to Emad and Rana's role in a stage production of The Death of a Salesman) finds himself increasingly captivated by the quest to find the perpetrator of the assault on Rana, that slowly but surely unravels his usual in-command lifestyle, while Rana's mental mindset and ability to cope with the trauma of this event sees her become a shell of her former self, unable even to do mundane run of the mill tasks.Farhadi expertly deals with this situation that arises in the Etesami's life, the film feels almost like a documentary, so real are scenes played out and as Emad's quest takes a potentially dangerous turn as the film enters into its final stretches, The Salesman's tension riddled and fiercely real situation's become some of the year's most wholly captivating, as we're trust headfirst into decisions that will affect these characters lives till the end of their days.Final Say – The Salesman isn't flashy cinema but Farhadi's carefully considered drama has a raw and poignant power that will lay its grip on viewers and won't let go until the credits roll, making The Salesman another fine feature film from one of the world's most consistent and original filmmakers.4 sleeping teachers out of 5"
" Director Need Lessons
",0.0,-0.5334,2017-10-17 00:00:00,3,"""The Salesman"" is a pre-bad (worse than bad) movie; a nugatory one. It neither sells anything nor buy. It is unable to sell and buy and incapable of dealing or discussing at all.It's a not-yet-made, confused and passive movie to which the action happens- from the outside-. It doesn't have any sort of action of its own, let alone character. It's a movie with no story, script, directing, camera-work, or editing.The movie doesn't even have an acceptable ""what"" due to a hollow script to which anything enters and from which anything exits. The script lacks many necessary things but contains lots of useless ones, instead. Of course, nothing has been aesthetically removed from the script, for nothing is there in the first place. Thus the writer doesn't have anything at all to remove.The movie is incomplete, unfinished and ""open"". The director doesn't know that an ""open"" phenomenon is not a phenomenon yet. It can be open only after it is able to be closed and after it is completely finished.Our director, as if he knows that his ""The Salesman"" needs a lot of effort yet to be a movie, attends lots of interviews and attaches himself to his dumb movie. He pretends to be oppressed, spark controversy about himself, and soothe himself by making a ""modern"" pretension to be intellectual and relativist. Thus, he pleases himself for ""causing the audience to have a mental challenge"" and ""that the audience is full of questions while coming out of the theatre is of worth"" for him.One should remind him that it is not worthy at all if the audience come out of the theatre being confused by lots of unanswered questions. It is not worthy at all if all of those questions are about the ""what"" of the story but not ""how"" it is told. it is not worthy at all if the origin of the questions is the audience not facing a specific and finished story by which he can reach the ""how"" and experience.He (the director) has left us no other choice but to remind him that cinema is neither a horn nor a riddle. A work of art is a live experience, not a proposition or the answer to several questions. Art is not a statement, but the way of stating. The audience's challenge with a good work of art is intuitive and emotional, then intellectual. The intellectual who doesn't have the slightest idea of feelings, is one of the concept-oriented people who can never understand art.The audience's main question about this vague and passive movie is the following: ""Is someone raped or just attacked?"" In order to pretend that the movie is important, the director decisively says, in one of the interviews, that ""no one is raped."" Nevertheless, the movie implies the opposite. Not in its mise en scene- which isn't actually there-, but by two dialogues; one is of the wretched violator's (""I was tempted."") and the other one is of the doleful victim's (""I wish I were dead.""). In another interview, with a Hitchcock sense of humor- which doesn't fit him at all- the director mentions that he hasn't been in the bathroom, so he doesn't know what has happened."
" Layers of Character Development
",0.0,0.6345,2017-10-10 00:00:00,10,"Well deserved 2017 Oscar for best foreign film. A tight psychological drama about personal family drama in Tehran. Starts slow, but once it grabs you, it doesn't let go. A surprise if you think that Iran is a cultural vacuum of nuclear Islamic fundamentalists. Hollywood hasn't a clue how to make a movie like this."
" Farhadi's dramaturgy still rocks, but a fly in the ointment is that his hand-picked moral tale needs some tweaking
",0.0,0.9134,2017-09-27 00:00:00,8,"Iranian moral dramatist Asghar Farhadi's seventh feature THE SALESMAN wins him a second Oscar in the BEST FOREIGN LANGUAGE PICTURE bloodbath amid a political fracas, which in my humble opinion irrevocably influences the end result. The titular salesman refers to our protagonist Emad (Cannes' BEST ACTOR recipient Hosseini), however he is not a salesman by vocation, but a high school teacher presently headlining a play of Arthur Miller's DEATH OF A SALESMAN, in which his wife Rana (Alidoosti) also stars. In the movie's opening, they are evacuating from a collapse-prone building where they live, and among all the ruckus, Farhadi smartly bookends it with two cracks on a windowpane before showing us an excavator working on the ground outside, a brilliant visual pointer to adumbrate what comes next: Emad and Rana's bonhomous relationship is going to crumble after an incident, and the rest of the film will sure-footedly take us to comb through their ordeal and elicit what is the crux. The incident occurs in the new apartment where the pair just moves in, although Farhadi opts to keep the happening off the screen, when someone buzzes their door, Rana takes its as given that it is Emad and leaves the door open without asking who it is (a plot devise looks implausible falling upon a Muslim woman who is alone at home, in the buff, though Farhadi furnishes the couple with a more Westernized predisposition), and later is assaulted by a man when she is in the bath, blood is spattered but she survives. Few details are revealed by a traumatized Rana, to an extend it, purposefully, hinders viewers' final verdict on this atrocity, it seems like the old chestnut of leaving audience to formulate their own judgement, but in this case, it recoils on our perception of the story after its lachrymose climax, during which Farhadi makes great play of his compassion manipulation excesses. But which side should we take is precisely predicated upon the missing pieces, otherwise, the entire drama degrades into a moot point. We can side with a perturbed Emad, who takes it on himself to track down the assaulter and implement his eye-for-an-eye revenge even impelled by Rana to keep the truth under wraps from the assaulter's family, or conversely, we should feel disposed towards Rana's magnanimous gesture, even a sordid soul deserves some sympathy, or, more deleteriously, is there a sideswipe on her too, because she should be partially responsible for what happened to her and should her relenting smack of an atonement for her own slip-up? Farhadi takes chances of complicating the central mind game out of artistic license, but the catch is that, regarding the situation's nature, this is not a case of splitting the difference, there are ambiguity residing in this imperfect patriarchal society where shame/humiliation often linked with a putrid waft of machismo, but if we look it through a more matter-of-fact angle, Rana is the victim here, both physically and mentally, why on earth she cannot have the final say on the subject matter? Maybe this is what Farhadi contends, but it doesn't pack an epiphanic punch as his previous works have done. Be that as it may, THE SALESMAN has its incontrovertible mastery in the vein, the paralleled three- act play-in-a-movie aptly mirrors Emad and Rana's fix in the real world (disillusion is the commonality) and the film's tension building-and-retaining process is par excellence in today's cinema-scape. The leading roles are entrusted to two Farhadi's frequent collaborators with arresting outcome, in particular, Shahab Hosseini amazingly holds sway as a reluctant terrorizer in the play off with a humbled Farid Sajjadi Hosseini, not the usual suspect of a sex offender, and not to mince words, Farhadi's dramaturgy still rocks, but a fly in the ointment is that his hand-picked moral tale needs some tweaking."
" An argentine melodrama in Farsi
",0.0,0.7874,2017-09-03 00:00:00,7,"I applaud director Farhadi for making Iran more accessible to outsiders, focusing on modern urban issues, and making Tehran more internationally relatable. But I'm not a fan of his pacing or how he plays out the drama. I had low expectations as ""A Separation"" lost me due to the unrelenting yelling between its characters. ""The Salesman"" was more lively and allowed its characters to have more emotions. But two things ultimately distracted me: the first was the uneven pacing. The movie would pick up but then drag, and the worst part being the final act; just as the dialogue, drama, and suspense were at its best, and Farhadi has you feeling empathy for everyone, he does not know when to quit, and gives us almost 20 minutes of people crying.The second one was: I realized that he was just making an Argentine film. If you've seen Argentine cinema, that you'll notice that, aside from the occasional dark comedy, they're mostly slow-paced melodrama about relationships between family members and the communities, where people go from being numb to an ultimate eruption of emotions. Even their thrillers play out this way. Shahab Hosseini looked and acted like Ricardo Darin, down to the body language and linguistic pacing. Thus, I felt like I had seen this movie a dozen times before.It is no surprise to me that Farhadi's next film is set in Argentina and involves Darin."
" The Salesman (2016)
",0.0,-0.8502,2017-08-09 00:00:00,8,"This film made waves at the Academy Awards (not just for the Academy boycott). I've been meaning to check it out at some point, and finally had the opportunity to watch it on an airplane during a flight. I've heard of A Separation but never watched it. Going in pretty blind into this film, I was very pleased with the end product. I read Death of a Salesman in high school and was able to spot some parallels.The film is about a husband and wife who work in theatre (on a production of Death of a Salesman). One night their apartment starts collapsing so they move into a new apartment. Soon the wife gets attacked in the shower while waiting for her husband. The husband becomes consumed with finding out who attacked his wife and attempts to pursue the culprit even as relationships around him start falling apart.A lot of people didn't find this to be as good as A Separation, or so I've heard. I thought the script for the film was quite sharp. Like Billy Loman in Death of a Salesman , Emad's relationship is on the rocks. He must also try to avoid the humiliation of what occurred within his family and must wrong the right. While the film is a bit of a slow burn on finding out who committed the act, the clues leading up to the reveal and the ride is very fun to be a part of.I found the last 30 minutes or so of the film to be powerful and it also helps to ascend the film to a higher rating. Its gripping and hard to keep your eyes off of what happens next. Its suspenseful but yet innocuous You know there's no immediate danger to the lead but wow its a joy to watch what transpires. I will have to eventually check out A Separation, especially if its more acclaimed than this.8/10"
" Another Slow Burn
",0.0,-0.9856,2017-07-31 00:00:00,8,"Iranian filmmaker Asghar Farhadi delivers another slow-burn domestic drama in this movie about patriarchal insecurity and helplessness.The film isn't as gripping as ""A Separation,"" but it's still a fascinating character study of a middle aged actor whose wife is assaulted (the details of her assault remain vague, both to him and to the audience) and sets off on a grim mission to seek vengeance on the attacker in whatever way it presents itself. Juxtaposed to these scenes are ones showing him perform in an Iranian production of ""Death of a Salesman,"" the ultimate male mid-life crisis story. Like watching a car accident in slow motion, we see him move closer and closer to his goal even as his wife wants him to quit and we gain some sympathy, however slight, for the attacker. As in ""A Separation,"" Farhadi constructs a complicated set of characters with complicated emotions, not interested in good vs. bad or even right vs. wrong, suggesting instead that perhaps everything is to a greater or lesser degree a shade of gray. But the story he builds around these events isn't as compelling as ""A Separation,"" so the film doesn't have that earlier one's dramatic punch.Winner of the 2016 Oscar for Best Foreign Language Film, though the excellent German film ""Toni Erdmann"" really should have won.Grade: A-"
" As real as it gets
",0.0,-0.9473,2017-07-29 00:00:00,10,"As with other Asghar Farhadi movies, this movies is an authentic window into real life. You can empathize with every character. Every line of dialog is realistic. The acting is superb. The twists of the story are not forced, rather fit organically with the story and how the characters think and receive information. The subject matter makes it hard not to vilify the antagonist but Farhadi manages to do so by shedding light on their layered character and motives. Just as in real life, the people who do evil are not pure evil themselves.The realistic portrayal of the movie also makes watching the movie a self-exploration journey. You can't help but put yourself into the shoes of the characters and think what you would have done differently."
" Terrific movie, you just need a bit of patience
",0.4767,0.8807,2017-07-24 00:00:00,9,"This movie is a beautiful drama, the build up is gradual and the intensity reaches a crescendo during the last 30 minutes which is an absolutely spell binding piece of acting and storytelling.The film shows Iran as a very normal and sensible society yet because of the respect the culture awards older people which makes the climax even more astonishing.It took a while for me to get into it, I was on a flight and was dozing in and out until around 44 minutes before the end, when its just engrossing."
