title,title_sentiment_score,text_sentiment_score,date,rating,review
" underwhelming... sort of
",0.0,-0.5933,2021-04-05 00:00:00,7,"After watching A Separation, The Past and About Elly, i had a high expectation of The Salesman. It still has a Asghar trademark, visually simplistic, no music and great acting. But unfortunately, the story felt a little flat and dragged. The 'twist' is underwhelming, with no actual resolution of the story."
" Slow drama developed
",0.0,0.4404,2021-03-09 00:00:00,7,Slow in drama development. Another Elly us way better
" a bad film
",-0.5423,-0.9666,2021-02-23 00:00:00,1,"Bad film by Farhadi Irani, the award-winning director of foreign festivals, still shows the blackness of his country to win a foreign award, which has now reached its goal, but I consider this film to be one of the newest, worst, saddest and most famous films. I know the movies. Hell shows the audience. Where it is said in the conversation that the reconstruction of Tehran is not right! This movie is not good at all. 1/10"
" FAMILIAR EMOTIONS.
",0.0,0.7783,2021-02-18 00:00:00,7,"In this film we found familiar emotions, slowly hiding inside a behind big and tall cultural wall. I liked it. I felt so close and so far away to the characters at the same time. A nice slow burn building tp a rewarding climax."
" Natural storytelling and performances, but very long winded movie that drags on
",-0.0772,0.8681,2021-02-15 00:00:00,6,"Culturally-informative tale about honour and justice and the different perspectives at navigating a tricky and shameful situation, from each person's perspective.This would have been great... If it wasn't 2 hrs long. It's fairly heavy and emotionally-moving in *some* places, but for me, not enough to justify a 2hr screentime. I would argue the story could have been as effective with 30+ minutes less footage.And it wasn't mindblowingly emotional for me, it was more interesting as a look into understanding a different culture, rather than each individual character.The performances were natural and on point."
" Very well put together
",0.3384,-0.9094,2021-01-26 00:00:00,8,"This Iranian film pulls together a reflection on both the iranian culture and art, censorship, restraint and a sense of decency and then flips this on its side when the wife of the main character is attacked in their own home. Through
a combination of revenge and grief the main character begins to lose himself and the film then builds together an ending that really builds the tension. Overall, a really well put together movie which although it takes a while to get to its point, once it gets there, it really delivers."
" Asghar shows his genius once again
",0.0,-0.7783,2020-12-03 00:00:00,8,"""How does a man turn into a cow?""
How a man's damaged self-image and guilt drives him towards obsession and revenge to satisfy his manhood and ego. Another test of moral by Asghar Farhadi."
" so good. not as good as A Separation, but still brilliant.
",0.8553,0.6879,2020-09-20 00:00:00,7,"While this doesn't linger on the aftermath of secrets commanded by societal repression (his two previous works) it feels like it should - to justify the lack of communication and compassion that encourages Emad's revenge. It gradually favours a perspective more critical than empathetic, straining the link sought between art, empathy and retribution. Still, a stately film that's wonderful in its smaller moments."
" Fractures in the house and the family unit, but the drama is solid here
",0.2263,-0.9201,2020-08-24 00:00:00,7,"Following an earth tremor probably caused by nearby construction work, a block of flats partially collapses causing the residents to flee in panic. When one couple move to a new flat, the wife (Taraneh Alidoosti), an actress, alleges she has been sexually assaulted by a stranger who has entered the home causing a strain in the marriage to her husband (Shahab Hosseini).Once again director Asghar Farhadi strikes drama gold with a drama about how an upsetting event can rupture a loving family unit and the domestic setting. He did it previously with such films as A SEPARATION (2011) and THE PAST (2013). This time he has expanded out somewhat in making the couple actors who are attempting to stage a production of Arthur Miller's 'Death of a Salesman' with a plot that invites comparison. The drama builds well and is engaging throughout."
" A Lesson of Life
",0.0,-0.8462,2020-05-02 00:00:00,8,"The Salesman is a 2016 drama film written and directed by Asghar Farhadi.
The story of The Salesman concerns a young Iranian couple, Emad and Rana who work as lead
performers at a local theatre and are preparing for their next gig i.e. Arthur Miller's Death of a
Salesman. Forced to leave their collapsing apartment due to dangerous works on an adjacent building,
the two rent a new flat. Things are set in motion when an unexpected incident linked to the previous
tenant occurs in their new home and turns their peaceful life upside down.
The wife is assaulted. Her husband attempts to determine the identity of the attacker, while she
struggles to cope with post-trauma stress. Emad finds the culprit left his car keys, which he matches to a
pickup truck parked outside their new apartment. As the movie progresses, we see that Emad is able to
track down the owner of the pickup truck with the help of one of his student's father. He pretends to
need a mover to lure Majid to their now empty old apartment, but Majid's prospective father-in-law
arrives instead. Gradually, it becomes apparent the older man was himself the intruder. Emad, now
fixated on getting revenge, invites the old man's family to the apartment in order to expose him.
Crafted with immaculate vision & precision control, Farhadi narrates the entire tale
immaculately and intertwines the film's multi-layered structure into a single strand, which then
allows him to establish & gradually escalate the tension.
The script is just as carefully refined as his direction, packing a believable set of characters who
are enacted by a talented crew delivering powerful performances. Farhadi's innate ability to bring
his written characters to life with remarkable genuineness plus the close proximity between their
situation and its very possibility of happening in real life resonates on such a personal level with
the viewers that it allows them to invest in these scripted people's lives.
The Salesman is a captivating movie with a stellar ending, ingeniously directed by Asghar
Farhadi, who can make his viewers weep for the protagonist and antagonist of the film in the
same frame."
" Gripping
",0.0,0.5719,2020-04-26 00:00:00,9,"Truest form of cinema.. no fancy music, no fancy songs, no fancy costumes.. just a simple storyline, delivered in a suspenseful and engaging manner.. brilliantly done by all the actors.."
" The door that opened slowly
",0.0,-0.8481,2020-04-21 00:00:00,7,"Compared with the discussion of morality, I payed more attention to the indifference of the husband when his wife is hurt.After the wife was injured, the husband just asked her to forget the pain.The words were very light, but the wife who suffered both physical and mental trauma was in deep pain.The wife only needs a consolation, while the husband cares more about his reputation.What a pity story."
" Just talk for God's sake!
",0.0,-0.7227,2020-02-24 00:00:00,6,"The films by Farhadi I've seen so far gave me frustration because of the lack of open and clear communication. I don't know if this is deliberate and the director is trying to tell us something about Iranian society but it reminds me cheesy Turkish soap operas where the enigma will be resolved instantly if people talked to each other patiently rather than raging or looking away. As a Turkish person who's never been to Iran yet, I find Iranian films fascinating even for the similar looks, customs, objects and life style we seem to share. But unfortunately I don't find it realistic that people don't talk or have a proper fight with each other although living/working together. Maybe I'm too naive though, I don't know..."
" Overrated but watchable
",0.0,0.8205,2020-02-20 00:00:00,7,"Having read some over the top praises of this film I think some balance might help. The themes about a shaky society, male/female roles etc are pretty laboured, and never are articulated, too many silenced without much content. There are a number of continuity problems; why is Bajar the landlord so secretive about the tenant? Why does the assailant leave his phone, keys, and money and vehicle behind? Is the small child the assailants? What actually happened?"
" Honour and revenge
",0.0772,-0.0447,2020-02-18 00:00:00,7,"In Asghar Farhadi's movie 'The Salesman', an actress (currently performing in Arthur Millar's play, 'Death of a Salesman'), injures herself after being surprised by a peeping tom. The incident leaves her traumatised and puts stresses on her marriage; her husband seeks revenge, motivated not entirely from concern for her but also from a measure of wounded male pride. I didn't really understand the choice of title for the movie (is the play-within-the-film really so important to the film as a whole?) and its opening half is slow, painful but not particularly enjoyable to watch. The second half is much stronger: instead of a typical stupid Hollywood ""revenge"" plot, we actually have a delicate (though suspenseful) drama that centres of the importance to us of how we are perceived by others. Farhadi, as he has shown in his other films, is skilled at depicting the interactions between ordinary people in a compelling way. It's ultimately worthwhile sitting through the somewhat dreary start."
" Farhadi rules
",0.0,0.8993,2020-02-12 00:00:00,8,"My second Farhadi movie and I gotta say this man is a genius. One of the best working directors today, his potray of human relationships is very unique and interesting. The leads are great, especially Shahab Hosseini. The bittersweet ending will be the one I'll remember forever."
" A very realistic drama regarding assault, PTSD and other thought-provoking issues
",-0.5859,-0.9338,2020-01-10 00:00:00,10,"A very realistic drama and study of society regarding assault and other thought-provoking issues, such as a family put under stress after a violent attack causing post traumatic stress order; both for the rape victim and her husband.
I think this film is also a very good social study of human frailties and the ethical problem how justice can be effectively enforced in society; leading to the question to what extent individual retribution is justified."
" An absolute snoozefest
",0.0,-0.3597,2019-12-04 00:00:00,4,"I like Iranian movies, and fully understand that due to heavy censorship, their content has to focus on themes that impact daily life and how people react to those events. This movie however really misses the mark with a silly script that has too many irrelevancies, and non-contributory scenes. The story just drags on forever and has a very unsatisfactory ending. There just seemed no point to such an overly long movie."
" There was the emotional wound in another dimension.
",0.1531,-0.9877,2019-08-29 00:00:00,5,"I was annoyed for the insensitive conduct by Emad. I felt that it was lack of thoughtfulness because I'm female perhaps.
Why did he search the criminal who raped his wife, Rana? For hurted her or by the hate against the criminal who gave them in a trouble? Even if he could catch it and solve the practical crime, there was the emotional wound in another dimension.
His revenge idea was critical absolutely unless the criminal wasn't crazy and alone. It was based on 'Code of Hammurabi.' He tried to destroy the criminal's life as his was done.
Emad and Rana had their private lives in a bland way. In the other side, the insides were reflected throughout each roles on the stages they acted together. I realized that by her emotional acting in credit role.I was tired since I didn't think this movis is such serious tone. Additionaly, it was a bit difficult. I should not watch it while doing something."
" A heavy piece of tragic brilliance.
",0.2263,-0.2975,2019-07-09 00:00:00,10,"An absolutely stunning drama about the effects of extreme trauma on both the traumatized and their loved ones, and the ineffective nature of vengeance. Farhadi is a filmmaker who always seems to know exactly how much to reveal to an audience without being either too opaque or too obnoxious. The live performance motifs throughout really elevate the actuality in the characters' lives."
" A modern man turning into a conservative
",0.0,0.5845,2019-06-10 00:00:00,9,"Because their own home has become uninhabitable, a young couple (Emad and Rana) temporarily moves into an apartment that has been recommended by a colleague. The previous occupant turns out to be a prositute, and a client of this prostitute harrases the woman by accident (not knowing that the prostitute has moved away). Emad tries to track down this client. During the movie this becomes an obsession for him.The film begins rather confusing with images of a bed on a theater stage (Emad and Rana are members of a theater-company that is performing ""Death of a salesman"" by Arthur Miller) and the evacuation of a flat that threatens to collapse. Both have only an indirect link to the main story. In Iranian cinema the ""play in the play"" concept is not unknown. Look for example to ""Through the olives trees"" (1994, Abbas Kiarostami). But Asghar Farhadi does not belong to the generation of filmmakers who was responsible for the Iranian new wave in the beginning of the '90. I do not see a direct link between the ""Death of a salesman"" play and the main story of the movie. Links suggested in other reviews seem far fetched to me.The movies of Farhadi are most of the time relational movies in which he pays tribute to a writer as Tennessee Williams and a directer as Elia Kazan. The collapse of the building in the beginning of the movie is not only the introduction to the main story (the couple needs a new home) but has also symbolic significance. The cracks in the wall symbolise the cracks in the marriage that will arise later in the movie. The strongest point in the movie is how it evolves from a thriller (who donnit) to a relation drama. In this drama questions arise such as:
Is Emad protecting his wife or his own ego?
Is Emad protecting or destroying his marriage?
How is it possible that in a modern man like Emad the old fashioned value patterns take the upper hand so quickly?
As befits a good movie, it only pioses the questions and does not answer them.After the Iranian movie ""A seperation"" (2011) Farhadi made the more international movie ""The past"" (2013). ""The salesmen"" (2016) is again typical Iranian. In movies in which previous occupants have an influence, the previous occupants most of the time have a psychological defect (compare ""Le locataire"" (1976, Roman Polanski)). In this case the previous occupant is a prostitude and the neigbours refer to her in the vaguest of terms (the woman who often had male visitors)."
" Must seen
",0.0,0.7964,2019-05-01 00:00:00,10,Asghar Farhadi is amazing . shahab hosseini and taraneh alidoosti did strong performances
" Another Masterpiece by The Great Asgar Farhadi
",0.8481,-0.8398,2019-04-11 00:00:00,10,The great motion picture of despair! In this movie you will understand that you're the one who suffer the most by your taken revenge. There is a proverb about that situation: If someone died or if something happened you can never change that situation. Because it's already gone..
" Bit of a fizzer
",0.0,0.4342,2019-04-01 00:00:00,3,"Haven't seen too many Iranian films, not sure if in Iran this is a great flick, didn't do it for me. About 20 minutes too long, not sure who i was supposed to be siding with, fizzer of an ending. Looking back, i think i may have been too distracted by the husbands' furrowed eyebrows, throughout the whole film! The thing that got me the most, a horrible thing has happened to his wife, he seemed zero sympathetic! Academy Awards bungled once again."
" exquisite acting
",0.0,0.0,2018-12-08 00:00:00,10,"A solid and suspenseful plot presented with elegant visuals and exquisite acting. Shahab Hossieni and Taraneh Alidoosti are a couple whose marriage is tested when she is violently assaulted. A constantly fascinating drama, an eye-opener for the audience."
" The Salesman - Sells Little Of True Value
",0.5658,0.974,2018-11-19 00:00:00,4,"So, after watching, I read that I've just looked at an Award winning drama - this came as somwhat of a surprise - as there seemed little solid 'Award' material evident. It almost apears Awards might now be given out to sell a trendy moviemaker or a 'product'. 'Salesman' is a vague, dreary movie in almost every sense - now this can be a good component if used to its full value but, this work is centred around an incident that happens in a very scant time - so scant, that all the elements that make up the largest percentage of the story are left wanting, as in, hardly believable or full of obviously undeveloped character motivation and situations (we also never truly find out 'precisely' what happened) Seems this could be all award-winning works now need...a grim situation, overblown to look stronger than the writing actually sets up - this appears especially so if there's also a 'politicised' slant.Add to this a plot background reference to a literary classic (""Death of a Salesman"") to suggest this work must also be intelligent by association but, that 'association' can equally be seen as a highly questionable metaphor. The situations that make up the sum of this movies scenario are somewhat pretentious and far from worthy of such high praise (as many other worldwide viewers have clearly noted) Performances are routinely good but the material is just too thin to last the dismal 2 Hr distance. If you're inclined to think Awards must automatically represent high quality you may be satisfied - conversely, if you see the awards as 30% quality, 35% promotion and 35% 'political' - you just might find yourself joining others among the disappointed."
" The Salesman Doesn't Oversell - yet, evokes reassurance in fighting a losing war
",-0.7035,0.8968,2018-10-26 00:00:00,8,"""...how beautifully fragile are we that so many things can take but a moment to alter who we are for forever?""
Samuel Decker ThomsonAs we open to the stage being set through the moving facades and focused dim-lights of a half-furnished empty theatre (the dress-rehearsal of Arthur Miller's ""Death of a Salesman"" by the protagonists and friends), we soon cut towards the cacophony of evacuating a building - with its façade collapsing. Through such irony and chaos, we are introduced to Emad (Shahab Hosseini, ""A Separation"") and Rana (Taraneh Alidoosti, ""About Elly"") - a married couple in their 30s harbouring those collective dreams, who were picking up their household and securing a new apartment.Little did they know that moving houses shall cost them a home. The new apartment had a shady history - the last dweller being an escort woman, who hurriedly left without her belongings citing issues with her clients. Then one ominous day, Rana alone in the new apartment is mistaken for her previous tenant and assaulted by an intruder. Though only physically hurt, she struggles terribly with her mental trauma which also got the better of Emad.
Again, as they try picking up their lives while goofing up their parts in the play, they both knew that it would take time - but, only if time healed all wounds, esp. the ones given by the 'times' itself.So, as Rana sets her foot down to avoid a revenge (and subsequent guilt) with the intruder (an old, rattled carpet-seller) Emad painfully complies by letting the man go with just a slap. Soon enough, they find him passing-out with a heart-attack surrounded by the unaware family of his own.
Much like the Salesman who courted failures of his profession and personal life, Emad and Rana tried their hardest to reinstate the tranquillity of their marriage. In the aftermath, as the drained out couple sits for another pre-run make-up session, their eyes draw a blank semblance of ghosts of their shared grief.The film carries ""story-within-a-story"" format (Miller's ""...Salesman"" and Farhadi's Emad and Rana) sharing the theme of the ""abomination of living"". Asghar Farhadi's treatment towards his pivotal middle-class Iranian life (familiarized in his first Academy Award-winning - ""A Separation"") retrospect through one's own misgivings and vulnerabilities is surprisingly inspiring.Nevertheless, writer-director Asghar Farhadi builds up an innocent-seeming ambience and then, almost mercilessly, smashing it to smithereens. Still, this film isn't a usual tragedy; neither a completely unusual one. It does portray genuine apathy but doesn't drop to any deliberate pathos. Without overselling anything, ""the Salesman"", evokes some reassurance even while fighting a losing war.This well-shot (Cinematography by Hossein Jafarian ""About Elly"") work is masterfully merged with one of the best screenplays of previous years, winning dual Cannes Awards (""Best Screenwriting"" for Farhadi and ""Best Actor"" for Hosseini) and further acclaim by a second Oscar for ""Best Foreign Language Film"".
In a sensitive global-political environment, it is a slight nod to the times that we live in where we may have to not just protect but nurture our families with utmost care for crafting a better future.Heartbreaking and Remarkable! An 8.5/10."
" A successful drum movie with a fascinating storyline and good actors
",0.8807,0.9545,2018-10-23 00:00:00,9,"As expected, this work is one of the best films in the history of Iranian cinema. It is also one of the best drama films of the year.A movie with its beautiful play of actors and a story that attracts the end of the film."
" Better than A Separation
",0.4404,-0.7003,2018-10-21 00:00:00,7,"The Salesman. Won Oscar for best foreign language film (although Iranian director boycotted oscars in protest against Trump's travel ban). A woman is attacked in her home and her husband goes to extreme lengths to catch and shame the purpurtrator. All against the backdrop of the pair starring in Arthur Miller's play Death of a Salesman. Superbly acted, filmed and tense in places. Personally I preferred this film to the director's universally acclaimed A Separation. 7 and a half out of ten"
" Unique
",0.0,-0.7974,2018-08-27 00:00:00,10,"Watching this movie is like going to a unknown room that is empty and dark.
But when you keep going, the movie will build everything for you and destroyed the things you didn't have.
After the movie finished ( it never finish in your mind of course) you just say to yourself, Wow!Watch this alone with full attention."
" A WELL DESERVING WIN...!
",0.3382,-0.8074,2018-07-30 00:00:00,10,"The 2017 best foreign language Oscar went to this staggering indictment of physical slight & the enveloping revenge which consumes an Iranian couple. A theatrical adaptation of Death of a Salesman is being put on by an Iranian acting troupe when a married couple, involved in the affair, need to move to a new apartment. Once in their new place an incident occurs, due to confusion on the attacker's part sending the husband on a trail of disappointment, resentment & impotence to regain face & bring honor back to his family."
" Stunning
",0.3818,0.8799,2018-07-12 00:00:00,9,Asghar Farhadi never seizes to surprise you. It was a stunning movie with a very powerful plot. I really enjoyed watching it and will definitely watch it again.
