title,date,rating,review
" I loved it!
",2021-03-28 00:00:00,8,"This was my favorite of all the three. I was finally not distracted by the fact that she was really not fat like real people. It clearly pointed out that she had reached her target weight. Also, her maturity brought with it a sense of acceptance of her life and her choices. I didn't rate it higher due to some of the goofs, her birthday a big one. I felt the Mark Darcy character was better depicted here and that the years that have past have taught him some humanity. The Jack character was a good treat and much more dimension than the Hugh Grant character whose storyline was really overdone. This movie was a good watch if you are a fan of the Bridget Jones story."
" I don't like it
",2021-01-16 00:00:00,1,I don't like it. I think it's a waste of time because the first two movie is beautiful and funny but the third one is wasteful. Doesn't like it
" Bridget Jones's Baby
",2021-01-03 00:00:00,5,"3rd in the popular series, see 40+ Bridget realising time is running out for having a baby. Determined instead to have some fun, she sleeps with both Dempsey and Further and gets pregnant - but which one is the father.Enjoyable slice of wit with Zellwegger on sparkling form with all around her also pulling their weight. The plot around who the father is, is a bit meh and Hugh Grant is conspicuous by his absence, but otherwise it's witty and quite touching."
" I just don't get it? But I love it!
",2020-12-18 00:00:00,8,"I don't normally do spoilers, but I can't hold my WTF in on this one.
I really, really enjoyed the film and it's probably my favourite in the series, having just got a certain something that the others didn't quite have.
However, why the F would you choose to Marry and raise a child with Arsey Darcy (I've really never seen the appeal in Colin or his character here I'm afraid) when the most perfect and Godlike man, in the form of Patrick Dempsey is right there and so obviously more compatible with Bridget than Mark is.
If it was Daniel Cleaver I might understand. I believe this is how it goes in the book, but Hugh wouldn't come back at the time and so had to be replaced with Jack, but you just wouldn't would you, if a quite clearly better option is available!!!
It's not even just because he is gorgeous and adorable to boot, but the character is so charming and has that spontaneous and worldly side that Mark is missing and that Bridget craves, whilst still being a great guy, unlike Daniel would have been. And I understand that there's a history with Mark, but I don't know, it just makes me fuming.The film itself is a great story, full of some great moments and one liners. The soundtrack is superb and Ed Sheeran's cameo will go down in legendary history along with Sir Elton John's in ""Kingsman"".It seems like the director has shaken things up a bit and the writing has given some of the bit parts a chance to shine too, whilst still keeping the focus appropriately on Bridget and the fellas.Emma Thompson does her fantastic thing as always, but don't you think that she always looks a bit sad these days? I think it's because Alan Rickman gave that necklace to that Ho instead of her that one Christmas? I'll never forgive him for that, despite his actions at Hogwarts.I really like the change in Bridget too, I like the fact that she's grown up, but still a bit daft. All of the films have their silly moments and farcical elements, but this one really gets the balance spot on. And I love the moments where she tells someone off, she really gets those right.
I also like the fact that she's not fretting about her appearance as she had been, realising that she was fine ""Just the way she was"".I still don't get the Darcy thing, but I do enjoy watching this one. It's actually quite hilarious."
" Maybe for the fans...
",2020-10-10 00:00:00,4,"Maybe works for the fans, but lame and desperate apart from the few scenes of laugh"
" Atrocious
",2020-08-26 00:00:00,1,"I wasn't expecting much, as I wasn't a fan of even the first film. None of this film is remotely believeable, and is an insult to the intelligence. Hard to know whwere to start, but the eponymous heroine is the best place I suppose. Every now and then the plastic surgery and make up cracks and you see how old Bridget Jones looks. She's supposed to be 43, yet she gets pregnant after just two sexual encounters with different men. In reality she looks about 55 - if anything the plastic surgery has aged her, as well as making her look like an alien. There is zero chance that either of her desperate suitors would go for her, especially given her loose morals, foul language, tired old jokes, and pathetic hangers on.
Even Paul McCartney would have drawn the line at this one, and there aren't too many rich men quite as stupid as Paul. Even Paul isn't that stupid these days.
Give this one a miss. Tedious retread of a worn out series. Embarrassing. I can see why Hugh Grant gave it a miss. Very wise, I wished I'd followed his example."
" Funny and dramatic enough
",2020-08-17 00:00:00,6,"It rivets you till the end. This is a story of a somewhat easy woman in terma of sex who becomes pregnant without knowing who is the father between two very different men (one a dignified aristocratic barrister and the other a much more relaxed technician). This suspense all the movie along is well performed by the actress who does Bridget (Rnée Zellveger) who besides being a beautiful woman does an excellent job in terms os words, deeds, smiles, laughing and the facial expressions. And the love triangle develops itself in several unexpected turns.
Although not exactly a masterpiece (the story is too simple to allow that) this movie can entertain reasonably you till the end."
" Utter boredom
",2020-08-16 00:00:00,2,"Over 90% of the movies that I watch are horror so as a rule romantic comedies aren't really my cup of tea. However,I really enjoyed the first Bridget Jones movie, the second was so so. Naturally I was curious about this, the third entry.
At the age of 43 Bridget gets pregnant, but she's not sure who the father is, he could be either her ex Mark Darcy, or he could be an American billionaire. Personally I didn't care who he is, this movie is so incredibly slow and unfunny, I just about hung on until the end credits. I found it sad that a film resorts to swearing in attempt to be funny. It's not. Only positive thing was the soundtrack. Oh, and Bridget's more slender figure. Two hours of utter boredom."
" Irresistably a feel good movie at the end, despite the middle.
",2020-07-21 00:00:00,7,"Bridget Jones's Baby represents an alternative timeline from the one provided by the novel Mad About the Boy, and it starts off very strong, no plot wallowing, even though Bridget is wallowing in the opening scene. This plot instead seems to begin with the timeline hinted at by the 2006 diary continuations published in the Independent, in which Bridget accidentally slept with both Darcy and Daniel and got pregnant by one of them. Except, instead of the baby turning out to be Daniel's but raised by Darcy as in the column, Bridget has a short but memorable affair with an internet billionaire she meets at a music festival (played by Patrick Dempsey), and it's heavily implied by the end that the baby is Darcy's, although it's entirely possible that Jack, the invention created to fill the Daniel-sized hole in this movie, manfully stood aside and gave up any claim he might have had over the child when it became obvious that Bridget was still hung up on Mr. Darcy. Dempsey is as handsome and charming as ever and quite likeable as a well-meaning man who finds more personal meaning in numbers that he can quantify than in people which he can't (hence the name, probably) but it's still hard to ignore the feeling that his role was probably originally written as Daniel's. Maybe Hugh Grant couldn't do it but it seems apparent that it started out as him, and then the scriptwriters had to doctor it up and added in jokes to make the new man less Danielesque. It's still quite funny and charming, just not as much as it would have been had Daniel been the other man. Luckily Zellweger and Firth still have wonderful chemistry and the characters are still perfect for each other, their individual dorkiness balancing each other out marvelously. Their love story pretty much saves the picture from getting bogged down in klutz jokes in the middle. Their happy ending is so happy it nearly erases the awkwardness of some jokes from that long middle section that just didn't land (never in my life have I been so strongly reminded that Gen X is way bigger and more influential in other countries than in the USA than when watching this British movie) Emma Thompson also shows up as Bridget's OBGYN and to steal the picture out from under any of her scene partners. Will I watch again? Yes, but I'll fast forward through the middle third."
" big no no for me
",2020-06-17 00:00:00,1,Whitewashed and full of superficial stereotypes.. what did I just watch?!
" Interesting continuation of the Bridget franchise
",2020-04-30 00:00:00,6,"Quite entertaining rom-com, third instalment in the Bridget Jones Diary franchise with a few twists that make it a better film than the second really.The odious Hugh Grant character, Daniel 'Vivian' Cleaver (Yes you read that right) does not appear in this instalment and his disappearance from this film is explained away pretty well. An apparent death although a body has not been recovered. Is he dead?Bridget Jones (Rene Zellwegger) is still a single, forty something (43 To be precise) who somehow falls pregnant with two possible fathers. (New character, US dating algorithm billionaire guru Jack Quant (Patrick Dempsey) and series regular Mark Darcy (Colin Firth)).The film follows the pregnancy from the first scan to the waters breaking with some hilarious scenes. Jones (as Daniel Cleaver would say) eventually marries but to whom? I won't give that away.There's also a twist towards the end of the film. Is Cleaver still alive? Open for a continuation of the series perhaps. All in all an entertaining, comedic film."
" Yesss
",2020-04-02 00:00:00,10,Woah the best one yet. I'm glad they didn't listen to me when I said not to make a third. I guess I'm not much of a film critic.
" dear, don't lose heart.
",2020-03-28 00:00:00,7,"Fifteen years! How many romantic comedies can last 15 years and be so popular? The heroine is radiant, and the sense of humor is natural. The smile is quick and accurate. The old singles and contemporary elements are playing a new height."
" Sweet, funny, Bridget grows up at last
",2020-02-27 00:00:00,7,"Bridget Jones is now a single 40 something news producer. The job is going well, she has a great apartment, good friends and has finally lost the weight she's struggled with over past movies when she discovers that she's pregnant. In true Bridget fashion she isn't quite sure who the baby's father is though; Mark Darcy who she bumped into at a christening a few weeks back or the random ""McDreamy"" American she hooked up with at a music festival.I enjoyed this a lot, its very sweet and in tune with the other movies in the series even though some of the gags/comedy is a bit lukewarm its still entertaining. It was also nice to see that Bridget had matured, and wasn't quite the goofball as previous films I adored Colin firth as potential dad #1 and good choice in adding Patrick Dempsey to the cast as possible dad #2, the two men together are very funny. I honestly didn't know who the father was going to be until the very end. Emma Thompson is excellent and hilarious as the OBGYN. Nice to see the whole cast back for this final instalment including Bridget's Mum and Dad and assorted friends."
" 'Is you is or is you ain't my baby?'
",2020-02-20 00:00:00,3,"A situation familiar to Mr C Firth from the equally turgid 'Mamma Mia' of blessed memory(comparatively speaking).
Is he the father of Ms Jones's brat?Frankly do we give a damn?
The usual appalling cliches and ham acting with Mr J.Broadbent looking suitably ashamed at dishing out so much old rope.
Lots of swearing from Miss Zellweger and her potty - mouthed chums which doesn't amount to a hill of beans.
I ask myself how much longer this franchise can limp along and I am not confident of a good outcome in this regard.
By the time Bridget Jones's infant gets to Cambridge(naturally),it's mother will be drawing her enhanced pension and still making cow - eyes at Hugh Grant.
You can take that to the bank."
" Absurd ""Comedy""
",2020-01-04 00:00:00,3,"(1st ever movie review.)I absolutely loved the 1st BJD, even though there're short snippets of stupidity, as opposed to sincere humor, in it. Cannot imagine why someone thought it was a good idea to try and make a baby comedy based around a despicable, middle-aged skank. There's absolutely nothing funny about a woman not being forthcoming and honest with 2 possible fathers. The absurdity that an attractive billionaire would carry on as was portrayed in the movie is unbearable. Humor doesn't have to be an insult to one's intelligence.(I walked for hours while in labor.) I just realized, the intent must have been a comedic fantasy film. Nothing is realistic, a lot of the scenes are stupid, and the bits that actually made me chuckle were few and too far between. BOMB!"
" Waited too long
",2019-12-26 00:00:00,7,It would have been better if they made this sooner. Some funny moments but sometimes jarring to watch.
" Awful
",2019-10-26 00:00:00,1,Awful characters dredged up again for more of the same. Script diabolical with constant swearing in lieu of any actual jokes.
" 7/10
",2019-09-25 00:00:00,7,Would have been a 10/10 if Jack is whom Bridget chooses in the end. I like Mark but it has been 10 years....a girl gotta move on!
" Didnt live upto the standard of first two movies
",2019-09-24 00:00:00,5,Not the same without daniel creager..would havw been much entertainnig if he were in it
" Lovely addition to Bridget Jones
",2019-09-09 00:00:00,9,"I found the third movie to be a lovely addition to the franchise of Bridget Jones. I found it quite comparable to the first two. The laughs hit, the characters just as messed up as usual, and the new additions bring a youthful element. Quite enjoyed her antics, as usual, as she navigates her numerous dilemmas. Was a bit annoyed by mark darcy but he plays the character he always did, aloof and a bit standoffish, but wouldn't want him any other way. I would have liked a bit longer of a review to bridge the gap between this and last movie. But overall, it was what they all are, mindlessly entertaining. Don't go looking for an Oscar worthy performance, that isn't the intent. It's a romcom."
" Swearing Females
",2019-08-23 00:00:00,1,"If you find women swearing and using foul language funny, you will laugh hysterically. If you are seeking a witty, well written and funny film. you will get more laughs in War and Peace and BJB feels as long as that seven hour epic. I assume that Hollywood's obsession with 'strong women' resulted in the 'writers' deciding that foul mouthed women would be men's equals, nay superiors. Who needs humor when you have political correctness? I smiled once, but that was in relief that this boring garbage finally ended."
" A sequel too far.
",2019-08-19 00:00:00,4,"Part of the charm of the oringinal films and source novel, is that Bridget Jones is insecure and struggles with her weight. In this film, Bridget is her ""ideal weight.' To cut a long story short, the character of Bridget Jones has been ruined. Partly because Renee Zellweger's appearance has altered so much.
To be honest, I could only sit through the first 10 minutes of this film, it was not a good idea to make another one."
" I miss the old Bridget
",2019-05-20 00:00:00,2,"Honestly, this movie is just awful. I want the old Bridget Jones back, not this fancy, skinny, popular, upper middle class, cliche, boring woman. A waste of an hour and a half, which is all I gave it."
" Very funny, better than the 1. Movie
",2019-04-22 00:00:00,8,"Yes, it's very funny, i laughed very often while i was watching this movie. It's better than the 1. movie. Pretty good."
" Totally cut me off
",2019-04-22 00:00:00,4,"Anyways, as I was saying..she then was suddenly all about Darcy once again.. Not only does that show a lack of strength on her end, it shows that when it comes to taking the best route with a man she actually loved and could have been with until trying to make Jack this terrible being because Darcy threw a tantrum.. she gave up and just ran back to him.. This just wreaks havoc upon any feminist around the world, and is not exactly something Id want my daughter growing up seeing.. Just the idea that you should allow a man to walk all over you, ignore you, completely throw you under the bus the minute rocky water comes forth, only to then end up with him again? When there is a better option available? It's just wrong. I personally was going to give it three starts but felt I should in fact give credit where due because the story line was good, and the humor in it was as well. Overall I was not exactly happy, and the whole getting back with her ex after he clearly showed where he stood in terms of her, work and the baby, just seems wrong to me."
" Good but the ending should have been different
",2019-04-22 00:00:00,4,"I really liked this movie overall. I found it funny, and still relevant in some aspect to the first one. The only thing I disliked about this movie was the ending.SPOILERS: If you have not seen it yet, I would stop reading. Personally, the person she ended up with was wrong, Although her and Mark have a major history, its simply that.. History. One thing I dislike about a lot of movies that are portrayed is the concept of bringing old flames back together. When in fact, doing so isn't always the best resolution. Jack himself was a way better candidate to not only be the father of the child, but to be a husband to Bridget.. It's clear that Mark values work over her. And it's also clear that in the past they had an array of issues with trying to make it work as a couple.. Like his product of putting work first hasn't exactly changed.Therefore his ability to be involved with the child at all is slim to none, and not only that but now that child will grow up with that mindset of putting work first. And I just think that's wrong. Not only that, but throughout the whole pregnancy he wasn't even present. At first he was all about it, but the minute they ran into any product of ""rocky roads"" he ran. He would dissapear and entirely close himself off of being involved with Bridget or the progression through her pregnancy. Like why would you want someone like that? It's funny to because it's kind of all over the place with where bridget lies. First the idea of being with Darcy was totally not in the books, then the minute that possibility of he could be the dad comes forth and suddenly her perception of him has changed? She expressed earlier in the film that ""she was falling"" for Jack but the minute Darcy had a temper tantrum and cut them off entirely she was just sudden"
" Jonesing for another movie
",2019-01-06 00:00:00,10,"Patrick Dempsy was a great add. The best one so far.
Hope they make another!"
" Only if you're a insanely hardcore Bridget fan
",2018-12-27 00:00:00,3,"Let's start with the positive: Emma Thompson is great!Now that we've got the positive out the way, let's stick to the horrible script and plod on. Bridget Jones's Diary was a great movie and they should've stopped there. But money trumps common sense and here we have the (hopefully) last addition.To summarise how this movie made me feel; like the director desperately wanted to appeal to a younger audience while alienating anyone who was endeared by Bridget her first story. The soundtrack is godawful, Ed Sheeran seems to be forced into this mess, the jokes are predictable and the script itself is so awful, even Colin Firth can't save this one.The difference in pacing, jokes and just overall feel is staggeringly dreadful and made it hard to actually finish watching this movie.So if you just pressed play, please stop and just rewatch the first movie. It'll keep the good memories unspoilt."
" Absolutely horrific!
",2018-12-14 00:00:00,2,"Not funny! Not sharp. Not Rene Zellweger. What has she done to her face? How can she actually do THAT much plastic surgery? She was beautiful (so were Meg Ryan AND Helen Hunt before they messed with their mugs!!!I couldn't even watch a few minutes of it, as she tells two men that she is pregnant and has no idea who's the daddy, in her Bridget Jones rambling way, which is not funny anymore. And it's a shame. Because the first movie was fresh, different, sharp, and genuinely ground breaking. This? No."
" An undemanding bit of fun
",2018-10-21 00:00:00,6,"Bridget Jones's Baby. Ridiculous, at times annoying, some chuckles but few laugh out loud moments. An undemanding watch though and was never bored. Not a touch on the original but far better than the debacle that was edge of reason. 6 out of ten"
" It was actually okay?
",2018-10-20 00:00:00,8,"I mean, the movie is not great or anything, but I liked it, and i have a feeling that others will too."
" Darcy Baby
",2018-09-05 00:00:00,10,10/10 just because Darcy ended up being the dad :)
" Great movie. Amazing movie.
",2018-08-03 00:00:00,10,I have always loved Patrick Dempsey. Now I love Colin Firth more. This is a great movie. I olny recently watched all 3 movies. They are hilarious. It touches on what a women goes through as someone who is single and pregnant. I am glad that they picked the ending that they did. Not sure if I would have liked it as much if he didn't turn out to be the father. Glad that everyone put aside their differences and all worked together. Love it love it love it.
" NOT ANOTHER ONE...!
",2018-07-30 00:00:00,1,"Bridget Jones' Baby is more of the same in Bridget Jones' cinematic journey into her lovelife. A little better than Edge of Reason, but not much, Baby reunites most of the original cast expect for Hugh Grant who is sorely missed & given a possibility of return by film's end but at this point do we even care? Bridget Jones has gone from a character in control of her destiny to someone whose whims are determined by others as evidenced in the two follow-ups. A shame really..."
" Funny like Bridget
",2018-06-18 00:00:00,6,"I did like many gags that were hilarious, some less so. I found the film storyline rather predictable but tagged along for the good jokes. The last third was getting much less funny, more predictable but it needed to wrap up somehow."
" Good Luck To This Baby
",2018-06-12 00:00:00,3,"I hardly know where to begin to write a review of this film. To me this film fell short on so many levels that I cannot help but conclude that even the writers and craftspeople who worked on it didn't really care about it. I mean really care about it. I think the original was such a big hit that they all just went through the motions here hoping for a 'goodwill' paycheck. Therefor I refuse to spend for time on this review than the artists did on this project. As such I will just say that the script was extremely cliched, misogynistic, predictable, and dated."
" Hilarious!!!
",2018-05-27 00:00:00,10,First movie was funny - second movie kind of boring - third movie So freaking funny!Loved it! So hilarious! Tears from laughing! She did it again! Must-see!
" Tasteless
",2018-05-07 00:00:00,1,"No movie should get a rating higher than 1 star, that makes a joke about genocide. It's neither smart, neither funny, it's just completely tasteless and awkward. I for one certainly don't believe, that movies necessarily need to have a positive message, but laughing over genocide is just too awful to appreciate anything else that this movie might offers."
" Wasting of time and energy watching this movie
",2018-04-28 00:00:00,1,"Nothing to enjoy about this movie, boring, predictable and cliche. Most of all, so unreal. Renee looks so different in this movie, old and had plastic surgery I suppose? Her voice, or the fake British accent sounds so phony. The first one was enjoyable, even though the story also unreal but more of a romantic fantasy for women, but at least it was funny and entertaining. This one is just so much more worse."
" Pure Rot
",2018-02-18 00:00:00,1,"Why in the wide wide world of sports did they make this? Hugh Grange of ret wisely left this project, as he 'disliked the script'. Emma Thompson was a co-writer, so perhaps that is a clue as to why this is such a horrible dud. The miscasting of Patrick Dempsey merely ensured this would flop.The 'Edge of Reason' pushed it a bit too far, but this was an uncalled for piece of rot that is barely coherent and full of very very bad performances.It's difficult now to watch either Colin Firth or Renee Zellweger in anything after seeing this, but its always been difficult to watch Patrick Dempsey.God help us if they let these people make another movie."
