title,date,rating,review
" Disappointing
",2021-04-09 00:00:00,2,"I mean ... I watched the whole thing just to see what other BS was inserted into this well known story. Above all, the book of Exodus is a story of God's love and mercy for His people shown through His use an imperfect man to perform His miracles. You will find none of that in this mockery of God and those of us whose faith is in Him."
" Historically and Biblically inaccurate
",2021-04-08 00:00:00,1,"Not sure who's idea it was to make this movie, but they shouldn't have. The acting is mediocre at best. Not sure what accent Christian Bale was trying to have, but it wasn't Hebrew. He was a worse Moses than he was Batman. And he wasn't a very good Batman. Having Moses commit multiple murders is totally inaccurate. Also, a child god? Obviously Ridley Scott hasn't studied history or read the book of Exodus. Preparing an army to fight goes against Moses' faith in God. The Ten Commandments movie was overacted, but at least it had some semblance to what actually occurred based on historical documents. This movie obviously was made for the action scenes and thinks faith in God isn't possible. I wouldn't recommend wasting anytime watching this poor excuse of an account of Moses. Christian bale really needs acting lessons as do many of the cast members in this debacle."
" Emotionless
",2021-04-08 00:00:00,5,"The defiant leader Moses rises up against Egyptian Pharaoh Ramses II, setting six hundred thousand slaves on a monumental journey of escape from Egypt and its terrifying cycle of deadly plagues.Before I get into this review, I want to stress on a subject first. The storyline of this movie is based on the biblical story of Moses, but it is not his story and does not reflect the story as it is in the bible. I have seen a lot of wrongly based reviews and incredibly low ratings because of this.Directing: Ridley Scott needs no introduction, but I must say that he took a noticeably big leap with this movie. I am not disappointed with his vision and the crucial changes he made to the original story because that his own vision and he has the right to do whatever he wants with it. When it comes to stories that have a deep historical and religious following one must be careful when relaying that story especially in a high budget international movie which is something Ridley did not take into consideration.Production: One thing that jumped out to me was the numerous Egyptian producers and executive producers that worked in the team to make this movie as historically realistic as possible with extensive attention to detail. With Ridley on set, I would expect nothing less than perfection. The Hiring thought was not accurate to say the least and this showed drastically throughout the movie.Script: The script plays the most important part in movies such as this one, especially when it is based on a true story and more importantly when it is referenced biblically. Extreme caution needs to be taken when writing such a script. I can't say the writers did a bad job, but what I can say is that they approached this movie as they would any other, and I suspect this was the intention of Ridely.Acting: I am not sure what happened here, Bale is a phenomenal actor, so is Sigourney and Kingsley. I must say that the acting overall was bland. Throughout the movie I felt there is something missing, I can't wrap my head around what it is exactly, but I had this constant feeling that there is something missing in their performance. I am also not fully convinced that Turturo was the best decision here to take on the role of Seti. To be honest, I didn't feel any of the main actors fit their roles except Edgerton whom I think did an amazing job as Ramses.Cinema and sound: The numerous nominations, the 140 million plus thrown at this movie should be the ""enough said"". Visually stunning, amazing sets, extreme attention to detail in everything and some of the best camera work I've seen. I would expect nothing less with Ridley on set and they deserve the praise. I especially like the score by Alberto Iglesias and felt it fit this movie very well.Conclusion: I was excited to watch this movie, but I am saddened to say that I ended up leaving disappointed. Movies such as this need to have a deep emotional connection with the viewer, and the lack of it makes it bland and only watchable for the stunning cinematography.I give Exodus: Gods and Kings a rating of 5/10."
" Not Good
",2021-03-31 00:00:00,2,"This movie made God looks like He's a horrible personality,and the Egyptian was the ""real"" victim."
" Not so much...
",2021-03-12 00:00:00,4,I thought the crazy bible people rated this movie down. It turned out I was wrong. Oh Riley mate... What the heck where you smoking...
" The bright knight barely rises!
",2021-02-18 00:00:00,3,"Outdated story, poor acting, poor screenplay and yet some good action scenes at the end.
Nothing special at all!"
" Ridley, Thank goodness you're NOT Mel GIbson
",2021-02-16 00:00:00,6,"The title by the way is in response to some joker that had the title ""Ridley, you are no Mel GIbson"". I say, thank god he's not. This may be a soulless, emotionless Hollywood play on the biblical classic text but at least its relatively faithful to the fictional text. Unlike Braveheart which was one mans grotesque indulgence into Scottish history. I should also mention that... Ridley, thank goodness you're not Mel Gibson. Can you imagine what that self appointed anti-Semite would have done to this, probably would have depicted Moses on the loosing side!!Ok, rant over, back to the film. It was ok, the effects were good, the majority of acting was fine, the direction was ok. Its a filler film, good for a Sunday afternoon with no thinking involved and a big bag of popcorn.People go crazy at films like this when they think the subject matter should be treated with respect. They're wrong. If you want respect, read the bible, its a good yarn. Full of set pieces, dramatic climaxes and over zealous writing. But be warned it has more plot holes then the film and the endings not as good.Hope that helped"
" Believe it or not, it's Ridley?
",2021-02-16 00:00:00,2,"Anyone for some Ham and Cheese? Ok, it's slightly better than 'Gods Of Egypt', but that's not hard.
Allegedly the Director's Cut is 4 hours long, perhaps all the bits that were cut out were the good bits? I would hope at least that the film makes more sense with all that extra footage. I could just tell that it has been butchered in the editing suite.Now I'm not someone who ever attended Sunday School or paid attention in Religious Education lessons if I even turned up to them, but even I have heard of Moses. However without knowing his origin story, the bit with the basket, ya know? until halfway through, I didn't realise that it was that Moses we were watching a film about.I spent most of the time on Wikipedia refreshing my memory on Mo's biblical antics and found that this film had not only missed out huge chunks, but that it had also used a lot of artistic license in its production.Starting as the cousin of Ramses II (Not the actual Pharaoh from the original novel) it does follow Mo, who is banished and confronted by ""God"" or at least a very weird child as a messenger or something, before starting a war with Ram to free the slaves. If you know the bible, it does loosely continue with what is printed there, but with those huge gaps.
Actually, if anything, it goes out of its way to disprove the divine intervention element, by explaining the science behind the plagues, etc.There are also moments when it moves forward in time and we just have to guess that that is the case.The cast are pretty awful and the ones with any experience, Ben K and Sigourney barely get any lines. Mother didn't even spot that Sigourney was in it.Let's put it this way, I don't think there will be many R.E. Teachers using this to teach the story of Moses."
" Ridley Scott's modern Re-telling of a Biblical Tale
",2021-02-08 00:00:00,7,"As someone who recognises Ridley Scott as a force in Cinema and a fan of many of his Films, I have to say that 'Exodus: Gods & Kings' is not among his best. Scott has decided to modernise the Biblical tale in ways that make the entire story more 'plausible' to a modern audience. Thus, he starts with the Battle of Kadesh to give the film an exciting opening before moving on to the Moses/Ramses face off and the well known aftermath. Religious purists criticised the Film for 'inaccuracy' and changing the 'known facts' of the story - absolutely astounding thinking as the Bible is not an 'Historical Document' and, indeed, there is no mention of a 'Moses' in any surviving texts of the time. Even the idea that the Hebrew slaves 'built the Pyramids' etc is now seriously in doubt as Archaeologists can find no evidence at all for this assertion. Even the inclusion that the pharaoh referred to was Ramses II is a total guess as the name is never quoted in the biblical texts.
Leaving aside the source material, the Film looks fantastic - ancient Egypt looks fabulous and the cinematography is superb. All of the main sequences are well done but the entire Film suffers from a curious lack of emotion and connection. The Cast does it's best - Christian Bale tries to convey Moses as more of a rebel leader than a spiritual one and Joel Edgerton struggles with the role of Ramses. The real issue here is that the Script does allow the two main protagonists to really gel. I do give credit to Scott for attempting to make the tale more realistic for today's audiences but for a number of reasons this film doesn't quite work as well as it should."
" Pleasantly surprised
",2021-02-06 00:00:00,8,Maybe because my expectations were lowered by all the bad reviews I actually liked this one. Taken for a simple but efficient action movie it actually works. But most of all it's the photography and visual quality that I really appreciated. And of course Christian Bale offers a solid performance while being on screen for almost all of the scenes.
" Yawnnnnnn.
",2021-01-29 00:00:00,4,Visually fun-stunning but ultimately very wearying. I slept through the plagues but I was awake for the less than convincing parting sea and then nodding off with the postscriptum of tired Moshe Bale clinging to his stone carvings and dropping his childish God-nipper as the caravan heads further into the road to Jerusalem... very yawn-making...
" An insult to Judaism and Christianity
",2020-12-13 00:00:00,3,Average film dying to rewrite the bible. Why not get your source material from elsewhere? if you are going to deny the existence of God in the story. Between this rubbish and that Egyptian god rubbish film..Leave these tales alone ..only the Greeks seem lucky enough to become unfashionable enough that their Gods wont be rewritten. Oh well let's see what happens with the Nordic tales
" TOP CLASS HISTORICAL FILM
",2020-11-07 00:00:00,8,"What Ridley Scott has delivered here is just great. Emotionally upsetting, with epic scenes and a damn good soundtrack. And yes, I see the length of 150 minutes as the only real point of criticism. Because hardly any other biography like that of Moses is so epic that a Hollywood blockbuster is the only right one. But here a length of over 3 hours would have been more appropriate to deepen the individual characters, of which there are quite a lot, which unfortunately was only mediocre. Otherwise, one can easily feverish the story, although one knows it and although the first half of the film is only ""good"" from a dramatic point of view, which is above all because the sufferings of the Hebrews are not shown intensely enough. Some people criticize Ridley Scott for not exactly sticking to the biblical facts here. I think he's doing it just right. Just as he showed new approaches with Alien, which were not particularly well received, he is going the same way here. This gives a film whose story is generally known a certain unpredictability and freshness.
Thank you Ridley for this movie experience."
" Why?
",2020-10-08 00:00:00,4,"Why is this movie? For what audience is this movie? What's the goal of this movie? If it was because of money then, well, seeing that the costs and the box office are almost the same, this didn't go too well. It definitely wasn't because of some religios motivation because it exceeds at missing the point. So in the end all we have is a cliche action movie based on the bible made for no one. So much talent wasted if you look at the cast and also at ridley Scott. They should've just done a different movie"
" What a strange mismatch of special effects and screenplay
",2020-10-03 00:00:00,5,"The film is brimming with special effects that vary between more or less acceptable, and sometimes rather good to remarkable, but there is a mismatch between those super-realistic effects and the rest of the production. Christian Bale as Moses was an odd choice, given his recognizability. His star=power does not help the film. The effort to naturalize the story by de-mythologizing the characters and settings fails because the story really actually is a myth, at least in terms of what we are accustomed to experiencing in our own lives. Think for an instant how you would react to those special effects were they actually to occur. So, which to choose? Myth or history? Perhaps it should have been produced by Peter Jackson rather than Ridley Scott."
" just. plain. silly.
",2020-09-06 00:00:00,2,"An uncommonly stupid portrayal of what is-as the movie's title and billboard explicitly declare-supposed to be the biblical account of the Hebrews' exodus from Egypt and into the 'Promised Land.' I didn't expect an authentic account of the story. I didn't even expect a loosely-based-on telling of the story. But this film is so off the mark, in every way possible, that it has forfeited any rational and defensible right to name itself after the Bible book it is supposed to portray.I'm no scholar, so I'm not sure how much extra-biblical chronicling of the Exodus exists from antiquity; but unless there is other source material out there that is strangely and perversely contrary to the biblical account, this film certainly ranks among the most perverted presentations of supposed 'history' in the annals of motion pictures.Others have done a fine job of pointing out the silliness in the characters and plot, so there is no need for me to recite those absurdities. Suffice to say that if you're looking for some decent special effects complementing inane content, you might suffer it well."
" Awefully butchered story about Moses
",2020-08-08 00:00:00,3,"What shall I say, I have never seen such a worse adaptation regarding this Biblical story ... a small boy playing the role of God or an Angel? No explanation of Moses and his Brother and why the plagues were used against Pharaoh and his people? Aweful! Moses carving the 10 laws by himself? ... I could go on and on...
The only good thing is the Camera and the visual effects..."
" This is not a story of Exodus
",2020-07-25 00:00:00,1,"Now, I know that it's not easy making a movie after 'real' story. And I know that sometimes you need to make adjustments, like the screaming and accusing in Apollo 13.
But there is no way anyone can argue that the 'adjustments' in this movie serve the purpose of advancing the story.
It seems as if someone said let's take those 3 elements of the story and make A TON up random stuff along the way. This is just madness.Btw, you can see further evidence of low production value in the CGI just look at the red Nile.Terrible movie, I want my time back...This. Is not an exodus movie!!"
" Why was this made?
",2020-07-07 00:00:00,2,"The director sure did create an ""epic"" environment. It feels big and looks great but that is where my positives end. When you name your movie ""Exodus"", people have a specific book in mind and that book is not what this movie was based on. I'm pretty convinced that Hollywood has a different ""god"" and a different ""bible"" than the rest of us do. This version of moses was arrogant and murderous. Not the meek and humble (but still human) man working on behalf of God for the Israelites. It is obvious the director, writers and actors have a certain special disdain for God.On the secular hand, the characters lacked all emotion besides loud and arrogant. I'm not sure if loud is an emotion, but this movie thinks it is.This movie isn't worth anyone's time and energy. Read Exodus, it's a lot better."
" Exodus stage left...running...
",2020-06-30 00:00:00,6,"I'm not quite sure what went wrong with this; so it might be better start off with what went right...? Someone, Sir Ridley Scott presumably, had watched Charlton Heston and Yul Brynner in ""The Ten Commandments"" (1956) and thought that it could do with a bit of a refresh; hell it worked for Peter Jackson! Let's get onto Nina Gold and see whom she can find... three minutes later they elected on Christian Bale as Moses and Joel Edgerton as Ramses II with a supporting cast of Sigourney Weaver (Ramses' mum); Sir Ben Kingsley (""Nun"" - no, not as in Mother Theresa) and John Turturo as the Pharaoh Seti (who was reputedly both wealthy and wise, so what was he doing in this?). Only Ghassan Massoud (Grand Vizier) came anywhere near convincing anyone in his portrayal, otherwise this is really just an unashamed rip off of De Mille's version with enhanced digital - not necessarily better - special effects. What is interesting is the manifestation of Jehovah as the young boy and the imagery of the plagues sent against the Egyptians is presented in a potently gruesome, grizzly fashion. The rest of it is long, fairly run-of-the-mill and I struggled to see where the alleged $140m went."
" Exodus, but not prince of Egypt
",2020-05-29 00:00:00,6,"Like anyone who watches a movie based on a true story or even based off a book it's never 100 percent accurate, ask any movie goer. What this director and writer forgot is that it was targeting a Christian audience (for the most part) and needed to stick to the story! There are significant meaningful parts of this story that are forgotten and replaced. Moses's staff for one, not a sword. The entire relationship between God and Moses was pretty much absent. They basically filmed it as if the two never liked each other. The movie almost seems to be half on the side of the murdering villainous Ramses and half on Moses's. SEVERAL scriptures of the story weren't shown, including some of my favorite parts or they were heavily altered. I will say though there are parts in the Bible where it doesn't go into detail in which the writers had to get creative, and they did, but not in a very accurate way. I went to see this movie because I am a Christian and also a fan of Christian Bale, he is a great actor and they are moments where he and Ben Kingsley do a great job. Unfortunately because this lacked faith, heart, knowledge and respect of these biblical heroes and God for that matter, it wasn't a success."
" Should not be allowed
",2020-05-26 00:00:00,1,"This film is absolutely nothing like the story it purports to be telling. It suggests it's a portrayal of the account in the Tanach and Bliblical Old Testament of Moses leading the Israelites out of Egypt. The story is almost completely made up in the mind of author and is not taken at all from the manuscripts in which the account actually exists. It is insulting to the devout Jew and Christin alike. There should be some warning at the beginning of the film that it has absolutely no likeness to the Tanach / Biblical accounts of Moses, and apologise for the insult it is to those who truly believe. Absolutely horrendous!!!"
" Unnecessary violence against animals
",2020-05-25 00:00:00,5,"If there hadn't been so much attention on the various ways to kill horses, I would've given a higher rating."
" Absolute nonsense...
",2020-05-10 00:00:00,1,What a load of absolute nonsense... totally unscriptural!
" Dull and overly long
",2020-05-09 00:00:00,2,"Having little knowledge of the backstory of this film, and not caring overly much about these certain historical biblical period piece dramas. Found Exodus to be quite boring at many parts, overly long and dragging on in several instances. There were a few scenes which sparked some interest but overall, this was not a great watch. One is not surprised at the criticism this movie has faced, resulting into an obvious box office disaster (given it's $140 million dollar budget)."
" Better than most reviews claim
",2020-05-02 00:00:00,8,"Joel Edgerton doing the whole thing as Richard Burton, Ben Mendelsohn in eyeliner and Christian Bale at his earnest best - what's not to like? I saw it was on TV and watched out of curiosity then was hooked in about 10 minutes. It seems to have annoyed a lot of Christians for not sticking to the facts(!) but I found the revisions to the plot quite interesting and it was more believable than the book"
" Could have been amazing, but it's the opposite
",2020-04-18 00:00:00,1,"Just read the actual book of Exodus. If you cannot read, then watch the cartoon, the Prince of Egypt, it is way better. Not worth renting... So you think you are going to see one of the great stories of the Bible by watching this, guess again. Why, why, why, would you alter the 2000+ year old account of the Exodus that still amazes, to present some rubbish twist of the account that WAS written by Moses. So to tell it otherwise with Moses as main character is frustrating. Also, to portray God as a emotional child who always bickering with Moses and vise versa, not the humbled man Moses is told to be, it is not the God of the Bible or the man Moses (shows complete ignorance of the writers and those involved in the production). God uses man to accomplish his goals, he used Moses and demonstrated his power through him, from the burning bush to using the staff, to parting the water... This movie just gets it all wrong, visual affects are great, acting is good. So why one star? You can't allow ignorant people to just rewrite history to give your own twist on events that is totally an unnecessary change, and get away with it because of technology and CGI. It is like it is on purpose to try and make people discount the Bible and God, and I'm not ignorant it is ""just a movie"", but you have just lowered everyone's intelligence and knowledge by releasing this trash story."
" Distortion of Islamic original history!!
",2020-04-14 00:00:00,1,How dare they are? Who give the permission to destroy the actual history of Islam? In original history there Feraon (remeses) die under the sea but in this movie its not happen that way. Also there are lots of distortion make by this film. Wast of 2:30 hours 😑
" Exodus Delivers
",2020-04-13 00:00:00,8,"The story of Exodus is one of the most timeless, significant stories of history, and portraying it in a Hollywood epic was a Herculean task. Whenever Biblical material is tackled, there are two groups the director must please: religious folks, who expect word for word Biblical accuracy, and non-religious folks, who just want an action packed movie, which is not overtly religious. This film doesn't please either of these two groups. So Exodus was destined to receive bad reviews, which is a shame, because it is a spectacular film. The rivalry between family members Moses (Christian Bale) and Ramsees (Joel Edgerton) provides tension from beginning to end. Alberto Iglesias' musical score alone is worth the admission. An exciting watch, especially at Easter!"
" What is this movie?
",2020-04-10 00:00:00,1,Is this movie any related to the biblical stories of Moses? If yes...then the director has to do more readings.
" Ridley could have done better
",2020-04-05 00:00:00,4,The acting was average by everyone in the movie. This is because the script and the cinematography lacks credibility. Special effects were awesome and can see why this wasn't released in the US. Much more script could have done well and kept to the story line instead of mixing along the way.I watched it 'coz of Ridley Scott and I was utterly disappointed.
" Not a true depiction of the bible story!
",2020-03-29 00:00:00,1,"I usually don't write reviews and am not happy that this one has to be a bad one, but depicting a bible story is of utter importance and a moral obigation to be correct or not be done at all, and this one is simply wrong.The movie is visually alright but that is not what a bilbe story is about.Moses is depicted as a very confident general, but was he in the bible? The man who did not feel comfortable approaching the Israelites himself, who let his brother Aaron talk instead?God did not appear to him as a child in the bible, did he?BEFORE every Plague, Moses approached the pharao do warn him and give him the chance to let the Isralites go to prevent a plauge from happening.The water was split - not a tsunami - although I like the approach that everything that happened are naturally occuring events, just much more intensive then normally.I could go on, but I think I made my point: Don't mess with a bible story, make it right or don't make it at all!"
" Why Faraw King Alive!
",2020-03-27 00:00:00,8,"Enjoyed this movie but problem is story has been mixed with actually story. Faraw King has been died in river but in this movie Faraw King is still alive, beside there is no visible face of God so how can you show show real existence! It should be hidden or you can make it just echo voice."
