title,date,rating,review
" With nowhere near the auditory or visual pop and splendour of Kingdom of Heaven,
",2020-02-14 00:00:00,5,"With no lessons learned from the much better paced Directors Cut of that film and with none of that film's current social relevance, Scott's Exodus is not as well written as Gladiator and relies on its star power instead of its character development. And while Bale is excellent, and whitewashing is a complicated issue that I won't touch, the moments brown-face does go a little too far. Was there ever any legs in the idea of a gritty realistic Moses story? I don't know. But what I do know is absolutely every ounce of Scott's magic is absent in this film, save for a few decently constructed scenes and the requisite good design. It's an immediately boring, toneless, pointless hodgepodge."
" it's not a perfect movie, but it's good entertainment
",2020-01-23 00:00:00,7,"I really don't understand why people dislike so much this film. Although we know its flaws - like the plot being very similar to Gladiator or Bale's not so convincing acting -, it is always a film that I watch when is on TV. The production is great and the film pace keeps you enterntained for the whole movie. Bottom line: don't just go watch the film based on the very bad or very good reviews (in fact, be aware of film reviews that says the films are ""worrible"" or ""wonderful"") - it is not the best film directed by Ridley Scott, but for sure it deserved a better score in IMDB."
" Did not like it
",2020-01-05 00:00:00,4,"The story is weak and quite short for 150 minutes.
The action offers little action and is sometimes boring.
The only positive thing is the performance of Christian Bale."
" A good movie ..soundtrack..only bad for religion ppl
",2019-12-09 00:00:00,9,"A good movie ..soundtrack..also pic...
only bad for religion people
Open your mind guys its not history book"
" Misunderstood, but profound.
",2019-11-24 00:00:00,10,"Surely very misunderstood, from what I gathered reading some reviews. However if one keeps his/her mind open and see the beauty in the choices and depth of Moses's portrayal and God's by Ridley, one can really enjoy and have a cathartical experience. Loved it."
" Not a big Bible movie fan
",2019-11-14 00:00:00,10,"But I enjoyed this film, I love Bale's acting, Edgerton's also, a long movie, but I watched it beginning to end, great special effects!"
" Diverting Enough...
",2019-11-04 00:00:00,6,"I ironically first became aware of this film when it became the centre of a firestorm of criticism about five years ago over the 'whitewashing' of history by casting hot caucasian Sigourney Weaver as an ancient Egyptian queen. (This may have been a canny publicity ploy to get us to all watch it, since she's hardly in it, but thanks to all the 'negative' publicity surrounding her role in it we certainly do now; which is why I bothered to watch it in the first place!)Ironically it's her accent that was actually the most incongruous aspect of her presence in it; and the wide range of accents throughout the cast that most recalled the old Hollywood biblical epics of the fifties.'Gods and Kings' does have the odd sliver of wit that makes it worth trudging through, and both the cast and the design often look good; although the cartoonish CGI aerial shots will probably date it even faster than it's fifties forbears."
" Depressingly disappointing...
",2019-11-04 00:00:00,2,"I think Scott lost his way directorially a some time ago. This film is, sadly, no exception. This has little to offer in terms of anything new in the biblical epic genre. Especially irritating is the mix of disparate accents that kill one's ability to believe and immerse oneself in the on-screen story. The visual effects are good but the movie has no soul and the cast are such a hotchpotch of actors clearly not suitable for their respective roles. All-in-all it left me feeling like the movie was pointless to watch - I just couldn't get into it. It could and should have been so much better."
" Wasted talent and an old story embellished.
",2019-09-03 00:00:00,2,"Ridley Scott has given us some epic movies, Alien springs to mind, as does Gladiator and also Blade Runner.This is definitely NOT one of them. I would even go so far as to say ""who are you, and what have you done with Ridley?""I am a big fan of Ben Kingsley and will generally watch any movie in which he stars.Unfortunately, both he and Sigourney Weaver, two talented actors, were completely wasted in itty bitty roles and I was left wondering how and why they were enticed to stoop so low.The money must have been very good.Christian Bale (loved him as Batman) was a poor, unemotional Moses and his role in this biblical story was almost completely ignored. There were no ""let my people go"" moments. Director Scott has done his utmost to present the plagues as occurring due to natural phenomena.I wonder whether he tried to think of a way to make the killing of the first born seem natural too, although to his credit, he didn't attempt such folly.His presentation of God as a nasty, vengeful, precocious brat was unsettling, to say the least and I must admit to being slightly offended by his choice of metaphor.Aaron too, a central character in the biblical account, was relegated to the level of an also ran, despite his having been accredited as Moses' 'mouthpiece'.The film was overly reliant on (in my opinion mediocre) special effects, and very thin on getting the best out of the actors, all of whom have, and could have, done much better.This is an ideal movie to showcase special effects but Scott's need to retell the story with his own (anti?) biblical slant, missed many opportunities to create a spectacular epic.Raining hail and fire was missing, the plagues being presented as a natural course of events.We also didn't get the snakes, Moses starting the plague of blood or any of them, he was relegated to the role of a spectator.No clouds by day and pillar of fire by night.In leaving out so much of the original story, Scott has relegated what could have been a grand epic to 'just another movie', one where I found myself hitting the fast forward so I could get to the end and then to bed."
" Better Than Average Sword and Sandal- Exodus: Gods and Kings
",2019-08-30 00:00:00,6,"Ridley Scott is a master of special effects and action. There is plenty of both in this film. There is also a dearth of screenwriting and adaptation, unfortunately, and it holds back the film from being a few notches higher. It is not as good as Gladiator, and not as good as the original Ten Commandments, which had very few special effects, actually. The special effects in this film bury the original, but are buried by the mundane performances of the actors. Mr. Bale is really not up to the level of acting required for this role. John Tutturo was very good, however. But the worst miscasting was for Ramses (the ghost of Yul Brenner must be spinning in his grave). That portrayal was God-awful and kept the film from A status. Ben Kingsley gives it his Edward G Robinson best shot at a small role, and does all right, but where is your Messiah now, NYAH? Why not include Billy Crystal in the fillm; he would have been a better Ramses than the one that played him. Egyptians didnt have a British accent, eh what? The mountain side scene was the best in the film for me; great filmmaking, but not quite enough to make up for the serious writing problems. When will Hollywood learn to spend at least 1% on good writing. For 1.5 million, you could get Shakespeare to write the damn thing. Despite all these misfirings, Scott single-handedly pulled off a better than average epic. There have been several that have been worse, but there has also been several that were better."
" A visual treat, yet something is sorely missing
",2019-08-24 00:00:00,5,"I was hesitant to watch Exodus, despite my love for Ridley Scott and his style, as I heard many stories about the filmmakers and actors not fully grasping the story of the Book of Exodus. Scott, as an atheist, was a strange director to make a Biblical story. I was pleased with Exodus as an exclusively epic scale film, however it's Biblical aspects are thoroughly lacking.For a start, the story is only slightly partially faithful to the Exodus narrative and there are many, many, many small aspects that are changed. For example, Moses kills two Egyptians in an alleyway instead of one and he does so to protect his identity not to save a beaten Hebrew. Another aspect is the lack of Moses' staff and its use in the crossing of the Red Sea. What is worse is that there are many more essential details that are missing: Moses and Aaron meet far too late into the story, the plagues occur out of order, the burning bush IS God (not the angel). So many things are left out and they seem small to regular audiences but to the Christians watching, it is quite a travesty.The movie is largely centred around its visuals, which is fine for an epic to do, but there has to be an underlying substance to hold all that spectacle up. And sadly Exodus has very little substance. I found it very hard to relate to anyone in the film, even the enslaved Hebrews. It was a struggle to empathise with the characters. I want to say the visuals and production design make up for the lack of characterisation, but I cannot. I love Scott's visual style but it cannot float without good characterisation. But I must say... my goodness is this film a beauty to look at. Both computer-generated and practical, the production is truly great. Expected for a Scott film.The acting overall is fine. No one really stands out to me apart from Joel Edgerton. His broken character is all that makes this movie more than an empty eye-candy fest. Bale is a very strange pick for Moses, but I grew on him as the film progressed. Everyone talks about Bale's casting being strange but I find Ben Mendelson's casting as the viceroy the weirdest thing I have ever seen in an epic film. And I've seen some weird Epics (also can we just point out that Ewen Bremmer, the guy who said in AVP ""now this is like finding Moses' DVD collection"" is featured in an Exodus film? I genuinely think Scott hired him just to make that gag).I wanted this to be so much more, but I guess having a Biblical film directed by an atheist, this is the best kind of result we could have gotten."
" Not exactly true to the Biblical story!
",2019-08-18 00:00:00,2,"I started to watch this film last night on TV and after about an hour, switched it off. To start with, it bears NO relationship to the Biblical story whatsoever (Exodus). There is no record of the Hebrews being taught to fight and the telling of Moses and the burning bush is twisted out of all recognition! It put me in the mind of Darren Aronofsky's version of Noah (with Russel Crowe) which had a very similar handling. Both would be better being labelled ""based upon the story in the Old Testament"" because that's about as close as it gets!"
" Horrible
",2019-08-10 00:00:00,1,"This is not Moses story. Unreal story, horrible acting, bad cgi. everything in this movie is just bad."
" Below par
",2019-08-02 00:00:00,5,"Bit naff. Only watched it all because Christian Bale was Moses. Oddly this film made me question whether the ""miracles"" were in fact miracles, or whether they were just random acts of nature."
" Flawed Exodus
",2019-07-16 00:00:00,7,"Follows the basic story from the bible, but too many unanswered questions. For example, what happened to Miriam the sister of Moses? According to the bible she leaves Egypt with the Israelites and is part of the leadership. However in the movie ahe disappears after saying goodbye to Moses as he heads into exile. Could have been a better flick by staying closer to the bible"
" Very good IF you have an open mind.
",2019-06-26 00:00:00,9,"As a Christian, I take the Bible very seriously. In Deuteronomy 4:2, God tells the Israelites: ""You shall not add to the word which I am commanding you, nor take away from it, that you may keep the commandments of the Lord your God which I command you.""When Bible movies add things God did not place in His words, it can be bothersome to me-though I do enjoy movies like Noah and The Last Temptation of Christ. I have realized overtime that these movies are not intended to be the Bible onscreen, but rather inspirations from the director's mind, and not literal adaptations. That's all I will say on that here, before I get off topic or, perhaps, controversial.Exodus: Gods and Kings was directed by Ridley Scott, who's an atheist. His interpretation of the classic Moses story was originally one of the 10 worst movies I had ever seen, and I therefore gave it a 2/10. You can tell that from older reviews I have written.I mentioned that last month at a church youth group meeting when we compared the Burning Bush scenes in The Ten Commandments, The Prince of Egypt, and this. We all cringed at this version of it, which has many changes, such as Moses falling in quicksand and breaking his leg and a little boy talking to Moses, not the bush. But we compared it to the book of Exodus and found similarities between the Biblical narrative and the movie.However, on June 11th, 2019 I rewatched Exodus Gods and Kings and realized that it very much requires an open mind-and one with a movie in mind and not The Bible. It does follow the overall skeleton structure of the story, but it puts new flesh on it. I gave you the Burning Bush example, and I'll leave you to the others to examine yourself.I have heard that the effects are dull, but I highly disagree! The Red Sea Parting looks awesome, and I'm sure Cecil B. DeMille is rolling in his grave that Scott could make it cooler! The Plagues are nice too, I truly believed that all the water turned to blood and that insects and frogs were covering Egypt. Exodus Gods and Kings has set the standard for epic film-making in the regard of special effects!I also think the pacing is nice. It runs for exactly 2.5 hours and it felt more like 2. Some think The Ten Commandments(a nearly 4 hour movie) felt shorter, and AT TIMES I could see that, but it definitely does not apply to the whole film.On a grade scale of A+ to F, I am going to have to give this a simple A. I did have a couple of inaccuracy and other minor issues, ones I would rather not mention in favor of how much I admired Exodus Gods and Kings my 2nd time around, and they are also rather hard to put into words. But that is besides the point. There is so much good it overshadows any issues.In respect of Ridley Scott's vision, I admire and recommend Exodus Gods and Kings. Like I said, it requires an open mind to watch it, not a Bible to movie comparison. It's astonishing effects and unique storytelling(which I should note make you wonder what Moses's life was like out of the Bible's teachings) and interesting casting choices make this a pretty good Bible movie for the modern audience who want a fresh take on Moses.It's epic, it's grandly shot, and it's Ridley Scott's interpretation of Moses. Take it or leave it. I took it, and now I admire it! I could make more comments in favor of the movie, but for now I'll take an Exodus from this review! Exodus Gods and Kings is a spectacular vision and one worth experiencing if you are interested.As of 10/8/19: Movies I ""Really Like"" and ""Liked"" will be 9/10 stars."
" my notes
",2019-06-25 00:00:00,4,Meh. it was ok but long and boring. a cool visualization of the story. good directing and cool scenes. Christian bale is still a beast (1 viewing)
" This film is nothing to do with TORAH,QURAAN,BIBLE
",2019-05-25 00:00:00,1,This movie has no relationship with religious beliefs.This is not based on true events
" Visually spectacular but with no soul
",2019-05-23 00:00:00,5,"Visually it was stunning!! but for me the film didn't really know where it was going, it wanted the audience to decide on what they thought really happened! which I think lost at lot of the emotional factor to this great story!!!
Also I believe Ridley decided to try and please everyone but in the end that just made it potentialy being a great film in to a mediocre one."
" Wasted potential on an epic scale
",2019-04-24 00:00:00,4,"On paper, Exodus: Gods and Kings sounds like a surefire hit - proven starpower, an obscene budget and a suitably large story. Unfortunately, this film should have stayed as just a idea.Director Ridley Scott uses as much CGI as possible to compensate for the dull script, making Christian Bale and Joel Edgerton's jobs an uphill battle. Their acting abilities become diluted by the overly-serious tone, restricting them to playing only a fraction of their character's potentials.It doesn't get any better at the film moves forward, relying on the biblical storyline to carry the rest of the production: more famous actors and panoramic scenes are exploited, but nothing makes any meaningful impact on the viewer whatsoever. By midway into this 150 minute slog, you'll be praying for the credits to roll."
" The CGI is Great But the Whole Thing Just Falls Flat
",2019-04-22 00:00:00,7,"Insert plagues here then return us to a long, drawn-out version of what should be an epic story. Alas, filmmaker Riddley Scott lays an egg. Portraying the image of God as an 11 year-old child? No pillars of fire? The only worthwhile changes involve Moses' love for his wife and his adopted brother, Ramses II. Like ""Scrooge"" this story has been filmed many times before. The only two versions I like are the 1956 De Mille extravaganza and Dreamwork's animated ""Prince of Eqypt."" Can you say different?"
" Horrible, real miracles replaced by hollywood tricks
",2019-03-14 00:00:00,3,"It could have been such a beautiful meaningful film. Great actors, good budget, wonderful story.
And then they mess up the story. The wonders that happened are ignored or rationalized. And then new impossible events - wonders or rather, 'hollywood tricks- are squeezed in..
Why? Why?"
" A beautiful historical mythology movie.
",2019-02-23 00:00:00,10,"10/10 - regardless of watching it as a religious movie and watching it as a historical fiction movie, you will be very entertained by the visual effects, the story plot and the music.Christian Bale as Moses was the man of the movie for me."
" Visually great, but with changed story and without a soul, sadly.
",2019-02-19 00:00:00,6,"As a visual spectacle its a treat, really. 8 stars. So if you are not a Christian its entertaining. Else you are in for a shock: parts of the Biblical story are rewritten!
To a degree I can understand adding a few sideline stories and adding in the Bible unmentioned details, but altering the main character, Mozes, baffles me. In the book Mozes is humble in a way but Bale (a good actor) turned him into anything but that. He's a warlord kinda person. Worse, Bale played like if he hated the role. Hence his character feels hollow.
The pharao has a more interesting character but is depicted as a bit of a crazy madman. Why? Also puzzling: God is... a kid. Personally I can live with that chouce but weird it is.
And then there is the famous scene at the red sea. Its spiced up with a dozen tornados (luckely they left out flying sharks...) Oh and Mozes and Ramses have a sort of 1on1 standoff in the middle, seconds before the tsunami (!) hits and... both survive. Its downright crazy.
This could have been a great movie, now its pretty good fun, but only as simple entertainment without the Biblical perspective. If you count that in 4 stars would be the max."
" A decent film for what it sets out to do
",2019-02-18 00:00:00,7,"If you're looking for an enjoyable action/adventure/drama movie based on Exodus then this movie is worth a watch. I feel a lot of the low scores are unjust and must be because of other people's impossibly high expectations given what Exodus means to them or they wanted deep drama with character development (something the actual book was no good at either). I just read Exodus for the first time recently (I'm not religious) and decided to watch this movie. The movie follows the book quite closely with only a few minor changes which I felt actually made the story more believable and compelling. The boring parts of the story have all been kept out or displayed rather, in a manner that requires very little scene time but enough to pay homage to the original. Overall, the movie finds a decent balance between action, adventure and drama to tell its story but doesn't excel in any category. A slightly above average movie that is worth a watch but this movie doesn't bring anything exceptional to the table."
" CGI movie with historical setting
",2019-01-25 00:00:00,3,"The movie does not meet any criteria that comes with this heavy topic and fails everywhere.
Three stars because I like the CGI and the actors because I know they can act good, in other movies though.It is probably one of the most famous biblical stories and I would expect the movie will thematise aspects like faith and struggles in difficult situations, the fight between god's will vs individual will, morality, ...
Moses as the key figure with his change from pharao's royal family member into leader of Isrealites and prophet of the one true god.
But what is shown is a Moses who doesnt believe in his god, who does not know why he is doing what, who is unwilling to follow god's way ... and all started because Moses had an accident and was hit on this head, really?!
OK, who wouldnt doubt like Moses when god is portrait as unreasonable, angry and vengeful little kid... while writing this review I noticed that Ramses is more multifaceted portrait then Moses.At some points the movie tries change perspectives, tries to show situations from different view point, question but also fails as it doesnt go enought into depth, doesnt give the characters the opportunity to develop. Instead characters change from scene to scene with contrary behavior.Actually I cannot remember having seen a good Ridley Scott movie for quite some timeSome examples:
Struggle with faith is portrait as two people openly questioning Moses decisions and his reply is something like: follow me because I say so or die. So the Hebrews dont even accept Moses as his prophet but just follow him as he is less evil compared to Egypt slavery.Moses is secretly watched when talking to little child god, creating the perception of mentally ill person.Moses always only talks to 3 Hebrews but convinces all of the thousands others.Moses leaves his wife and kid because of his visions after head insury and because he was told he and his skills are needed for what to come. Actually Moses does not do anything except of displeasing little child god, not knowing what is happening, not knowing what to do, not agreeing with god's will, not really caring about what is happening.Moses grew up with Ramses as brothers. Ramses doesnt hesitate to cut off the arm of Moses' foster-mother just because some guy said some rumours about Moses. Then Ramses exiles Moses but gives him his sword as help for survival. Later Ramses orders Moses' death not thinking twice but always keeps a welcoming tone when they speak to each other.Ramses"
" Um. You forgot the biggest scene in the Bible
",2019-01-19 00:00:00,1,"What happened to the Red Sea parting. That is like the most important and cinematic scene in this biblical story and you didn't even address it. What a rip off!I've never seen a worse biblical movie-well, maybe Noah with Russel Crowe was worse... but still. Ugh. Terrible."
" Not Really Sure About This One
",2019-01-04 00:00:00,6,"I was really confused how to rate this movie. As a spectacle and action movie it was good. Good battle scenes, great CGI, decent performances especially from Bale. But I am Catholic and no matter how much you view this as an action movie it is very much aimed at being a historical masterpiece and it's there where it fails. It is really inaccurate and bordering on offensive. Sometimes there is a degree of artistic licence a director can use but I think where religion is concerned they should not stray as it such a sensitive subject and means so much to many. A decent action movie but no more than that and if you are Christian or Catholic I would probably give it a swerve"
" Nice movie!
",2018-12-08 00:00:00,8,"I really don't believe in god, but I like this movie!"
