title,date,rating,review
" Save time: don't watch this
",2021-04-03 00:00:00,2,"The acting is good. Everything else is an attempt at aligning as many clichés as possible in 90 minutes. The family man of the title is an utter failure of a human being and thoroughly uninteresting. I managed to watch till the end thinking with this IMDB score there had to be something else but no, there is nothing."
" Decent actors miscast - couldn't buy it
",2021-02-11 00:00:00,2,"As one who's seen the corporate sales game up close, each of the principals here are badly miscast. I can't say who is the worst between Butler and Dafoe, both miss by miles. This tainted the rest of the movie for me. The family scenes were passable though even there Butler and Gretchen Mol were not ideal for these roles. The children were great. Excellent performance by Maxwell Jenkins as the son."
" Must see...even if it's just once.
",2020-10-28 00:00:00,10,"Don't listen to the wannabe critics. This was a great film. I don't know if this movie was medically accurate or not. I'm not a doctor. What I do know is that, whether or not they got the medical aspect correct or didn't, that isn't what caught my attention. The emotional feel of the film...did. Their acting was superb and heartfelt. I felt their pain, without question. As a parent, this was unbelievably hard to watch. After a certain point, I just couldn't stop the tears from falling. I would absolutely recommend this film."
" Formulaic - not bad but nothing special
",2020-10-25 00:00:00,7,"I never got around to seeing this movie. I'm seeing it now and it's- eh.Some of the more emotional parts of the script seem a little forced, despite the great acting. I think the written dialogue is a bit old for the age of the children, kids don't speak that way.Definitely, not a wasted 105 minutes, but not the best you'll ever spend."
" Medical joke
",2020-10-09 00:00:00,1,This movise is a medical joke in many ways. ACL patients cannot go out like this due to low immunity. No doctor will tell these statements in the real words. Finally the waking up from a comma.. please spend money wisely next time.
" Family over money
",2020-09-22 00:00:00,7,Awesome....This family drama have lot of moment's to cross check our daily life.
" Don't believe the low critic reviews
",2020-08-22 00:00:00,9,"Well written, well acted, and heart touching. Highly recommend this movie"
" Gerard Butler Weeper
",2020-08-22 00:00:00,7,I had no idea what it was about do I kept waiting for someone to get kidnapped but this is not the typical GB action flick. His kid gets sick and he learns some lessons. Good performances. Half a hanky.
" What's not to love
",2020-08-09 00:00:00,7,I thought this movie was well made although overly melodramatic for sure. Gerard Butler was ok. My favorite part was Alfred Molina. Also enjoyed the Chicago architecture scenes.
" What you'd expect from a Gerard Butler movie
",2020-06-12 00:00:00,3,"The film lacks structure and believe ability and having a stereotypical Sikhs doctor os an insult.
Plot is weak and rushed. I felt no emotion at all. This could have been such a good film.
It looks like it was made in 2 weeks .
What a shame . Not wanting to be unkind , how does Gerard Bultler get the roles ."
" Great movie
",2020-05-28 00:00:00,8,"Heartwarming and brings you to think about the priorities in life, particularly if you have kids.
Nice acting with high quality characters."
" Always ignore the critics
",2020-03-14 00:00:00,10,"I went into it not knowing what to expect but this movie thoroughly kicked my ass.Ironically, the pathetic lonely fags they call metacritics gave this film an equally pathetic low score.The best films almost always have low metacritic scores while the worst films have higher scores. It clarifies to me just how sick and dark Hollywood really is."
" Sorry, but it was just not good.
",2020-02-27 00:00:00,2,"The whole thing was pointless. And predictable to some extent. I don't really like Gerard Butler, but I'm not one to be put off by a movie for it. However the whole thing was tedious to watch. Not even good at being a « tear-jerker ». The casting was good, that's a fact. But the drama was really out of place or even, all over the place. And the ending... I still don't understand how someone with a cancer so advanced, to the point of considering fighting it with AIDS, could recover this fast."
" Jerry maguire v2.0
",2020-01-14 00:00:00,7,"Magic stirs men's blood. Sunlight streams down on father and son with closed eyes and outstretched arms in downtown Chicago, and their spirits surge. Corporate headhunter Dane Jensen, the father in this scene, needs such magic. Equal parts charming and ruthless, Dane is on the verge of taking over the company that employs him. At the same time, his young son Ryan is diagnosed with a life-threatening illness. Channeling some inner darkness of lies and deceptions has always provided Dane with an edge against competitors inside as well as outside the company, yet that is not what his family needs now. In fact, they've never needed it. No one does. If Dane ever realizes this, it may come too late.This well written and touching film explores what it means to be a family provider. It takes heart as much as strength, and empathy as much as confidence. The excellent script is written by a former headhunter; it takes one to know one. The film is full of delightful twists and turns, and it goes to unexpected and fascinating places. Part of the magic that stirs Dane's blood, for example, comes from seeing the city and life through the wonder filled eyes of Ryan. The cast, including Gerard Butler as Dane and Willem Dafoe as Dane's boss, is wonderful."
" Nice movie
",2020-01-12 00:00:00,10,Nice movie and script. Intriguing story with iOS and downs with architectural interests shown
" Bloody awful, a Christmas film it is not
",2019-12-29 00:00:00,1,"I was talked into watching this borefest over Christmas and boy was it painful.Some people on here are talking about how much 'depth' the characters have. What???Anyone vaguely resembling Gerard Butler in this film needs to be punched in the face.Upon seeing his son's nice hospital ward Gerard Butler says 'wow, nice tv I wouldn't mind catching some leukemia myself'&'Come on, his heart's stopped, so just switch it back on'How on Earth are the only a handful of 1* reviews."
" Movie Critics Without A Clue
",2019-12-28 00:00:00,10,"Can I just say....unless you are Roger Ebert, you hardly can call yourself a film critic. Most ""pro"" critics hardly rated this film. Good for you...read mine because I love movies like this one! You should decide for yourself that family takes priority over career choices! Gerard Butler carries this film so well. The whole cast is believable and yes there are contemptuous companies that care more about earnings than people. Watch this movie and let the story be told!"
" Family Man Reality!
",2019-12-28 00:00:00,10,This uber successful family is faced with the family crisis. Financial success and status seem trivial compared the reality that happens to this family. The cast presented a real story of how the pressure to succeed can be halted when your kid needs you more than your job!
" Sorry on behalf of low reviews
",2019-12-28 00:00:00,10,"This movie is very very well made. Story can be said as old but hey that means how close the matter is to our hearts.It has closed every loop it opened during the plot. Very beautifully written, edited, music, cinematography and has hell lot to teach. Everybody plays a vital, complete and beautiful role."
" Good intentions, bad movie
",2019-12-27 00:00:00,4,"I am really surprised at the glowing reviews. It was hard to find anything enjoyable about this movie. The script was bad, the acting mediocre, and the storyline was lacking. Skip it."
" Surprised by the poor critical reviews
",2019-12-23 00:00:00,8,"Movies are supposed to change you in some way...make you laugh, cry, be excited, afraid, etc. this one accomplished its goal."
" Surprisingly excellent
",2019-12-23 00:00:00,10,"Honest, care- fully and intelligently written to give light to more than itself. Im glad Im not a critic' with such a profound nose stuck up in air to high to feel. Nope- Rather I'm just a professional human being avg hard working parent, some 50 yrs of experience though. Thoroughly enjoyed the yhoughtfully crafted characters throughout and their honestness and humanity, even the unnoticeable things a child would do naturally. (Tip child passing another at end) This movie was incredibly human- I guess thats why we liked it so much.
Hey peterp of some movie buff site: was it original. Is your dinner original? Poignant, human and real. Whats better than that. Messages us of SEVERAL important values to be kept or reminded of. A great work and thankyou for those who took part in making this valuable work."
" Slightly forced tearjerker
",2019-10-19 00:00:00,5,"With these kind of drama's involving family issues and a character having cancer of some sort, the audience and mass reactions typically tend to be high, and higher than those of critics. One is to believe that if a film is a tearjerker of sorts of deals with a child dying or being really ill, audiences tend to care more and look past the flaws of the film. While critics can tell when a film is generic and its script isn't too good.In this case, this film isn't nearly as good as some of the reviews are claiming. Decent performances and a decent watch but it came across as a forced tearjerker type drama. A lot of it's plot dragged on.This seemed to be a film where there was instant karma. A character does something not good or isn't nice, then something bad occurs. Then a character does a good deed, and something good happens. Gerard Butler's performance was believable but his American accent was noticeable.A Family Man isn't a terrible film but it isn't really a great one either. It is watchable."
" Ironic relate to character
",2019-07-22 00:00:00,8,Not sure how i missed this one but it is a piece of work ! Gerard Butler as a high pressure phone recruiter with a terminally ill child a ruthless boss (Willem Dafoe) and a loving wife. I lost a tear about mid way and a few more later. Good Movie period !! I been self employed since 1998
" Horrible
",2019-05-02 00:00:00,1,"Every once in a while you will a film so forced, so poorly acted, and so blindingly manipulative that positive reactions like a lot of these reviews make you question just how dumbed down and tone deaf most people have become. There is not a genuine moment in this film, and the heavy handed phony dialogue is really laughable in places. I really felt sorry for Willem Dafoe, he must have bills to pay. This thing is excreable."
" Tear jerker
",2019-03-14 00:00:00,9,Very good movie have tissues handy butler is a good actor one of my favorites
" *puke*
",2019-02-23 00:00:00,4,"Sooo pathetic. Soooo American, makes me wanna throw up."
" Underwhelming but emotional at times
",2019-01-02 00:00:00,6,"Can't think of a better word to describe this film than the one I chose for the title. Just when I really wanted it to kick up and put another gear on, it did exactly the opposite and even made me laugh with how childish this script is.
I mean if you look at this from a safe distance, this is a film about a successful HR man, who is neglecting his family every day because of his jobs demanding hours. Anyways his older son gets ALL, Acute lymphoblastic leukaemia, and quickly sets on a slippery slope. Dane, Gerard Butler, continues to act the way he was acting, despite now rushing to the hospital instead of his home every night. Meanwhile, at his job he has the reputation of being ruthless and occasionally screws over people in order to remain first in his bosses eyes at the end of each month.
So what do we do? The kid must be dying until the final minutes of the film, at which point he miraculously comes back from the coma and the dad loses his job only to become more successful as an independent HR consultant.
As I said, childish script undermines the viewers perception and offers nothing more than an hour and a half tv time for a casual family viewing.Mistakes were plenty too, but what I really hated was the final moments when the kid is dying and Butler makes way for the daughter to hug him too, as if it was a line in the McDonald's and how obvious all is off course at the end, that the kid will wake up. The fact that he enters the room and the producers think that they maintained tension by not allowing him to know if his son is dead or not, is really the fairy dust of every proper joke.
Mediocre effort, lucid, see-through script, good to very good acting at times, but all is lost inside this casual effort.
The result really is a film that no one will remember ... Skip it if you can"
" Poor Casting
",2018-09-16 00:00:00,5,"No, no, no! I'm not buying Gerard Butler as an American, or as a Recruiter. He overacted in this one, and his attempt at sounding American was silly. Just let him be an Australian.
I'm bored with the over-the-top ""alpha"" sales guy routine in movies. It's such a cliché. At least have someone do it with nuance. Meanwhile I also didn't buy a marriage between the Butler character and Gretchen Mol's wife. The makers touched all the bases. They used a Sikh Indian doctor to dispense Eastern wisdom, a young African American male nurse to share empathy, and a wise, precocious boy to root for. But like most Hollywood movies, they didn't want to have any Western religion or wisdom taint the story.Butler's lead character and Willem Dafoe's supporting character as boss were cartoonish. There was some decent dialog, including some from the wife character about parenting and the need to be there for your family. Overall, they made an earnest attempt to highlight the ""What goes around comes around"" philosophy, and the ""Pay it forward"" concept. I'll give them credit or wanting to encourage a decent value.But I hope they weren't suggesting that all successful people cut corners and live amoral work lives. I suppose not, because a female competitor at Butler's office seems to have succeeded while being relatively honest.Well, the acting was poor, the plot telegraphed, the message cliched, but it could have been worse."
" Well-observed story with new-quality Gerald Butler
",2018-08-07 00:00:00,9,"Not everyone is going to appreciate Mark Williams's ""A Family Man""; and the level of appreciation a viewer does achieve is going to depend more than slightly on a couple of controversial matters. First and foremost is acceptance of terminal illness in a child as a justifiable plot device. The kid here - the part of Ryan Jensen - is Maxwell Jenkins, and he does a very good job. But this is heavy stuff, and might be regarded as a hammer to crack a nut, since this plot is needed to make Ryan's father focus in - at least a bit - on what really matters in life, and what really matters is not (supposed to be) work! The father - Dane Jensen - is played here by Gerard Butler, who mostly leaves behind his typical kind of role (and his Scottish accent). Which brings us to accept/not accept number 2, and I must say I accepted. Indeed, I warmed to Butler as the character - and to the character itself - far more than I anticipated. The mother of the family (Elise Jensen) is a character (well) played by Gretchen Mol, but the real, realistic joy, interest, sadness and ""meat"" of the film - for me at least - is the way she basically/mostly fails to understand/sympathise with the nature of the 21st-century trap her husband has fallen into, not especially because he even wants to, but simply because that is how life is ... NOW.This plotline from real life familiar to many of us goes as follows. A great many people today do jobs whose titles tell you little, and whose descriptions beg the response - ""you can make a career out of that?"" But this is the 21st century, and few indeed of us are logging or mining or making cars or even teaching or nursing or policing or being Marines or doing medical research. (A glorious contrast in the film is by the way provided as Dane comes into contact with Sikh Dr. Savraj Singh (a very good Anupam Kher), whose ""real job"" is saving Ryan's life). But many, many people are not exactly producing very much of utility, beauty or future value, but rather helping move money or assets around, and somewhow magicking income up out of nowhere, with who knows what real resources underpinning it. At the outset, the character of Ed Blackridge - that's Ed's boss - sets this scene clearly, and makes it clear that he has gone further than Dane, in that he doesn't even pretend there might be work-life balance, for work and the lifestyle that goes with it is ALL he has, and that allows him to make plenty, and saves him all those expensive items of expenditure (and precious time) associated with family, education, home and all that stuff. You might expect to find somebody playing this part with panache, and you get Willem Dafoe, who does it JUST RIGHT here.But although Dane (a headhunter as it happens, though it could be a thousand other ""corpo"" jobs) has taken many a leaf out of Ed's book - far more than his wife would like - we know that he works in this kind of field as the ONLY way for most people to ensure better income in modern America (or other countries in fact), and even then with that income being dependent on working nearly ALL the time, and even then most likely straying beyond the threshold of morality at times. This is not actually Dane's choice, this is what the modern world does, as economist Thomas Piketty will tell you. In a conventional, old-fashioned job you will be mostly condemned to struggle at the boundary between the lower middle-class and the working class, with your income going nowhere for years and years - as it indeed has done in the US and UK for a start (hence support for Trump and Brexit), while even going backwards in countries like Italy. A person might escape that trap by working ""flexibly"" (meaning 24/7) and/or (sadly/unforgivably) by working deviously - at somebody else's cost. And that way the family (who hardly knows you) is supplied with a standard of living it takes for granted, but WOULD really and truly bemoan if they lost it (however much they protest otherwise when it suits them). But of course that does not stop them (does not Dane's wife Elise and even his kid) from taking the perceived higher moral ground, and criticising endlessly how the guy works - thereby blaming him for some law of the modern world not of his making.In fact, Dane DOES find a way out - actually helped by Ed (a sweet twist), but in this he does not resemble the majority of the population in America and Europe (at least). There are one or two other plot subtleties, and a beautiful little sub-story about dad-kid quality time focused on the architectural highlights of Chicago - a lovely thing that (like pretty much all of the film) I can very readily understand, appreciate and sympathise with. It's great empathy from the makers. Interesting, then, that this is seen by some as a woman's film - and doubtless the theory is that Elise gets sympathised with. But my male take is of sympathy for Dane (if not for his crude descents into immorality and wrong business practices - which I condemn while nevertheless seeing the reasons). ""A Family Man"" is not going to appeal universally, but - beyond its possibly-exaggerated flirtation with mawkishness or sadness (depending on your point of view) - it does really, really observe the world around us, which is a wrong world that places value on the wrong things. Who knows if that can ever now be different?"
" Unrealistic Scene near the end, this is not how business works
",2018-03-31 00:00:00,4,"When he gets the job for Old Lou, the young woman hiring just said ""I need to expense the 25k fee before the end of the year"". Instead of the Family Man offering to kick back the fee, he offers Lou for free. And she takes it.No, she just said she NEEDED to EXPENSE it.If they had arranged a kickback of the fee that would have been more realistic and Family Man's team would have won the battle.As it is Family Man will have to pay the 25k out of his own pocket anyway.Oh, and he got fired too. Deservedly so. He could have just slipped the recruiter a kickback, and gotten the big promotion.Absurd and DUMB script."
" Good performances wasted on a terrible script
",2018-02-18 00:00:00,4,"A Family Man tells the story of Dane Jensen (Butler), a headhunter who is proficient at his job, and will sink to all lows to be the best at it. He balances that with a home life, which he maybe isn't home for enough, but is putting in the time to make ends meet for his family.His whole world is thrown for a loop when his eldest child is found to have a terminal disease. The story follows an extremely predictable path of redemption.The disappointing aspect of the movie is in what could have been. Butler gives a solid performance as the main character, and Alfred Molina, Willem Defoe, Gretchen Mol, and Alison Brie are all equally up the task. However, the script does such a good job painting Butler's character as ruthless that when it wants to redeem him, all you can do is ask: Really? Similarly Defoe's and Molina's arcs betray they characters.It really is a shame, because the actors deserved better,"
" Moving and Dynamic Performance by Gerard Butler
",2018-02-02 00:00:00,10,"Gerard Butler graces us on the big screen with an astonishingly, moving performance in this heart-wrenching film about finding yourself in this mad mess we call life. Truly a dynamic performance and one worthy of watching."
" 'All families got problems but you only got one.'
",2017-12-28 00:00:00,8,"Writer Bill Dubuque and Director Mark Williams have created a tender, sensitive family story that is well developed and addresses many of the issues we all face. A brilliant cast delivers the goods with style and empathy - and Chicago has never been so beautifully captured photographically as cinematographer Shelly Johnson has accomplished. The musical score is by the always-reliable Mark Isham.As the boss (Willem Dafoe) of a Chicago-based headhunter, Dane Jensen (Gerard Butler), who works at the Blackridge Recruiting agency arranging jobs for engineers, prepares to retire, Jensen vies to achieve his longtime goal of taking over the company going head-to-head with his ambitious rival, Lynn Vogel (Alison Brie). Factors intervene: Dane's close friend Lou (Alfred Molina) is unemployed and desperate for work, Dane's wife Elise (Gretchen Mol) is concerned Dane is not spending time with his family, and Dane's 10-year-old son, Ryan (Max Jenkins), is suddenly diagnosed with Acute Lymphatic Leukemia by the doctor Singh (Anupam Kher) and his professional priorities at work and personal priorities at home begin to clash with one another. Dane spends quality time with Ryan by touring the beautiful architectural wonders of Chicago and Ryan's wise observations set Dane on a new path. Dane finds a job for Lou (at Dane's expense of giving up a headhunter's fee for a friend), and Dane and Elise grow closer. Dane is pulled between achieving his professional dream and supporting his wife and son, who need him now more than ever.Much of the success of the film is attributable to the fine performance by Gerard Butler, but he is enhanced by the performances of the entire cast. A very 'feel good' movie, perfect to restore faith in humankind just when we need it the most."
" An Hour and 48 Minutes I'll Never Get Back
",2017-12-23 00:00:00,1,"There is nothing to redeem this movie. The acting is wooden by all of the characters, nothing to really make you route for anyone and cliched storyline from beginning to end. Anything bad that happens can be undone magically by doing one thing good. People magically change their entire personalities and become good in the end. Not like it really does in real life. Don't waste your time."
