title,date,rating,review
" Action packed
",2020-11-06 00:00:00,9,"A little of everything in this movie! Action, drama, romance, sacrifice, good guys and bad guys, underdogs and heroes~"
" Monster Trucks
",2020-07-04 00:00:00,5,"I saw the trailer for this fun looking film in the cinema, then I missed it a few times when it started showing on television, but finally I got the opportunity to watch it, and I hoped it would be worth waiting for, directed by Chris Wedge (Ice Age, Robots). Basically, in a small town near a lake in North Dakota, Terravex Oil is in the midst of a fracking operation, overseen by CEO Reece Tenneson (Rob Lowe) and geologist Jim Dowd (Thomas Lennon). During the operation, three subterranean creatures are released from an underground water system. Two of the creatures are captured by the oil company, but one of them escapes. Meanwhile, high school senior Tripp Coley (X-Men's Lucas Till) has taken up a part-time job at a local junkyard, to escape his home life; his parents are divorced, and his mother Cindy (Amy Ryan) is in a relationship with Sheriff Rick (Barry Pepper). He starts building a pickup truck which he plans to use to leave town, but it does not have a working drivetrain. One night, Tripp encounters the escaped creature in the junkyard, but it gets away before he can do anything. The next day, along with classmate Meredith (Evil Dead's Jane Levy), Tripp finds the creature has a diet of oil and it takes shelter within the hood of his truck. He befriends the creature, naming it Creech, and promises to help him get home. Tripp modifies the truck to give Creech more control over the truck as a makeshift engine, he and Meredith becomes impressed and surprised at Creech's speed of intelligence and talent. Meanwhile, Tenneson is concerned about protect the oil company's image. He sends hired mercenary Burke (Holt McCallany) to kill their captured creatures, and poison is put into a hole leading to the underwater tunnels. of Jim objects to these decisions, as he finds that the creatures can directly learn whatever skill is taught to them from the other one. Tripp and Meredith go see Tripp's father Wade (Frank Whaley) to seek help, but Wade sells Tripp out to Burke. Tripp and Meredith get away in the truck with Creech, pursued by Burke and his team along with Rick. Tripp, Meredith and Creech manage to escape by jumping over a train, and camp at a hunting cabin owned by Meredith's father near the lake. When Creech gets the sense something bad will happen to the other creatures, he heads to the Terravex headquarters where the other creatures are being held captive. Tripp and Meredith follow Creech using Meredith's cell phone vehicle tracker. When they arrive, they realise the other two creatures are Creech's parents. Creech arrives and is captured, while Tripp and Meredith are taken to Tenneson who tells them to forget about the creatures and has Burke escort them out. Sympathetic to the creatures' plight, Jim decides to help Tripp and Meredith rescue the creatures. With the help of Tripp's junkyard boss, Mr. Weathers (Danny Glover), they acquire and modify two more trucks for Creech's parents to control. Jim helps the group by stealing a Terravex truck and loads the creatures onto it. At the dealership, the creatures take control of the modified trucks based on Creech's own experience, and the group make their escape up the mountain leading to the tunnels. Terravex gives chase and the group escape by using the trucks to jump over the edge of the mountain. On the way, Rick helps Tripp and the group escape from Burke. Tripp gets into a head-on battle with Burke, who attempts to push him into the drilling hole, but Burke's truck is overturned, the poison machine is destroyed, and Burke is killed when his truck is thrown into the equipment. Creech saves Tripp from drowning before he and his parents depart back home and Terravex is exposed by the group for the experimentation that was harming the creatures' habitat. Tenneson is arrested for his crimes, Tripp and Rick are on good terms and work together to build a new engine for the truck, and Tripp and Meredith are in a relationship. Also starring Tucker Albrizzi as Sam Geldon, and Ready or Not's Samara Weaving as Brianne. Till is likeable as the leading young hero, Lowe is reasonable as the bad guy, and Glover is fine in his short time onscreen, and obviously Creech is an adorable character. It is a reasonably simplistic story, it makes you laugh enough at the right moments, it is sweet without being too mushy, the chase and action sequences are entertaining, and the special effects are of course terrific, it might have bombed at the box office, but it is a fun family friendly fantasy comedy adventure. Worth watching!"
" Meh.
",2020-05-25 00:00:00,5,"It's very cliched but not terrible. It does nothing at all new but I will say it did have a few funny scenes. Some intentionally, most of them unintentionally. They try to put in some emotional moments and it's actually funny how much they don't work. I will say that the creature at the centre of this movie is fun. The biggest problem is that the movie is forgettable and boring. The characters and story are completely uninteresting. However the 3rd act has quite a few ridiculous moments that actually make it kinda fun to watch, but most of the the first half of this film is boring. So in conclusion it's not good, nor is it memorably bad so it's ultimately very skip-able. (54%)"
" It is not terrible.
",2020-05-16 00:00:00,5,"On repeat viewings I realized its not that good. But not that bad. A mixed bag, but little kids will definitely love this one. I know I did when I was in 6th grade. But now it kinda sucks, but whatever."
" Surprisingly good movie
",2020-04-25 00:00:00,8,"I have to admit first off that I was dead set against this movie. I saw a previous movie almost based upon this but more on the horror side. So I couldn't bare another movie about a monster in a truck. I finally saw this movie and like so many starts out slow but builds to a climax that would keep your eyes glued to the TV. The characters are likable which adds a plus to this movie. Somehow I thought about ""Super 8"" where kids help a monster get home. The concept was ""ok"" out there. The plot holes are there, cars getting damaged yet no one is investigating the wrecks, cop's that are too easy going and the bullies aren't scary enough. The bad guys are quirky which just adds to the base. And the monster is nothing but lovable, E.T. in a sense.Now what I got was far from what I expected and that alone is a plus. The movie moves quickly which covers all the plot holes and the driving stunts are amazing. Rarely does a kid's movie grab my attention and keeps it to the end. It was like watching ""Herbie: The Love Bug"" where it's never explained how a car got a mind of its own. Creech (the creature) steals the hole movie in every scene it's in it grabs your heart Everytime. You end up rooting for Creech and hoping he finds it's way home.This movie will definitely be added to my library as will be watched several times. There is just too much to love about this movie and too much happening to notice all the flaw's this movie had. In all it's a great escape from the current issues we are living in (the virus pandemic, most places closed and money growing tight) that it's a great way to escape everything for a few hours."
" Senseless children's movie
",2019-11-09 00:00:00,3,It's Watchable and well funded but it's nowhere near 10 🌟
" So cute and family friendly
",2019-09-23 00:00:00,7,"This reminded me of movies from the 1980s. Evil oil and gas company threatens cute, previously unknown monsters when they drill deep underground into the monsters' habitat. Teenager befriends escaped monster and action ensues. Good guys save the day and the bad guys pay. It was all about the monsters for me...so very cute! The actors in it all were good...I especially loved seeing Danny Glover and Barry Pepper, and the teen couple was a good match. It made me smile a lot. I would definitely say it is for the whole family."
" Loved it!
",2019-07-19 00:00:00,8,"Such a fun movie. Very well done, great cast, great story. And they didnt ruin it with some lousy overdone high school love story (like A.X.L.)
And they had a fun twist on the ""monster truck"" that was only slightly ridiculous but mostly kinda cool.
My kid loved it as well"
" Great movie!!
",2019-06-20 00:00:00,10,Wonderful and fun movie to see! Definitely underrated. It'll leave you on the edge of your seat! My family and I enjoyed it very much. Beautiful scenery too. I recommend the movie highly.
" Petroleum guzzling squids
",2019-05-22 00:00:00,5,"Monster Trucks has Tetravex Petroleum hydrofracking in North Dakota and they
hit a big pool of water. Boss Rob Lowe says drill on through and they discover a
species of ancient amphibious life which has learned to survive on crude petroleum. They look fierce, but when treated nice like Lucas Till does and his
science tutor Jane Levy they can be friendly.And useful as he finds that the one that came across him is good for powering
his monster truck. It's now a monster truck in the literal sense of the word.And Till and Levy will need speed to overcome Lowe and his cronies, to both
capture the two creatures the oil company has and return to their homes in the
earth.Some of the elements of Mighty Joe Young are in this plot which has a kind of
goofy charm to it.And it's nice to see big oil lose one."
" Ignore the average score, this is great fun
",2019-05-11 00:00:00,8,"Nearly didn't bother as IMDB had this at 5.7 but it turned out to be yet another example of a great, fun, family movie that's been rated by waaay too many grumps that probably didn't realise it was a family/kids movie.The creatures were genuinely superb, from a CGI pov, truly likeable and the cast was good enough to keep it all totally watchable for adults.There were a few moments of, ""oh come on, how did he get there that quickly?"", but you can forgive the crew the odd bit of continuity screw-up because the reward is a perfectly good way to spend a 100 minutes of your afternoon!"
" Broken Down
",2019-04-17 00:00:00,3,"Monster Trucks shows flashes of inspiration throughout it's bloated, two hour runtime. However this film ultimately shows it takes more than monsters and trucks to create something compelling, or at the very least interesting."
" Despite all the silliness, I began to get used to the ride.
",2019-04-11 00:00:00,9,"As a throwback to 90's children's fare, as well as a generally fun and kind-spirited time at the movies, it succeeds admirably."
" Great movie for kids
",2019-01-26 00:00:00,6,"I have five kids ranging in age from 10 all the way to 3 years old. All of them enjoyed this movie. Clean language, fun storyline, not scary."
" Great movie for all ages.
",2019-01-26 00:00:00,9,"My husband and I watched this with our four children (ages 2-8) and we all loved it. Great acting, CGI, and plot. Original and well done. All of us watched the entire movie, even the 2 year old."
" Don't Worry If You Love Wholesome Movies.
",2019-01-13 00:00:00,8,"It's a simple-plot-movie that beats up into your mind what was it like to watch a truly good kids movie when you were an innocent child surrounded by popular and bad kids movies. So what the hug are you waiting for?!
Hope on to a great ride full of love, friendship and caring!"
" A good film.
",2018-12-23 00:00:00,10,"Obviously made for children but I'm 69 and I thought it was great. Well made, well acted and well directed. I would recommend this film to anyone and everyone regardless of age, but particularly my grandchildren."
" ...
",2018-09-21 00:00:00,1,I pray every night for tripp's butthole to fall off and he has to eat it
" Real Monster Trucks
",2018-09-12 00:00:00,8,"A Family friendly movie that doesn't skimp pn the action,good fun for all ages."
" Dumb for the dumber in us....
",2018-09-02 00:00:00,6,"Ok, the bad first...It's a stupid movie...Now, the only thing that saves it is...welll...it's a stupid movie, heh heh...to tell the absolute truth, the movie kinda grew on me...and I found myself actually liking it some...I expect the kids will love it, because it is so irreverant in it's production values, but if you are a purist, mechanically inclined, it will make you cringe at times...okay, most of the time, heh heh...But truthfully, it can be considered a fun movie, just wanting to be outright silly..."
" Cute
",2018-08-19 00:00:00,6,"Family film with a pleasant cast, decent directing and an okay script. Lots of fun action, some cute creatures and okay effects make this suitable for all family members, although really young kids might find some of the scenes a bit intense. Overall, it's fun."
" infantile
",2018-05-30 00:00:00,2,This film is recommended only for under six years of age.
" Likeable and entertaining
",2018-05-16 00:00:00,8,"Loner teen Tripp wants to leave the small North Dakota town where he lives: he has issues with his mother's cop boyfriend, and has very few friends. Meanwhile, the local oil drilling company drills through to a subterranean lake, only to find that something is living down there. And that something comes to the surface, and suddenly a boy and his (engineless) truck have a motive power they never expected.This film is made up of bits and pieces taken from other, higher profile films, and nailed together. It is a high-school movie with the disaffected teen who doesn't fit in at school or at home. There is the budding teen romance between two characters who never expected it. We have heartless ecological vandalism on the part of big business. We have a security operative who is quite prepared to kill. James Cameron's The Abyss has been rifled for key moments. You will spot other movies which have ""donated"" assorted elements.Yet the bits fit together quite well, helped by three main things. One, the scenery (British Columbia standing in for North Dakota) is attractive and gives a sense of production value. Two, the monsters are very well realised, often funny, and hugely sympathetic. There is a strong sense of character and communication, which is commendable given that there is no spoken word from them: the CGI is excellent. And, three, the main characters are all likeable, If a film is average, the fact that you take pleasure in being in the company of the characters can make a big difference to how enjoyable the film is, and this movie is a case in point.Monster Trucks isn't going to hold many surprises for the average adult filmgoer, but it is amiable with a certain goofy charm to it, and there were a couple of moments - entirely daft, to be sure - where I felt like punching the air and shouting ""Yes!"" I left the cinema with a smile on my face and, in my world, that is a recommendation."
" All the goofy, stupid charm of Power Rangers.
",2018-02-26 00:00:00,6,"This is a lesser version of the kid-befriends-and-saves-mysterious-creature-from-evil-adults story...though it's not complete garbage either. The driving is fun, the monsters are cool, the plot is clear. Its biggest issue is the ""hero"", who's dull, whiny, cliched, and pompous. The film certainly isn't great or at all original, but there are much worse things to show your kids."
" I'm not all that impressed.
",2018-02-04 00:00:00,6,"At first, I thought this movie was going to be hilarious and action packed but it simply didn't come through. The simple idea was good but it just really didn't pan out. The plot couldn't figure out if it was going to be happy go lucky, a fantasy, a coming of age, or an action movie. Also, using sub-par actors didn't help those facts either. While a simple minded kid may enjoy the movie, regular adults probably won't. Maybe I'm thinking too critical about it because of its intended audience which was kids but it wasn't anything special. The idea is good though which is why I didn't rate it any worse. Get back to the drawing board and maybe this could be something that mounts to a good flick."
" Great CGI but Tacky Heroism
",2018-01-20 00:00:00,6,"6.5/10It would be fun to watch in first time, especially in the theater, so thrilled to watch an adventure story with flying cars and strange intelligent creatures. The monster even looks cute after getting used of its tentacles. Its visual effect was avant-garde, still looking awesome after a year.However, the plot is cliche, it is a typical heroism presentation. What I disliked the most is not the car crushing and explosion, it was the way how the lead character, Tripp, he rudely treat others who trying to be nice to him, especially his girlfriend and the fat friend. Heroism movie is always giving the wrong subconscious to people that an ordinary person can get something special one day, and win everything after a 'victory', and everyone around is willing to help without logic.Roast (Spoilers)
In beginning, the rich nerd classmate (lately-girlfriend) offered Tripp help in a study group because Tripp was in bad grade, and Tripp was not appreciated but showed annoying. Later, the girl unconditionally helped and supported Tripp tools and even followed him to the monster saving plan. This script is so bad, as a girl, I always feel so sick when I see a smart pretty (and rich!) girl threw herself on a guy that looks social awkward and has no strength. Grossly distorted character's setting, reduced female's IQ, just need a pretty face and a cheesy romantic story, and I don't even know where's the chemistry.Anyway, this movie is fun to watch in somehow, if you want to watch an action movie with great CGI, this can be a choice.Thanks for reading my review, just some random gripes that came to mind."
" Fun movie
",2018-01-14 00:00:00,9,"I saw this movie when I was travelling to New York on a plane and I really enjoyed the movie.
This movie was absolutely fun especially with when the alien was fixing the chase scene. 
The acting was good. This film is definitely no Dragon Ball evolution. 
The CGI was very awesome and the story was cleaver. 
Overall very fun."
" An Underrated Film
",2018-01-01 00:00:00,8,"I like to consider myself a connoisseur of movies. I've watched so many of the classics that I can pick out a good movie from a mile away.
I watched this movie with my family and genuinely appreciated it. I expected Monster Trucks to be childish and tiresome, however, I almost immediately realized that I was going to love it. I have never liked kid's movies, so I was skeptical when my little sister insisted we watch this one. The humor was just adult enough to make me laugh along side her. Besides that the creature and the lead guy are both cute!! What more can you ask for in a child's movie? 
After I watched it, I looked it up online and was horrified to find it such a major flop. What, after all was wrong with it? It was so much better than any of the recent movies I have watched that were child-like. 
Anyway, my family and I loved this movie and will watch it many times in the 
future! I recommend it to not only the children who will love it, but any body who loves trucks and good humor as much as we do!"
" The future holds a tiny piece of the past
",2017-10-27 00:00:00,8,"This movie was a trip to memory lane. It's a modern version of movies such as E.T., Bigfoot and any other eighties and nineties movies where a kid finds and protects an alien (or other kind of creature) from a government or any other association. So it's not anything new, story wise, but it brings a whole new take to the genre. I really loved Creech and its childlike behavior and the chemistry between Creech and Tripp and Meredith. The action scenes looked great! The scene where they are chased through the town and make their escape by jumping the train was great to look at.It's not a movie with great depth but it doesn't require to be. I've seen movies with more depth that really sucked. This one is so underrated and deserves more credit!Great job, Chris Wedge!"
" Monster mash
",2017-10-17 00:00:00,4,My son went to see this film with his friends and they left before the film finished yet they were the target audience!The film is not great but it is family friendly and cheesy with not too good special effects. It lacks the bombast as well as the verve of the Transformer films.High school teenager Tripp (Lucas Till) works part time in a junkyard when he finds a large slimy creature that consumes oil and takes shelter in the hood of a truck which the monster can control.The oil company whose fracking activities unleashed the monster have sent a team to hunt it down as Tripp with a high school friend Meredith try to evade them. They get help from Tripp's mom's boyfriend who is the sheriff and get hindered by Tripp's dad.The film has a pro green agenda but the script is a bit dumb and so is the lead actor.
" Terrible movie
",2017-10-03 00:00:00,2,"Not very good at all. It was actually a pretty stupid and pointless movie with the sole intention of political propaganda. The only redeeming quality is the cuteness factor of the CGI sea creatures. Some political extremist groups must be sending people here to give all these positive reviews. Seriously, it is a terrible movie, for any age viewer. The CGI was cute, and the cliché family togetherness scene at the end was sorta redeeming, but I'm really not into showing movies to my kids that are neck deep in political extremist propaganda.Nothing in this is worth seeing. Just pass."
" No turning back now...
",2017-08-09 00:00:00,7,"In a North Dakota oil town, a creature is discovered and let loose. It finds its way into Tripp's (Lucas Till) truck which he modifies. There is also a girl involved (Jane Levy) and the evil oil company who want to eliminate the creatures because oil is more profitable.The film is on the order of ET. If your son is tired of you dragging him to see films about a princess, try this one. There is plenty of wanton destruction and irresponsible behavior to satisfy most boys. Or you can wait as this will be in the bargain bin shorty. ""Big Miracle"" is better.Guide: No swearing, sex, or nudity."
" Two thumbs and four giant wheels up for MONSTER TRUCKS!
",2017-08-02 00:00:00,10,"Not just every movie gets me so excited and pumped up as to just rush to IMDb and write it a positive review, but Monster Trucks sure is one of those rare cases! Seeing the trailer and knowing that this is a NIckelodeon movie I expected a good, fun, family friendly flick with a likable creature, but my expectations were quite surpassed. The movie really is all of the above-mentioned, but it just shines with a lot of positivism and heart. The creature-truck concept is really original, while the story is your classical coming-of-age, boy-against-world, boy-meets-girl, boy-comes-to-terms-with-step-dad- who-in-the-end-turns-out-to-be-a-decent-nice-guy, and of course, most of all, boy-and-unusual-out-of-this-world-friend kind of story. Some may call these themes repetitive, I call them eternal and engaging when done in the right way, and the cast and the director all do a lovely job to bring out the emotional charge in this one. Not to mention that Creech is extremely lovable from his very first appearance in the film, the effects are believable and quite well done, and the CGI is never overused as to overwhelm the scene. There is plenty of spectacle, plenty of action and some really fun (even if kinda guilty pleasure) scenes of destruction and smashing stuff. The humor is there too, and it never crosses any boundaries, no crude jokes or anything to really worry about. I would totally watch this film again, but this time with my two little daughters. This movie is like TREMORS meets FREE WILLY! It made me feel like a 10- year-old again and I would highly recommend it to anyone, especially if you're into stories about unusual friendships such as ""The Iron Giant"", ""E.T."", ""Lilo and Stitch"", ""The Water Horse: Legend of the Deep"", etc. Two thumbs and four giant wheels up for MONSTER TRUCKS!"
" Good for kids up to 11-13
",2017-07-29 00:00:00,5,"The story is simple, not a smart one, not a funny one (ok, a bit). Just a simple story for an evening entertainment. Not a great story to be taught. Several months passed since we watched this, only 3 years old boy somehow remembers the monster truck, the rest of kids never discussed it, what I see is quite bad for such a budget."
" Could do better
",2017-07-22 00:00:00,6,"So I saw Monster Trucks... (reasons OK) and its actually quite a technically well made kids movie that steals shamelessly from other better kids movies. The casting is weird and at times its taking itself a bit too seriously, but what gets me is the unnecessary plot holes joining the stolen bits together. Plot holes that you see coming a mile down the road, easily avoided, but they just drive on in. I get that its ""just a kids movie"" but if they put a fraction of the effort they went to with the FX into the script... it would still be a kids movie I guess... just more of a How to Train You Dragon movie as apposed to a Transformers movie."
" Really fun, entertaining adventure
",2017-07-09 00:00:00,8,"This movie deserves a lot more of a chance: it's an adorable adventure story that has the feel of the live-action Disney films from the 1970s and 80s. The story is fun, implausible, but as far as sci-fi storytelling goes, it's entertaining enough to deserve a certain amount of suspension of disbelief. The acting is good, with likable characters. The creatures/CGI are pretty great, and it's definitely a good family flick. This is an overall great ride!"
