title,date,rating,review
" Another Great Entry from Benson and Moorhead
",2019-06-17 00:00:00,8,"This is an awesome movie. I really didn't know what to expect when I went into it, because I'd gone in blind based on the strength of ""The Endless"" and ""Resolution"". I was not expecting a love story from the two that made those other films, but they pulled it off. Benson and Moorhead not only have something to say (and something worth listening to), but they also have an incredible amount of range. I'll be sure to watch anything else that comes from this team, as I've been consistently impressed with their work. See this film, see their other films, and watch for films from them in the future!"
" Excellent indie love affair, with sci-fi bits
",2019-04-23 00:00:00,7,"I'm not sure why this movie needed the science fiction aspect. As a love movie it was pretty good. The writer had gone to a lot of trouble to make the relationship natural, easy going and highly likeable with a really good script. There were many lovely touches, such as the old man and his orchard, or the light reflecting cave. There was great cinematography going on too, with good romantic locations, and lots of shots of wildlife. The sci-fi aspect was OK intellectually, but visually lacked a defined vision, and certainly the movie needed better cgi/effects department work. I'm a fan of sci-fi and I like to encourage it. Spring wanted to be two things. It succeeded with the love affair. It needed either a rethink for the sci-fi aspect, or a lot more work, and with a better creative director. Another criticism is that the cameras used for Spring seemed to be lacking colour. Was that deliberate? Whatever, I really enjoyed the young love, but scratched my head as to the sci-fi."
" Trash
",2019-02-15 00:00:00,1,"Badly written, badly produced, awfully acted. Total lack of cinematographic touch in delivering the defining moments and the lenghty explanations. A couple of pathetic jokes. The guy reacts in a laughable way when he discovers what's happening. Thanks, oh thanks Guillermo Del Toro for recommending this as ""one of the best horror movies of the decade"". Oh, and I've read every single word written by Lovecraft in his career: though being marketed as ""Lovecraftian"", this story has nothing to do with HP Lovecraft."
" Yeeeees, Springs
",2019-02-02 00:00:00,9,"Before Sunrise and Under the Tuscan Sun, you should Let the Right One In.I almost hesitate not giving this 10/10 stars. Maybe bits and pieces here and there got me down, but that made up for like 7% of the movie. The remaining 93% was amazing.Talk about chemistry, well, literally and romantically. These two leads felt like soul mates and the journey with them, almost perfect. But, backing up...This movie felt so real, even in a fantasy realm. In summary, a poor man's life was circling the drain in California, so why not move across the globe? There, he seemingly repeats his story, but not really. He's got a new love interest. Unfortunately, she's got some 'splainin to do.I wondered hard on how this was ""horror"" as I found this on the horror channel, Shudder and this site is listing it as horror. To me, it has some horror elements, but it's really a drama with sci-fi bits. And great special effects in what felt like an ultra-low budget film.All-in-all, this movie was brilliantly shot, excellently acted, wildly original (even when drawing from other films mentioned above) and the dialogue and back/forth between the characters, both main and minor, was the driving force for me. I looooved the wonderful rapport and quick witticisms. And they weren't overdone. Just enough to make it feel genuine and seamless.Can't recommend this enough, even to non-horror fans...as this really isn't horror anyways.***Final thoughts: No real spoilers, but not sure how I feel about the ending. I knew that's where it was supposed to lead up to, but would've rather had an alternative ending. Also, quick question: how did he suddenly become an all-but millionaire? And finally: Wow, this was made in 2014 and so relevant today concerning immigration and what an eye-opening take on it!"
" If only the ending..
",2019-01-10 00:00:00,3,"This film is alleged to be part of the Lovecraftian horror genre, and there appears to have been some concept work done prior to writing the bulk of the script, which runs much like a Latin soap opera. However the concept work fails to deliver anything that Lovecraftian horror is made of, and even following its own premise, this film falls apart.A 2000 year old metamorph, even with a sketchy memory, would know so much about human behavior, that they would be completey incapable of the histrionic/borderline head games that this girl plays out with the 'protagonist'. She would have to have given herself a total lobotomy to endure such a banal runaround, but she had not, according to her dialog.The main character was perfectly written as ignorant fodder. His fate should have been food for Louise, and his dying screams a satisfying end to his drivel about true love.If this movie had *at least* had an optional ending in which Evan is eaten during Louise's transformation, I would rate this film with 8 stars, because I could watch the entire thing again with my own head canon - a story arc consisting of Louise knowing from the outsdet that Evan is a sacrifice, and the entire brief romance is a game for her; a horrific tragedy for him. That would have been an interesting horror romance.I mean come on! 2000 years of life, and you'd throw away immortality for a drunk american leg-humper? It a bit of an insult to the audience's intelligence, and the alternate ending that is included in the BlueRay confirms what we (and Louise) should expect from Evan."
" Would be 10 out of 10 but for the supporting actors!
",2018-12-17 00:00:00,9,"A truly great watch. There is little in the way of missing elements in this Sci-Fi/romance/horror. It even has the odd moment where you can laugh.Rarely do I watch anything that has 'romance' in the genre, but I was glad that I watched this little gem. It has a good story, builds the characters, fills in the blanks (yet leaves a lot to the imagination) and actually makes you glad you watched it through. I say that because I can imagine folks giving up on it, some story pieces only really fall into place in the latter parts of the movie. It is worth the wait and frankly even the special effects (makeup in particular) are first rate.Synopsis: watch it! It's actually a great movie and the leads are really good."
" A Pox On the Houses of Morehead and Benson!
",2018-10-11 00:00:00,1,"What a rip! Marketing a romantic comedy as a horror flick. The filmmakers should be ashamed of themselves. This was like sitting through Twilight 24 or something. I'm not going to write any spoilers here; I don't need to. My one star review speaks for itself. What started off as an interesting crime drama devolved into a ridiculous love story with pseudo-supernatural elements surrounding it. Every character outside of the main couple had diddly squat to do with the film's progression. They were just there as distractions or fillers to pad out the 90 minutes that is this stinker. BTW, the one star if for the cinematography. All those wide, sweeping shots of Italy were pretty cool."
" Don't Share The Ending...
",2018-10-09 00:00:00,7,"Severely underappreciated film which has been mis-billed as a Gothic horror film. This movie is, quite frankly, in no way, shape or form, a Gothic horror movie. This film is however a beautiful, cerebral, thought-provoking romance which is worthy of more views that it has received. Watch when you can get it all in with one view as this film will engross you and draw you in from start to finish with it's heartfelt story and intriguing characters. If you enjoy romances along the lines of ""Eternal Sunshine"" and ""Amerie"" than this is the next film in that line for you to enjoy."
" A heartwarming horror film
",2018-10-09 00:00:00,9,"Who would have thought a romantic comedy could exist in the same plane as horror. To sum it up, this film left me speechless. The writing was impeccable; I often thought, ""i would have reacted the exact same way"" or ""I would have said that too!"" It feels so real and genuine. I liken this movie to a fairytale in that it captivates and teaches a lesson but not before showing you the atrocities people are capable of. Take some time to watch this, seriously. You have my word, for what it's worth, that you wont be disappointed."
" It will surprise you.
",2018-08-23 00:00:00,10,"This is probably the most beautiful film I have seen in a long long time. Good movies are movies you'll want to see two or three times so that you can relive the excitement of seeing them again. Great movies are movies that stay in your memories forever. You dont need to see them again, you just know how they make you feel every time you think about them. This movie my friends, is a great one. See it."
" I Wanna Know What Love Is
",2018-07-27 00:00:00,7,"This is a difficult movie to review because it is a sad, romantic, mysterious, horrific, hopeful journey through fears of loneliness and death. 
Here's what I liked about it:
The setting was beautiful.
The actors did a nice job in their portrayals of emotion.
There weren't many special effects but the effects shown were not over done of cheesy in any way.
The story was unique.
My dislikes:
The reveal/backstory/explanation for the female lead seemed really rushed. So much so, that I had to go back and view it again to make sure I understood what she was all about. 
There were a few places where I could see what was coming.
Even though it was a slow burner, my understanding was that all this was taking place in a week or so. That didn't make much sense to me.
Overall, I thought it was decent, creative and rather touching movie. Glad I checked it out."
" Very unique and very different.
",2018-07-06 00:00:00,7,"This was really sweet, romantic and mysterious. I loved the subtle way the story unfolded amidst a blossoming romance. I enjoyed lead character Evan (Lou Taylor Pucci)'s back story as well and made the film that much more believable. It was a refreshingly different and unique monster tale. (We never really know exactly what Louise (Nadia Hilker) is, but can only speculate she's some sort of vampire cross breed. I loved the visuals and I loved the dialogue. This is a supernatural film done very realistically, and even harnesses some very deep emotions."
" A Love(craftian) Story
",2018-05-14 00:00:00,9,"This film really surprised me. I walked in expecting it to be 50% horror and 50% romance. Instead, I got a movie that was 90% romance, 5% comedy, and 5% horror. And to be honest, I didn't care. I really liked this movie.The chemistry between the two leads (played by Lou Taylor Pucci and Nadia Hilker) felt so natural. Their performances were both great, and I really bought their relationship. In a film like this, the lead performances should ultimately make you care about their relationship, and ""Spring"" absolutely succeeds at that front.Also, I did like the scenes that did involve horror. Despite there not being that many, the ones that were there were extremely good.The comedy in the movie actually felt extremely natural. This film implemented a good amount of comedy that didn't feel forced or out of place.Finally, this film gave me an ending that I didn't expect. I won't say what happens, but you should watch it. It's great.However, I do have one gripe about this film. There is a scene in the film where a lot of exposition is being given to another character. I do like knowing what's happening, but this expository scene just didn't sit well with me. Other than that, this movie was kinda great."
" DO YOU THINK SHE IS BEAUTIFUL
",2018-05-01 00:00:00,8,"A different type of film, one that crosses genre boundaries. It is a romance first and a sci-fi /horror second. The target audience is perhaps those women science geeks who can watch ""An Officer and a Gentleman"" over and over again.Evan (Lou Taylor Pucci) down on life, absconds to Italy where he bums around until he meets Louise (Nadia Hilker) who throws herself at him. It it isn't long before we know she is different, or sooner if you look at the DVD cover. The explanation of what she is, comes first in subtle clues and unrelated film dialogue which ties everything together, almost like an old Russian novel.In spite of the special effects, the film moved a bit slow for my taste.Guide: F-bomb, sex, nudity (Nadia Hilker, Vanessa Bednar)"
" Treacly and pedestrian.
",2018-04-18 00:00:00,5,"What starts as a nice, but somewhat soft, attempt at smashing the horror and romance genres together turns into a complete mess once the script makes its third act reveal. As the protagonist stumbles onto the truth at the center of the love story the film abandons any attempts at authenticity and shows a disregard for the craft of writing characters and for finding the most cinematic expression in the narrative. Instead it opts for endless, uninteresting dialogue straight out of a twee CW supernatural TV show, or worse, a Twilight film.The filmmakers are incapable of ramping up to anything cinematically horrible, beautiful, strange, or interesting. So instead of cinema, we get multiple, lengthy, awfully written expositions of the needlessly complicated preternatural occurrence at the center of the film, even though they've visually told us almost everything we need to know early on.And the characterization is the worst part of all of this. We are supposed to believe that the love interest is 2000 years old, but she is the least believable timeless character ever put into a genre piece. 2000 years and still all of the communication skills, gravitas and air of a annoying, immature young adult prevail. My forty six year old wife has a deeper sense of the years she's lived in her general air, than this character has in even the simplest line of dialogue or delivery. We're supposed to believe that our young male protagonist is somehow interesting enough to hold her attention, even though he's a just some cookie-cutter nice guy. She's been in and out of human relationships, presumably with some extraordinary partners, for thousands of years across hundreds of cultures, but this guy somehow has the spark? It's all bereft of the most fundamental imagination.The direction is super competent. The photography, while a little flat when it comes to light, is compositionally strong. For the first two-thirds, the film is able to lock down an interesting tone, despite a heavy reliance on some pretty lame images of insects that are supposed to enhance the creep factor and convey nature's strange permutations, or whatever. But I can't stress this enough, the script is really bad. The dialogue can be painful, and the fact that the filmmakers don't know when to shut up and just let their story be told visually, makes for an arduous viewing on the back half of things.I was really excited about the The Endless. The trailer looks engaging. It's interest in that film which prompted me to try this one, but The Endless has the exact same writers, and that dampens my enthusiasm tremendously. Hopefully there's been some growth between the films."
" An atmospheric romantic film with Lovecraftian elements.
",2018-03-25 00:00:00,7,"I saw this on a dvd recently. Wasnt keen on watching this.
Firstly, it is not a horror film n fans of the horror genre will b disappointed.
There is too much chatting between characters but there was something which made me complete the film in one sitting n although as a horror fan i got cheated into seeing this, i cannot dismiss this as a bad film.
This film falls perfectly in the Lovecraftian horror genre. Has elements of science fiction, romance, mythos n fate. The acting by the two leads was surprisingly very good n both the characters were likeable. The only drawback is u dont get to see the monster in its full form but thats not the point of the film. Also noteworthy are some beautifully shot scenes. 
The ending scene was beautifully done with beautiful settings.
To b honest, i dont like such films n will not watch these kinda films. 
One of my online pal convinced me into seeing this. Definitely it is a very good film but not my taste."
" A superb little film any horror fan should give a shot.
",2018-01-02 00:00:00,9,"Tired of the trending, by the number supernatural/zombie/hack-and-slash horror films? This is the refreshing little film you need. I watched the film having no idea what I was stepping into, and I think that's the way it should be watched. It covers a host of disparate film genres and blends them beautifully together ( I don't even want to mention which ones as that itself partly spoils the film in my mind). The film has gorgeous visuals, great direction, and some amazing shots of breathtaking locations in Italy. The films score is composed by electronic musician Jimmy Lavalle, and compliments the film perfectly with its lush and ethereal sounding synths - definitely worth listening to on its own too. With it's amalgamation of genres it's easy to see why the film didn't prove more popular, but give it a watch, and you'll be glad you're in the minority of those who did the same."
" Dark, Modern Day Fairy Tale
",2017-12-28 00:00:00,8,"Ultimately a traditional love story, wrapped in Lovecraft, Spring is a terrific film. Solid direction, top-notch acting, subtle exposition and a unique script make this a memorable experience that begs to be revisited. Nadia Hilker is amazing. At the film's climax, the premise is so ""out there"", that there is no other option but to allow the characters to accept it and dive right in. Highly recommended."
" Quite original, if not fully engaging horror/romance
",2017-12-05 00:00:00,6,"Personal issues make a young man decide to travel from his home in the USA to Italy to escape from his problems. When there he encounters an enigmatic beauty called Louise who has a very strange primordial secret.What you cannot accuse Spring of is not trying to do something a bit different. This is a film which is definitely fairly original in approach. It sort of defies any clear genre definition and is instead an odd hybrid of horror and romance. Sort of like Before Sunrise (1995) with a side helping of body horror, if you can imagine such a thing. It's that age old story of boy meets girl, girl turns out to be a two thousand year old serpent-like being. Don't you just hate when that happens? Joking aside, the premise is certainly something different and it does stand apart from typical horror or romantic movies of late. That doesn't mean that it is an entirely successful film though, I didn't think the overall whole was up to the task of the admittedly original concepts contained within it. I reckon the two leads were partially responsible for this as there didn't seem to be a massive amount of genuine chemistry between them. Lou Taylor Pucci is a little on the whiny side and does tend to gravitate to playing quite annoying characters such as he also did in the Evil Dead remake. It does mean that he is not entirely easy getting fully on board with. Nadia Hilker was definitely better and quite alluring as the pivotal character Louise but, essentially, the chemistry was missing for me. Much better was the Italian scenery which was gorgeous, it reminded me of how few decent contemporary Italian horror movies we get nowadays compared to the golden years of the 60's to the 80's. So it was nice to see an interesting horror narrative play out against the peerless architecture and sun-kissed beauty of this country. The horror is fairly rationed here, with the relationship material very much taking centre stage but there is definitely some impressive moments. Most notably in the big reveal sequence where we see Louise writhing around in her apartment in her primordial form. I thought that the special effects were very good here and created some indelible imagery. In the final analysis, I would put this one down as genuinely worth the time, even if it does fall short on what it could have been. Certainly a film for those who want to see different angles from the horror genre though."
" interesting indie
",2017-10-08 00:00:00,6,"In California, Evan is caring for his dying mom and watches her pass away. He loses his lousy job. On a whim, he goes on a trip to Italy. After meeting beautiful Louise, he decides to stick around and get a farming job. They spend a night together and he wakes up to find her gone. She is suffering from a strange transformation as they strike up a relationship.This is an interesting take on the relationship indie. There are horror elements but they are not played for scares. Her revelation is too revealing and happens a little too early. She needs an earlier scene where she is in danger of discovery. This movie needs more tension. The relationship needs more tension. It's all very low intensity with some good low budget body transformation ideas until the second half. It does bump up the tension but I wish it happens quicker. There is one funny joke and some good atmosphere."
" The only true horror of this is the stupidity
",2017-10-03 00:00:00,3,"Oh, the horror! I love indie movies, I love intellectual artsy movies, and I especially love psychological horror. Why didn't I like this critically acclaimed movie, then?Well, for starters, this movie is offensively dumb, and also in and of itself offensive(but in a dumb way). And it manages to not be particularly entertaining at the same time. Only in this world, in this specific time, with this specific view on women, can this be considered part of high culture, whilst the female equivalent(Twilight) is rightly considered to be what it is; unbelievably idiotic. I can't completely one-star it, because it's execution was original, and it didn't give me a headache in quite the same way Troll 2 did - but the plot, oh the plot! It's the kind of offensive story some drunk dude will tell you at a bar, and because he currently lacks the self-insight that would prevent it, he actually thinks stuff like this is categorized as ""romance"" - instead of the horribly misogynist, weirdly specific fantasy that it actually is. And you try to smile, because you can tell that he's just being self-involved, and not deliberately creepy, and you hope he's the only man who thinks like this. This is the horror movie equivalent of that. And to those that enjoy anti-PC culture and thinks it's hilarious, you will too be bored! It's a soft core angelic succubus fantasy romantic, and since the creators were not aware of the offensiveness, none of it was executed in a particularly blunt or hard-hitting way. As for the rest, (cinematography, music) it is equally meh. I'm not going to get further down to specifics, because there are other reviews for that(both the positive and negative reviews). I'm just going to say that I really did try to enjoy this and find the good parts, since people used to rave about it. But I came away with nothing. If not for the misogyny, I would've forgotten it immediately after."
" A drug addicts wet dream
",2017-08-28 00:00:00,2,"Some okay cgi and pretty scenery. The acting and story was better than Resolution. Although that isn't saying much. Everything else was just drugs and unbelievable moments. I can't believe all the positive reviews. It's like a twenty something man- boy drug addict had a anime-related tentacle poem dream and thought, ""I'm going to make a movie about that!"" There is some attempt at making it ""smart"" with all the science garbage but it just doesn't come together."
" Good (kind of)
",2017-07-28 00:00:00,7,"Interesting. I could have sworn this is a European film. It certainly has the look. The cinematography is gorgeous. If you are looking for a horror movie, forget it. It is a romance. The chemistry between the main characters is very good. However...the storytelling misses the mark. Considering what both of the characters are going through, I needed to feel their pain more. The film is actually quite reminiscent of 'Let the Right One In' which I think did a much superior job of providing the necessary dark creepy angst. The girl needed to be less glib and more mysterious. The guy needed to be more freaked out.This isn't a bad hair day, people."
" Peep This Reviews
",2017-07-09 00:00:00,8,"This is an absolutely outstanding movie. The cinematography is gorgeous, the acting is more than adequate and the story is thoroughly engrossing. It's essentially a rather intense love story. There are certainly elements of horror but they're handled in such a unique fashion. Lived up to the hype I've heard and far exceeded my expectations. It is not your standard horror film by any stretch of the imagination. Something worth seeking out."
" Low Budget But Ernest & Capable
",2017-03-04 00:00:00,7,"The better points of SPRING are very good, particularly the camera work and the dialog. Unfamiliar with these actors but they did an excellent job. The makers of this film are far more deserving of being granted a big budget than the makers of much of the comic book sci-fi in the megaplexes today. Problems emerge with the contrast between the budget and the need to introduce more convincing visual effects regarding the ""transformations"" , i.e., the supernatural aspects of the story. Indeed, the romance and intrigue aspects of the film would have been more compelling if the genre had NOT been sci-fi but; e.g., espionage or crime. Good idea to use the old Italian farmer as balance. Not so good an idea to ""throw in"" the Pompeii footage for filler (or did I miss plot points?). But, hey, I finished watching it - sure sign of a victory in today's age of streaming video."
