title,date,rating,review
" Reasonable...
",2021-02-15 00:00:00,7,"Slow, long introduction, it discourages me in horror movies, that I am a fissure ... Horror films do not need long introductions, charismatic characters and a good story are enough, and here everything is reasonable, except photography, with beautiful images of passionate Italy ... More a novel than a terror in itself, except for the appearances of the ""monster"", reasonable..."
" Unusual, quirky, occasionally amusing but always interesting and engaging
",2021-01-27 00:00:00,7,"Unusual, quirky, occasionally amusing but always interesting and engaging film. It may not, ultimately, be as successful overall as the next feature (The Endless) from Moorhead and Benson but well worth a watch. I found some of the humour here a bit juvenile and after a fantastic and bewildering and exciting beginning a rather disheartening and cheap portrayal of loutish and drunk British tourists. The ultimate joke here might have been that the extremely loud and stupid Brits may have been here to replace what might have been Americans in another film for certainly the too good to be true Californian guy here plays it as if he is a caring sharing Englishman. All that aside the budding romance is well played and the creeping awareness that there is far more to this is very well dealt with. I quite liked the film as a whole but did have these reservations that prevented me being totally convinced and then when the film seems to completely collapse at the end it is very unfortunate. All I can say here, however, that nothing could be worse or more childish than the proposed alternative ending seen on the extras."
" Interesting failure. The shabby romance sinks it.
",2021-01-12 00:00:00,6,"Most films in this subgenre founder thanks to their writers' inability to craft a believable, affect romance between the leads. This one is no different. Their flirtation for the most part is shallow, crude, stupid; when everything hinges on the pair falling in love, but the dialogue and scenes are generally crass to the point of juvenile, the film can't succeed.And this one doesn't. Still, each actor has some good moments, and the conceit is shocking but somehow believable. Any horror buff will be used to interesting failures--that's _Spring._ Enjoy."
" ""My Weird Italian Vacation""
",2021-01-12 00:00:00,6,"A decent watch, could watch again, but I don't think I can honestly recommend.As much as I feel like I liked the movie as a whole, the more I think about what it actually is, and it is definitely a better atmospheric movie than it is an epic story or a high paced creature feature.This is a slow burn, hinting at this or that, drip-feeding information until things are just very obvious. While I think a ""Jaws"" approach definitely would have given more punch, the movie opts for a deeper question of ""I see what's happening, but why?"".The movie definitely takes the time to discuss everything in detail, and while the things that would need some explanation are interesting, the movie is filled to the brim with someone's vacation video.Ultimately worth a watch if you're into semi-grotesque semi-horror stories this should be worth a watch, but I don't know how many people are going to come back to watch this one again."
" GREAT ATMOSPHERE.
",2021-01-05 00:00:00,9,"Instantly creates an environment that welcomes the viewer's interest, slowly, yet methodically builds a works a characters that you care about. While the ending was a bit cliche, the ride there was absolutely with it."
" Entertaining but forgettable
",2020-12-12 00:00:00,7,"A lot of reviews spend (in my opinion) too much time trying to analyze films. For me, I have two expectations; 1. To be entertained and 2. To (hopefully) be told an original story. If a movie provides those two elements, then I consider it successful.
Spring is about a 20 something guy who decides to travel to Italy after the death of his mother. Now untethered and hating his place in life, he just wants something different. Once there, he meets a pair of hard drinking brits and travels with them to a small seaside village where he meets a beautiful woman who, as it turns out, is an immortal.
That's essentially where the supernatural ends and the rest of the film is more drama/romance than it is sci-fi/horror.
A lot of reviews talk about her choosing to give up mortality but they missed the point. It's not a conscious choice, her body chooses when the oxytocin is high enough. Basically, IF she falls in love, her body chooses to stay the same and instead of metabolizing the embryo, she becomes mortal and stays pregnant, passing it on to the embryo. That's where the movie got a bit convoluted, but she doesn't give up immortality, she fell in love with the guy and her body gave it up for her to have a life with him. Still, 2000 years isn't a bad run, so...
You could probably write a 500 page analysis of symbolism and metaphor but why? In the end, it's a decent original story, portrayed by talented actors and shot in a sort of low budget manner than keeps it from feeling like it's recycled Hollywood garbage.
The funny thing about this is, although I found it entertaining, I had completely forgotten about it until I started watching it again by accident."
" Excellent movie! Modern day fairytale
",2020-12-10 00:00:00,8,"No spoilers. This is such an amazing movie I can't believe I had never heard of it before. Interesting premise, good acting, terrific inventive storyline. I haven't been this pleasantly surprised with a movie in a very long time probably because I wasn't expecting much from the beginning."
" Boy meets girl
",2020-12-01 00:00:00,6,"It's not going to end up on my all time favorites - but spring has a Style which is somehow original and in any case different to what is usually labeled horror or mystery these days. Maybe cause the love story is the actual focus of the movie, maybe the two Leads play natural and are not hired straight from a model contest and maybe, well maybe, the filming location in the beautiful southern part of Italy transforms an (ir)regular boy meets girl story into something a bit more profound. The finale, usually an action filled Big Bang, came almost sweat and quiet. The excessive use of (dead) animals is something I did not like at all,-1 from a 7."
" Romcom-Italian version of Take the right one in
",2020-11-29 00:00:00,7,"Cthulhu meets Take the right one in meets The (wo)man from Earth aka Italian werewolf in Naples born in Pompeii and waiting for the American white savior bum to realize the true love, as none of the men from the ages and lands compare to that Californian sincerity and easy-talking charm of young and dreamy screenwriter's alter ego. The most horrifying thing about the movie is that it is a realistic take on dating Italian women, who if impregnated need to be catered for the rest of your life (even if she dies) lest they turn into a monster - which her body, not mind, decides based on oxytocin and other suspicious science. Apparently, eating hostile man's te sticles and innocent rabbits makes for a nice source of stem cells. A bit naive and plot-hole filled mishmash somewhat saved by nice on the location shooting, slow art-house style spending time on atmosphere and not dwelling too much into junk stem-cell pseudo-scientific ""explanation"" that is also thrown into the pot, with some hints of redeeming humor makes overall an OK watching experience."
" Lots of interesting build for NOTHING
",2020-11-21 00:00:00,4,"I really -wanted- to like this film, and I did til I got about midway. The whole story starts off with a lot of promise, beautiful scenery, some predictable but totally decent acting... and then just delves into nothing.
Our story begins with a man meeting a beautiful, fun girl with a strange secret she uses a lot of dumb excuses to conceal. It leads you on a meandering romantic venture, which begins to grow stale due to constant twists, teases and allusions... that just keep going. While I feel it's fine to leave ""plenty to the imagination""--- be aware, most of this film is simply a cute romance story. It's nicely done and pretty, but not terribly interesting. The ""reveal"" need not be spelled out in entirety, but there's a lot of build-up for nothing much.
By the time the film is nearly finished, there's some interesting special effects here and there, but it feels quite shallow. There's no elaboration as to why any of the weird stuff is happening, and the plot essentially disintegrates.
I'm a little surprised at how well-received this was, because I found it incredibly disappointing. The romantic atmosphere congeals, as if someone felt they could make a rather bland (though quite cute) love story film ""more interesting"" by tacking on some sci-fi elements without really fleshing them out. Although the pacing is balanced, the nuances and tension just never really materialize into anything exciting. You get some vague weirdness, but it certainly doesn't live up to the Lovecraft comparisons.
I appreciate the concept, but the execution comes off as contrived.
To the point: Fans of standard romance films and M.Night Shamaylan will love it, those looking for something unique will probably be let down."
" Spring - all over again
",2020-11-17 00:00:00,9,"Lou Taylore Pucci - many probably know him or heard of him through the Evil Dead remake. But here he really proves what a good actor he is. Of course he had a really good scrip to help him with that. But still it is amazing what they accomplished. Yes this is a horror movie, but it could or rather can work as a drama too.Just like that - easily done - well seemingly easily done. The dialog is spot on, the characters (two main ones that is), feel as real as they get. Well the outer surface of them that is. I'm not sure how much you know - certain aspects of the story or rather the characters - I couldn't escape knowing about them. As little as possible that is, because I had no idea what our female main character was up to ... which was more than an interesting watch and experience overall. A horror movie with a heart ... but still lots of violence and blood! And some nudity if that matters to you one way or the other"
" Different and fun
",2020-11-17 00:00:00,7,"I liked this movie. I appreciate the reach for something that, at least for me, seems very ambitious. For the love story that that is, I'm not all convinced. I could not believe in those characters, and love stories are all about the characters. In this film they were pretty much underwritten, given basic and shallow personalities and it seemed to be on purpose. They were an Avril Lavigne song all over. He was a boy, she was a girl, could it BE any more obvious? No, Chandler Bing, this is not a rom-com. Or is it?That's the deal with this movie. As entertaining as it was, I didn't know what I was really watching. For me, personally, It needed a clearer focus to be really great.Maybe I had high expectations for it as a thriller/sci-fi/horror movie, because I thoroughly enjoyed Resolution and The Endless, both from the same directors. The romance part of it seemed like a total joke to me, but i'm not mad about it. All in all this is a fun movie, especially if you don't take it so seriously, cause there's a lot of plot holes that I could be nit-picky about. But the story is good and well acted, it is beautifully shot, the cgi is neat, and it has really great and memorable moments.*Spoiler alert*It's a silly observation, that I just need to get it out of my chest. How am I supposed to believe that this girl is a human being that lived 2000 years and does not know how to brush their hair? It really annoyed me the whole time. Was that a wig? It looked like she had a wig on, or very suspicious hair extensions. I guess that hair was a character choice to make a joke? The ""I'm too cool for brushing my hair"" type of girl? Because that's the kind of girl that guys go for in the movies. Anyway, that hair was there, and i did not like it. Towards the end she was having a rough time, so it's plausible, but from the start her hair was not acceptable. If so, that's a bold choice for a joke, and I absolutelly love it."
" One of my favorites
",2020-11-01 00:00:00,10,"This is one of those films that you just can't lable, in the very best way! I don't know what genre i would put this in, other than transformative. It is instantly my favorite movies. It doesn't shy away from practical effects, it has the best characters I have seen in a very long time. Even their secondary characters were outstanding and I'd watch a whole movie about them. The edits and camera work are superb and never had a bored moment. Could rate this high enough!"
" Completely unexpected
",2020-09-24 00:00:00,9,"I had seen The Endless, so I knew Benson and Moorhead were not the usual horror types, but I had forgotten that Spring was one of their films until I saw the credits.Anyway, I was not expecting this movie at all. As we got into it, I thought it was developing kind of slowly, and when we start to find out the nature of Louise's secret, I figured it was going to be just another vampire-style monster flick.Boy was I wrong! In fact, this really isn't a horror movie at all. It's a romance that uses horror tropes. The story is not actually terribly original: an immortal being has to decide whether or not to give up immortality for love, but the way in which it's dealt with is really fresh, and it comes out in a very unexpected way.My only beef was with the whole stem cell thing. Supposedly, every 20 years or so, Louise has to get pregnant, at which point she absorbs the fetus's embryonic stem cells, and will regenerate into a completely different person. However, if she falls in love, the oxytocin in her system will cause her to use her adult stem cells instead. She will remain the person she is, but she will die in a normal span like everyone else (supposedly she's a scientist and figured this out on her own).Stem cells aren't magic, and the real advances with them have been made with adult stem cells. Bringing the idea of embryonic stem cells into this movie seemed to give it an unnecessary political tilt that comes at the expense of bad science.But we're not talking about a peer-reviewed study here, we're talking about a movie that's operating on a metaphorical as well as a literal level, so we might forgive a moment of maladroitness from the filmmakers.Apart from the fact that it was a little bit shocking to see Louise in all of her slimy, tentacled glory, this film wasn't really very scary. It was mostly kind of sweet and even somewhat uplifting.This could be even be a decent date movie if your date isn't particularly squeamish.Nadia Hilker's performance as Louise is fantastic. She's sexy, and very believable as someone who thinks she's seen it all (she is 2,000 years old, after all). Her performance is subtle enough that by the time she tells Evan that she's not in love with him, we're (or at least I was) justified in thinking that maybe that's not completely true.Lou Taylor Pucci turns in a terrific performance as Evan (but is overshadowed somewhat by Hilker). Evan could have been a very forgettable ""everyman"" type character, but Pucci gives him depth. Evan is despondent after having lost both of his parents in fairly quick succession. He's emotionally shattered, and for the first maybe 2/3 of the movie I was convinced that he wasn't really in love with Louise - that he was just looking for something to latch onto.Usually horror movies make me laugh, and romances make me roll my eyes, but this movie doesn't fit neatly into either genre. The horror and romance aspects blend together seamlessly to give us a picture of of people making great sacrifices in the pursuit of love. Ultimately that's what this movie is about. No one understands loss and grief like Evan, so when Louise makes her choice, you know the tragedy of what she's letting herself in for is not lost on him.This is a terrific film, and could even be appreciated by non-horror fans, if they're not too grossed out by the films messier scenes."
" I want to go to Italy! 🇮🇹
",2020-08-21 00:00:00,8,10/10 based just on the scenery of Italy alone in this film! 🎞
" Best movie!!! Watch it!
",2020-08-20 00:00:00,10,"Watching this in 2020, great movie! I wish lou pucci would make more movies. I really think he's a great actor."
" The next del toro,or Terry Gilliam, WATCH this film!!
",2020-07-26 00:00:00,10,The combo of these 2 writer directors is scary!! Scary in a great way I just hope they keep their visions and follow their own path and gut instincts cause so far they've made 3 movies that are outright unique creative gems!! This movie is a must see for ANYONE who wants to watch a film that is in it's own category. Why do we have to always label them? Why can't we just watch them and let the film do what all great films must do....ENTERTAIN!!! Watch this gem of a non descript movie!!
" Relationship demons... figuratively speaking?
",2020-06-23 00:00:00,8,"I was simply in awe of this beautifully made, slow-burn romance-horror, which I couldn't stop thinking about long after it finished. The unique touch was its shades of H.P Lovecraft with an excellent monster design interwoven into a naturalistic romance tale. Nothing too over-the-top or even frequent with its monster element, but only minor glimpses and a minor quick thrill here or there. Simply put, it's an intimate and lyrical love story between two very much connected individuals coming face to face with allegorical and bonafide relationship monsters. Possibly leading to tragic circumstances, or undisputed love?One thing though is that you become infatuated by the chemistry shared by Lou Taylor Pucci and Nadia Hilker (who captured my eyes when we see her for the first time in that red dress). Another thing was the whimsical, and heartfelt music score that complements the ongoing moods. Then there's the splendid Italian backdrop, which the sweeping camerawork made excellent use of the many picturesque views.Perfect, textured and visceral low-budget film-making."
" Anothe Benson & Moorhead classic
",2020-06-11 00:00:00,7,"Some damn refreshing script-writing in this film. I enjoyed more than I thought I would - and mainly form a technical perspective - some of the practical and special FX and drone shots int his are fantastic.if you like this film then see the Endless & Resolution for some damn fine film making. One day these guys will make it big with some epic Hollywood blockbuster - in the meantime, just enjoy their films while they are still great!"
" GREAT surprise...
",2020-05-24 00:00:00,10,"Talk about transcending all of the descriptions...they meld into one fantastic, mythlike story...and it starts out in a way that is deceiving to the point where most viewers are probably wondering if they should continue...
i was VERY surprised at the low rating. so i gave it a 10 to bolster it to, at LEAST, the solid 8 that it deserves...
no. it's not 'slasher horror'. so if that's what you're looking for, move along... nothing to see here...
but it does, in its way, earn the description...just not in the 'usual' way...
because that's just it...there's very little that's 'usual' about this film...ok. aSIDE from the romantic part...which really IS at 'the heart' of this film...
but ALL of the pieces are extremely well done...the dialogue...the acting... the photography...AND...the locations...
i couldn't recommend this movie enough to anyone who might think a film categorized as 'horror/romance/scifi' MIGHT be interesting...
find out for yourself...but keep going till at least a half hour...if you're not committed by then, feel free to bail..."
" Surprised Me
",2020-05-17 00:00:00,7,"Interesting concept that caught me off guard, a little slow and corny for the first 30, but stay with it and you'll get a cool little horror/sci fi flick that is original(mostly)."
" A hidden Lovecraften movie
",2020-05-06 00:00:00,10,"I liked this movie a lot. Very original, and the two leads are perfect.
When we see her at her worst, well the movie cuts off before that happens.What I mean to say, the worse we see her is Lovecraft looking. I has read a lot of Lovecraft lately and this fits the bill perfectly."
" Yeah right
",2020-04-18 00:00:00,1,Another 'horror' 'art' film. Watch it if you want to be bored to death.
" ""Women, Jewels Of The World!""...
",2020-03-09 00:00:00,9,"After a family tragedy and ensuing drunken disaster, Evan (Lou Taylor Pucci) quickly finds his life in the proverbial toilet. With the law literally at his door, he heads to Italy on a whim, finding the change of scenery... invigorating. Especially, upon meeting a beautiful woman named Louise (Nadia Hilker), who seems to somehow be wherever Evan winds up. Soon, Evan is captivated, love blooms, and the preternatural terror begins.SPRING is another wonderfully odd, innovative film from Director's Justin Benson and Aaron Moorhead. Drawing from several genres, this movie is fascinating from start to finish, managing to be both eerie and touching, without being sappy. The perfect movie for romantic horror / sci fi / monster enthusiasts... Special mention for the Directors' full use of the incredible Italian scenery..."
" This is a slow sweet boil
",2020-02-26 00:00:00,7,"Italy is presented lovingly with beautiful mood music. Though this is really a love story with horror trappings, those trappings serve to make the urgency urgent. So, yes, I liked it."
" Horror Sci-fi
",2020-02-02 00:00:00,5,"A young man takes a trip to Italy and meets a girl. They spend time together over a couple of days, but then he finds out she changes into a hideous creature from time to time. I don't even remember what happens at the end. I really didn't like the lead actor, so that put me off the film right away. Every interaction he had with the rest of the cast was marred by the fact that I didn't want to see his face."
" Great romcom/ horror
",2020-01-13 00:00:00,8,This is almost like a modern version of From Dusk Till Dawn. Starts out as a typical hot headed boy running from the law and then meets girl and they fall in love but that is not case here. The girl has a big secret. This film had a great story and great acting. Not sure why this fell under the radar.
" Cool writing and a nice idea in a romantic fairytale
",2019-12-17 00:00:00,8,"Simple in its structure, Spring offers a romantic story digestible for science-fiction fans and goes beyond to introduce a pinch of uncertainty and a rich brew of good writing. However, if somebody expected a classic horror, they could be disappointed."
" Loved it!
",2019-12-05 00:00:00,9,"No spoilers in this review. This isn't really a horror movie, it's a romantic story with a twist. Perfectly cast, perfectly acted, it's a story that really deserves a sequel in my opinion. The main two actors couldn't have done a better job; they are absolutely believable in their roles. That says volumes for the direction, as well. I'll definitely be watching it again soon."
" Twilight For Men
",2019-11-21 00:00:00,3,"Take a cheesy romance with a not very bright young man and a mysterious older woman. Add insipid dialogue and cringeworthy emotional beats. ""If you loved me, you'd die with me!""--style. I'd blame the script for the lines, but a better actor wouldn't sound like a whiney spoiled brat. Unless we are meant to hate the male lead, and, based on her response, we are supposed to feel touched by their connection.Beautiful backdrops, decent horror flashes, but the love story parts just fill you with loathing by the time its over."
" Moody, romantic, funny, body-horror - Awesome and sticks in your mind.
",2019-11-06 00:00:00,10,"This was kind of a shot in the dark for me (no pun intended), but another review comparing this to ""Before Sunset"" as a romantic body-horror flick intrigued me. It's an entirely appropriate analogy, and the two main characters here are as involving and likeable as the couple in the Linklater trilogy - hell, maybe more so. This also struck me in the way as the European ""Let the Right One In"" did - a great meld of moody, indie direction with fantasy-horror elements and crackling dialogue.It starts as a directionless California punk named Evan travels to Italy to escape his dead-end life (and the cops). The first third is very much a straight hostelling adventure. However it switches gears somewhat when he meets the beautiful and mysteroious Louise who has a very cool but horrifying secret. The soundtrack by Album Leaf is electronic and moody. Highly recommended, especially if you like Richard Linklater, Nicholas Winding Refn, David Cronenberg and Giullermo Del Toro."
" Very intriguing
",2019-10-26 00:00:00,8,This is my 2nd Benson and Morehead movie. This one is a lot like Resolution. Well made and suspenseful. But Nadia Hilker is a criminal. She should be charged with grand theft - movie.
" A Simple Love Story
",2019-07-13 00:00:00,10,"This movie is so awesome.
Thanks for creating this.
Reminding me of a certain feeling in my life."
" my notes
",2019-06-26 00:00:00,6,Pretty good movie with a nice story that kept you invested and some memorable moments and intriguing ideas (1 viewing)
