title,date,rating,review
" Easy to know
",2021-01-17 00:00:00,2,"Rated 2 just because the actor, but the story? Nah. Easy to predict, and already know the end just in 20 minutes. Waste of time. 1 of the worst bruce film just because the writer etc."
" a burning question...
",2020-12-19 00:00:00,4,"Firstly, the echoes of WestWorld devices are loud here...but someone tell me...there is a policewoman technician in an early police station scene where the lead offers up his badge...she is a spitting image of melanie griffith, I swear this must be a brief uncredited role. and an incredible look of youth if she did indeed do this in 2015. anyone?"
" Awesome - WW genre
",2020-11-07 00:00:00,9,"It saddens my heart to think this movie, was so poorly reviewed. A couple of years later. West World is on the scene and the whole world loves it. I really enjoyed this movie. If u are a fan of West World. You will enjoy it, as well."
" I LIKE THOMAS JANE BUT EVEN HE CAN'T SAVE THIS BAD B-MOVIE
",2020-10-26 00:00:00,2,"I checked this out because I'm a fan of the Awesome Thomas Jane & have liked him since 1999's Deep Blue Sea & 2000's The Punisher, Jane is an Awesome actor & action lead but here his hair was annoying lol & he could've save this boring Sci-fi B-movie!!!
Bruce Willis is here as like an extended cameo & seems so uninterested in his role so that's bad & the film feels too cheap & tacky at times & I'm usually a big fan of B-movies & DTV films but they aren't all good & this one was just too slow & quite boring.Nothing fun or exciting happens but there is some good scenes or images scattered amongst the crap but it's not something to enjoy or watch again"
" Bruce, does Passmore have pics?
",2020-08-11 00:00:00,2,"Wow, i spend most Fridays watching horrible movies. This one is now the worse one ive seen since Megasnake"
" Not bad - not great !
",2020-08-09 00:00:00,5,"Story of the film is interesting but the final product isn't.
Death of Evan is bad and it could go without it.
The end is like wtf ?
5/10"
" Boring
",2020-08-06 00:00:00,1,"I casually saw this movie on TV tonight. I thought, ""oh, a Bruce Willis science fiction movie I didn't see? How is that possible?"" After a while, I realized.
With bad acting, plot holes and dumb dialogue, this movie steals from every AI movie I've ever seen, but it makes it worse. I feel lucky I didn't pay to see this masterpiece. After watching Vice, I came to IMDB for the negative comments, and I wasn't disappointed."
" Some ad(Vice) to the writers: do more than one draft
",2020-07-30 00:00:00,4,"Vice was directed by Brian A. Miller, written by Andre Fabrizio and Jeremy Passmore, and stars Thomas Jane, Ambyr Childers, Johnathon Schaech, Bryan Greenberg, and Bruce Willis. It is about an artificial human being escaping from a place where people can play out their wildest fantasies, and is being followed by a cop, and the mercenaries sent by the owner.Plotting is substandard fare, with the whole caught-between-two violent pursuers premise being something everyone has seen. Julian (Willis) has created Vice, a resort where people can play out their fantasies with the involvement of androids. with emotions. When the androids are damaged their memories are wiped and they are repaired. Kelly (Childers), an android, meets Evan (Greenberg) who wants her to follow her dreams. She is killed by a visitor (a cameo from Tyler Jon Olson) and reactivated. Meanwhile, detective Tedeschi (Jane) arrests a man inside Vice. Kelly escapes and Julian sends a cleanup team, including Chris (Schaech), to get her back. Kelly teams up with Evan, and eventually Tedeschi to take down Julian and Vice.Characters are all bland. Tedeschi is the standard detective character who holds no respect for the antagonists, and would rather be fighting Vice itself instead of picking up after it. Kelly is potentially interesting, having been shown her many deaths and reboots; and feels a connection to Evan. Evan is fine, having a decent series of motivations and dealings with Kelly. Chris is the hitman that is in every third sci-fi/action movie, and Julian is the same; just another bad guy that spouts technojargon and wants to keep his company running for profit and other nefarious reasons. Eh. Performances are all weak, with Jane trying in most scenes, but some of the time he just looks tired. Childers is alright, trying her best with a superficial character. The rest of the supporting cast are serviceable. Willis (my favorite actor of all time) is indefensibly bad, looking dead behind the eyes in his scenes which look like they were filmed in a day or two.Action scenes are subpar too. Most of the action consists of guys shooting at each other or at Kelly and missing every single shot. There is no worry for the characters since they are so... nothing. All of the shootouts where both groups involved are firing at each other look the same, with endless shot-reverse-shot photography, and a blue steel look to it all. Little in the way of hand-to-hand combat exists in the movie. What does exist only happens in the last few minutes against a couple generic goons for Julian. So much for upgrades. I can give props to the usage of blood squibs though, the usage of which is a surprise when an action movie is constructed of a meager budget, so at least there's that.Technically the movie lags. Miller's direction gives the impression that he had no intention of showing the audience anything of true substance aside from mediocre action scenes. Ideas are presented like Vice's effects on people who go on to commit violent crimes after their visit, and those against AI becoming desperate to pray to God, and those who embrace it falling into vanity; but the writers get away from these ideas as fast as they can to get to the next action scene. The production slumps into being a bland procedural with a sci-fi appeal that never impresses.Vice is a subpar action/sci-fi venture that held promise which was quickly dropped in favor of a bland procedural and uninspired action bits. Miller, a helmer who has never shown aptitude enough to make something better than decent, really dropped the ball here. Again.44/100"
" What was with all the horizontal fluorescent lights everywhere
",2020-07-12 00:00:00,4,This film could have been so much more but fell flat. Sorry brucie baby I love ya but this film had such good bones and could have expanded it so it was more high octane. The lighting was terrible. Also when she FINALLY -asked for her special skill set it was feeble. Expected her to turn into a killing machine but no.
" This was such a disappointment.
",2020-07-11 00:00:00,2,Bruce Willis and Thomas Jane's performances are surly and flat. I'm always confused when this type of drivel attracts good Hollywood talent. The story and script are shallow and boring. Even the soundtrack is lacking. It sounds like a bad 80's TV movie. It's all quite pointless. Don't waste your time.
" Female robots for entertainment.
",2020-06-29 00:00:00,5,"Bruce Willis played here a Villain's role. He is the head of a highly techno company in future which provides female robots for entertainment they are rebootable every day. One robot model and a cop, both made failed this company. Bruce is okay. Though story plot is based on science fiction movie only seems chasing and gunning everywhere. Lot of parts you can see only escaping , chasing and gunning lots bullets rather than actual science experimental. Movie goes down here otherwise it would have better. Just once time watchable."
" A Poor Attempt to Retell the Same Sci Fi From the Same Tired Moral PoV
",2020-06-16 00:00:00,3,"Movie was bad. Just bad.
IT was less than Westworld in trying to bring the same stuff predicted by sci fi time and time again for decades; namely the emergence of artificial humanoids for our pleasure. BUt for too long people have misunderstood the need for such things one day, believing this to be a moral issue, instead of a critical thought one.
Morality should not be an issue so long as such inventions dont have true emotions, or deep learning logic capability anywhere near what humans are capable of. Not only that, but it will become necessary one day for many men, women and whatever types of things people consider themselves, to have access to these pleasure drones. Its a critical thinking issue, not a moral one. But the movie barely even scratched the surface of trying to cry a rivr about "" oh its so wrong, even though these things are not really human"". The acting was bad, and the talents of Willis and Aaron Eckhart were wasted. I passed out before the ending, but I can assure you, it was garbage. 3/10 just for hte big names involved."
" Excellent concept
",2020-06-03 00:00:00,9,"I don't get all the negative comments, it's a fantastic sci-fi movie and very good acting and the blond Amber Childers is so gorgeous, wish she was is more films. Good directing and excellent SFX considering the small budget. Don't believe the low ratings it's a fun movie that kept me glued to my tv screen. Good watch movie lovers ;)"
" Oh Bruce, Bruce...oh Bruce...wtf....
",2020-04-06 00:00:00,3,"With a budget of only ten million, one wonders how much of that was swallowed up by Willis and his ridiculous fees (leaving very little for the actual film to be made). Someone really should tell him that his days are rapidly approaching. Ok, Roy (Thomas Jane) is a cop who dislikes the 'theme-park' attraction called Vice run by Julian (Willis).Julian created a world where anyone can go and live out their fantasies with artificials, free of the law and repercussions. Unfortunately some of these people drag this fantasy into the real world and this is why Roy is determined to shut the place down. It also seems as though it's mainly men act out these fantasies against the female artificials. Not sure if there is some allegory there about society or not. Maybe that line of thinking is too intelligent for this film, who knows though?Anyway, being based of Philip K Dick's novel, and this being a brainless cross of Westworld and Surrogates, we get a ghost in the machine, or more specifically, in Kelly (Childers). Kelly goes on the run...and runs, and runs, and runs....and is chased, and chased, and chased...through fake fog...and more fake fog...and you get the idea folks. The film is so slow-paced, despite it trying to excite with gun fights. Oh yes, the gun fights. I think all the bad guys are the same actors who play stormtroopers. Nuff said there.The plot is dire, the action is no better and neither is the direction. Willis dials his lines in (as he usually does these days) and Jane just seems to sleepwalk through it the best he can. Childers is passable with what she is given to work with. The only redeeming features are that the photography and production values are actually half-decent, but even those can't help balance what is a pretty bad and dull film. One to pass, unless you like seeing Willis turn up purely for a paycheck.
The Sage's Rating: 3/10"
" A cliched but still generally enjoyable movie.
",2020-01-19 00:00:00,6,Is it a low budget bastard child of westworld and Blade runner? Damned right it is. Is it a good Saturday afternoon time waster? You betcha.
" Limp performance by central actor sinks ship
",2019-12-01 00:00:00,3,"Just back from seeing VICE with a couple of friends.
Viewed at Cinestar multiplex, Berlin.
This is not a review but just some immediate reactions.
In short, over long, drawn out, discombobulated, baloney.
Really boring because the people described in it are all boring from the top down and what they have to say sounds like a college term paper being read out. Extremely uninteresting. Full of gimmicks like pretending to end the picture in the middle and running some final credits at that point. Or showing repeated closeups of a beating human heart that looks like a pile of raw liver. to underline the fact that the hero is undergoing a heart transplant as surgical hands fumble around in a bloody thoracic cavity. Pseudo documentary style with dates and description of events written on screen every ten minutes. But these inter-titles are more confusing than enlightening because the entire sequencing of the film is so jumbled and messy.The whole film with ragged time toggling back and forth is very confused, even when you are familiar with the events and the order in which they actually occurred. In Sum: I would have walked out halfway through if I hadn't been with friends. The private bedroom and bathroom life of the central couple, Amy Adams and Christian Bale, is more sickening than revealing of their private intimacy. Both are shown in badly lit full screen facial closeups over and over which emphasizes only their dullness. Almost the only memorable scene is when Bale does a full throat gargle with mouthwash in the bathroom while chatting with his wife. Arguably his most lively scene in the entire flick. This is supposed to be about a Vice president, Dick Cheney, who was so powerful that he relegated the president, George W. Bush, to the background in the wake of 9/11 when we are to believe that he took charge and plunged us into a series of dead-end wars. None of this potential power comes across from Bale's limp lifeless performance. He emanates weakness, not strength. The characters mulling around in the white house and other government offices got to be so dull that after a while it was a gigantic relief to see Richard Nixon in two brief closeups. His withdrawal from office speech on TV following Watergate actually brought the picture to life for a few seconds, which isn't saying much. One plus. Every scene that Sam Rockwell was in playing president George Bush was more or less watchable. The facial similarity was there and Rockwell played rings around Bale every time he was on. All in all an overweaning pretentious muddled mess that made me heave a sigh of relief when it finally did end after several phoney half baked endings. Much is made of Cheney's life long hobby of angle fishing and at the end we see a rather pretty sequence of colorful angling hooks and flies as if this were the secret key to Cheney's entire personality, like the Rosebud sled at the end of Citizen Kane. But Citizen Cheney is at least a light year away from Kane"
" Great premise, exciting movie
",2019-07-02 00:00:00,7,"What a fantastic premise! In a throwback to Total Recall, there's a company in the future that you can go to if you want to have an exhilarating experience with no consequences. Simply plug into the mental game, immerse yourself in the imaginary world, and do anything your heart desires. You can kill, cheat, steal, set fire to an orphanage, and have a drug-infested orgy, and when you're done, you unplug and return to the real world.Bruce Willis is the CEO of the very lucrative company, and he shares with the audience that everyone in the simulated world is a robot programmed to be a realistic person so his customers can have as realistic experience as possible. During one of the re-boots, where all the robots are repaired and their computer memories are wiped clean for the next customer, one robot Ambyr Childers gets skipped. She keeps her memories, and some of the things she's lived through are quite terrible to remember. As her memories come to her, she also starts to experience feelings. Is it possible she's turning human?Vice is a very exciting movie. With tons of action scenes, an intriguing story, likable characters, and a beautiful leading lady, what can go wrong? Male and female audiences will be enthralled, since it's not a typical manly action flick, so try it out for your next date night. If I liked it this much, and I normally shy away from futuristic settings, you're bound to!DLM Warning: If you suffer from vertigo or dizzy spells, like my mom does, this movie will not be your friend. Some scenes include strobelights, swirling camera movements, or fast edits, and it will make you sick. In other words, ""Don't Look, Mom!""Kiddy Warning: Obviously, you have control over your own children. However, due to adult violence and sex scenes, I wouldn't let my kids watch it."
" my notes
",2019-06-26 00:00:00,1,"Terrible, just awful. copied off a bunch of other movies like surrogates, gamer, and the purge. shouldn't have been made. smh (1 viewing)"
" This is a modern Westworld that is even more shallow than Westworld for lack of plot development, character development, and ending...
",2019-05-30 00:00:00,3,"Not terrible, but not far from it. This is a Westworld remake, people pay big bucks to VICE to live out any fantasy with androids, called 'Artificials', that are mostly human with cloned skin and internal organs, etc. Just like Westworld, one of the units goes haywire and everything falls apart. The guards have the infinite ammo cheat as they fire thousands of rounds at the escaping Artificial, Childers, who is not hit, but the cop, Thomas Jane (Boy is he ugly! Aren't there any handsome leads in hollywood anymore?!?), takes out a dozen body armored guards with his pistol for the 'most of the movie' chase scene. Unfortunately there is hollywood propaganda about the anti-mililtray dark slant by how this technology is going to be used. It is a real shame to see how Bruce Willis has declined, physically, as well as an actor. He was listed as #4 on the credits... He is 'the face' of VICE and 90% of his shots are his chiseled, old, face on promos for VICE or being the 'hard' man that he is type cast as he directs underlings. Again, it is NOT terrible, this is a modern Westworld that is even more shallow than Westworld for lack of plot development, character development, and ending..."
" A great time-passer!
",2019-05-21 00:00:00,6,"Ok, starting off with the fact this has not won any Major Red Carpet accolades, I feel this movie may have the core values of ""entertainment"".
Albeit, more nudity could have peaked a higher interest; the action scenes did not disappoint!
Side-note: for ""trained"" armed security, I believe they couldn't hit water if they fell out of a boat. Why is that??? Most action movies could end with a few well placed shots by ""trained"" security...Plot line: decent. Stretching, but could be worse.
Actors: Willis, can't ever do wrong! Jane, batting .500, but always a fan. Childers, new fresh face. Should try and stick to movies with minimal lines.All in all, say thru it and wasn't highly disappointed! Give it a go!"
" Big city sci-fi thriller with Bruce Willis and Thomas Jane about artificial humans
",2019-05-04 00:00:00,6,"In the near future, a big city resort called Vice utilizes artificial humans wherein clients can fulfill their debased fantasies, including rape, robbery and murder. An artificial female (Ambyr Childers) escapes and seeks sanctuary at a city church. Bruce Willis plays the entrepreneur of the resort, Thomas Jane a disheveled cop who wants to put him out of business and Bryan Greenberg the man who resides in the church, but he ain't no pastor.""Vice"" (2015) mixes the concept of ""Westworld"" (1973) and ""Futureworld"" (1976) with elements of ""Blade Runner"" (1982), ""Groundhog Day"" (1993), ""Universal Soldier"" (1992) and ""The Island"" (2005). While it only cost $10 million and you can't expect blockbuster production values, it's more polished than the average SyFy flick, which usually only cost $3 million or less.Practically the entire movie takes place at nighttime in the big city and I like the reverent tone. Jane is great as the city cop and Willis is his reliable self in a role he could do in his sleep. Childers comes across as a low rent meshing of Malin Akerman and Alicia Silverstone, but in her mid-20s. She's a'right, but it would've been better with someone of the caliber of Scarlett Johannson or Silverstone when she was younger.What turned me off is the eye-rolling way the security guards at the resort couldn't hit the side of a barn; meanwhile the cop rarely misses. Sure, this is done in a lot in movies, but there's a way to do it that looks relatively realistic and doesn't insult the intelligence of the viewer. Not so here.""Vice"" thankfully shoots for some depth amidst its action thrills. For instance, there's the question of robotic self-awareness, which was explored with Data in Star Trek: The Next Generation. Then there's the debate over media violence & sex, whether in movies or video games. Does it provide an outlet for people to purge their debased desires or does it encourage that behavior in the real world? Lastly, there's a halfhearted commentary on religious fundamentalism and spirituality.While lackluster in some ways (due to its low-budget), I liked the reverent tone and the profundities amid the thrills, not to mention Jane's entertaining performance. It's marginally better than ""Westworld"" (1973), which, let's face it, wasn't exactly a masterpiece.The film runs 1 hour, 36 minutes and was shot in Mobile, Alabama, and Miami, Florida.GRADE: C+/B- (5.5/10)"
