title,date,rating,review
" Scarcely did I expext such a gripping plot!
",2021-03-27 00:00:00,8,"Before watching the film I had flicked through comments here. Nonetheless, I did't think that The Martian would be so intriguing and action-packed. Usually movies about outer space have a threadbare plot. They are fillfuled with implausble creatures. Moreover, so many subordinate plots do such films maintain, that it becomes quiet hard to concentrate and follow the general link. By contrast, not only does The Martian hold the viewer's attention to the bitter end, but also it provides the sence that similar events could be real! Its labyrinthine plot is connected with life of man who is forced to survive in extreme conditions, namely on Mars. Is he able to do it? Or it is going to be such a creepy end? You can learn it right now! In addition, I wanna say that no sooner had the film finished, than I started to cry!"
" Expected something darker
",2021-03-23 00:00:00,7,"It's a good piece of alone-in-space-drama, but I didn't expect those funny sequences here and there, that I suppose were meant to entertain. Some comic relief is all fine, but it felt ridiculous sometimes. I would have preferred it to be darker and more serious. I saw Gravity the night before and it had a much deeper impact on me. It had its moments of comic relief for sure, but they worked much better. And also the claustrophobic/agoraphobic element was so much more present in Gravity. And about the science - I have to say they could have tweaked the sound design for more realism. Sound is different on Mars. Higher frequencies attenuate quickly due to Mars' atmospere. I'm no physicist, but I know how to google. So in the outdoor scenes sound would be very muffled, lacking the higher frequencies we're used to hearing on Earth. Maybe they concidered this but it didn't work...? No, IMHO they should have gone for more realism. It would have served the movie well."
" Great
",2021-03-20 00:00:00,10,I like how he showed feeling for the rover before he took off in Ares 4.
" Best space travel flick
",2021-03-19 00:00:00,10,"Acting, special effects, science accuracy...The all round space travel flick, if you will..."
" After INTERSTELLAR, my favorite!
",2021-03-18 00:00:00,10,"This movie is a job well-done. Incredible execution. Matt Damon's performance alone make this movie a masterpiece in Sci-fi genre. Personally, i adore Sci-fi movies. It's my favorite genre. And i have seen many of 'em but nothing hit me like Interstellar and The Martian did. This is an incredible movie. A must watch one. I recommend 100%."
" very funny
",2021-03-17 00:00:00,8,"I tried reading this book and gave up like 5 pages in because it was so boring. The movie sounds even more boring- Matt Damon stuck on Mars alone for several months- but it's genuinely hilarious. The pacing is impressive considering the limited characters and settings. The science side of things is not overwhelmingly difficult, but it's also not dumbed down in an unrealistic way. You can really feel the tension when Mark Watney is communicating with people on Earth, and you can feel the frustration and isolation when he is struggling through survival tasks alone."
" One of 2015 best films if not the best
",2021-03-14 00:00:00,9,One of the best films of 2015 if not the best film of that year. The acting is top not from every single actor in surprised they didn't win the sag award for film. The story is also great it's edge of your seat and then at times very funny. The special effects are also top notch. Amazing film to watch and highly recommend for everyone to see.
" Pretty Good
",2021-03-12 00:00:00,7,"Obviously, this is one of those movies where it is predictable from start to finish. Man gets lost, has to be found, has to to survive alone, etc etc. So obviosly there will be some cliche endings. There is some things things to poke fun at and flaws that are kind of ridicuolous. I don't know if all of the science is 100% accurate because it is based on a fictional book.
It's kind of funny it has two actors from interstellar in it that are main characters in interstellar and are main characters in this movie. But they did a good job acting anyways.
This is not a perfect movie, but I still think it was fun to watch with the family. I don't know if it would be as fun to watch by myself than instead of watching it with the family, so I would recommend watching it with the family."
" A pure cerebral feast
",2021-03-10 00:00:00,10,"It was great to see a scientific sci-fi where everything made sense and wasn't moulding into fantasy. No little green men. No oversized bugs. A pure cerebral feast. The whole blend was superb - acting, scenery, dialogues. I had a problem only with overly, but predictably, twisted plot, where every single thing goes wrong in order to introduce a new thing (which will go wrong). This multitude of suspenses levels out your attention after a while. However, if this film is not ten stars, I don't know what is."
" movie for nerds
",2021-03-09 00:00:00,9,"This is my favorite movie to watch when I need peaceful movie night. At first I didn't have high hope for this movie because it's a movie about astronaut and mar. Usually these combination will lead to boring nerds' movie, after I watch it I would say that it is a nerd's movie but it's not a boring movie. The story have been tell by good pacing there are times that protagonist is sparks with hope and crushed with unfortunate situations. There are some political problem in cooperate that shown in this movie too. The sound is also well design. My favorite scene is potato farming scene because it's first scene that show hope for protagonist to survive. I also like the cast of Mark Watney(Matt demon) because of his performance as only human that exist at mar at that moment. But I also have some dislike as the scene of potato farm are ruin because it look like it's too intended as story driver. The best component I think this movie have is how they tell science information without making it boring with details, Ridley scott has done excellent work with this movie as example of sci-fi that doesn't have to be boring."
" Overall, Awesome film!
",2021-03-07 00:00:00,9,"This is a very well directed film with a great story. Matt Damon was great in this film and The visuals(just like in many other space movie)
Was phenomenal. The only flaw I would say with this movie is that some of the side characters could have been given more things to do in the story."
" 2021-3-1
",2021-03-02 00:00:00,8,"The China part was kinda odd. Maybe they couldn't make it more reasonable in the movie. So if you eat potatoes only, you're gonna die in 2 years, but, of course, if you're positive as Mark Watney and had choices, you wouldn't treat your body that way. Would? Mentioned about positiveness and humour, what about a person who was positive and humorous but suck at relationship?"
" Very Cinematic
",2021-03-01 00:00:00,9,"Plot: not that bad, is very romanticise, maybe too much. But still is very enjoyable.Actors and Actress & Acting: well, Matt Demond did an extremely good job, really. Also the others were very good.Visual Effects: extremely well done, very cinematic.Soundtrack: very very good! There is no miss.Conclusions: a good movie that, maybe, with a little more drama would have been more apprised."
" The Martian
",2021-02-21 00:00:00,10,Its an amazing movie and I would be going to mars on 2033.
" Good thanks ðŸ˜Š
",2021-02-21 00:00:00,8,The movie is better then i though..i just love it..
" Astronaut stranded on Mars has hope of returning home. Great visuals, scientifically accurate for the most part.
",2021-02-20 00:00:00,7,"Compelling plot that keeps you interested in the character as he succeeds and is then set back. Held back just a bit by stupid early-2000s-2010s type jokes. I did not like the ending; it was one of those disappointing endings where the character shows up much later as a teacher in an epilogue. Otherwise a compelling suspense movie, well done."
" Simply put,
",2021-02-20 00:00:00,9,"The best Ridley Scott film ever made.The only Scott film in which he does not put any unnecessary weight on his direction of making the tone, mood, action, etc."
" Mediocre space sci-fi film
",2021-02-19 00:00:00,6,"1. Matt Damon delivered concrete acting, but the character is very one-dimensional; no family, no friends, whatsoever; very very limited character development throughout the entire film2. Numerous plots that does not make any sense; Matt Damon flying in the space like Ironman really kills all the realism in the film3. Not the first time I see Chinese government added in the plot as a ""saviour"" (here i'm referring to the film Arrival). Out of nowhere the Chinese authority would offer help to NASA and save the poor astronaut with their unknown great technology. This is an obvious strategy to facilitate promotion of the film in the great Chinese market irl, but is also such a disgrace to the entire plot, ignoring all the complex real life politics... 0% similar to reality...4. Still I'll give the film a 7/10 for the good CG and acting from Damon. I have seen far worse movies."
" I just watched Perseverance land on Mars!!!!!!!!!!! BRAVO!.
",2021-02-18 00:00:00,10,"I watched brilliance on the screen, accomplished by thousands of people who contributed to the making of the film The Martian. No matter how much a spoiled brat you may be, who never contributed a nickel's worth of anything to any other person or cause, thank goodness NASA is not like you.. I did not read the book which the film is based on, but do not see how it could be made any better. I thought it was just brilliant. I have been in my apartment since last April and this was a welcome trip out of this world! I wish everybody in the credits was named. I will not be alive when any people arrive on Mars. I wish you Godspeed and onwards and upwards. Take really good coffee with you and goodies!"
" Probably the worst performance of Damon
",2021-02-17 00:00:00,6,"Movie starts off well. Pretty good visuals, good actors, CGI mars terrain reproduced beautifully. First 30-40 minutes is really promising honestly. Then it becomes a borefest.I think the main reason why it's so boring is the terrible performance of Matt Damon rather than inferior script or lack of tension. Entire movie he made me feel zero sympathy for protagonist. He's dull as possible. No fear, no madness, no connections to relatives. You see that he rations his food and he must be looking like a skeleton after a while. Yes, his ""body double"" is a skinny guy but Damon's face looks more healtier than any regular person. he's always in spacesuit and only thing we can see is his face. Clearly this role requires losing considerable amount of weight and if you are not willing to Christian Baled for this role then don't take the part. On top of that zero character development makes things much worse.It was difficult to finish the movie after 70-80 minutes mark. Especially ending was like a joke. CNN broadcasts the entire operation along with conversation goes with astronauts with zero delay as if it's happening instantenously like a Whatsapp call was laughable.I can't even believe its score is still 8/10, which is even higher than some great space movies like Apollo 13, Alien, Moon etc."
" Boring and childish
",2021-02-12 00:00:00,4,"The entire film is made as the work of a high school student who has no idea about the basics of physics.
On top of that it is infinitely boring and unconvincing.
It is full of meaningless scenes, and the funniest thing is when we discover that the spaceship is full of fresh potatoes !!!"
" The reason I didn't give it a 10...........
",2021-02-09 00:00:00,9,"So with this film I really enjoyed the scientific side to it and how possible it could be to one day live on Mars. It had the usual space danger moments, but the reason didn't give it a 10 was some parts just felt too unrealistic and I started to question it at times."
" A sci-fi not only for sci-fi fans
",2021-02-07 00:00:00,9,"The Martian is one of my most favourite films. It is a Ridley Scott's action sci-fi film which is based on the book by writer Andy Weir. Matt Damon stars as an astronaut Mark Watney - ""the Martian"".
The plot starts at the end of the research mission on Mars. NASA astronaut, a botanist and mechanical engineer Mark Watney went missing in a dust storm during a mission on Mars. The rest of his crew left the planet, thinking he is dead. But Watney survived and he must find the way how to survive alone on the foreign planet and how to send signal to the Earth to say that he's alive.
Although the film is quite slow-paced and there are not many action scenes, it is still immersive. That's because the place of the film set as well as the special effects are outstanding and make the film realistic and credible. The soundtrack is also good, the music can be heard almost during whole film because there are not many dialogues.
In my opinion, this film is really gripping and spectacular. Every aspect of the film is really good. However, I found Matt Damon's performance the best thing about the film. Overall, it is a really enjoyable film."
" SO STRESSFUL
",2021-02-02 00:00:00,9,This movie just has every emotion there could possibly be!
" Best SiFI
",2021-01-31 00:00:00,10,"Best SIFI movie ever,
Mat Damon nailed the perfect astronaut for NASA..."
" It is entertaining, and sometimes it is fun, but if it were more dramatic it would have worked even better.
",2021-01-29 00:00:00,6,"I confess that I was not very impressed with this film. Presented as a space drama, I thought it would be something more tense than it is. And although it was also advertised as a scientifically accurate and credible, I confess that I was not very convinced, but I will not discuss it either.This film has a simple script: in the future, a mission manages to set up a space base on Mars, but has to retreat in haste when a heavy storm catches them by surprise. During the withdrawal, one of the elements is picked up by debris and disappears. However, he survives and begins to rebuild the base and try to stay alive and communicate with Earth where, however, and by chance, they discover he is alive. After some communications, NASA decides that the remaining elements of the expedition, already on their way to Earth, have the right to know what is going on and to take part, if they wish, in the effort to rescue him.Ridley Scott doesn't seem like a competent director for a film like this. I think it gave the film a tone too light, removing drama and tension. There are some moments, closer to the end, when he still tries to reverse it, but he can't and the climax is bad, although the film ends up decently entertaining us. Growing potatoes on Martian soil is something that would never have crossed my mind. I don't know how easily it would work, even if it is possible. Surviving in inhospitable places is never easy, especially for someone who has never had to, and if that is valid in our world, it would be even more valid on a strange planet. Ignoring all this, based on a theory and forgetting how difficult it is to put into practice, the film makes everything easy to do and, instead of a tense life or death situation, gives us a vacation in a Scout camp on Mars. Oh, and it is obvious that China, a dictatorship led by a madman with ambitions to control the world in the same way that he controls the life and freedom of his people, had to appear and show how, at the right time, it is capable of saving everyone and being essential to democratic countries.The cast's work is quite good. Matt Damon and Jessica Chastain are the main protagonists of this film and have put a lot of effort into their characters. This is quite obvious, and to be expected from two talented actors as they have proven themselves to be. Matt Damon, in particular, impresses his character with sympathy and seems to be a kind of ""our friendly neighbor"". Sean Bean also shone in his role, and makes a good counterpoint to the character of Jeff Daniels, who excels at the arduous task of becoming an obnoxious NASA director; Donald Glover, Kristen Wiig, Michael PeÃ±a, Kate Mara, Sebastian Stan and even Chiwetel Ejiofor made a positive contribution, but the film is not theirs to shine.Technically, the film is extraordinary and had a budget to bet high. So what we have is an extraordinarily realistic set, costumes and props, combined with superb cinematography, where Mars looks beautiful, sharp and convincing. All the visual effects and CGI are good and combine very well with the rest. The soundtrack is within the expectations, in a film that does not seem to be taken seriously."
" Bravo Matt Damon
",2021-01-27 00:00:00,9,"Primarily the only actor on screen for most of the movie is Matt Damon. He is superb in the role! I was not initially interested in seeing The Martian, but so glad that I did. Matt Damon joins the club of he and Tom Hanks - Two Actors who can carry a movie alone on screen, Tom did in Castaway. Damon and the movie deserved all of its Oscar nominations."
" Alone in space ..scary thing
",2021-01-23 00:00:00,8,Too late ..honest to watch this movie ..but it just entertaining and tense ..good job with actor matt damonn ..
" Great, realistic enough Sci-Fi movie
",2021-01-22 00:00:00,9,"This is a great sci-fi movie that's realistic enough to not be weighed down by being unrealistic or ridiculous in that way.The acting and plot are great. The story is engaging, and Matt Damon does a great job in playing a character that everyone is trying to save (he always seems to be playing a character that everyone is trying to save or everyone is trying to kill)
One thing that I do think weighs this movie down, and why it's a 9/10 and not a 10/10, is all the swearing. I can understand some swearing here and there, but it does get to a point in the Martian that the swearing feels gratuitous and can detract a bit to a lot from the viewing experience depending on how much you do or don't mind swearing in movies.
Other than that I'd say the movie is fairly accurate to the book, and it's extremely well done, and is a definite must watch if you like it when movies at least try to put a good effort into being as realistic as possible.9/10 would recommend."
" One of Ridley Scott's best!
",2021-01-20 00:00:00,8,"To summarise THE MARTIAN in a sentence, I consider it to be the quintessential N.A.S.A movie. It's a film about space, about the science and logistics behind space travel, how the media responds to off-world emergencies and finally, of course, Mars. Despite what the name may entail, this film is not about little green men brandishing ray guns that get their kicks by sucking out our brain stems and blowing up rural farms - this is a film about man's will to survive by outsmarting the odds he has been handed.
Performed brilliantly by Matt Damon, astronaut Mark Watney is left stranded on Mars by himself after an accident forces his crew off the planet, believing him to be dead. This film is set in the far future, and apparently in a time period where travel to and from Mars is possible, yet time-consuming. What could very easily be a film about a man twiddling his thumbs on a dust-ball planet speaking into a video diary is in fact a very excellent sci-fi adventure that I think anybody who appreciates well-crafted cinema can enjoy. The film, while filled with science-y mumbo-jumbo, is a lot more exciting than that may make it sound. I thoroughly believe THE MARTIAN will be hailed as a modern-day classic in ten or fifteen years, and we'll be showing it to our kids. It is family-friendly (with perhaps very little cussing), intense in one scene but happy and funny in the next, and you'll be with Watney in his million-mile isolation all the way. You truly want to see how (and if) he can escape Mars before he succumbs to starvation, a lack of oxygen, or even his own mind.
Jeff Daniels also lends a decent performance as N.A.S.A's director, pressured by the media's incessant interrogations and the financial/moral burden of choosing to either save a single man, or just forget about him. To top it all off, the visual presentation is stunning here, and you could really believe they shot it on location on Mars! Or, ahem... a really big desert on Earth.
This is based off of Andy Weir's 2011 novel of the same name, which I still have to read; but I am tempted to believe this is a faithful adaptation due to its critical success. And who should direct a brilliant sci-fi movie like this except for the man who gave us eternal classics like ALIEN and BLADE RUNNER? Ridley Scott, despite being as old as God these days, still has a cutting-edge professionalism about him, and you could believe the movie was put together by a young guy if you didn't know who Scott was.
I am very grateful to have seen this movie in the cinema back in 2015, when everyone was talking about it, but it isn't too late for you to check this movie out yourself now. So go slip on your astronaut gear, depressurise your room, and bring him home!"
" Ridley proving himself once again
",2021-01-19 00:00:00,9,"Strong, well-executed, moving. Classic Scott-style directing, with its fast pace, yet never leaving emotion behind, keeping you glued to the screen throughout the runtime. Reminiscent of the original Alien, yet clearly proving the director's overall increased maturity and experience. My thoughts on the cinematography are mixed, from the one hand side the movie features a particularly bland color palette, most sequences however are nice, vivid and well-balanced. What strikes me the most is the fact that they didn't account for the reduced gravity on Mars, however not only is the price cut behind this clear, but also you forget it surprisingly easily in the first 10 minutes or so, since everything else is so gripping. The visual effects are simply flawless, realistic to the maximum and beautiful at the same time. The story itself and the characters are simply masterful, not at all out-of-this-world, or should i say the way facts are presented combined with the pacing makes you believe it's all happening at the time you're watching the movie. Though i am probably not meant to make this comparison, it leaves (in my humble opinion) Nolan's ""Interstellar"", a great movie on its own, completely in the dust, simply proving the effect Scott's experience has had on his work. A must-watch."
" Great movie
",2021-01-18 00:00:00,10,"Great movie, like to think as realistic as it can be. I love performance by Matt Damon, Chiwetal Ejiofor, Jeff's Daniels and Jessica Chastain."
" Excellent story, triumphal ending!
",2021-01-15 00:00:00,9,"No matter how many times I watch this movie, it never fails to make me laugh at the humorous parts, cry at the sad or frustrating parts, and cheer at the triumphs. An excellent movie, from start to finish. Ignore the criticism that seems to stem towards good science fiction and watch it!"
" Excellent
",2021-01-14 00:00:00,10,"Have seen this film a number of times and despite a few, very few dialog clunkers on of the best I have seen in a long, long time. Entertaining and you learn something! Major take-away is how optimistic the filmmakers were regarding China. They (China) generously offer to share technology (not gonna spoil it) and are heralded as heroes. vs today as they selfishly refuse to contain and thus unleash a virus and pandemic that kills millions without repercussion."
" Goosebumps
",2021-01-11 00:00:00,10,"I watch this film because I heard about the amazing reviews. But in the end end up giving me major goosebumps, it may have been one of the best films I've ever watched. The suspense kills you. I highly recommed."
" Disturbing propaganda elements
",2021-01-11 00:00:00,6,"I truly enjoyed the film and found it excellent and untertaining untl the very disturbing and ridiculous parts about chinese good guys saving the mission...This is pure propaganda, exactly like in ""Gravity"" by the way and this is very disturbing. Without it, I would give a 9..."
