title,date,rating,review
" The death or resolution.
",2019-08-22 00:00:00,5,"The most important thing is the knowledge itself, but the wisedom for working it.
Watney starring by Matt Damon was left alone in Mars. That sounds serious, but actually it was not. It reminds me the old TV program. In that, a comedian lived alone only by the lottery. It was similar to this.A few days ago, I asked my coworker if she has watched it already. But her reply was so funny! She asked me, 'It's a story about the growing potetos, isn't it?' I was so surprised!! As she got it like that, actually it's a positive survival."
" ""How to cultivate potatoes""
",2019-08-18 00:00:00,6,"This film had potential, unfortunately not much happens and we are just subjected to an individuals mundane life on Mars.If you are interested in harvesting potatoes I'd recommend it, for anything else just have a snooze."
" One more reason not to give up on humankind
",2019-08-17 00:00:00,9,"I first saw The Martian in 2015 in a movie theater and I remember enjoying it.
After giving it a re-watch 4 years later I can say I enjoyed it even more.
The best part about this film for me is its emotional package. I love it when a film shares its emotions with you through good screenplay and acting. And The Martian does a great job at this.
The film also deliveres a very hopeful message. There is still good in humankind and as Sean Bean said it in the film - a single life is worth it.
It feels great to see people dealing with the situation through science one problem at a time (as Damon's character put it in the end of the film). Human intelligence and cooperation can work miracles, and as I've said, even one human life is worth all the trouble.
The characters were also great, them being more human (all the humour and interactions) but still logical and thoughtful helped the story.
It is also great that they have made it technical enough to be believable.
Some of the comedy timings and mentions made me burst into laughter (especially the Project Elrond announcement with Sean Bean in one scene).
And while I do think that making this a little darker would've made it better, I still think that The Martian is one of the best movies about human spirit, survival and problem solving.P.S. It was interesting to see how some of the ideas and vistas of The Martian made it into other Ridley Scott's projects like Alien Covenant."
" Awesome
",2019-08-12 00:00:00,10,I'll watch this movie over and over and over again! In fact I bought the regular blu ray and then bought the extended version witch was a treat to watch as well.
" Good movie
",2019-08-11 00:00:00,8,Makes me want to go on a rocket to Mars and escape this society of degenerates.
" Light hearted spacey fun, minus the aliens and a dash of drama
",2019-08-01 00:00:00,10,"The film The Martian was adapted from the novel of the same name by Andy Weir. This film is placed at some point in the near future where humans have successfully landed on Mars. We join the film midway through the third manned mission to Mars. The crew is going about their tasks, you are given the feeling that they are excited yet settled into a normal routine of daily tasks. What we see of these tasks is short-lived however because a storm is moving in and the crew must act fast to escape. In the following frantic minutes, the crew attempts to salvage their work before take-off, however, as they move through the storm one of the crew is struck by debris and is lost in the dust of the storm. Without the time to search and the astronaut's life signs failing to report the crew launches in their vehicle to head home.The theme throughout this movie is hope through cooperation, we begin to see this theme shortly after the crew escapes, as this is where the movie truly begins. We learn that our main character, Mark Watney (Matt Damon) did survive the storm, but now alone on Mars he must survive again with limited resources and knowing that it will be at least 4 years before help arrives. While we feel for the character initially being abandoned on a planet, it isn't long before NASA discovers that he is alive and work begins to save him.
This film overall is one of my favorites, I have watched it at least 5 times over the years and read the book multiple times as well. Matt Damon's portrayal of Mark Watney is a perfect fit, his mix of humor and emotion as he goes through his ordeal is captivating. All the actors/actresses in this film really were superb, it is one of those movies where you can tell that everything and everyone just clicked together to create something special.There was a large cast behind this film but some of the highlights were Jeff Daniels as NASA Director Teddy Sanders, Chiwetel Ejiofor as Vincent Kapoor Director of Mars Missions, and Kristin Wiig who I am generally not a fan of for all her comedy movies but was great as NASA's Media Relations Director Annie Montrose. We follow these characters as they initially deal with the loss of Mark Watney and then work to save him once he is determined to be alive. The set design and sound are amazing, while Mars appears clearer then what we generally see in photos from our rovers I completely by what I see and hear. The technology in the movie seems futuristic yet attainable, nothing appears to be so advanced as to be not a reality within the next 20 years.
The music choice while not a personal favorite fits well into the movie and is used in multiple ways, as a running joke about bad taste in music, as a source of positivity and laughter to see Mark Watney listen and comment on the songs despite his situation, and as a source of hopefulness as we see people of different ethnicities, countries, and political influences put their difference aside to work toward the goal of saving one human. I will admit that I am a sucker for that last bit, this part of the movie and the beginning of Valerian and the City of a Thousand Planets both have scenes of selfless cooperation that really touches me.If you are a fan of space movies minus the aliens and love disco music then this movie is for you, if you love Matt Damon then this movie is for you if you love underdog movies where people work together to overcome then this movie is for you."
" One of the best
",2019-07-30 00:00:00,10,One of the best. Realistic comedy of a man stuck on Mars
" I loved everything about this movie
",2019-07-27 00:00:00,10,"I loved the main character. I love how he makes the best time while being all alone and without knowing what's about to happen. It seemed to bother most of the people that there was not much communication, I personally find this odd. Ofcourse, if you're a ""nerd"" you would see some things that don't match up compared to the reality that science thought us to believe. You need to remember you're still allowed to dream. Totally recommend this movie if you want to lose track of time! Give it a chance."
" A pretty good time
",2019-07-26 00:00:00,8,well adapted from the bookMatt is excellent in this roleset design is great
" Brilliant movie
",2019-07-20 00:00:00,9,An excellent movie but why oh why they had to ruined it with thousands of people all over the world cheering for his recovery at the end. Nobody would give a damn if it was a real story. It was already embarrassing in Armageddon. Anyway 9 stars from me
" A great movie for engineers
",2019-07-17 00:00:00,9,"If you are an engineer or you just have a engineering mind, you'll be excited from interesting engineering challenges during the movie."
" Best movie Ever
",2019-07-15 00:00:00,10,From the hundreds of movies that I have watched this is one of the best movies
" Fun sci-fi thing
",2019-07-10 00:00:00,6,"This is a pretty good movie. Everything looks great, and Matt Damon gives a good performance. The parts where he tried to grow food, and when they were planning the rescue, were quite interesting. The climax was a little lackluster, as all their crazy plans end up working just as expected. I didn't find it very tense, and it lacked any of the social commentary that great sci-fi films usually have. Entertaining and well executed, but not particularly deep or ground-breaking."
" Very Interesting and Entertaining
",2019-07-09 00:00:00,8,"I love this movie and have watched it several times. The whole case is terrific and the science is better than most, as several scientists have pointed out.
True there are some conceits here, but a movie without conceits is either a documentary or very boring or perhaps both.
The design of the spaceships and the other hardware was first rate; I don't know that there was hardware we saw that couldn't actually exist in the near future.Mark's emotional progression was very well done. There would definitely be some very high highs and some very low lows during that ordeal!I did end up hating the NASA director (Jeff Daniels) because he seemed to embody the worst of the recent NASA managers with his decision making.
If I had been Mitch Henderson, my response to being asked to resign by the NASA director would have been to say 'I'll put my resignation on top of yours'. Not sure if future space travel will include a NASA manager in charge. Might be more realistic to have a corporate person in that position.I do wonder about the reviewers who tried to point out inconsistencies. One being that Mark could have just replanted everything after the storm destroys his crops.
I think this statement completely ignores the fact that when Mark established his 'farm' he was working off the food supply left from the original mission with only some slight rationing. His energy levels would have been at their highest. Existing off mostly potatoes by the time the HAB was compromised he would not have had the energy or the will to re-establish the farm. With a supreme effort he was able to get to the Aries IV MAV. There he got better food (you can see he is having an actual meal) before he had to strip down the MAV for his launch.
So there were certainly some conceits made as this was a movie, but his inability to restart his farm was not one of them.
I think it was certainly a satisfying movie and will undoubtedly watch it again."
" my notes
",2019-06-26 00:00:00,5,Meh. some nice looking shots. a couple intense scenes. other than that nothing special. And the parts that we're supposed to be funny weren't funny at all (1 viewing)
" A wonderful film
",2019-06-24 00:00:00,10,This movie was absolutely amazing! Terrific cast and had a good outcome in the end.
" Fun for Almost Everyone!
",2019-06-13 00:00:00,8,"This is a very solid sci fi film; one that certainly stands out above the crowd as a more memorable entry into the genre. Spellbinding visual effects, wonderful performances, and a hilarious and fast-paced script make for a very enjoyable and epic journey over the surface of Mars. I absolutely recommend this movie; it's one that I think almost everyone will enjoy."
" Entertaining, but some things are annoyingly unrealistic
",2019-06-08 00:00:00,7,"This is a gripping, entertaining movie, light, not overly dramatic and funny. It doesn't pretend to be scientific, but you cannot just talk to someone on The Earth the way you'd do it on regular video conference, - Mars is too far for that ! It takes light 3 min to cover the distance from Mars to Earth. It could have been much better movie if they'd done it the right way."
" Do rewatch this
",2019-06-02 00:00:00,10,This movie was a hit in 2015 but many seem to have forgotten about it. This movie should definitely not be forgotten about. It is Matt Damon's best movie in my opinion. The humor brought to us through the writing is hilarious and it is delivered perfectly by people like Matt and Donald Glover. The concept is both sciencey and interesting to your average watcher. It is a compelling story filled with trials to overcome. With an amazing soundtrack this really is a 10/10.
" Couldn't Decide if I Wanted Damon to Survive
",2019-05-18 00:00:00,6,"The first half of this movie is not bad, although the happy go lucky, put a happy face on being left on Mars (Damon) was 60% hard to take. Permanently robbed of any credibility by his starring role in Dumb and Dumber, Jeff Daniels was not believable as the head of NASA.Hearkening back to Apollo 13, the ingenuity factor was interesting. The second half became predictable and silly. There should have been a lot more left on the cutting room floor. It's loooong."
" Must watch
",2019-05-12 00:00:00,9,U should must watch to know about the things of mars & what to do when u r in trouble in such of situations &..
" An entertaining thrill ride from start to finish
",2019-05-10 00:00:00,10,"Ridley Scott is without a doubt one of the finest film directors of the last 45 years and in that time he directed great movies such as ""Gladiator"" (2000), ""Alien"" (1979), ""American Gangster"" (2007), and ""Black Hawk Down"" (2001), and with ""The Martian"" he has not only added another great film to that elite resume he has also directed one of the finest science fiction movies of the decade. The movie is based on Andy Weir's novel of the same name (which I did not read prior to seeing this movie) and stars Matt Damon in one of the finest performances of his career as Mark Watney who is on a mission to Mars with Captain Melissa Lewis (Jessica Chastain) who is in charge of the mission, Major Rick Martinez (Michael PeÃ±a) the mission's pilot, Beth Johanssen (Kate Mara) the mission's systems operator, and Chris Beck (Sebastian Stan) who is a surgeon on the mission. At first everything seems fine on Mars but goes horribly wrong in an instant when a dust storm forces the crew to evacuate and in the process leaves Watney behind after not being able to find him. After Watney finds himself left on Mars he has to resort to his wits in order to survive on Mars for as long as he possibly can until help arrives while also try to figure out a way to tell NASA that he is still alive and well. The movie is not only one of the best sci-fi adventures this decade has to offer but it ranks with ""2001: A Space Odyssey"" (1968) and ""Apollo 13"" (1995) as one of the greatest movies about space exploration ever put on film. The movie features excellent performances throughout especially from an excellent supporting cast which includes Jeff Daniels as the president of NASA, Chiwetel Ejiofor who plays the man in charge of all of the missions to the red planet, and Sean Bean who plays the flight director for NASA. Scott's direction is on point and Drew Goddard's screenplay places tension at all the right moments to the point where you are actually there with them in this uncomfortable situation. This a very entertaining movie that has some very pulse pounding moments that is sure to be remembered for years to come, and put simply is a must see film."
" Realistic account of trying to survive on Mars while awaiting rescue
",2019-05-07 00:00:00,8,"In 2035 an astronaut (Matt Damon) gets stuck on Mars after he is presumed dead and his team departs without him. When NASA eventually finds out that he's alive & well they have to find a way to save him. But can he survive for the next couple of years until they arrive? Jeff Daniels plays the director of NASA while Jessica Chastain plays the leader of the vessel. Sean Bean, Chiwetel Ejiofor and several other notables are on hand.The only way for Ridley Scott's ""The Martian"" (2015) to work is if it can convince you that Damon's character is actually on Mars, which it does spectacularly and realistically (minus a few forced dramatics or stabs at humor here and there). If, like me, you're fascinated by Mars or the potential of living on another planet in the real world, ""The Martian"" is a must.It's reminiscent of movies like ""Armegeddon"" (1998), ""Mission to Mars"" (2000), ""Gravity"" (2013) and ""2001: A Space Odyssey"" (1968), albeit without the fantastical elements of some of these. It even brings to mind the first acts of ""Planet of the Apes"" (1968) and ""Beneath the Planet of the Apes"" (1970).The movie scores pretty well on the female front with Chastain, Mackenzie Davis, Kate Mara and Kristen Wiig. Davis looks good in tight pants.The film runs 2 hours, 24 minutes.GRADE: A-/B+"
" Good Fun
",2019-05-02 00:00:00,8,"THE MARTIAN is a realistic science-fiction film set in the near future. It stars Matt Damon in one of his finer performances. I normal don't care for his acting, but I thought he did a pretty good job in this one.The directing and cinematography are great. The pacing is spot-on. I think this is one of Ridley Scott's better films. Highly recommend."
" Bring Him Home
",2019-04-28 00:00:00,8,"It's possible to nitpick and complain about the structure of The Martian, but at the end of it all, I can't help but say I was inspired by it and that's what matters the most. Like Interstellar before it, deep down The Martian is all about telling the kids growing up now that, yes, you can dream about going to Mars. When we work together, or even when we're alone and determined - ""where there's a will there's a way"" - and we can accomplish anything, even the impossible. If everybody says it won't work, screw them, just go out and do it. I love that Ridley Scott is having fun with the sci-fi genre again. Go see The Martian and be inspired again."
" Why go back in the first place?
",2019-04-20 00:00:00,7,"Our hero is stranded on Mars by a sandstorm and his crew members leaving. This premise didn't bother me at all (although scientifically inaccurate). I just accepted it and went along with it.The visuals were great. I think they did a great job in creating a plausible Mars base. This is the best element of the movie!I'm also glad we didn't get a soppy family story from our hero himself! In the likes of: ""I need to get back, for my son"". I wondered though:
Why go back in the first place?Billions of dollars have gone into getting the crew THERE!
Psychology, they have accepted their likelihood of dying.Realistically, even dying on Mars should be a personal honor. If astronauts are going to Mars it'll be a one-way trip right?Scientifically, why use all these resources to go back - and save one measly human (no offence). We should accept that. Probably the first missions will be about building as much as possible. Can we create a self-sustaining Mars?Other scientific things that did annoy me:
The ungodly amount of duct tape.The lack of communicationThe bombsEither way, despite this, the film is entertaining, visually stunning and filled with great actors. It is an okay movie experience.If you expect a clichÃ© Hollywood movie and get a clichÃ© Hollywood movie - you'll be content."
" 11/10 unironically and wholeheartedly
",2019-04-09 00:00:00,10,"I could not name a single thing that could be improved in this movie without sacrificing some of its realism and unique feeling.It is not typical hollywood, the ""countdown stops at 0:01"" feeling is missing from the movie. Which is apparently what a lot of people miss, because scifi is aliens and lasers and action.
But this is how things actually usually are and it gives the actions of the characters and challenges faced by them paradoxically *more* weight through this.
This is an extremely brave decision that on its own sets this movie into a class of its own.It is deceptivey light. It is a positive, realistic, and respectful portrayal of the future, instead of a romp through some adventure, while at the same time being relevant in the present and ebracing the past.It manages to appeal to the human desire for exploration and togetherness without being emotionally manipulative. Kindof how a planet loved and cheered for the mars exploration rovers as if they were actual beings of their own. Because the capacity and desire of humans for connection and discovery is limitless. This movie speaks perfectly to that part in all of us.It is also a veritable nerd's delight without ever being embarrassing and feeling ""wink wink, nudge nudge""-y.The acting was so on point that it retroactively erased all of Matt Damons other roles from memory, and all future performances will be measured to this one.The characters were real. Not action/sci fi heroes, but regular nerds and people.This movie also adds something to the real world by it existing. It portrays exploration realistically, but still in a positive light, appealing to the human craving for it, and maybe reawakening that. At the same time it teaches that difficulties are not overcome as al movies would have you believe, by just a couple of people trying really hard for a couple of hours and fighting it out possibly. Difficulties are overcome by enduring through difficult times, taking advice from other people, and keeping hope. Physical fortitude, book smarts, coolness and on your feet thinking, friends you can rely on, emotional strength, and burning passion, desire and trying hard are all things that work together to get one through the night. Alone they are not enough, but some can be missing from people at times.
But we as humans overcome the difficulties. Because in the end it is worth it. For the future of us individually and all of us collectively.No other movie does as good a job as this one of conveying this.
All while i fail to find anything that when changed could make this movie better.
And while it is appealing in all its details, characters, designs, references, robots, music and action.Truly in a class of its own, and compared to others definitely up at the top with the best of them."
" Insanely entertaining
",2019-04-02 00:00:00,10,"The Martian directed by Ridley Scott is a Sci-Fi film following a rescue mission to Mars after one man is stranded on the planet... and this movie is GREAT. Within cinema one thing is for sure, when Ridley makes a great film it's monumental. The Martian is one of my all time favourites. The shots and cinematography on Mars are truly out of this world... The editing, score and integration of CGI is outstanding. This film is put together beautifully. Although The Martian isn't just exceptional on the technical side, it's also insanely entertaining. And that is thanks to the excellent script and line delivery by Matt Damon. This is his best performance in years. He's everything from witty to emotionally fragile, which forms such a complex and compelling character. The Martian has a perfect balance of distress and great humour. I love the integration of music by David Bowie and ABBA. It really helps lift up the spirit. The large cast doesn't weigh down the film at all, as they all add something more to the story. I can honestly watch The Martian countless times and never get bored. This is an outstanding film so therefore I give it a 10."
" Space Soapera
",2019-04-02 00:00:00,6,"Okayish movie with some funny moments but very predictable story and therefore in no way a masterpiece like some claim but rather the typical Hollywood astro-blockbuster like Armageddon, Deep Impact etc.Not really bad but also not really good. At max an one-timer. That rescue mission based on some real science/physics!? My a**."
" Astronaut Ice Cream
",2019-03-26 00:00:00,6,It is a highly sophisticated and technical survival film that is surely engrossing. Despite the gravitational pull to be an emotional drama The Martian adopts a cavalier attitude which is its greatest strength even if it shorts itself in the process. Like Astronaut Ice Cream it's fascinating but albeit extremely light as well.
" Best space movie.
",2019-03-22 00:00:00,8,"Way better and interesting than Interstellar. Interstellar makes you sleepy, but this....doesn't."
" Dreadful Hollywood dross
",2019-03-11 00:00:00,1,"The story is awful, the acting is abominable, the script is cheesy, the casting is overly PC, the science is an insult to anyone's intelligence.Do not waste your time with this dreadful Hollywood dross."
" Superb
",2019-03-09 00:00:00,9,"As good a Sci-fi film as you can ever
hope to see.
No monsters, no aliens. None needed."
