title,date,rating,review
" ""SILENT RUNNING"" meets ""MAROONED""
",2018-05-27 00:00:00,3,"As I recall this is the first time I've ever paused a Ridley Scott movie and gone back to it the next day. But on this occasion I did. It's missing that pin that keeps me stuck to my seat. And then it became obvious..... it's missing that chill factor- not the feel good factor. It's missing, but never seen, the grotesque surrounding our man."
" I'm not looking for intellectual brilliance with a movie like this
",2018-05-15 00:00:00,8,"I am looking for enjoyment.It is not ""rocket science"". It's a movie.As recent movies (past 20> years) go, this is very well done. It's interesting from the perspective of ""how would one survive alone on an alien planet"", and it's got humor.Is it the greatest movie ever made? No.Is it entertaining? YES!We have the typical A-hole political suck-butt.We have the smart-aleck scientific types with their quick, rather predictable, tried-and-true repartee.We have Matt Damon as the determined-to-survive castaway.There's the overarching question of WILL HE MAKE IT?No spoilers here. But it's an enjoyable movie given what it is and, given the typical movie making of the 21st Century, it's well done."
" Nothing impressive
",2018-05-01 00:00:00,5,"The Martian starts off setting high expectations when group of astronauts from NASA go on a Mars mission and while they're on the surface of the planet the atmosphere goes out of control, strong winds start blowing and a useless piece of debris hits our male lead Damon right in the ribs and he is pushed back by several meters. The rest of the crew assumes him to be dead and return to Earth only to find out after some days that he is still alive. Not only this but he has also managed to grow potatoes on the surface of Mars, (I couldn't imagine doing so if I were a BOTANIST you know) I mean there's an example of going out of your comfort zone (Earth). That aside, the middle scenes are pretty dull and you will find yourself forward-ing very often. There is a parallel mission going on Earth too to keep Damon fed till the next Mars mission is up and running and not to emphasize that a different politics is in progress there also and an astronaut's life on Mars basically depends it. 
The performances are average, any actor that manages to make any impact would be Jessica Chastain in the role of Martinez. Although the film picks up a little bit towards the end when Damon improvises with his profound knowledge a way to get himself out of a speedy rocket but it isn't too late to realize that you've wasted your precious time watching an economical version of Gravity."
" An Egg That Doesn't Quite Hatch
",2018-04-28 00:00:00,5,"The cast is talented, the scenes look good. So what happened? The writer of The Egg gets the story a bit scrambled and the film is at this point the most over-rated Sci-Fi film on IMDB.If you do not like the theater version, try out the unrated verson with 10 extra minutes on the DVD. This longer version reveals what the cast here truly wanted to do, and did. They take a crisis and make it into a comedy film. Worse yet, they then cut the film to make it look more serious than it was filmed at.Cut is an ending that comedically compares with Slim Pickens riding his bomb down in Dr. Strangelove. The trouble here is that this film is nowhere near as good as it is rated. Maybe Matt Damon and Kristen Wigg have a lot of fans out there, but serious Sci-Fi fans have a whole lot of issues with this one.Thw science is just not right. The premise is not much better. The films plays like the shooting budget got slashed after they started it. Funny, but sad considering the talents wasted."
" Good for the first 90 minutes but tediously overlong
",2018-04-09 00:00:00,6,"The first hour is interesting and engaging but the plot starts to tail off after 90 minutes and the final hour is dull and irritating. The attempts at humourous scenes fall flat and detract from the tension which has been building. Ditto the choice of music - as if 2001 A Space Odyssey had used Priscilla Queen of the Desert for its soundtrack. Ultimately, this film seems to be confused about what it wants to be. It starts out as a gripping thriller but then turns into something weirdly light-hearted. A pity, it showed promise but didn't deliver."
" Good film if you do not mind a little Star Trek type script...
",2018-04-05 00:00:00,9,"The movie mixed science fiction with a real life portrayal of life in space fairly well. Plot also examines the politics of space disasters as well. There is some Star trek dialog in the script, which may or may not turn some people off. Part of the movie that pissed me off was that it did not seem to give much credit to Rich Purnell for his idea...(see movie). Brian Ghilliorri"
" Cast Away on Mars with Matt Damon
",2018-04-04 00:00:00,6,"The title says everything i need to say. Apart from the fact that it is far more fun to watch Tom Hanks doing nothing, than Matt Damon. 
I'd assume anyone rating this over a 7/10 is a Matt Damon fanboy."
" It's a fictional movie people; enjoy it for what it is...
",2018-03-30 00:00:00,6,"I watched this film and enjoyed it because it's not considered non-fiction; it's a fictional account of what might happen if an astronaut were abandoned on Mars. Too many people who are submitting reviews are trying to get too technical. People, just enjoy the movie for what it is."
" Strove to present correct science.....REALLY??
",2018-03-29 00:00:00,7,"Generally the movie was good....lots of quasi-science which, although improbable, didn't stretch the bounds too far but the ending......really?
We're supposed to believe that the rocket nose....in order to save weight, jettisons the hard cap and replaces it with....wait for it....CANVAS.
If you do the math, the only speed quoted, which is BEFORE the maximum thrust, converts to about 2600 kilometers per hour.
Now I've put my arm out the window at about 150 KPH and had the hair nearly blown off so I'm pretty sure 2600 KPH is more than a little improbable.
Since the entire movie is predicated on hoping we will believe at least some of the science why couldn't they have just picked a smaller number to reduce it which didn't entail removing all the windows and the nosecone 'cause I'm pretty sure they'd be necessary at 2600 KPH....just saying."
" Project Elrond
",2018-02-26 00:00:00,8,"A NASA crew on Mars evacuates during a bad storm, Mark (Matt Damon) is believed dead and is left behind. However, he is not dead and needs to be resourceful to survive until the next mission, over a year away. However it it not as bad as ""Gravity"" or ""Cast Away"" without Wilson. Mark (plot spoiler revealed in previews) manages to make contact with Earth and we have a subplot to break up the monotony of a one man play.The film is designed primarily for science geeks. There is a lot of terms for them, many are broken down, some inanely as when a sling shot effect had to be explained to the head of NASA, something they do all the time.With all the hype of an Oscar nomination, I thought the film would have been better. It was good, I enjoyed it, but I don't believe it belongs in the Science Fiction hall of fame. There are no space aliens, ghosts, or anything crazy like that. Science fiction, not science fantasy.As far as science goes, my understanding is that Martian soil has a high perchlorate content hindering plant growth. Also NASA is leery of sending anyone to Mars as the radiation dose they will get on a round trip would be considered a lifetime dose for the astronauts, ending their careers and greatly increasing the risk of a latent radiation induced cancer etc."
" Fantastic film
",2018-02-25 00:00:00,10,"Excellent film: the science is accurate, the acting is solid, and the film carries an emotional depth that previous reviewers, who have been panning it, seem to have missed (but maybe they're not used to films where spaceships DON'T make noise in the vacuum in space and the audience actually has to think). One of Ridley Scott's best films."
" A film about growing potatoes with poop
",2018-02-23 00:00:00,1,A film about growing potatoes with poop. That's it.
" Fantastic
",2018-02-13 00:00:00,8,"It was well made, sure, but Childish Gambino was in it, so it's fantastic. Too bad Sean Bean did not die. Was disappointed. That'll happen."
" Great EFX but a bit preposterous, boring, yet spellbinding?
",2018-01-25 00:00:00,9,"With 1100 reviews, I suppose that few people may read this, but here goes: Fantastic sets and special effects. I wish I had seen this on a big screen. I am sure that it has been compared to everything from ""2001"" to ""Apollo 13"". It seems a bit tedious, but that might be because of the 3 hour cable broadcast time if you don't DVR it. An astronaut presumed dead is accidentally left behind when a long-term Mars Mission is aborted due to an intense hurricane force Martian sand storm is encountered. The first third of the movie centers on how Astronaut ""Mark"" manages to set up housekeeping, grow his own crops, and re-establish communications with Houston Control. Then it shift gears and become a rescue mission much like Apollo 13. There are equipment failures along the way and the mission crew almost commits mutiny when they decide to double back and rescue the stranded man. Smart and intelligently presented by Ridley Scott but not everyone's ""cup of tea"". I enjoyed it but found many badly-answered plot hole questions: There seems to be an unlimited supply of oxygen in the space suits. Maybe they can manufacture it in the suit? The ""Power of Duct Tape"" creates a perfect air seal. (I guess it really is the handyman's secret weapon?) A partial nudity shower scene is really unnecessary. Even after a clear plastic seal blows out, the entire craft doesn't fog up and blow apart? Oh, well, enjoy it for what it is, but don't expect it all to make perfect sense."
" The Martian Damon died in a challenge inside and outside the film.
",2018-01-19 00:00:00,8,"The movie Mars may not be a logical or purely scientific film, but certainly succeeded in satisfying everyone as a film science fiction exciting. The film is directed by Ridley Scott and starring Matt Damon and Jessica Shastin. It is believed that Mark has died and left alone on Mars, and begins a struggle to survive while trying to communicate. On earth, in the hope of saving him, Marc remains without a thing in this planet, which is twice as large as the Earth, and there is nothing but himself and what the crew left before the forced departure.One of the film's problems that you may read about is the storm that led to Mark's departure in the first place. Mars's atmosphere is about 1% as compared to the Earth, so Mars winds, which may reach 100 mph ""which is rare in the Mars climate"" would be like winds at ten miles an hour on Earth, Flying a paper plane in the sky not to fall humans.Beyond that film is excellent in almost all respects, since the beginning of the film can not stop stunned by what Ridley Scott of visual effects, and continue to amaze something something with the stages of passage of the film. The film begins in a desert desert similar to the environment of Mars, as we know from the images of him, red, arid, empty, filled with horrifying silence.The film moves to two stages. The film then moves to two sides, the psychological aspect of Mark being that he has nothing more than he can think of getting to his home and family, and the aspect that makes him one of the most responsible and discoverable people. Here lies the details, the film may not be perfect in writing. Both are in these two sides.When you see a movie that tells the story of the horror of loneliness, you have to think of two aspects (psychological and physical). The physical aspect I thought for a moment was that Matt Damon's work was a mighty example until I knew that the whole thing was just an effect on a computer, which increases visual dazzling and its effects and reduces The actor's creativity and sacrifices for the role.
In an interview with Matt Damon, he said he wanted to lose weight for the role, but director Ridley Scott stopped him. ""He talked to Ridley about losing weight for the role, because I had already done it for the movies, Almost a month ago I said that the time is perfect. I can lose 30 to 40 pounds and start shooting from the end scenes back to the beginning until I get back to my normal body. ""Riddle Scott"" replied ""F * ck that"".As for the psychological side, yes, there was a conflict, and yes, Dimon was good at it, but it was not enough for me to see the dramatic dramas, being on Mars, knowing that you are 140 million miles from Earth, home, home, family. Because you will not see human beings after today in your life, it is very frightening once you think about it, so I had a desire to stress on a dramatic scene that would be screaming and whining and then supplication and crying. but it's okay.Some may notice the American championship in the film, or even the mathematical complexities, when we calculate the number of years between Mars and the Earth or the speed of Mark's or even attraction between the planets and others, but the film certainly did not make it more sophisticated than the movie Nolan among the stars, Understand some of them and do not mind their presence, because it will not actually stop them, in turn will increase the quality of the scientific background of the film, which puts it in a challenge with the scientists who will see it.The film is not the ideal film in all its analogies, but it is certainly interesting to the viewer, a victory for Ridley Scott the rest of the workers, from the voices to the visual effects and even fashion .. A poetic and objective film at the same time, and above all we can not but stand in hugs for the creativity of Matt Damon and his grandmother to portray The scene of the dramatic car and the rest of the film with complete creativity.
The
DÃ©finitions de the
article
denoting one or more people or things already mentioned or assumed to be common knowledge.
what's the matter?
used to point forward to a following qualifying or defining clause or phrase.
the fuss that he made of her
used to make a generalized reference to something rather than identifying a particular instance.
he taught himself to play the violin
3 autres dÃ©finitions
Voir aussi
the"
" dumbing down the book spoiled the screenplay
",2018-01-04 00:00:00,1,"I read the book and also listened to the audiobook several times now. The charm of the story for me is, that it heavily emphasizes the Science in Sci-Fi. The whole thing is (mostly) sound and very well explained, so even technical illiterate readers can follow. 
For this movie someone decide to dumb down the content and take shortcuts and - surprise - mistakes, failures and plot holes ensue and some things simply make no sense anymore (just look at the goofs list - you could make a book out of them). Then again some scenes were unnecessarily added to confuse even further to make up for plot twists that were cut.
This messy screenplay can't be saved by the cast. Most of the characters are but a faint shadow of their book selves. Take crewman Vogel for example. Would anybody have guessed him to be German, if it wasn't for the patch on his suit? Jeff Daniels seems to wear a stiff neck and all the characters interactions feel like packed in cotton. Those guys should be passionate and fight for their opinions especially since the lives of astronauts are on the line and depend on their decisions. They are highly trained specialists in their field of work and have to fight against political red tape. Non of this was in the movie. They could have had a more passionate discussion about a burgers or football.
And don't even get me started on the props. Think about airplane furniture and then shave that down even more to get rid of any unnecessary gram, while barely preserving basic function. Where was that in the movie? The Hub looked like it was built to house colonists for decades and not to serve as a pressurized shelter for a two month mission. The movie-Hermes consists mostly of large corridors without any purpose and large window panes. A spaceship like this would never be approved.
I could go on forever, but it all boils down to this: Andy Weir went to great length to make the plot and every action the protagonist take plausible and get his book scientifically correct. That's what I love about it and why I was looking forward to the movie. And then I got handed this stupid, dumbed down, senseless piece of trash."
" Great, realistic, space adventure
",2018-01-02 00:00:00,8,"'The Martian' is based on Andy Weir's excellent novel - one of my favourite books from last year. It's a very simple concept - in the near-future, a manned-mission to Mars goes awry and Mark Watney (Damon) is presumed dead, as the rest of the team returns to Earth. However, rumours of Watney's demise were exaggerated and he just manages to survive, only to be faced with the conundrum of how to stay alive on a freezing planet with almost no food, water or oxygen until he can be rescued?It's beautifully shot, with Jordan a good stand-in for Mars on most occasions, and the CGI doing the rest. And there's obviously a few shots of Earth from space - always a great perspective to see. Scott directs well, with the pacing good, and time spread across the strong cast - Chastain, PeÃ±a, Mara, Stan and Hennie on the spaceship home; and Daniels, Ejifor, Bean and Wiig at NASA - showing how everyone involved deals with the initial tragedy and then attempted rescue mission(s).However, the film belongs to Damon, who has to use all his charm and skills to make one man talking to a video journal interesting. The film's possibly 15min or so too long, but luckily, it's a great book & a good screenplay, so there's plenty of levity to go along with the serious life-or-death/fingernail-chewing moments. Tense/great final 25min or so. Never quite reaches the heights of the book, but comes very close."
" Great Scott
",2017-12-31 00:00:00,10,Some reviewer on this site said don't trust any reviews that give this film more than 2 stars because they aren't genuine. Well let me say having just watched it that I wouldn't trust any review that give it less than 7 stars. If this was La La Land I would have agreed as that was overrated rubbish but this was superbly crafted wonderfully acted and a joy to behold. Not at any time during its 141 mins was I not totally engrossed and exhilarated by this total cinematic experience. I'll even go as far as to say this maybe the best film that Ridley Scott has directed.
" Captures the excitement, humor, and humanity of the book
",2017-12-27 00:00:00,8,"Full disclosure: I read (and enjoyed) this book. So I'm going to be one of those people who says ""They got this right, but they got this wrong."" Bottom line, though, they adapted this REALLY well. Scott captured what survival and problem solving looks like, and managed all the excitement/humor/humanity that made the book great. I would have loved a little more explanation and a little less self-seriousness, but there's no way not to enjoy this ride."
" Smart, thrilling, and surprisingly funny
",2017-12-10 00:00:00,9,"Super good, enjoyed this one a lot. Sort of a mix of Castaway and Gravity with Matt Damon taking on the deserted Hanks role, explaining things to a video diary along the way after he is left stranded on Mars and presumed dead by his crew. With meager supplies he must find a way to contact Earth, make oxygen and grow some food. Its very funny.This did feel a bit too long but in saying that I also can't think of any scenes that were unnecessary.Great special effects and finally a movie using CGI and green screens to enhance the movie not just BE the movie as is often the case these days, where movies forget about a story and just become special effect extravaganzas.It did get a bit over-the-top towards the end with Damon in his Ironman reminiscent suit but I went with it. Worth a watch.Oh, this is based on a book by Andy Weir."
" Globe Earth Propaganda
",2017-11-27 00:00:00,3,"The most unrealistic part of this movie, is not the fact that Matt Damon started a potato farm out of his own feces in space, but THE PREPOSTEROUS FACT THAT SPACE AND OTHER PLANETS EXIST!1! As a Christian Mom, I must tell you that the whole idea behind space, planets and even a globe earth is so unrealistic that I had to remove my 7 children from the cinema mid-way through and then perform an exorcism on them. I tried to contact Hollywood and demand this movie is removed from all cinemas within Christian governed nations but they wouldn't answer my e-mails or my calls. Alas I am here to try and convince all Christian citizens of the World, to avoid this movie like the plague. Also i'd like to inform you that NASA is a satanic organisation that throws arsenic in our water supply and that vaccines are made of sin. This movie proudly displays the ridiculous idea of space, which I am pretty sure is a myth (just like physics and sanitation). The only reason I am giving this movie is getting anything more than a 1/10 is because of Matt Damon. Check out my Matt Damon erotic fanfictions, if you want to make my Christian soul happy! :) Thank y'all. Vote Trump and don't forget that existing is a sin! Support West Ham United!"
" Full of cheesy quips
",2017-11-20 00:00:00,5,"I watched this initially at the cinema and gave it 7/10, on watching the 2nd time on Netflix I've decided 5/10 is generous. The cheesy quips are more noticeable the 2nd time around with a general feeling of 'Murica throughout the film, even after the help they receive from China the brave and clever 'Muricans prevail and the world applause's.The other major annoyance in the film for me was Donald Glover portraying Rich Purnell, a sort of 'on the spectrum/super clever' geek who is so clever he solved individually what teams of people cannot whilst being a second rate comedy actor with slapstick falling over and addressing the head of NASA like he's some random bloke he's struck up an interesting conversation withKristen Wiig was completely pointless, I can't actually raise enthusiasm to go more in depth of her character than thatNot a film I'd watch again"
" One of the best SF films
",2017-11-15 00:00:00,10,"I've been a big fan of the Martian, ever since I first read the book written by Andy Weir based on which the film was made. It is directed by Ridley Scott and features an outstanding cast such as Matt Damon in the role of astronaut Mark Watney and Jessica Chastain as Commander Melissa Lewis, the Ares III mission commander. Set in 2035, the action takes place on Mars, around Acidalia Planitia and its surroundings. The plot revolves around astronaut Mark Watney who, believed to be dead, was left on Mars by the rest of Ares III crew when they had to abort the mission due to a strong dust storm. And so, he sets out in an amazing race for survival, with limited resources of food and water, managing to do what no one would have thought that is possible to do on a lifeless planet. Under the direction of Ridley Scott, Damon gives a superb performance. As you'd expect, the film is thrilling and visually spectacular, with state-of-the-art visual effects. The script is surprisingly hilarious, which reflects on Damon's character, Watney, who tries to remain optimistic, despite knowing that he might not see the Earth again. Also, regarding the scientific information, the film, like the book, doesn't disappoint. It gives a wide range of accurate information from all the scientific branches. That said, for me it is the best science fiction film for many years, far more entertaining than the other science fiction films I've seen, and I would recommend it for anyone interested in science or looking for thrilling stories."
" A review of a gripping film
",2017-11-12 00:00:00,9,"Released in 2015, ""The Martian"" is a movie made by Ridley Scott, being a screen adaptation after the novel written by Andy Weir. It was nominated for 7 Oscars and it also won several awards at the Golden Globe. Even if it was filmed in many locations, the most unusual one ,for me, was Wadi Rum, Jordan The star of the movie is the well-known actor, Matt Damon, who manages to portray 'Martian' as a likable person and also to fill the two hours that remain after he is stranded on Mars. Being an adventure, drama, Sci-Fi film, ""The Martian"" tells the story of astronaut Mark Watney, who is presumed dead after a fierce storm and left behind by his crew on Mars. Surprising he has survived and finds himself stranded on the planet with only meagre supplies. Watney finds a way to signal to Earth that he is alive. NASA and a team of international scientists work tirelessly to bring him home, while his crewmates concurrently plot a daring rescue mission, a very risky one. All of them adventures are full of emotions and every scene in which one of them is risking his or her life makes you feel part of the movie and so becoming very gripping. For me, the biggest strength of this film is the actor who plays astronaut Mark Wathney, Matt Damon. Despite the fact that he is a gorgeous actor in general, he manages to play his role in an authentic mode, but also a little bit intriguing because of his way to act. But on the other hand, the story can be sometimes predictable and far-fetched, which is a huge weakness, from my point of view. Overall, in my not so humble opinion, I can say that ""The Martian"" is one of the most gripping films I have ever seen so far and I can recommend it to everyone who is interested in science, adventure and, why not in drama. I consider it can be seen by any category of age and occupation, but only a small part will understand the real message of the movie."
