title,date,rating,review
" the stakes have never been lower ...
",2021-01-19 00:00:00,1,"Okay dragon ball Super is terrible it has bad stories bad characterization and terrible animation ,And the stakes have never been lower they have two all powerful God angel friends sitting on the sidelines who also happen to have time travel abilities to save their bum When Frieza destroys the planet , The power levels of the top two henchmen were stated to be like 30 000 so piccolo, tien, gohan and krillin should have been absolutely destroying them , Again the stakes are just not here it's a nonexistent time travel strong friends there's no chance of losing"
" DBZ comes back to his roots after ""Battle of Gods"", but it's not enough
",2020-02-20 00:00:00,4,"Because yes, the insulting previous movie sins aren't in this one (exaggerated use of comedy in the wrong characters, lack of non comic violence, wrong characterization), the truth is that coming all the way back to exactly the same things that DBZ already did and better, makes this pointless and boring.Gokú is better than Vegeta, again.
Gohan not a ""real fighter"" giving his different intellectual education, again.
Goten and Trunks wasted on more comedic than real interventions.
The others, ignored.
The power levels in service of the plot, only to end everything in the same way every time. Etc.In the end, the whole thing feels a bit pathetic. Not a bad shonen anime movie, but without the same violence and any interest of improving story structure, dialogue or the evolution of the characters, I can't say anything more than this is a money play without anything to offer. Good for Akira and everybody that benefits from this. I'm (not a kid/teen anymore) just not interested."
" i wish vegeta got his moment
",2019-08-17 00:00:00,8,This movie was great. frieza came back to get his revenge of goku they all got new forms. great fighting. but why didnt they let vegeta get his revenge on frieza for making his life terrible and killing his father. the ending was terrible to say at least
" It's good, but the worst super movie.
",2019-06-24 00:00:00,8,"I love every dragon ball movie (except bio-broly), but this movie was disappointing compared to the amazing battle of Gods. The fights are cool, but this movie is just fan service. SSJ Blue is one of my favorites but it was so underwhelming in this movie."
" Officially ends DBZ for me. Because Super is meh.
",2017-11-17 00:00:00,7,"Finally watched this. Meh. DBZ movies always su&k when compared to the television series. I gave DragonBall Super an honest chance and had to quit it for obvious reasons, because it has become an endless cash-grab. Heck, even DragonBall GT is a better watch. Anyway, this film is actually one of the better DBZ films - only because Freeza is such a good villain and the film stays true to that. The problem is the action is sort of weak regardless of the fact there is a good amount of it. Overall - not bad. However it will officially mark the last time I watch anything DragonBall related."
" Nothing wrong with milking the DBZ cow, but this milk is sour.
",2017-06-26 00:00:00,2,"I'm a fan of the series, watched all the shows several times, played a lot of the games, so in short, I like Dragon Ball content. This movie however, it is just awful. The story is a joke and the whole movie is just boring.***Spoilers***Some officer from Frieza's old empire has the idea to summon the Dragon Balls and revive Frieza, who is stuck in teddy bear/rainbow hell. Frieza has proved to be no match for Goku, especially now Goku has defeated the far superior Cell, Buu and other much stronger villains and sparring partners. But Frieza has a trick up his sleeve, he never trained in his life (because he was lazy), but now he is going to train. Jup, Frieza is joining the gym. This will give him ultra mega golden super power and catches up with Goku and Vegeta (who are supposed to be more than 1000/10.000 times stronger) with a healthy carb diet and some cardio.When Frieza arrives on earth, Goku is not there, he destroy's north city, which seems to be more a inconvenience to all heroes. He uses thousands of henchmen to fight the earthen heroes as Piccolo, Krillin, Tien and Gohan, who have lots of problems killing them. Yep, that Gohan, who can tap into all of his power without even going 'super', destroyed Cell and rivaled Buu, now has trouble with henchmen. He needs a sensu bean to recover.Anyhow, Goku and Vegeta arrive, the fight in short; let's start full power, fight, that wasn't real full power, actual full power fight (Blue hair vs Golden Frieza), Frieza loses, but tricks the heroes by destroying earth and all is lost, but wait, Michael Sheen can reverse time and make everything good again.The end. What a waste of time."
" Just for fans
",2017-03-04 00:00:00,4,"""Dragon Ball Z: Resurrection of F"" brings back the old band including old big bad Freezer... I mean Frieza. Some of Frieza's people are still alive, and they find the dragon balls, resurrect him and give him some time to power up. All the while, Kuririn is happy as a cop, Son Gohan as a regular and average person and Piccolo taking care of Son Gohan and Videl's child. But when Frieza decides is time to carry out its vengeance, they will have to do their best to stop it... well, till Son Goku and Vegeta are back from their constant training.""Dragon Ball"" (and ""Z"") are history, legend in the anime world. The first part was more humorous, silly, with character development and lots of adventures, while the ""Z"" part became a non-stop of fighting and a constant introduction of new and badder enemies (which Son Goku always had to defeat), video game style. It still had humor and adventure, but they were left in the background. It was fun, but it became too much.This movie suffers from the same. The first part, lighter in tone, and with the typical cameos of different characters, like the aforementioned Videl, Android No.18 or always fun to meet again Pilaf and hench-couple are silly and funny. The second part, though, falls into a too long, too much, too repetitive, we all really know how it is going to end fighting. First, Kuririn, Piccolo, Son Gohan ('ironic' that Kuririn tells Android No.18 to stay home while Master Roshi joins the team)... appear and fight with Frieza's people. And then Son Goku appears and does what he always does (which the viewer, when they see the movie, will understand). It is just not very original or fun.The movie ends up just being light entertainment, that will be enjoyed the best by fans (but even those will probably think it is just too much of the same)."
" A very good movie, based off an even better Anime
",2017-02-15 00:00:00,8,"This movie, like Dragon Ball itself, has a lot that will appeal to first time watchers. The flashy fights, the enigmatic, charismatic characters and the story will make both die hard and new fans of the franchise feel like they were watching a high budget episode of the show. Complete with great voice acting by the returning cast, this film adds something new while reminding us about the old, infamous, villain Frieza. I don't want to diverge to much into the technical and production specifications but I felt it was my duty as a fan of Dragon ball to tell both old and new fans that they can rest assured of this being a return to format for the show, opening many exiting possibilities for future movies and Dragon Ball Super, the TV show which tells the story of both 'Dragon Ball Z: Battle of the Gods' and 'Dragon Ball Z: Resurrection F' while also continuing with new episodes. It is a must watch for fans of Dragon Ball and a recommendation for someone who is looking to get into a new TV Show, though I recommend watching the entirety of Dragon ball and Dragon ball Z, a large request, you could still find enjoyment in this movie despite not having knowledge about Dragon Ball lore."
